,Post URL,Post,Image num,sticker num,gif num,Paragraph num,Comment num,Video num,weekly viewer mean,Sympathy num,AD,Posting Date,Buddy num,Total visit,Blog category,Comment detail,AP
9,https://blog.naver.com/pm0146?Redirect=Log&logNo=222444402928,요즘 엄청 더워서 하루 종일 에어컨을 작동하고 있는거 같아요창문을 열면 훅 들어오는 습기와 더위때문에 환기도 제대로 시키지 못하고 있는데요특히 아이방은 창문형에컨을 설치해서 제대로 환기를 못하고 있답니다 외출하고 아이 방문을 열면 습하면서 퀴퀴한 냄새 때문에 소형공기청정기를 들여 놓으려고 해요심플한 디자인으로 어디에나 잘 어울리고 가벼운 맘공기청정기 랍니다오염된 공기는 좌우하단 방면으로 빠르게 흡입해주고깨끗한 공기는 필터를 걸러 상담에서 뿜어준답니다 ㅎㅎ작동방법은 원터치로 버튼만 눌러주면 되는데요 역시 원터치가 제일 편해요바닥엔 스펀지가 있어서 지지도 잘 해주고바닥 닿는 면에 스크래치를 방지해 주기도 한답니다소형공기청정기이지만 필터 사이즈는 일반 소형 공기청정기보다 훨씬 큰데요필터사이즈가 청정기 사이즈라고 보시면 될것 같아요필터가 엄청커요 일반 소형공기청정기보다 8배나 크다고 하네요이 필터는 아반떼ad코나니로 등 자동차에어컨필터호환 되기도 하니자동차 에어컨 필터 구매할 때 대량 구매해놓아도 좋을것 같아요정면에 동그랗게 창이 보이는데요이 보이는 창을 통해서 실시간으로 필터 오염도를 확인할 수 있기 때문에교체주기를 따로 기억할 필요도 없습니다5핀 케이블 연결해서 작동하면 되기 때문에보조배터리가 있다면 차량용 공기청정기로 사용해도 좋아요 맘공기청정기는 소음도 적은 편이라서아이가 주로 학습을 하는 공부방 책상 위에 두어도 괜찮더라고요약 모드시 저소음이라 수면이나 독서시 방해가 되지 않아요커다란 필터 깔끔한 디자인 방해되지 않는 저소음으로 장점이 많은 소형공기청정기예요 구매시 맘필터3개 추가증정이벤트를 진행하고 있다고 합니다소형공기청정기 맘공기청정기 자동차에어컨필터호환 ,16,0,0,171,2,1,4439.2,5,text_ad,2021-07-24,3040,5317444,육아·결혼,['오 조그만해서 방에 두기 너무 좋겠네요디자인도 심플하고 이뻐서 인테리어용으로도 너무 괜찮은거 같아요~ㅎㅎ'],"[('요즘 엄청 더워서 하루 종일 에어컨을 작동하고 있는거 같아요', 1, 0), ('창문을 열면 훅 들어오는 습기와 더위때문에 환기도 제대로 시키지 못하고 있는데요', 0, 1), ('특히 아이방은 창문형에컨을 설치해서 제대로 환기를 못하고 있답니다 외출하고 아이 방문을 열면 습하면서 퀴퀴한 냄새 때문에 소형공기청정기를 들여 놓으려고 해요', 2, 1), ('심플한 디자인으로 어디에나 잘 어울리고 가벼운 맘공기청정기 랍니다오염된 공기는 좌우하단 방면으로 빠르게 흡입해주고깨끗한 공기는 필터를 걸러 상담에서 뿜어준답니다 ㅎㅎ', 1, 1), ('작동방법은 원터치로 버튼만 눌러주면 되는데요', 0, 1), ('역시 원터치가 제일 편해요', 1, 0), ('바닥엔 스펀지가 있어서 지지도 잘 해주고바닥 닿는 면에 스크래치를 방지해 주기도 한답니다', 0, 1), ('소형공기청정기이지만 필터 사이즈는 일반 소형 공기청정기보다 훨씬 큰데요', 2, 1), ('필터사이즈가 청정기 사이즈라고 보시면 될것 같아요', 0, 1), ('필터가 엄청커요 일반 소형공기청정기보다 8배나 크다고 하네요이 필터는 아반떼ad코나니로 등 자동차에어컨필터호환 되기도 하니자동차 에어컨 필터 구매할 때 대량 구매해놓아도 좋을것 같아요', 2, 1), ('정면에 동그랗게 창이 보이는데요', 1, 0), ('이 보이는 창을 통해서 실시간으로 필터 오염도를 확인할 수 있기 때문에교체주기를 따로 기억할 필요도 없습니다', 0, 1), ('5핀 케이블 연결해서 작동하면 되기 때문에보조배터리가 있다면 차량용 공기청정기로 사용해도 좋아요', 2, 1), ('맘공기청정기는 소음도 적은 편이라서아이가 주로 학습을 하는 공부방 책상 위에 두어도 괜찮더라고요약 모드시 저소음이라 수면이나 독서시 방해가 되지 않아요', 2, 1), ('커다란 필터 깔끔한 디자인 방해되지 않는 저소음으로 장점이 많은 소형공기청정기예요', 2, 1), ('구매시 맘필터3개 추가증정이벤트를 진행하고 있다고 합니다', 0, 1), ('소형공기청정기 맘공기청정기 자동차에어컨필터호환', 2, 1)]"
7,https://blog.naver.com/pm0146?Redirect=Log&logNo=222433636961,돼지곱창 막창은 정말 언제 먹어도 맛있는것 같아요 예전에는 밖에 외출해서만 먹었는데 요즘은 냉동막창도 정말 잘 나와서 집에서도 편하게 먹고 있답니다 100 참나무 참숯초벌구이라서 냄새도 안나고 더 맛있을것 같아요ㅎㅎ포장도 꼼꼼하게 잘 와서 집에서도 간편하게 먹을 수 있지만캠핑이나 여행갈 때 챙겨가도 정말 좋겠더라고요 대구 동성로 막창장도 넉넉하게 들어있답니다뭘 먹던 소스를 많이 찍어먹는 저는 너무 좋았어요 ㅎㅎ소스파인 제가 먹어도 소스가 많아서하나 남았거든요다음에 고기 먹을 때 찍어먹으려고요막창소스지만 삼겹살이나 목살 등 고기 구워서 찍어 먹어도 정말 맛있을것 같았어요해동 후 조리해도 되지만 저는 에어프라이어에 조리할거라 그냥 냉동막창 상태로 조리했답니다에어프라이어 팟에다 넣어놓고 어느정도 조리를 했는데요 와  참나무 훈연향이 은은하게 나더라고요냉기가 가셔서 먹기 좋은 크기로 잘라주었답니다 ㅎㅎ먹기 좋은 크기로 잘라서 더 구워주었답니다 ㅎㅎ향이 진짜 좋아요 몇 개 집어먹었는데 입안에에서도 훈연향이그리고 잡내도 하나도 안나구 맛있더라구요 놀러가서 구워 먹으면 더더더 맛있을것 같다는 생각이 들었어요언능 놀러가고 싶은데  올해는 휴가 포기해야겠어요완성ㅋㅋ에어프라이어로 굽기만 하면 되니까 조리가 정말 쉬워요정말 노릇노릇 잘 구워졌쬬숯불에 구워먹으면 더더더 맛있게 먹을 수 있겠지만집에서 그렇게 먹기가 쉽나요ㅋㅋ바짝 굽는걸 좋아하시는 분들은 조금 더 구워도 될것 같아요저는 너무 바작 익히면 질겨지는것 같아서 적당히 구웠답니다오랜만에 먹는 막창이라 구우면서 계속 집어먹었는데 진짜 맛있었어요 ㅎㅎ후라이팬에 구워도 좋지만 에어프라이어에 구워먹는 막창이 기름은 쏙 빠지고 조리도 간편해서훨씬 더 맛있게 먹을 수 있답니다막장 소스에 콕 찍어 먹어요 ㅎㅎ땅콩가루가 들어있어서 땅콩맛도 나더라고요음 좀 호불호가 갈릴것 같아요저희 남편은 땅콩 엄청 싫어하는 사람이라서하지만 전 좋아하거든요 정말 맛있게 먹었어요 저는 콕은 아니고 풍덩 담가서 먹는 서타일ㅋㅋㅋ고기 먹을 때 밥을 꼭 먹어서 저는 밥 반찬으로 아주 맛있게 잘 먹었어요이미 다 먹고 소화가 되었는데도 사진 보니까 너무 먹고 싶네요 남편은 밥 반찬으로도 먹고맥주랑도 먹고ㅋㅋㅋ 냄새에 민감하신 분인데 잡내가 하나도 안나서아주 맛있게 잘 먹었답니다기름기 있는 음식은 시원한 맥주랑 먹으면 술술 들어간다는데저는 마실 수가 없어서 남편이 부럽더라고요 조리도 쉽고 먹기도 간편하고 잡내도 안나고 맛있는 대가막창이에요 돼지막창 에어프라이어막창 참나무훈제막창 초벌구이막창,22,0,0,275,0,1,4439.2,1,,2021-07-16,3040,5317444,육아·결혼,0,"[('돼지곱창 막창은 정말 언제 먹어도 맛있는것 같아요', 1, 0), ('예전에는 밖에 외출해서만 먹었는데 요즘은 냉동막창도 정말 잘 나와서 집에서도 편하게 먹고 있답니다 100 참나무 참숯초벌구이라서 냄새도 안나고 더 맛있을것 같아요ㅎㅎ', 1, 0), ('포장도 꼼꼼하게 잘 와서 집에서도 간편하게 먹을 수 있지만캠핑이나 여행갈 때 챙겨가도 정말 좋겠더라고요 대구 동성로 막창장도 넉넉하게 들어있답니다', 1, 0), ('뭘 먹던 소스를 많이 찍어먹는 저는 너무 좋았어요 ㅎㅎ', 1, 0), ('소스파인 제가 먹어도 소스가 많아서하나 남았거든요', 1, 0), ('다음에 고기 먹을 때 찍어먹으려고요막창소스지만 삼겹살이나 목살 등 고기 구워서 찍어 먹어도 정말 맛있을것 같았어요', 1, 0), ('해동 후 조리해도 되지만 저는 에어프라이어에 조리할거라 그냥 냉동막창 상태로 조리했답니다', 1, 0), ('에어프라이어 팟에다 넣어놓고 어느정도 조리를 했는데요', 1, 0), ('와 참나무 훈연향이 은은하게 나더라고요냉기가 가셔서 먹기 좋은 크기로 잘라주었답니다 ㅎㅎ', 2, 1), ('먹기 좋은 크기로 잘라서 더 구워주었답니다 ㅎㅎ', 2, 1), ('향이 진짜 좋아요', 1, 0), ('몇 개 집어먹었는데 입안에에서도 훈연향이그리고 잡내도 하나도 안나구 맛있더라구요', 0, 1), ('놀러가서 구워 먹으면 더더더 맛있을것 같다는 생각이 들었어요', 1, 0), ('언능 놀러가고 싶은데 올해는 휴가 포기해야겠어요', 1, 0), ('완성ㅋㅋ에어프라이어로 굽기만 하면 되니까 조리가 정말 쉬워요', 1, 0), ('정말 노릇노릇 잘 구워졌쬬숯불에 구워먹으면 더더더 맛있게 먹을 수 있겠지만집에서 그렇게 먹기가 쉽나요ㅋㅋ', 2, 1), ('바짝 굽는걸 좋아하시는 분들은 조금 더 구워도 될것 같아요', 1, 0), ('저는 너무 바작 익히면 질겨지는것 같아서 적당히 구웠답니다오랜만에 먹는 막창이라 구우면서 계속 집어먹었는데 진짜 맛있었어요 ㅎㅎ', 1, 0), ('후라이팬에 구워도 좋지만 에어프라이어에 구워먹는 막창이 기름은 쏙 빠지고 조리도 간편해서훨씬 더 맛있게 먹을 수 있답니다막장 소스에 콕 찍어 먹어요 ㅎㅎ', 1, 0), ('땅콩가루가 들어있어서 땅콩맛도 나더라고요음 좀 호불호가 갈릴것 같아요', 1, 1), ('저희 남편은 땅콩 엄청 싫어하는 사람이라서하지만 전 좋아하거든요', 1, 0), ('정말 맛있게 먹었어요', 1, 0), ('저는 콕은 아니고 풍덩 담가서 먹는 서타일ㅋㅋㅋ고기 먹을 때 밥을 꼭 먹어서 저는 밥 반찬으로 아주 맛있게 잘 먹었어요', 1, 0), ('이미 다 먹고 소화가 되었는데도 사진 보니까 너무 먹고 싶네요', 2, 1), ('남편은 밥 반찬으로도 먹고맥주랑도 먹고ㅋㅋㅋ 냄새에 민감하신 분인데 잡내가 하나도 안나서아주 맛있게 잘 먹었답니다기름기 있는 음식은 시원한 맥주랑 먹으면 술술 들어간다는데저는 마실 수가 없어서 남편이 부럽더라고요 조리도 쉽고 먹기도 간편하고 잡내도 안나고 맛있는 대가막창이에요', 1, 0), ('돼지막창 에어프라이어막창 참나무훈제막창 초벌구이막창', 1, 0)]"
1,https://blog.naver.com/pm0146?Redirect=Log&logNo=222301206159,뮤지션 이적이 전하는 희망의 노래 당연한것들을 책으로 만나보았어요당연한 것들을 포함해 2만원 이상 구매하면 아크릴 무드등도 받을 수 있어서함께 받았답니다너무나도 깔끔해 제 취향저격한 무드등이에요밤에 수면등으로 사용해도 좋고인테리어등으로도 아주 굿입니다크기도 크지 않아서 안방이나 아이방에 두어도 좋아요usb케이블을 연결한 뒤 버튼으로 온오프가 되기 때문에사용도 편리하구요 ㅎㅎ당연한것들은 초판 한정으로 퍼즐이 들어있는데요너무나 앙증맞은 퍼즐이 책 맨 뒷편에 있어요심심할 때 하면 정말 재밌게 할 수 있겠어요당연하게 여겨서 알지 못했던 것들지금 시국에 딱 들어맞죠어떻게 생각하느냐에 따라 다르지만꼭 지금뿐만 아니더라도대부분의 사람들은 공감이 될거라고 생각합니다그림도 함께 보면서 천천히 읽어내려갔는데요괜시리 가슴이 뭉클해지더라고요그리고 또 한 편으로는 힐링도 되고요그림보니 마음이 편해지기도 했어요함께구매한 마들렌 피낭시에 책이에요워낙 구움과자를 좋아하기도 하지만요즘 동생이 엄청 사먹어서 ㅋㅋㅋㅋ제가 만들어 주려고요다양한 레시피가 아주 잘 정리가 되어있어서 쉽게 따라할 수 있을것 같아요벌써부터 기대가 됩니다구움과자 책도 함께 겟다양한 구움과자 레시피가 있어요 새로운 내 보물책ㅋㅋ도구나 재료 설명도 잘 되어있고요보통 만들다가 실패하는 원인과 이유도 상세하게 나와있어서베이킹 초보자가 보기에 좋은 책이더라고요과정도 깔끔하게 잘 설명이 되어있어서 아주 굿초이스한 책이랍니다 yes24 당연한것들 예스24 예스베리굿즈,22,1,0,147,4,0,4438.6,8,,2021-04-07,3040,5317441,육아·결혼,"['보물책이라고 할 만 하네요^^무드등도 예뻐요', '피치님 잇님 블로그 구경하다가\n인사 남기고 갑니당 ^.^ \n블로그 눈팅 자주 하고 있는데 \n새로운 글 보러 또 방문드릴께요 ~ ㅎ', '공감누르고 갑니다 ~! ＾ν＾']","[('뮤지션 이적이 전하는 희망의 노래 당연한것들을 책으로 만나보았어요', 1, 0), ('당연한 것들을 포함해 2만원 이상 구매하면 아크릴 무드등도 받을 수 있어서함께 받았답니다', 1, 1), ('너무나도 깔끔해 제 취향저격한 무드등이에요', 1, 0), ('밤에 수면등으로 사용해도 좋고인테리어등으로도 아주 굿입니다', 1, 0), ('크기도 크지 않아서 안방이나 아이방에 두어도 좋아요', 2, 1), ('usb케이블을 연결한 뒤 버튼으로 온오프가 되기 때문에사용도 편리하구요 ㅎㅎ', 2, 1), ('당연한것들은 초판 한정으로 퍼즐이 들어있는데요', 1, 1), ('너무나 앙증맞은 퍼즐이 책 맨 뒷편에 있어요', 1, 0), ('심심할 때 하면 정말 재밌게 할 수 있겠어요', 1, 0), ('당연하게 여겨서 알지 못했던 것들지금 시국에 딱 들어맞죠', 1, 0), ('어떻게 생각하느냐에 따라 다르지만꼭 지금뿐만 아니더라도대부분의 사람들은 공감이 될거라고 생각합니다', 1, 0), ('그림도 함께 보면서 천천히 읽어내려갔는데요', 0, 1), ('괜시리 가슴이 뭉클해지더라고요그리고 또 한 편으로는 힐링도 되고요그림보니 마음이 편해지기도 했어요', 1, 0), ('함께구매한 마들렌 피낭시에 책이에요', 0, 1), ('워낙 구움과자를 좋아하기도 하지만요즘 동생이 엄청 사먹어서 ㅋㅋㅋㅋ제가 만들어 주려고요다양한 레시피가 아주 잘 정리가 되어있어서 쉽게 따라할 수 있을것 같아요', 1, 0), ('벌써부터 기대가 됩니다구움과자 책도 함께 겟다양한 구움과자 레시피가 있어요', 1, 0), ('새로운 내 보물책ㅋㅋ도구나 재료 설명도 잘 되어있고요보통 만들다가 실패하는 원인과 이유도 상세하게 나와있어서베이킹 초보자가 보기에 좋은 책이더라고요과정도 깔끔하게 잘 설명이 되어있어서 아주 굿초이스한 책이랍니다 yes24 당연한것들 예스24 예스베리굿즈', 1, 0)]"
6,https://blog.naver.com/pm0146?Redirect=Log&logNo=222286917346,이번 3월 예스 굿즈로 스폰지밥 북파우치를 받았어요너무 귀엽지 않나요크기도 딱 적당한 파우치인데요책 뿐만 아니라 다른 용품들을 담을 수 있게 수납이 나뉘어있어요아이 책은 사이즈가 작아서 쏙 들어가더라구요책 사면서 이렇게 귀엽고 실용성있는 굿즈까지 받으니 정말 좋더라구요 이번에 책은 역시나 초등교육에 관련된 책으로ㅎㅎㅎ아직 아는게 많이 없는 초보 엄마라 책을 통해서 배워보려고요아이에게 습관 길러주는게 가장 어려운데 초등 매일 습관 익힘책을 통해 재미있고 쉽게 습관을 길러주려고 합니다 한 번 훑어보았는데 아이에게 정리 습관 길러줄 수 있는 페이지가 있더라고요늘 정리정돈으로 스트레스를 받았던터라읽어보고 도움 받으려고요 매일매일 공부 독서 생활습관 등 체크할 수 있는 책인데요너무 괜찮더라고요특히 쓰기 부분은 맨날 달라지는 내용이라너무나도 괜찮았어요 일기대신 사용해도 좋을듯꾸준히 작성 한 뒤에 버리지 않고 오래오래 남겨두려고요아이가 크고난 후에 읽으면 정말 좋을것 같아요인스타그램에서 유명하신 미니님책 내셨다고 몇 년 전부터 보기만 했는데 드디어 겟저도 맛있게 먹고 살 빼보려고요나중에 아이에게 미안하지 않고 문구가 확 들어왔던 초등 학부모 생활 책이에요아직 학기 초라 학교가기 싫다 등 부정적인 이야기는 하지 않지만앞으로 어떻게 될지 모르니미리 읽어두는게 좋겠더라고요학부모가 궁금해하는 챕터도 있으니 많은 도움이 될것 같아요 아홉살 마음사전아이가 읽으면 참 좋겠더라고요아직 뜻을 정확히 모르는 단어들이 많아서읽어주면 좋겠다 싶었답니다감정표현을 잘 하는 아이라 더욱 좋겠다 싶었지요마음을 표현하는 다양한 말을 배우면 아이 사회성에도 도움이 될것 같고요한 페이지당 글밥이 많지 않아서학교가져가서 읽어도 좋겠다 싶어서 고르게 되었어요상황에 맞게 말을 하더라도정확히 뜻을 알고 사용하면 더 좋을거 같고요그렇지 않아도 며칠 전에 감격스럽다는말을 했더니그게 무슨말이냐고 물었는데저는 당황 분명히 나는 알고 있는 말이긴 한데대체 아이에게 어떻게 설명을 해줘야할지 난감했었거든요책을 읽어주면서 제대로 된 뜻을 알려주었답니다예스24 스폰지밥 북파우치,28,1,0,226,4,0,4439.2,11,,2021-03-25,3040,5317444,육아·결혼,"['글정독하고 갑니다!! 오늘 활기찬 하루 되세요 ~^3^', '요즘 블로그가 낙이라 놀러왔다가 글 많이 보고 가요 :) 시간가는 줄 몰랐어요 ^^', '피치님 포스팅은 언제봐도 굿굿 ㅎㅎ\n잘보고 가요~ 좋은하루되세용^^', '글 잘봤어요 공감 꾹~']","[('이번 3월 예스 굿즈로 스폰지밥 북파우치를 받았어요', 0, 1), ('너무 귀엽지 않나요', 1, 0), ('크기도 딱 적당한 파우치인데요', 1, 0), ('책 뿐만 아니라 다른 용품들을 담을 수 있게 수납이 나뉘어있어요', 0, 1), ('아이 책은 사이즈가 작아서 쏙 들어가더라구요', 2, 1), ('책 사면서 이렇게 귀엽고 실용성있는 굿즈까지 받으니 정말 좋더라구요', 0, 1), ('이번에 책은 역시나 초등교육에 관련된 책으로ㅎㅎㅎ아직 아는게 많이 없는 초보 엄마라 책을 통해서 배워보려고요아이에게 습관 길러주는게 가장 어려운데 초등 매일 습관 익힘책을 통해 재미있고 쉽게 습관을 길러주려고 합니다', 1, 0), ('한 번 훑어보았는데 아이에게 정리 습관 길러줄 수 있는 페이지가 있더라고요늘 정리정돈으로 스트레스를 받았던터라읽어보고 도움 받으려고요 매일매일 공부 독서 생활습관 등 체크할 수 있는 책인데요', 2, 1), ('너무 괜찮더라고요특히 쓰기 부분은 맨날 달라지는 내용이라너무나도 괜찮았어요', 1, 0), ('일기대신 사용해도 좋을듯꾸준히 작성 한 뒤에 버리지 않고 오래오래 남겨두려고요아이가 크고난 후에 읽으면 정말 좋을것 같아요인스타그램에서 유명하신 미니님책 내셨다고 몇 년 전부터 보기만 했는데 드디어 겟저도 맛있게 먹고 살 빼보려고요나중에 아이에게 미안하지 않고 문구가 확 들어왔던 초등 학부모 생활 책이에요', 1, 1), ('아직 학기 초라 학교가기 싫다', 1, 0), ('등 부정적인 이야기는 하지 않지만앞으로 어떻게 될지 모르니미리 읽어두는게 좋겠더라고요학부모가 궁금해하는 챕터도 있으니 많은 도움이 될것 같아요', 1, 0), ('아홉살 마음사전아이가 읽으면 참 좋겠더라고요아직 뜻을 정확히 모르는 단어들이 많아서읽어주면 좋겠다 싶었답니다감정표현을 잘 하는 아이라 더욱 좋겠다 싶었지요', 1, 0), ('마음을 표현하는 다양한 말을 배우면 아이 사회성에도 도움이 될것 같고요한 페이지당 글밥이 많지 않아서학교가져가서 읽어도 좋겠다 싶어서 고르게 되었어요', 1, 0), ('상황에 맞게 말을 하더라도정확히 뜻을 알고 사용하면 더 좋을거 같고요그렇지 않아도 며칠 전에 감격스럽다는말을 했더니그게 무슨말이냐고 물었는데저는 당황 분명히 나는 알고 있는 말이긴 한데대체 아이에게 어떻게 설명을 해줘야할지 난감했었거든요', 1, 0), ('책을 읽어주면서 제대로 된 뜻을 알려주었답니다', 1, 1), ('예스24 스폰지밥 북파우치', 1, 1)]"
