,Post URL,Post,Image num,sticker num,gif num,Paragraph num,Comment num,Video num,weekly viewer mean,Sympathy num,AD,Posting Date,Buddy num,Total visit,Blog category,Comment detail,AP
9,https://blog.naver.com/tsslove?Redirect=Log&logNo=222145851398,가습기추천 에어레스트 AR07 초음파가습기 거실에 두고 사용안녕하세욤  은비입니다야무지게 사용하고 있는 에어레스트 AR07 초음파가습기 이야기를 슬쩍 해보까해요 ㅋㅋ 원룸가습기라고하지만제방에 두고 사용하고자 했던 그 가습기거실에 사용하게 되어서 저는 제방 가습용으로 따로 ㅋㅋ 뭔가 두어야하는 상황이 되었습죠 네사실 거실은 넓으니까 원룸가습기로 알려져있는 에어레스트 AR07 이 감당할 수 있는 케파일까 싶었는데 ㅋㅋ 갓성비 입니다적극적으로 가습기추천하고 싶을만큼 가습력이 좋아요  컴터 옆에 두고 있어서 조심스럽기도 하고주변 가전과 좀 멀리 떨어뜨려두고 싶긴한데그래도 가습은 안할수가 없고 해서공기청정기와 컴퓨터 사이에 두고 사용중입니다걱정을 하긴 했는데 가습자체가 위쪽으로 되다보니까 ㅋㅋ 크게 문제가 되지 않아서 가습기추천 하기가 좋겠다는 생각이 들더라고요바닥에 두고 사용해도 되겠지만굳이 바닥이 아니라 책상가습기로 사용해야 조금더 잘 사용하는 게 아닐까 싶어지기도 하고 해서 ㅋㅋ 컴퓨터 옆에 뒀어요보통 컴퓨터책상 많이 이용하시고책상가습기로 사용하실때도 오래 앉아있는 공간에 두시길 선호하시니까요 ㅎ 가습력은 약간 요정도에여 ㅎㅎ 2단  정도에 두고 물 떨어질때까지 계속 두고아침에 채우고저녁에 돌아와도 계속 되고 있으니까 생각보다 만족도가 높아요 ㅋㅋ 단계도 조절 가능하고가습기추천 드리는 이유가 극명한 분사량 때문도 있죠 ㅋㅋ 책상위에 두고 사람이 있을땐 조금 더 과하게 틀고없을땐 조금의 실내 습도 유지를 위해 살짝 약하게만 틀어두고 가요 가습기 막 한방에 너무 크게 사용하면물이 고이거나 하는 상황을 미연에 방지하고 싶어서 ㅎㅎ 그런거도 있어요  로고마저 예쁘고 그래에어레스트 심플하게 잘나와서일반 원룸가습기 사용하시는 곳에서도 잘 어울릴것 같아요 물건이 많은 일반 가정집 거실에서도 요렇게 찰떡인데뭐 ㅋㅋㅋ 원룸에선 더 찰떡같은 아이템이 되어주지 않을까 싶어요  분사력 보여드리는건 아무래도영상이 더 나을거 같아서 영상에도 담아봤어요  단계별로 조절할 수 있으니까 더 좋고요  ㅎㅎㅎㅎㅎㅎㅎㅎㅎㅎㅎㅎㅎㅎ 그래서 만족도 엄청 높은거쥬때에 따라 조절이 가능하다는게 ㅎ통세척이 가능하다는게물도 한가득 부어두고 오래오래 간다는게 아주 만족스럽습니다 ㅋㅋ ,9,0,1,244,1,1,2332.2,19,revu,2020-11-16,6443,4589713,문학·책,[],"[('가습기추천 에어레스트 AR07 초음파가습기 거실에 두고 사용안녕하세욤 은비입니다', 2, 1), ('야무지게 사용하고 있는 에어레스트 AR07 초음파가습기 이야기를 슬쩍 해보까해요 ㅋㅋ', 0, 1), ('원룸가습기라고하지만제방에 두고 사용하고자 했던 그 가습기거실에 사용하게 되어서 저는 제방 가습용으로 따로 ㅋㅋ 뭔가 두어야하는 상황이 되었습죠 네사실 거실은 넓으니까 원룸가습기로 알려져있는 에어레스트 AR07 이 감당할 수 있는 케파일까 싶었는데 ㅋㅋ 갓성비 입니다', 2, 1), ('적극적으로 가습기추천하고 싶을만큼 가습력이 좋아요', 1, 0), ('컴터 옆에 두고 있어서 조심스럽기도 하고주변 가전과 좀 멀리 떨어뜨려두고 싶긴한데그래도 가습은 안할수가 없고 해서공기청정기와 컴퓨터 사이에 두고 사용중입니다', 2, 1), ('걱정을 하긴 했는데 가습자체가 위쪽으로 되다보니까 ㅋㅋ 크게 문제가 되지 않아서 가습기추천 하기가 좋겠다는 생각이 들더라고요바닥에 두고 사용해도 되겠지만굳이 바닥이 아니라 책상가습기로 사용해야 조금더 잘 사용하는 게 아닐까 싶어지기도 하고 해서 ㅋㅋ 컴퓨터 옆에 뒀어요', 1, 1), ('보통 컴퓨터책상 많이 이용하시고책상가습기로 사용하실때도 오래 앉아있는 공간에 두시길 선호하시니까요 ㅎ', 2, 1), ('가습력은 약간 요정도에여 ㅎㅎ 2단 정도에 두고 물 떨어질때까지 계속 두고아침에 채우고저녁에 돌아와도 계속 되고 있으니까 생각보다 만족도가 높아요 ㅋㅋ', 1, 0), ('단계도 조절 가능하고가습기추천 드리는 이유가 극명한 분사량 때문도 있죠', 0, 1), ('ㅋㅋ 책상위에 두고 사람이 있을땐 조금 더 과하게 틀고없을땐 조금의 실내 습도 유지를 위해 살짝 약하게만 틀어두고 가요 가습기 막 한방에 너무 크게 사용하면물이 고이거나 하는 상황을 미연에 방지하고 싶어서 ㅎㅎ 그런거도 있어요', 2, 1), ('로고마저 예쁘고 그래에어레스트 심플하게 잘나와서일반 원룸가습기 사용하시는 곳에서도 잘 어울릴것 같아요', 1, 0), ('물건이 많은 일반 가정집 거실에서도 요렇게 찰떡인데뭐 ㅋㅋㅋ 원룸에선 더 찰떡같은 아이템이 되어주지 않을까 싶어요', 1, 0), ('분사력 보여드리는건 아무래도영상이 더 나을거 같아서 영상에도 담아봤어요', 2, 1), ('단계별로 조절할 수 있으니까 더 좋고요 ㅎㅎㅎㅎㅎㅎㅎㅎㅎㅎㅎㅎㅎㅎ 그래서 만족도 엄청 높은거쥬', 1, 0), ('때에 따라 조절이 가능하다는게 ㅎ통세척이 가능하다는게물도 한가득 부어두고 오래오래 간다는게 아주 만족스럽습니다 ㅋㅋ', 2, 1)]"
10,https://blog.naver.com/tsslove?Redirect=Log&logNo=222145562387,천연가습기 제올라이트 천연탈취제로 자연스레 실내적정습도 유지안녕하세요  은비입니다새로 리뉴얼할 집 주방코팅 알아보다가 나노클린에서 천연가습기를 봐서일단 이거부터 구매를 해봤습니다 네나노클린화이트 천연가습기인데 제올라이트 라는 천연탈취제 성분 뭐 그런거라서천연가습기로도 사용할 수 있나봐요 ㅋㅋ 그래서 나노클린화이트 사용하는 중인데 ㅋㅋ 방냄새가 좀 사라진 느낌적인 느낌이 있습니다ㅋㅋㅋㅋㅋㅋㅋㅋㅋㅋㅋㅋㅋㅋㅋㅋ 휴 요새 자꾸 ㅋㅋ 방정리 안해서 방에서 냄새나여그래서  사람이 치우고 살아야하는구나 새삼 깨닫고요거러니까 나노클린화이트 가 제방에 딱 혜자입니댜 ㅋㅋㅋㅋㅋㅋㅋㅋㅋㅋㅋㅋ 지금은 솔방울과 ㅋㅋㅋ 제올라이트를 같이 두고 실내적정습도를 유지하고 있어요  포장은 요렇게 별도로 되어있오요  알져 그  물 잘 드시는 하마님 포장 같은 그런 느낌 ㅋㅋㅋ 이거 제올라이트 가볍게 부어서방에 두기만 하면 끝이여요이렇게 하면 손쉽게 실내적정습도를 유지할 수 있으니까하나는 엄마방 하나는 제방에 뒀고요 ㅋㅋ 방사이즈가 작아서 아무래도 하나가 좋긴 한데좀 사이즈 좀 있다 싶으시면 두개 세개 두세여  포장 가볍게 뜯어서 ㅋㅋㅋ 제올라이트 넣기전에 ㅋㅋ 스으을 쩍 덮어봅니다 ㅋㅋ 걍 기화되는 그런거라서 ㅎㅎ 누구나 손쉽게 할 수 있다는게 ㅋㅋ 아마 장점이라면 장점일것 같아요  사용방법도 가볍게 ㅋㅋ 종이에 적어서 주더라고요  나중에 사용하시고  ㅎㅎ 전자렌지에 건조시키거나혹은 자연건조 시켜서 반 영구적으로 사용할 수 있나봐요 2개월에 1회씩 관리니까 저는 1월 시작할때쯤 관리해주면 될것 같네요 ㅋㅋ 지금도 방이 좀 건조한 편이라서금새 마르고 그러했습니다 덕분에 그래도 실내적정습도 유지되고 좋지요  방법 숙지는 잊지마십시댜  나중에 필요하더라도 그쯤 또 다시 봐야하니이렇게 리뷰라도 남겨두면 ㅋㅋ 좀 났더라고요뭐였더라 하고 설명서 다시 찾아보게 되고요 ㅋ 저는 그냥 사용하고 있지만파우치나 용기에 피톤치드 오일을 떨어뜨려주면 더 좋다고 해요  ㅋㅋㅋㅋㅋㅋㅋㅋ티트리 오일은 넣으면 안되게쪄 흠 따로 동봉되어 온 친구가 제올라이트인데500g 으로 넉넉한 양이라서2통에 나누어서 넣으면 되어요  이것은 아주 간편  뭔가 천연가습기의 소임을 다할거 같은 그런 화이트 패키지에 ㅋㅋ 생각보다 마음을 많이 빼앗겼고요 ㅋㅋㅋㅋㅋㅋㅋㅋ 퓨어합니다 정말  너무좋더라고요 ㅋㅋ 약간 돌멩이 같이 생겼지만 여는 순간 약간나무향 이랄까요 거런게 좀 나요 ㅋㅋ 돌멩이 향 흙향은 아니라서 ㅋㅋㅋㅋㅋㅋㅋㅋㅋㅋㅋㅋ 거부감 없고 뭔가 좋은 향이더라고요자연의 냄새다 쯤으로 이야기해야할까여 용기 2개에 나눠서 넣을거에요 ㅋㅋ 잘 넣어볼게요  역시 영상은 폰카가 짱이고효 넣을때 약간 먼지가 날릴 수 있어요  건조해서 날리는 먼지니까물부으면 또 사라지지 않을까 싶고요  약간 흙같이 보이지만흙 아니고요ㅋㅋㅋㅋㅋㅋㅋㅋㅋㅋㅋㅋㅋㅋㅋㅋㅋ두개 야무지게 절반정도 차는 양이에요한통에 250g 씩 넣고 두면 딱인거 같고요 설명서에는 물을 약간 자박하게 깔려있는 정도로만 넣으라고 했으므로 ㅋㅋ 저도 물을 고정도 넣어볼겁니다한컵가지고 양쪽에 나눠서 넣어보았어요  물이랑 닿으면 마치탄산수 기포 올라오듯한 소리가 나는게그게 정상이래요  이상한건가 해서 당황했는데 ㅋㅋㅋㅋㅋㅋㅋㅋㅋㅋㅋㅋ소리 들어보면 괜히 마음이 뭔가 차분해지고 그러더라고요 물 양은 이정도 했는데 처음에 물 넣기전에 약간 평평하게 깔아주세여 물 넣고나서 정리해야지하니까 ㅋㅋ 잘 안되더라고요 ㅋㅋㅋㅋㅋㅋㅋㅋㅋㅋㅋㅋㅋㅋ요로코롬 뚜껑 덮으면 끝입니다절반도 채 못채우는 느낌이지만요물같은 천연가습기 되시겠슴니다ㅋㅋㅋㅋㅋㅋㅋㅋㅋㅋㅋㅋㅋㅋㅋㅋ밤에 너무 편하게 자고 아침에 일어나서 코가 막히거나 그러지 않아서약간의 비염을 가진 저로서는 너무 만족스럽고 그렇더라고요 안에 자박하게 깔린 물  그렇게 볼 수 있습니다 ㅋㅋㅋㅋㅋㅋㅋㅋㅋㅋㅋㅋㅋㅋㅋㅋ화이트제품 자체가 환경부 주관으로 안전인증 으로 높은 합격점으로 통과된 품질과 안전성 편리함을 가지고 있대요  향균이랑 탈취도 좋고9999정부에서 실시하는 안전검사에서 KCL 지정한 유해성분도 모두 불검출로 통과된 안전한 제품이래여 집에 ㅋㅋ 제 방은 제방 한 켠 가운데 뒀고요책이 많아서 사실 건조한게 맞나 싶다가도방 습기 생각 하면 있어야 할거 같고 그러더라고요  ㅎㅎ 엄빠 방에도 두고나니까 엄마도 좋은 가봐요 ㅋㅋ 자고 일어나셔서 불편해하지 않으시는거에 만족합니다기화식가습기 신기하지여  ㅎㅎ 저도 이게 될까 싶었는데 되긴 되더라고요 ㅋㅋㅋ 기화식 가습기에 또한번 반하고 그랬습니다ㅋㅋㅋㅋㅋㅋㅋ ,29,0,0,492,0,3,2332.2,21,revu,2020-11-16,6443,4589713,문학·책,0,"[('천연가습기 제올라이트 천연탈취제로 자연스레 실내적정습도 유지안녕하세요', 0, 1), ('은비입니다', 1, 0), ('새로 리뉴얼할 집 주방코팅 알아보다가 나노클린에서 천연가습기를 봐서일단 이거부터 구매를 해봤습니다', 0, 1), ('네나노클린화이트 천연가습기인데 제올라이트 라는 천연탈취제 성분 뭐 그런거라서천연가습기로도 사용할 수 있나봐요 ㅋㅋ 그래서 나노클린화이트 사용하는 중인데 ㅋㅋ 방냄새가 좀 사라진 느낌적인 느낌이 있습니다ㅋㅋㅋㅋㅋㅋㅋㅋㅋㅋㅋㅋㅋㅋㅋㅋ', 2, 1), ('휴 요새 자꾸 ㅋㅋ 방정리 안해서 방에서 냄새나여그래서 사람이 치우고 살아야하는구나', 2, 1), ('새삼 깨닫고요거러니까 나노클린화이트 가 제방에 딱 혜자입니댜 ㅋㅋㅋㅋㅋㅋㅋㅋㅋㅋㅋㅋ', 1, 0), ('지금은 솔방울과 ㅋㅋㅋ 제올라이트를 같이 두고 실내적정습도를 유지하고 있어요', 0, 1), ('포장은 요렇게 별도로 되어있오요 알져 그 물 잘 드시는 하마님 포장 같은 그런 느낌 ㅋㅋㅋ 이거 제올라이트 가볍게 부어서방에 두기만 하면 끝이여요이렇게 하면 손쉽게 실내적정습도를 유지할 수 있으니까하나는 엄마방 하나는 제방에 뒀고요 ㅋㅋ 방사이즈가 작아서 아무래도 하나가 좋긴 한데좀 사이즈 좀 있다 싶으시면 두개 세개 두세여 포장 가볍게 뜯어서 ㅋㅋㅋ 제올라이트 넣기전에 ㅋㅋ 스으을 쩍 덮어봅니다 ㅋㅋ', 2, 1), ('걍 기화되는 그런거라서 ㅎㅎ 누구나 손쉽게 할 수 있다는게 ㅋㅋ 아마 장점이라면 장점일것 같아요', 1, 0), ('사용방법도 가볍게 ㅋㅋ 종이에 적어서 주더라고요 나중에 사용하시고 ㅎㅎ 전자렌지에 건조시키거나혹은 자연건조 시켜서 반 영구적으로 사용할 수 있나봐요 2개월에 1회씩 관리니까 저는 1월 시작할때쯤 관리해주면 될것 같네요 ㅋㅋ', 2, 1), ('지금도 방이 좀 건조한 편이라서금새 마르고 그러했습니다', 0, 1), ('덕분에 그래도 실내적정습도 유지되고 좋지요', 0, 1), ('방법 숙지는 잊지마십시댜 나중에 필요하더라도 그쯤 또 다시 봐야하니이렇게 리뷰라도 남겨두면 ㅋㅋ 좀 났더라고요뭐였더라 하고 설명서 다시 찾아보게 되고요 ㅋ 저는 그냥 사용하고 있지만파우치나 용기에 피톤치드 오일을 떨어뜨려주면 더 좋다고 해요 ㅋㅋㅋㅋㅋㅋㅋㅋ', 2, 1), ('티트리 오일은 넣으면 안되게쪄', 1, 0), ('흠 따로 동봉되어 온 친구가 제올라이트인데500g 으로 넉넉한 양이라서2통에 나누어서 넣으면 되어요', 2, 1), ('이것은 아주 간편 뭔가 천연가습기의 소임을 다할거 같은 그런 화이트 패키지에 ㅋㅋ 생각보다 마음을 많이 빼앗겼고요 ㅋㅋㅋㅋㅋㅋㅋㅋ 퓨어합니다', 1, 0), ('정말 너무좋더라고요 ㅋㅋ 약간 돌멩이 같이 생겼지만 여는 순간 약간나무향 이랄까요 거런게 좀 나요 ㅋㅋ 돌멩이 향 흙향은 아니라서 ㅋㅋㅋㅋㅋㅋㅋㅋㅋㅋㅋㅋ 거부감 없고 뭔가 좋은 향이더라고요자연의 냄새다 쯤으로 이야기해야할까여 용기 2개에 나눠서 넣을거에요 ㅋㅋ', 1, 0), ('잘 넣어볼게요 역시 영상은 폰카가 짱이고효 넣을때 약간 먼지가 날릴 수 있어요', 2, 1), ('건조해서 날리는 먼지니까물부으면 또 사라지지 않을까 싶고요 약간 흙같이 보이지만흙 아니고요ㅋㅋㅋㅋㅋㅋㅋㅋㅋㅋㅋㅋㅋㅋㅋㅋㅋ두개 야무지게 절반정도 차는 양이에요', 1, 0), ('한통에 250g 씩 넣고 두면 딱인거 같고요 설명서에는 물을 약간 자박하게 깔려있는 정도로만 넣으라고 했으므로 ㅋㅋ 저도 물을 고정도 넣어볼겁니다', 2, 1), ('한컵가지고 양쪽에 나눠서 넣어보았어요', 0, 1), ('물이랑 닿으면 마치탄산수 기포 올라오듯한 소리가 나는게그게 정상이래요 이상한건가 해서 당황했는데 ㅋㅋㅋㅋㅋㅋㅋㅋㅋㅋㅋㅋ소리 들어보면 괜히 마음이 뭔가 차분해지고 그러더라고요 물 양은 이정도 했는데 처음에 물 넣기전에 약간 평평하게 깔아주세여', 1, 0), ('물 넣고나서 정리해야지하니까 ㅋㅋ 잘 안되더라고요 ㅋㅋㅋㅋㅋㅋㅋㅋㅋㅋㅋㅋㅋㅋ요로코롬 뚜껑 덮으면 끝입니다', 2, 1), ('절반도 채 못채우는 느낌이지만요물같은 천연가습기 되시겠슴니다ㅋㅋㅋㅋㅋㅋㅋㅋㅋㅋㅋㅋㅋㅋㅋㅋ', 2, 1), ('밤에 너무 편하게 자고 아침에 일어나서 코가 막히거나 그러지 않아서약간의 비염을 가진 저로서는 너무 만족스럽고 그렇더라고요 안에 자박하게 깔린 물 그렇게 볼 수 있습니다 ㅋㅋㅋㅋㅋㅋㅋㅋㅋㅋㅋㅋㅋㅋㅋㅋ', 1, 0), ('화이트제품 자체가 환경부 주관으로 안전인증 으로 높은 합격점으로 통과된 품질과 안전성 편리함을 가지고 있대요 향균이랑 탈취도 좋고9999정부에서 실시하는 안전검사에서 KCL 지정한 유해성분도 모두 불검출로 통과된 안전한 제품이래여', 2, 1), ('집에 ㅋㅋ 제 방은 제방 한 켠 가운데 뒀고요책이 많아서 사실 건조한게 맞나 싶다가도방 습기 생각 하면 있어야 할거 같고 그러더라고요 ㅎㅎ 엄빠 방에도 두고나니까 엄마도 좋은 가봐요 ㅋㅋ 자고 일어나셔서 불편해하지 않으시는거에 만족합니다기화식가습기 신기하지여 ㅎㅎ 저도 이게 될까 싶었는데 되긴 되더라고요 ㅋㅋㅋ 기화식 가습기에 또한번 반하고 그랬습니다ㅋㅋㅋㅋㅋㅋㅋ', 1, 0)]"
