,Post URL,Post,Image num,sticker num,gif num,Paragraph num,Comment num,Video num,weekly viewer mean,Sympathy num,AD,Posting Date,Buddy num,Total visit,Blog category,Comment detail
0,https://blog.naver.com/6384_o?Redirect=Log&logNo=221545133065,"얼마 전까지만 해도 아직 얇은 긴팔은 괜찮네~ 싶었는데, 어느순간 갑자기 너무 더워졌어요.오늘은 하루종일 사무실에 있었는데 어찌나 덥던지.. 빨리 여름 준비를 하려고 선풍기부터 준비했어요회사에 있긴 하지만 두 명 당 하나라 ㅡ..ㅡ​​​제가 찾아본 건프롬비 탁상용 선풍기 아이스링크​가격은 59,800원인데 SNS에 후기 올리면 다음 번엔 최대 50%까지 할인 받을 수 있어용@_@​​​​배터리도 빵빵한 무선 선풍기에회전, 타이머, 조명 기능까지 있는!탁상용, 휴대용이지만 필요한 기능은 꼭꼭 담은 선풍기라서 마음이 갔어요.​​​​색깔은 쿨 그레이와 스노우 화이트가 있는데 둘 다 넘 이쁘더라구요!그래도 그레이가 좀 더 고급진 느낌이 날 거 같아서 그레이로 선택​​​​​접이식이라서 휴대하기 좋은 사이즈에~ 디자인도 맘에 쏙이에요.무선이어서 충전기도 들어있네요.한 번 충전하면 최대 13시간까지 쓸 수 있대요.​​​​​밑에는 회전판이 있어서 회전모드를 선택하면 180도까지 회전되구요,각도 조절도 90도, 180도 이렇게 된답니당!그래서 어디에든 두고 사용하기 좋아요.​​​​​LED 기능도 있어서 무드등으로 사용하기도 좋아요여름밤에 ~좋은 기능이 많아서 회사에만 두려니 아까워지네요^^​​​​작동영상!자연풍 모드부터 5단계 풍속까지 조절 가능해요~휴대용이어서 많이 안 셀줄 알았는데 생각보다 엄청 세더라구요!5단계까지 올리면 일반 선풍기보다 더 시원한 거 같아요그리고 서큘레이터 기능도 있어서 공기 순환에도 좋은 휴대용 선풍기랍니당ㅎㅎ​​​​30분씩 타이머 조절도 가능하고 수면모드도 가능!수면모드를 하면 6~7초 간격으로 꺼짐과 켜짐을 반복한답니다타이머랑 수면모드를 같이 사용하면 더 편안하게 사용하기 좋아요 :)​​​​​지금은 이렇게제 화장대 겸 책상에 올려놓고 있어요~회사에는 안 가져가는중...ㅎㅎ^휴대용 선풍기인데 무선에,, 회전에,, 기능이 너무 좋아서 진짜 프롬비 휴대용 선풍기 추천해요​​​​이번 여름은 프롬비 아이스링크와 시원하게 나야겠어요 ~ :)​​​​",14,0,0,194,2,1,592.8,7,suspect,2019. 5. 23. 23:57,1677,2040604,취미,"['귀여워요.. 사무실 책상에 인테리어용으로도 좋겠어요~', '우와 미니미 탁상용으로 딱인데욤무선도 가능하니 더운 여름철 버티기 쉽겠어여']"
1,https://blog.naver.com/6384_o?Redirect=Log&logNo=221567036906,"예전에 올리브영에서 파는 전동칫솔을 쓰다가 너무 크고 성능도 별로라서 버리고..이번엔 좀 더 가볍고 작은 전동칫솔을 사용해봤어요.예전에 수학여행으로 일본 갔을 때 견학했던 오므론 회사거기에서 만든 음파전동칫솔이네요반갑 :)이번에 국내에 처음 런칭되었다구하더라구요요 모델과 HT-B214​​#오므론 #음파전동칫솔​​섬세함의 대명사 일본에서 만든 음파전동칫솔은 어떨지 한번 볼까요사람 손으로 하는 게 아니다보니까 구석구석 잘 닿을 수 있는지가 더 중요하니..​​​​​깐깐한 일본인들의 선택  음파전동칫솔​자사테스트 기준으로 일반 칫솔보다 3배 강력한 세정력과 분당 18,000회 오므론  음파전동칫솔!작고 깔끔한 디자인이에요~​​​​​​​아시아인 구강에 맞춰 만들어서 헤드도 되게 쪼그마해요ㅎㅎ그래서 치아 구석구석 깨끗하게 닦을 수 있어요예전에 쓴 건 큰 편이어서 구석은 사용하기 힘들었었기에.. 요건 넘 편했어요​​​​​​손잡이 쪽엔 온/오프그립감도 편하고 디자인도 심플!그걸로 IF DESIGN AWARD를 수상했다네요~​​​​​아래쪽엔 건전지 넣을 수 있게 돼있어요방수기능이 탑재돼있어서 본체도 물 세척 가능하구!​​​​​사용해볼까요~​​​​일반칫솔이랑은 사용법이 달라요손목스냅 없이 가로로 천천히 이동하면서!그렇게 해도 되게 시원하게 잘 되더라구요 *_*​​​​​진동&소음이 얼마나 되는지 궁금하신 분들 위해 동영상도 첨부할게요.소음이 그렇게 크지 않아서 언제어디에서나 사용하기 좋아요소리에 민감한 분들도 OK!저도 그래서 밤낮없이 완전 잘 사용하는중! 앞으로도 편하게 사용해야겠어요ㅎㅎ​​​△ 구매는 여기서 !구매인증 이벤트도 하는 중이에요​​​​~ .
",10,0,0,150,2,1,592.8,6,,2019. 6. 20. 23:58,1677,2040604,취미,"['전동칫솔은 솔 크기가 작을수록 좋더라구요. 저희 아이도 잘 사용중인데 일본꺼니 더 좋을꺼같아요. 지금 사용하는거 솔이 다 되면 이제품 구매해볼까봐요.', '맞아요 솔이 작으니까 구석구석 닦기 편해서 만족하면서 사용중이에요추천해요 !!']"
2,https://blog.naver.com/6384_o?Redirect=Log&logNo=221445589519,"서니예요 !페이스북을 보다가 발견한 풀무원 신제품모짜렐라 호떡만두와 달콤씨앗 호떡만두 !사진을 보니 너무 맛있어보여서 바로 구매해왔어요 :)신제품이라 파는곳이 아직 많지는 않더라구요..저는 강릉 유천지구 농협에서 샀어요 !​​요래 두개 ~사천식매콤 호떡만두는 빼고..ㅎㅎ진짜 만두는 별로 안 좋아해서요 ​​칼로리는 이정도... ㅠ.ㅠ​​모짜렐라 호떡만두달콤씨앗 호떡만두조리법 참고하세요 ~​저는 그냥 에어프라이어로 고고 ^^​​​생가득 모짜렐라 호떡만두에는 치즈와 고구마가 들었구요,달콤씨앗 호떡만두에는 각종 씨앗들이 들어있어요 ~어떤 맛일지 너무 기대되네요..!워낙  sns에서 핫해서 정말 ㅎㅎ​​2개 정도에 각각 칼로리예요역시 달콤씨앗 호떡만두가 높네요.... 거의 100kcal나 !​​12개 정도 들었어요 ~​​에어프라이어에 180도 10분 !기존에 쓰던 가이타이너 에어프라이어보다 큰 용량의 에어프라이어가 생겨서요즘은 이거를 쓰고 있어요 :)어디꺼인지 기억이 안 나서... 다음에 포스팅할게요 ㅎㅎ​​다 구워진 만두들 ㅎㅎㅎㅎ10분 했더니 너무 길었나봐요 ~7분? 그정도 하면 딱일듯해요.​에어프라이어에 구운 풀무원 모짜렐라 호떡만두반지르르하니 참 맛나보이죠 !​​치즈가 완전 가득 들었어요.되게되게 부드러운데, 한 가지 아쉬운 점은 치즈의 깊은 맛이랄까요,그게 좀 부족한듯해요 !고구마가 들었다는데 고구마는 사실 잘 모르겠어요 ㅎㅎ​​​​그래도 듬뿍 들어 떡볶이랑 먹으면 환상의 조합일 것 같아요 !간단한 겨울 간식으로 딱 좋은 .​​ ​​달콤씨앗 호떡만두 !요거는 생각보다 별로였어요.저는 모짜렐라 호떡만두에 한 표 ㅎㅎㅎ​​​생각보다 씨앗이 적고 약간 밍밍한 맛이에요.아쉽 ㅠㅠㅠㅠ 그래도 만두피들이 다 얇아서 속재료 가득인 건 확실하네요7,000 ~ 8,000원 가격에 12개입이니 사다놓고 먹기에도 괜찮은 것 같아요 :)개인적으로 겨울 간식으로 달콤씨앗보다는 모짜렐라 호떡만두를 추천해요.모두 에어프라이어에 꾸워드세용 ~~",17,0,0,188,4,0,592.8,11,,2019. 1. 18. 23:52,1677,2040604,취미,"['뭐 검색하다가 포스팅도 잘 보고 정보되어서 갑니당 ㅎ ^^', '감사해요!', '헉.. 아침부터 츄릅츄릅파링!ㅋㅋ', '와 이거 참 모두 맛있어 보이네요~']"
3,https://blog.naver.com/6384_o?Redirect=Log&logNo=221531954049,"미세먼지, 꽃가루, 황사에 대비하기 위해서 공기청정기 하나를 장만했어요.안에는 먼지 때문에 힘들고 바깥은 꽃가루, 황사 때문에 힘들고 어찌해야할지 모르는 봄.여러가지 복합적으로 있는 봄에는 고생한답니다.조금이라도 편하게 하기 위해서는 공기청정기가 답인듯 해요ㅠㅠ​​​​제가 사용해본 건 제로홈 공기청정기10평까지 사용가능하구 강제환기키트를 함께 판매하고 있어요.가격은 138,000원이라 가성비 굿!추가필터는 25,000원인데 포토후기 작성하면 하나 추가로 더 준다고 합니당ㅎ__ㅎ​​​​개봉꼼꼼하게 포장되어서 도착했어요~우리집 공기를 책임져줄 아이!​​​​​강제환기키트도 함께 도착아무리 공기청정을 해줘도 바깥 공기와 환기는 꼭 필요한 법이기에 세트로 :)아직 설치는 안 해봐서 설치해보고 따로 후기 또 남길게요.​​​​​오늘은 공기청정기~거실에 설치해놓았어요깔끔한 디자인이라 어디에 설치해도 잘 어울려요.​​​#제로홈 #공기청정기​터치 방식으로 되어있구요~타이머 설정이 있어서 간편! 시간간격+바람세기 조절을 할 수 있어요.세팅만 해놓으면 알아서 척척!​​​​​필터커버를 열어서 필터교체를 해줄 수 있는 공간자주자주 먼지 제거를 해주면 좋아요그러면 더 오래 사용할 수 있다고 합니당. 보통 6개월정도 사용한대요.​​​​옆에는 손잡이~옮기기 쉽게~​​​​​필터는 프리필터-카본탈취필터-트루 헤파필터, 3중구조로 되어있어요.그래서 입자가 큰 먼지부터 작은 초미세먼지까지 차례로 걸러내 제거율 99.97%정도라고 합니다!홈페이지를 보면 1평 기준으로 20초만에 공기청정, 환기하는 모습을 볼 수 있어요:-)​​​​영상처럼 기계를 켜고 Speed 버튼을 눌러 바람 세기를 조절해요.마지막 단계는 Sleep 모드로 무음상태며 수면등만 표시되었다가 10초 후엔 모든 등이 소등된답니다.Timer 버튼을 이용해서 몇 시간 뒤에 OFF할 것인지 설정도 가능~​​​​사용방법이 간단하면서 있을 건 다 있는 제로홈 공기청정기가격은 부담없어서 집들이나 혼수선물로도 참 좋을 거 같아요.​다음에는 강제환기 하는 법으로 찾아올게요 :)​​​​​​널
",14,0,0,187,3,1,592.8,8,suspect,2019. 5. 7. 23:35,1677,2040604,취미,"['공기청정기... 저도 고민중인데 계속 고민만 하고있네요,..ㅜ', '요즘은 공기청정기가 정말 필수인것 같아요~', '오 엄청 저렴하네요!! 가성비 굿~~ 튼튼해보이네요']"
4,https://blog.naver.com/6384_o?Redirect=Log&logNo=221520193230,"​요즘 필수템이 돼버린 공기청정기 !차량이나 집안이나 마찬가지인 거 같아요. 이젠 바깥도 믿을 수 없기에 환기와 동시에 필요한 공기청정기특히 저는 먼지에 예민한 편이어서 더더 필요하더라구요 :)​원래는 회사에서 준 거를 달고 있었는데 크기가 좀 큰 편이어서 작은 모닝에는 잘 안 맞더라고요막 둘 곳도 없고.. 중간에 두니까 괜히 자리만 차지하고그냥 달고 다니다가 이번에 정말 작지만 성능도 좋은 차량용 공기청정기를 사용해봤어요.​​​​Sweet Wit 차량용 공기청정기27,900원​▲ 구매처는 요기 ~아이디어 상품 쇼핑몰인듯 해요.​​​​스위트위트 차량용 공기청정기는 유해물질과 박테리아를 99% 제거해주는 기능을 가지고 있다고 해요 :-)차 내부가 작은 공간인만큼 효과도 좋겠죠​​​실제 제품 소개 내에 있는 영상 캡쳐본이에요 ~담배연기를 금세 정화시켜주는 모습 !요걸 보니까 확 꽂히더라구요.뿌옇던 연기가 언제 그랬냐는듯 사라진..​​​​​개봉 ~정말 작은 사이즈에요길이는 10cm 남짓 되네요.작지만 좋은 성능이 최고의 장점인듯 !재질도 메탈이어서 더 세련돼보여요.​​​​앞쪽에는 듀얼 USB 포트가 있답니당공기청정기를 사용하면서 다른 기기를 사용할 수 있어요.충전도 요 포트를 이용해서 하면 된답니다 !​아, 그리고 요 제품은 충전 외에는 필터 교체 같은 유지보수가 따로 필요 없어요.​​​​​제 차량에 달아보았어요.달아보니 더 작아보이는 ^^ 자리 차지를 얼마 안 해서 좋고 매달려 있어서 걸리적 거리지도 않아요.공간 활용 갑인듯 !​​​​​시동을 걸면 표시등에서 파랗게 불빛이 나와요.그리고 그 위쪽은 음이온을 방출하는 부분이어서 덮어놓고 사용하면 효율이 떨어진답니다.덮지 마세요 ~​​​​​​작지만 강한 공기청정기 ~앞으로 깨끗한 공기와 함께 안전운전 해야겠어요.먼지와 냄새로부터 안녕 :)​ ​​​ 

를 통해 본 업체에서 이용권을 제공받아 작성된 리뷰입니다,
",11,0,0,189,7,0,592.8,12,text_ad,2019. 4. 25. 19:30,1677,2040604,취미,"['차량용 공청기 크고 투박한게 대부분인데 컴팩트한 사이즈에 디자인까지 멋지네요!', '필터 교체 안해도 된다니 완전 편리한데요?필터교체 없이 공기청정이 가능하다니..저도 하나 장만하고싶네요', '오 작아서 좋은대요! 거추장스럽지 않으면서 열일할 공기청정기로 딱!이네요!', '우왕 작아서 좋은것 같아용 제가 지금 쓰는건 거추장스러워서 ㅠㅠ파링', '우와 사진 보니 이거 진짜 좋아 보이네요 저희차에도 하나 해야겠어요', '요 작은게 공기청정기능은 아주 탁월하네요!필터교체 없는거라니 더 좋은데요~ 저도 하나 살까봐요 ㅎㅎ', '진짜 요즘엔 이런 소형청정기도 준비해야하나봐요ㅠ']"
5,https://blog.naver.com/6384_o?Redirect=Log&logNo=221989289481,"​​햇볕이 점점 따가워지는 요즘,마스크를 쓰더라도 선크림은 필수품이더라고요.특히나 저는 야외에서 일하는 시간이 많아서더더욱! 필요한 자외선차단제..자주, 많이 바르는 만큼 금방 떨어져서 새로 마련했어요.​개인적으로 촉촉한 선크림을 좋아해서그런 류로 골라보았답니다 :)​​​​발드르선크림- 48,000원- 40ml- SPF40 / PA+++​​​​현재 여름 대비 30% 할인 중이에요.마스크팩 1set도 주고 있어요~​​​​양이 생각보다 많더라고요^^써봤는데 촉촉시원해서 열감 내릴 때 쓰기 좋아요.​​​​촉촉한 선크림추천 발드르!​블랙색상이라 깔끔하고둘러진 금테두리가 고급진 느낌​​​​에센스에 자외선차단제를 더한 선크림이어서 촉촉하게 데일리로 바르기 좋아요~​선크림만 바를 때 뿐만 아니라,위에 팩트나 쿠션을 더할 때도 피부가 건조하지 않아져 좋구요.​​​​부할초추출물, 아르간커넬오일이 함유된3중 기능성 선크림이에요.​자외선차단, 미백, 주름개선피부케어에 필요한 것들 :)​​​​또한 특허성분인 '루핀 프로테인'이 함유되어있답니다!​​​​사용해볼게요.살짝 묽고 가벼운 제형이고거부감 없는 향이에요.​화장품 향에 호불호가 좀 있는 편인데 다행..ㅎㅎ​​​​엄마의 사용 사진!건성피부여서 촉촉한 선크림을 선호하는데에센스에 자외선차단제를 더해서 다른 것보다 훨씬 촉촉함이 느껴지더라고요.로션형이라고 생각하심 될 거 같아요~​​​​​톡톡 두드리면 금방 흡수가 되고~바르기 전보다 살짝 밝아진 느낌이네요.톤업선크림은 아니어서 드라마틱한 효과까진 없어요.하지만 꾸준히 바르면,, 좀 도움이 되겠죠?​가볍고 촉촉해서 데일리로 바르기 좋은 선크림발드로 선크림추천 합니다 :)​​​​",15,0,0,138,1,0,592.8,7,suspect,2020. 6. 4. 0:54,1677,2040604,취미,['자주 소통하고 지내요^^ 잘 보고 갑니다^^']
