,Post URL,Post,Image num,sticker num,gif num,Paragraph num,Comment num,Video num,weekly viewer mean,Sympathy num,AD,Posting Date,Buddy num,Total visit,Blog category,Comment detail
0,https://blog.naver.com/7qaz?Redirect=Log&logNo=222329487113,"​배우기에도 쉽고, 언제 어디서든지 할 수 있는 악기 칼림바 :)​칼림바는 코로나로 인해 집에 있는 시간이 많아지고취미 생활 하나쯤은 있어야 하는 시대에서 도전해보기 좋은 악기다.​원래 칼림바는 2년 전 쯤 취업계를 내고 직장에 다니기 시작하면서퇴근후에 뭔가를 배워보면 좋을 것 같다는 생각을 했다.그래서 클래스 101어플을 켜서 알아 보던 중 발견했는데칼림바 배우려고 칼림바만 찾다가 종류가 너무 많아서 포기ㅠㅠ​​칼림바의 매력적인 소리와 굳이 학원을 다니거나 강의를 듣지 않아도칼림바만 있다면 언제 어디서든 배울 수 있다는게 장점이었다. 무려 독학 가능!​어릴때부터 안배워본 악기가 없는데이건 왜인지 쉽게 배울 수 있을 것 같고 강의비도 안들고!칼림바 전용 악보만 보면 된다는 점!그리고 유튜브에도 강의를 찾아 볼 수 있어서 너무 좋았다.​​​칼림바 하나 집에 있으면 심심할 때 손가락으로 튕튕 튕기면 시간도 뚝딱 가고 정말 재밌다 :)10개월 된 아기도 칼림바 소리 듣자마자 반해버렸다! 정말 매력적인 악기​​칼림바를 입문하게 되면 엄청 많은 칼림바 종류에 놀란다. 정말 종류도 많고 음계도 다양하고 도데체 뭘 사야하는가 엄청 고민되는데, 럭키벨 칼림바는 그런 입문자/초보자들이 쓰기에 너무 좋다.​​​그럼 바로 럭키벨 언박싱 고고!​​​스트로폼으로 박스안에서 굴러다니지 않고, 배송 중 파손 되지 않도록 꼭 맞게 포장 되어 왔다.​구성품은 영어로 된 칼림바 설명서가이드라인 스티커 (초록, 빨강)음계 / 계이름 표시 스티커안경 닦이 처럼 생긴 칼림바 전용 크리닝 천조율계칼림바 파우치칼림바​이렇게 들어있다~ 알찬 구성😆​​칼림바에도 기본적으로 음계 표시도 되어있지만 연하게 되어있기 때문에초보자는 스티커를 붙여주면 한눈에 바로바로 들어와서 연주하기 편하다.​럭키벨은 음계 표시도 각인으로 되어있기 때문에 지워질 걱정도 없어서 너무 좋다!​​그리고 럭키벨 만의 예쁜 사슴​초록색/빨간색 띠 스티커는 둘 중에 원하는 색으로 선택해서악보를 보고 붙여주면 된다 :)​​*칼림바 악보는 인터넷에 [칼림바 악보]라고 검색하면가요부터 여러 악보들이 쭉 나오니 그걸 보고 하면 된다.칼림바는 어렵지 않은게 악보에 번호로 표시되어 있어 정말 편하다.(대신 악보를 외워야 빨리빨리 연주하기 쉽다)​​​​​*조율계는 연주하다보면 틀어져서 음이 달라질 때가 있는데그럴때 위 아래로 건반을 톡톡 쳐가면서 맞춰주면 된다 :)​​​칼림바 음은 어플로도 충분히 확인 가능 :)정말 칼림바 하나만 사면 된다는게 너무 맘에드는 취미여러 칼림바 조율 어플이 있어서 맘에 드는 어플 선택해서 다운로드 하면된다. ​​​​​​럭키벨 칼림바의 장점 :)​1. 솔리드 제품 - 한 나무의 단판 재질 솔드로 만들어 진다.보통 여러 잡목 합판으로 만들어지는 경우가 대부분인데 럭키벨은 한 나무의 단판 재질솔드로 만들어 지기 때문에 음전달이 빠르고 노이즈가 감소된다는 장점이 있다. 타사(잡목 합판) 제품보다 더 영롱하고 맑은 사운드가 난다.​​2. 국내 배송칼림바는 국내에서는 아직 유명하지 않기 때문에 해외 배송, 구매 대행, 병행 수입 제품이 대부분이다. 그렇기 때문에 정말 배송에도 많은 시간이 소요되고, 배송 중 파손 문제 등 여러 문제가 있지만, 럭키벨 칼림벨은 국내 배송이다. 그래서 하루만에 배송된다. 정말 로켓배송ㅎㅎ 이게 젤 맘에 들었다배우려고 마음 먹었는데 배송이 느려지면 내 마음도 느슨해지잖아... 그렇잖아! 우리는 빨리빨리의 민족 :)​​3. 확실한 CS국내 배송이기 때문에 확실하고 꼼꼼하게 검수해서 출고된다. 그렇기 때문에 확실하고 친절한 럭키벨에 문의하면 잘 처리해주는 점이 좋았다.​​4. 예쁜 디자인그냥 단순한 디자인, 동그란 디자인이 아니라 다양하고 예쁜 칼림바들이 정말 많다. 특히 럭키벨사의 사운드 홀이 예뻐서 너무 마음에 들었다.​​5. 끝음소리칼림바 구조 상 끝음 소리가 안 좋은 경우가 대부분이다. 하지만 럭키벨은, 럭키벨사에서 오랜 연구 끝에 키와 키를 받치는 지지대의 최적의 조율을 통해서 끝음이 잘 나는 칼림바로 유명하다고 한다. 그래서 그런지 정말 럭키벨 칼림바는 짧은 손톱, 긴 손톱 모두 끝음소리가 너무 예쁘다. ​​연주하기에도 쉽고 독학하기도 쉽고 언제 어디서든 할 수 있는취미를 찾는다면 소리가 매력적인 칼림바/칼림벨을 강추 강추 😎​​​​럭키벨 칼림바 구매 정보👇🏻https://bit.ly/3myHChA​​​​​제품을 제공 받아 작성하였습니다🙌🏻 
",9,0,0,483,0,0,107.4,1,text_ad,2021. 5. 1. 0:10,51,36171,,0
1,https://blog.naver.com/7qaz?Redirect=Log&logNo=222402802877,"일상공감 물받이 우산 :)요즘 비가 자주 와서 우산 쓸 일이 많은데, 물받이 커버가 있는 신기한 우산이다.종종 비오는날 가다보면 볼 수 있었던 우산!​​​실내에 들어와서 물받이 컵을 올려주면 된다.물받이 컵은 단단한 플라스틱으로 되어있고 맨 아래 뚜껑을 돌돌 돌려 열어주면 모아진 물들을 버릴 수 있다.​손잡이 부분도 튼튼하고, 깔끔하게 적혀있는 '일상공감' 글씨 :)​​​​​​​​​​​물받이 컵을 다 내리고 우산을 펼쳐 본 모습!물받이 컵 때문에 우산을 쓰고 다닐 때 웃겨 보일까봐 걱정했는데 딱히 크게 신경쓰이는 부분은 없었고 디자인이 깔끔해서 좋았다.우산을 폈을 때 쉽게 고장나지 않을 것 같은 견고함까지👏🏻​​​​​혼자 쓰기에 넉넉한 우산 크기!(우산을 들고 있는 모습이 넘나 귀염 뽀짝하군요🥰)​요즘 비닐 같은 일회용품을 줄이기 시작하면서 우산비닐마저 점점 없어지고 빗물털이가 많아지는데 사실 이것도 별로 잘 털어지지 않아 불편했다.실내에 들어와서 우산을 접으면 우산에 묻어 있는 빗물로 인해 내 옷이 젖어서 찝찝해지고, 가끔은 버스나 전철 안에서 다른사람한테도 피해를 주게 되는 것😥그리고 특히 제일 짜증났던 건 차에 탈 때 옆좌석에 우산을 두면 시트가 모조리 젖어서 비싼 가죽 시트가 망가지는게 마음이 아팠다😭​그런데 이 우산이 있으면 그럴 걱정 하나도 없다는 것! 물 묻을 일이 없고 바닥에 물이 떨어지지 않아 깔끔해서 너무 좋았다👍🏻물받이 우산으로 편하고 깔끔한 비오는날 되기를🙆🏻‍♀️​우산에 묻은 빗물 때문에 짜증이 났었다면 ""이거슨 물받이 우산"" 추천😆​​​​​👉🏻일상공감 이거슨 물받이 우산👉🏻일상공감 홈페이지​​​​​제품을 제공 받아 작성하였습니다🙌🏻",10,0,0,188,0,2,107.4,1,text_ad,2021. 6. 19. 2:04,51,36171,,0
2,https://blog.naver.com/7qaz?Redirect=Log&logNo=222396978406,"에버블루에서 나온 프로클린 캡슐 세제와 드라이시트 :)캡슐세제를 처음 봤던건 미국여행 갔을 때! 미국에서 사용했을 때 너무 좋아서 한국에 오자마자 찾아봤지만 그때 당시에 한국에는 캡슐 세제가 없었다.아쉬운 마음을 뒤로 하고 잊고 지냈는데, 이제 한국에서도 조금씩 캡슐세제가 나오기 시작했다!세탁할 때 한알씩만 톡톡 넣어주면 되니 편리해서 구매하려고 알아봤는데 여전히 가격이 넘나리 사악...🙄그렇게 두번째 포기하고 있었는데 에버블루에서 가성비 갑 캡슐세제가 따란🧡 덤으로 향기 좋은 건조기 전용 섬유유연 드라이 시트!​​​​​에버블루 프로 클린 캡슐 세제세제량 조절이 어려운 초보자, 기숙사/원룸 등 좁은 집, 민감한 우리아이 피부에 맞는 안전한 세제를 찾는 사람에게 찰떡!​​캡슐 세제 ✔포인트✔3in1 캡슐 세제 : 세탁, 섬유보호, 향기 모두 갖춘 세탁세제✔무색소, 무알러지향 : 10가지 유해물질 불검출 테스트 완료 (MIT/CMIT, 납, 카드뮴, 전인산염, 파라벤5종, 폼알데하이드)로 민감한 피부, 아기옷에도 안심✔허브계열의 상쾌한 향 : 섬유유연제를 사용하지 않아도 되는 은은한 허브 계열의 향 (알러젠 FREE) ✔저렴한 가격의 캡슐세제 : 개당 297원, 액체세제와 가격이 비슷한 캡슐세제로 편리하고 비용 걱정 없이 사용✔잘 녹고, 안터지는 캡슐 : 찬물세탁에도 잘 녹지만, 20kg의 힘에도 터지지 않는 특수 가공법으로 안전하게 사용 가능✔뛰어난 세정력 : 생활 4대 얼룩 (단백질 얼룩, 간장/주스 얼룩, 흙먼지 얼룩, 땀/피지 얼룩) 강력하게 제거하는 듀얼 효소 함유​​​​​사실 처음에 파우치를 오픈 할 때 왜 안열리나 엄청 고생했었는데 어린이 보호포장으로, 어린이가 개봉하기 어렵게 설계되어있다.뒷면의 위쪽이랑 앞면의 아랫쪽을 잡고 양손으로 열어야 열리는데, 이렇게 써 놓으니 어렵게 느껴진다😂​​​​사용방법은 세제 투입구가 아닌 세제 통속에 넣어주기! 그리고 캡슐세제를 먼저 넣고 세탁할 내용물을 넣어주면 된다.​​​​​사용하지도 않았는데 파우치를 열자마자 은은한 허브향기가 났다.색소가 첨가되지 않아서 투명한 세제 :) 깔끔하고 안전하게 느낌이다.​캡슐 세제 표준 사용량6kg 이하 세탁량 캡슐 1개 / 6kg 이상 세탁량 캡슐 2개(6kg = 대략 셔츠 2개, 수건 5개, 청바지 1개, 양말 5개 정도의 분량)​섬유 보호 효과로 보풀방지와 세탁 후에도 향이 은은하게 지속되어 섬유유연제를 따로 사용하지 않아도 된다.사실 수건이나 속옷에는 섬유유연제를 사용하지 않는것이 좋다고 하였는데, 섬유유연제를 사용하지 않으면 수건이 너무 거칠어지고 여름엔 특히 향도 군내가 나서 안좋은걸 알면서도 그동안 계속 섬유유연제를 사용해 왔었다.​​​​​우리집은 주로 찬물로 세탁하기 때문에 세제통에 세제를 넣지 않고 직접 따뜻한 물에 풀어서 사용해서 엄청 귀찮았다.근데 캡슐 세제를 사용하니 하나만 톡! 하고 넣어주면 끝이라 너무너무 편하고 세탁하는 시간도 단축되니 캡슐세제 매력에 다시 한번 푹 빠져버렸다😍​또 정말 섬유유연제를 사용하지 않아도 향이 은은하니 군내도 나지 않아 좋았고, 수건도 거칠지 않고 부드러웠다.성분도 착해서 아기 옷도 세탁 할 수 있다니, 놀러오는 조카의 옷을 세탁하기 위해 따로 세제를 준비하지 않아도 캡슐로 세탁을 할 수 있다는 점이 너무 좋았다😊​​​​​​​​​​에버블루 드라이시트 (건조기 전용 섬유유연시트)의류를 건조기에 넣을 때 한장 같이 톡! 하고 넣어주면 되는 건조기 전용 섬유유연시트다.보통 섬유유연제를 넣고 세탁해도, 건조기 돌리고 나면 향기가 거의 사라져서 아쉬울 때가 많은데 섬유유연시트를 같이 넣어주면 향긋하니 좋은 제품!​​​​​건조기에 양말과 시트를 함께 넣고 돌려보았다 :)사실 건조기전용 섬유유연시트는 사용해 본적이 없어서 이렇게 사용하는게 맞나 싶은데,같이 넣고 돌리니 섬유 유연 시트가 먼지를 다 먹었다.​양말이 무리였던건가...ㅠㅠ 먼지를 먹은 섬유유연시트와 함께 근처에 있던 양말도 먼지가 듬성듬성 같이 있어서 조금 아쉬웠다.그래서 결국 시트를 빼고 건조기를 10분 더 돌려 먼지를 털어내고 양말을 꺼냈다.​섬유유연시트와 양말에 먼지가 같이 있어서 약간은 아쉬웠던 제품 :( 그래도 향기가 시원하고 상쾌한 향이 나서 너무 좋았다.날이 점점 더워지기도 하고 보통 양말은 건조기 돌리면 약간 꿉꿉한 느낌이 났었는데 섬유유연시트 덕분에 상쾌한 건조 성공 :)​​​총평 : 찬물에도 잘 녹고, 캡슐 하나로 세탁이 깔끔하게 된다는 점과 잔여물이 남지 않았다는 점이 매우 마음에 들었다.            패키지도 너무 예쁘고 저렴하면서 향기도 좋고 성분도 좋은 가성비 높은 캡슐세제라서 가루 세제보다 훨씬 편해서 좋았다🧡​​​상품 구매 링크 👉🏻https://c11.kr/pdz1​​​​​​​#캡슐세제 #캡슐세제추천 #에버블루 #에버블루_캡슐세제 #착한성분_캡슐세제 #드라이시트 #건조기용섬유유연제 #향좋은드라이시트",17,0,0,534,0,1,107.4,1,revu,2021. 6. 13. 23:59,51,36171,,0
3,https://blog.naver.com/7qaz?Redirect=Log&logNo=222434322138,"마미포코 땀먹는 팬티형 기저귀👶🏻마미포코 꼼꼼 검증단 2기에 선정되어서 새로 업그레이드된 땀먹는 팬티형 기저귀를 나늘이가 사용해보았다 :)​패지키에서부터 느껴지는 시원함과 귀염뽀짝한 스티커👍🏻새롭게 업그레이드 해서 돌아온 '땀먹는 팬티형 기저귀'는 이름답게 땀흡수와 통기가 아주 잘 되어서 여름 기저귀로 딱이다😀​​​​​각 사이즈별로 단계가 잘 설명 되어 있어서 사이즈 선택하는데 어려움이 전혀 없었다. (넘나 친절쓰-!)​나늘이는 11개월쯤부터 걷기 시작해서 13개월인 지금은 아장아장 아주 잘 걷는 아기다 :)13개월 된 나늘이의 몸무게는 11kg~12kg 정도 나가고, 세상 자랑스러운 꿀벅지 소유자!​​​​​마미포코의 땀먹는 팬티의 앞모습과 뒷모습 :)​​​​​마미포코 땀먹는 팬티 기저귀의 장점은!360도 통기성 시트와 허리의 땀을 흡수해주는 땀먹는 허리밴드, 이중 옆샘 방지가 있다 :)​허리 밴딩 부분이 정말 쫀쫀하고 부드러워서 아이들이 활동할 때 불편함이 없도록 만들어진 것 같다.허리 부분에 손을 넣어 봤는데 정말 시원하고 구멍이 촘촘하게 나있어서 땀이 찰 걱정도 없고 통기성도 정말 좋아 보인다. ​​​​​어떤 기저귀들은 소변 알림띠 조차 없어서 손으로 일일이 만져보면서 체크해야하는데 , 마미포코는 알림띠로 한번에 손쉽게 육안으로도 확인 가능하다. (소변 알림띠는 노랑색에서 파랑색으로 변하기 때문에 편리하다)​​​​​아이들의 활동량이 많아지고 더운 여름이 되면 기저귀 라인에 땀이 많이 차서 아이들이 간지러워 하고 불편해 하는데 마미포코의 땀먹는 팬티는 그런 걱정이 하나도 없다!​앉았다 일어나면서 활동량이 정말 많은 나늘이-!움직일 때 마다 허리 밴딩 부분이 쭉욱쭈욱 잘 늘어나서 뱃살이 걸리는것 없이 아이가 편해했다​​​​​샤워하고 나와서 뽀송한 나늘님밤에도 요 제품을 착용하고 잤는데 뒤척이는데도 샌 부분이 없었고 통잠자는 나늘이의 많은 양도 충분히 다 흡수했다.특히 요즘은 불편하면 무조건 ""빼-!"" 라고 외치는 나늘님이 유일하게 입어보고 빼달라고 하지 않은 기저귀😎👏🏻​​​​​우리 나늘이의 꿀벅지 :)XL를 착용했는데 딱 여유롭게 잘 맞는 사이즈였다.​촘촘한 구멍으로 통풍도 해결! 우리 나늘이의 땀도 쫘악 흡수해서 해결!​촘촘한 구멍의 이름은 슈퍼에어홀이다.3만개 이상의 슈퍼 에어홀로 공기가 솔솔 통하게 제작되었다고 한다. (WOW 와우👏🏻)​​​​​'이모 나 촬영 다 했으니까 놀아줘🧡'​요리 돌려보고 조리 돌려보고, 디자인도 정말 너무 예쁘다😍​폭염주의보가 내린 날, 더운걸 잘 못느끼는 이모가 나늘이를 데리고 산책을 다녀왔다가 더위 먹은 나늘이...(이모가 미안해...😱😭)​그때도 산책 갔다 왔을 때 티셔츠는 땀으로 흠뻑 다 젖었어도 팬티만큼은 땀을 다 흡수해서 뽀송뽀송했었다!(슬프지만 성능은 인정합니다😅)​​​​​여름 최적화 기저귀인 마미포코 땀먹는 팬티 기저귀👍🏻✔360도 땀먹는 허리밴드✔땀케어 슈퍼에어홀 3만개로 통기성 up✔땀먹는 엠보싱 시트✔부드러운 기저귀 소재로 뱃살 커버, 흘러내리지 않음✔최대 12시간 지속되는 흡수력✔중대형 10mm UP, 넉넉해진 사이즈​​올 여름 땀많고 활동량 많은 우리 아이의 기저귀 찾고 있다면, 땀 흡수력👍🏻 우리 아이가 편해하는 마미포코 땀먹는 기저귀 강추추추추추추추추추추추추천!ヾ(•ω•`)o​​​​​본 포스팅은 해당 브랜드로 부터 제품을 받아 솔직하게 작성되었습니다🙌🏻",18,0,0,342,0,0,107.4,2,,2021. 7. 17. 0:55,51,36171,,0
4,https://blog.naver.com/7qaz?Redirect=Log&logNo=222371902217,"육아는 템빨브리카 드링크앤스낵 홀더유모차 스낵컵언니가 감기에 걸려서 몇일 동안 나에게 조카를 맡겼는데오전부터 저녁까지 뭘 하고 놀아줄까 고민하다가몇번 유모차 태워서 데리고 산책을 다녀왔었다.​그렇게 일주일을 산책하니, 이제는 매일 산책을 가자고 조르는 나늘이🤣먼저 양말 가져와서 신으려고 하고 너무너무 귀엽다.​아무튼! 본론은, 같이 산책 나가면서 가장 불편했던게과자 담은 접시를 손에 쥐어주면 떨어트릴까봐 늘 불안했다.​그러니 내가 매번 과자를 하나씩 입에 넣어줘야 하는데유모차 끌면서 입에 넣어주려니 귀찮....아니, 편하게 혼자서도 먹었으면 좋겠어서 엄청 검색했다.불안불안한 이모의 심정잠깐이라도 한눈 팔면 떨어트릴 것 같단 말이다😑​​...​내 동생은 유모차 위에 플라스틱 식판? 같은게 있었던 것 같은데찾아보니 호환성도 따져야 하고 디자인도 많지 않고 가격대도 비싸서 포기..​나늘이 유모차는 리안 휴대용 유모차인데유모차는 휴대용인데 식판은 휴대용이 아니면챙기기도 귀찮을 것 같았다.​...아무튼!그래서 쿠팡 열심히 검색 결과 원하는 템 발견!""브리카 드링크앤스낵 홀더""육아는 쿠팡 로켓배송 기본이지😎로켓배송으로 바로 담날 받았다.​​구성품 : 본체, 스낵컵&뚜껑​​요렇게 간단하게 되어있다.과자랑 음료 두가지 거치 가능!자동차 장난감 같은 작은 사이즈의 장난감도 넣어도 될 것 같다.​​​본체와 집게가 분리 가능해서 세척하기 완전 편리하다.사이사이 음식물 껴버리면 빼내기 피곤해지기도 하고유모차에 달았는데 풀어서 뺐다가, 다시 조이고 번거롭지 않게 만들었다.​​​​일자형 유모차에 달아보았다.꽉 조이니 안정감 있게 잘 달려있고흔들려도 안떨어지고 단단해서 좋다 :)​전보다 한결 자리도 넓어지고 물통이나 과자접시가 떨어질까봐 걱정 안해도 된다.이거 하나로 엄청 편해짐!​물통도 꺼내서 마시고 싶을 때 혼자서 꺼내먹으니 넘나 편함!'물' 말할줄 알긴 하는데 목소리가 아직은 넘나 작아서자동차소리나 암튼 밖에서 잘 안들리니까자주 못챙겨줬는데, 먹고싶을때 물통에 손 대는거 보니 넘 귀엽다.​요플레 냠냠 먹다가 잠든 나늘이 :)요플레 한손으로 들고 다니기 힘들어서 넣어봤는데딱 잘맞음! 편하구나아~ 내 손에 자유가 생겼어💛​​​첫날엔 과자가 잘 안보여서 그랬던 건지 아님 커버때문인지 암튼 과자를혼자 안집어 먹길래 약간 아쉬웠는데두번째 날에는 혼자 꼬물꼬물 스낵타임 즐기고 있었던게 너무 귀엽고 웃겼다.​​​​​​​브리카 드링크앤스낵홀더 장점✔스낵컵이 있고, 분리가 가능해서 편하다.✔카시트, 유모차 등 여러곳에서 사용 가능하다.✔음료와 과자가 같이 거치 가능해서 편하다.(과자 뿐만 아니라 넓어서 요플레 장난감 등 다양하게 담을 수 있어 편함!)​단점✔음료거치 부분이 뻑뻑해서 좀 두꺼운 물통을 넣을 경우 잘 안빠진다.(아직 어린 아기라 혼자 힘으로 잘 못 빼서 물 빼려고 하는 손 보이면 내가 빼주고 있음)​​​​아무튼 배송온날부터 오늘까지 엄청 잘 쓰고 있는 꿀템!이제 유모차 산책, 외출때는 없으면 아쉬운 제품이다💛(이모만 아쉬운건가...🙄)​​​​https://link.coupang.com/re/CSHARESDP?lptag=CFM87469671&pageKey=9102454&itemId=39955619&vendorItemId=3000148713​",12,0,0,308,2,1,107.4,2,,2021. 5. 28. 16:59,51,36171,,"['앜ㅋㅋㅋㅋㅋ과자먹는 동영상 너무 귀여워요 드라이브의 재미를 아는 여자😍', '안녕하세요? 포스팅 잘 보고 갑니다~ 제 블로그에도 방문해주세요~ 정보 공유하며 자주 소통해요~^^ 행복한 하루 되세요']"
5,https://blog.naver.com/7qaz?Redirect=Log&logNo=221687561314,"삼성 블루스카이 공기청정기 구입!원래는 암웨이 엣모스피어 공기청정기2014년형 사용했는데 필터값이 너무 비싸서 쓰다가 중고로 팔아버렸다.​집 평수마다 삼성 블루스카이 공기청정기는 3000, 5000, 7000 평수에 따라 구입할 수 있다.7000은 너무 부담되어서 3000 두개랑 5000구입!​삼성 블루스카이 공기청정기 사이즈별 평수​3000 : 34㎡(10.2평형)5000 : 60㎡(18.1평형)7000 : 90㎡(27.2평형)​​​3000은 동생방이랑 내방 하나씩, 5000은 거실겸 부모님방에 두었다.​​​#삼성블루스카이30003000모델은 에너지효율등급 3등급!오른쪽 옆에 Dust랑 Gas Sensor가 있다.​공기청정되어 공기가 다시 나오는 부분은맨 위에 전원키고 작동하는 머리쪽이다.​*어플연동 안됨 *바퀴없음​​​​​#삼성블루스카이50005000모델도 오른쪽 옆에 두개의 센서가 있다.Gas는 똑같은데 Laser PM이라는 3000과는 다른 센서가 붙어있다.그리고 왼쪽에 3way Air Flow System 여기에서도 바람이 나온다.​5000은 빅스비가 지원된다👏🏻그냥 스마트띵스 어플 다운받고 연결하면 핸드폰으로 조절하거나 작동이 가능해진다.​5000에는 바퀴가 있고 3000에는 바퀴가 없다. 첨에 둘다 있는 줄 알고 3000을 질질 끌고 댕겼다😭​삼성 블루스카이는극세필터(암웨이꺼로는 프리필터), 헤파&탈취필터로 이건 헤파랑 탈취랑 붙어있어서 한번에 같이 교체해주면 된다.교체하기도 간편하고 좋은거같다. 암웨이땐 다 따로 구입하고 교체시기도 매번 다 달라서 귀찮았는데 한번에 해결!(암웨이 엣모스피어는 프리필터, 헤파필터, 탈취필터 세개가 들어있고 프리필터는 헤파&탈취필터는 각자 따로 구입해서 넣는 구조)​​​​​처음 개봉하니 안에 헤파탈취필터는 까만봉투로 포장되어 있어서 빼서 뜯은다음 다시 장착해야한다.처음에 아빠가 봉투뜯고 방향 확인 안해서 어떤 방향으로 다시 집어넣냐며 당황해하셨다.​근데 친절한 SAMSUNG님👍🏻 큼지막하게 넣는 방향이 써져있다.​​​​전원 풍량 취침 등등 여러 설정하는 알림판이 잘보여서 좋다 :)​​​​​​짜리몽땅 뚱땡이 귀여미 3000이랑 길쭉하고 무섭게 큰 5000 비교샷🙆🏻‍♀️",18,0,0,189,0,0,107.4,1,text_ad,2019. 10. 24. 17:58,51,36171,,0
