,Post URL,Post,Image num,sticker num,gif num,Paragraph num,Comment num,Video num,weekly viewer mean,Sympathy num,AD,Posting Date,Buddy num,Total visit,Blog category,Comment detail
0,https://blog.naver.com/flutter_da?Redirect=Log&logNo=222172600879,"​나는 어찌보면 물욕이 없는 사람..식욕만 있었나봄 ㅠㅠ아이폰 11pro로 바꾼지가 언제인데 .. 무선충전기도 없음 ㅋㅋㅋ근데 너무 충격적이게 무드등+ 고속 무선충전기 한몸으로 된 만들기 집콕놀이 키트 +아크릴 무드등 만들기 추천해봄예쁜 인테리어 + 실용성 기능까지 !!! 아주아주 칭찬하고 싶은 키트​게다가 요즘 코로나처럼 어디를 못다니는 요즘 ㅠ_ㅠ 집콕놀이로도 좋은 DIY 제품도 가능!올해는 크리스마스 트리도 하고 크리스마스 분위기 좀 내려고 했는데..그 이유가 코로나 때문에 어디 가지도 못하고 늘 우울하니깐 ㅠ_ㅠ뭐랄까 인테리어라도 따뜻한 느낌으로 하고 싶은데  크게 바꾸긴 비싸니깐~ 비싸지 않고 예쁘지만 실용적이기도 하니 요런 키트로 좋은것 같음 :)​뽁뽁이에 가려진 부품들!무드등은 이제까지는 사서 그냥 전원선만 꽂으면 불이 들어왔는데 이건 내가전선 등을 연결하고~ 아크릴에도 내가 원하는 그림을 넣을 수 있다물론 예쁜 그림이 그려진 아크릴도 선택은 가능했지만 :-)​​왼쪽이 아무것도 없는 아크릴판! 처음엔 왠 숫자고? 했는데 이건 흠집나지 말라고 비닐이 덧대있었던기임마찬가지로 눈사람도 비닐이 덧대여져 있음! 크리스마스 기념으로  눈사람, 루돌프, 산타가 있었음 +_+) 산타가 인기가 많은것 같았지만 나는 눈사람으로 선택 어몽어스도 있긴하지만~ 나는 고전적인 눈사람 루돌프 이런 종류가 더 좋음 ㅋㅋ;;​​소리조각사 아무키트집콕놀이 키트 기본 구성품은 무선충전기 거치대, 무선충전 모듈, 스위치, 나사 4개, 사포, 아크릴판 1개! 34,000원이다! 무드등+ 무선충전기~ 게다가 원목판이라 절대 비싸진 않은듯~직접 조립을 하면되는데~ 어렵지 않게 전선처리가 다 되어있고 나중에 찰칵 채우기만 하면 사실 끝이긴한데~ 내가 만져서 불이 들어오니 좀 더 신기하고 재미있는듯이정도면 학생들도 할 수 있는 수준이라 집에서 할수있는 놀이 공예라 집콕템으로도 딱일듯아참 소리조각사는 나무로 된 제품들을 주로 파는데~ 여기 도마나 우드 스피커도 예쁘니 구경해보면 좋을 것 같다​​추가 구성품으로 글루건이나 무지 아크릴판과 철펜을 살 수 있음!무지 아크릴판은 3500원이면 구매할 수 있으니~ 꼭 추가구매해서 나만의 무드등을 만드는것도 좋을듯철펜은 뾰족해서~ 살짝만 그어도 아크릴 판에 그려지는데~ 개인적으로 좀 어린 친구라면 페인트마카를 이용해서 그려도 좋을듯함!나는 처음에 요걸로 도전하려다가 부드럽게 안나올 것 같아 페인트 마카로 갈아 탔음 :-)​​이런 회로판 같은게 있으면 헐..머리 아파 ㅠ_ㅠ 하겠지만사실 앞서 말했듯이 요거에 달린 플라스틱과 전원스위치의 플라스틱과 맞춰서 끼워주면 끝이라 어렵진 않았음글루건은 없으면 구매하는 것을 추천추천! 사실 나는 너무 만들고 싶은데 집에 글루건 심이 안보여서 ㅠ_ㅠ 글루건 없이 만들어봤음 ㅋㅋ​​무선충전기가 제대로 되는지 확인부터 해야하지만! 나만의 무드등을 하겠다며 ㅋㅋㅋㅋ 디자인 고민중!코끼리 2녀석으로 할까 하다가.. 마카의 두께를 생각해서 결국 포기 ㅠ_ㅠ이렇게 투명한 아크릴 판이니깐~ 덧대서 그리면 어렵지 않게 그릴 수 있다!​​아크릴 흠집 보호를 위해 붙여있는 비닐은 나중에 이렇게 제거해주면 된다 :-)나도 무지아크릴에 나만의 그림을 그려보기 위해 비닐 제거!​​ㅋㅋㅋㅋㅋ 가장 쉬운 펭귄으로 그리기 ㅋㅋㅋ 나만의 아크를 무드등 만들기​​아이패드로 그렸던거랑 너무 다른 느낌힌데 ㅋㅋ 특히 입하고 눈을 흰색으로 하니깐 뭔가 섬뜩하지만.. 나중에 빛을 쏘게 되니 제법 예뻤다특히나 눈을 그려주긴 정말 잘한듯! 덧대서 그리다보니 전혀 어렵지 않게 그려졌다! 혹시 수정을 원하면 수정도 가능한데.. 요 키트 구매처인 소리조각사 동영상은 만드는 방법 뿐만 아니라 그런 수정용품에 대해서도 설명 해줘서 좋았다. 아크릴 보다는 다른게 좋다고 말씀 해주셨는데.. 나는 그냥 수정없이 한번에 만들어서 기억이 안난다 ㅠ_ㅠ​요렇게 동영상보면서 따라하면 전혀 어렵지 않게 만들 수 있는데한마디로 말하자면 거치대 안 쪽으로 무선충전 모듈을 글루건으로 잘 접착하고~스위치를 거치대 안에 넣어 두개를 접촉해서 무드등의 빛 LED와 무선충전 파워를 동시에 켤 수 있는 시스템인데 어려워보이지만 동영상과 함께라면 전혀 무섭지 않다는것​설명처럼 혹시라도 불량인지 아닌지 먼저 확인 해보기 위해 연결을 해봤는데~ 요렇게 LED등도 잘 들어오고 휴대폰도 올리니 충전도 잘되고~나도 신기한데.. 고학년 초딩이나 중딩들이 만들어보면 진짜 더 신기해 할 것 같았음어쨌든 기능은 제대로 되니 이제 무드등을 제대로 만들어 보기로!​​같이 오는 사포로 살짝 더 다듬어 줘도 되는데 이미 1차적으로 다 작업이 되어있어서인지 깔끔해서 나는 따로 사포질은 안했음 자작나무로 만들어진 충전기 바디~ 사실 자작나무는 타도 예쁜 소리 나는데 +_+)ㅋㅋㅋ​​스위치는 나사를 풀며 이렇게 쏘옥 전원 버튼 넣는데 들어가는데~ 원목으로 구멍같은게 다 작업 되어있어서~ 사이즈 오차 없이 할 수 있었음전원 스위치도 넣고~ LED 등 붙이는 곳에 LED도 끼워서 고정하기!이것도 글루건으로 고정하면 됨 :-) 나는 빨리 만들고 싶어서 테이프로 우선 고정해서 완성하고~ 나중에 글루건으로 다시 작업해줬다 ㅋㅋ 글루건 추천!​​무선충전기 모듈은 요렇게 밑에 글루건으로 붙여주면 됨글루건을 작업하고 선을 빼면 더 깔끔할껀데.. 나는 글루건없이 하다보니 ;ㅡ; 좀 지저분해짐 ㅠ_ㅠ 어쨌든 모듈은 이 방향으로 해서 끼워주는 곳이 있어서 맞춰서 끼우면 됨 :-)  어려워보여도 동영상보고 하니깐 10분 정도면 충분히 만들 수 있었음.. 한 오분이면 될것 같기도 함-ㅅ-;;모듈은 이렇게 끼워주면 되는데 혹시라도 나처럼 글루건으로 접착전에 먼저 켜보려고 조립하는 분이라면 이 상태로 나사를 조이고 충전 케이블을 꽂으면 저게 쏘옥 들어가니~ 밑판 닫기 전에~ 연결하고 밑판 닫아두면 좋을듯! 하지만 모두 글루건으로 작업할꺼기 때문에..괜한 오지랖이 된 나의 한마디 ㅠㅠㅋ​​요렇게 나사까지 조여주면 끝! 나만의 크리스마스 아크릴 무드등 완성임 :-)집콕템으로 예쁜 인테리어와 공예? 창작의 시간을 보낼 수 있고 무선충전기의 실용성까지! 1타 3피~​전원을 누르면 아크릴 판 밑으로 조명이 들어오면서 무드등이 완성되는 동시에 이렇게  무선으로 고속 충전이 가능하다는것~이게 가장 맘에 든다 ㅠ_ㅠ  이제까지 우리집에 무선 충전기가 없어서 너무 불편했었는데.. 이제서야 ㅋㅋㅋ ​왼쪽은 소리조각사 아무키트 패키지로 온 눈사람~오른쪽은 내가 그린 펭귄 ㅋㅋㅋㅋ 아크릴판 하나 더 구매하면 이렇게 2가지 느낌으로 무드등을 바꿔가면서 할 수 있으니깐 더 좋은듯!처음에 철펜으로 그려보려고 살짝 그었던게~ 불 켜니깐 눈에 확 들어오지만 ㅠ_ㅠ 그래도 예쁘니깐 됐음 ㅋㅋㅋ​​늦은 시간에 컴퓨터를 자주 하는데, 이때 늘 노트북으로 폰도 충전하고 했는데스탠드대신 요 무드등 켜고, 휴대폰도 충전하면서 컴퓨터 하니깐 편하고 좋다 :-) 게다가 일반 충전 아님 ㅋㅋㅋ 고속충전! 사..사랑합니다 ♥무드등의 이 따뜻한 느낌 너무 사랑스럽다 ㅠ_ㅠ 집콕놀이 키트 추천함혹시나 집에서 할수있는 놀이 찾는 사람들이나~ 아이들과 함께 하는 것을 부모님들 있으면 함께 요렇게 아무 키트 만들어 봐도 좋을듯~~구매 및 구경은 요 링크에서 확인 가능함 :)​https://smartstore.naver.com/sorijogaksa​<이 포스팅은 업체로부터 제품만을 제공받아 직접 체험 후, 솔직하게 작성한 후기입니다>",30,0,0,813,5,1,761.2,17,text_ad,2020. 12. 13. 21:37,1762,1943319,맛집,"['앗 귀여운 펭귄~', '좋은주말보내셨는지요..^^ 오랜만에 방문드렸습니다.. 다음주 한주도 기분좋은 한주 되시길 바랍니다^^', '아하 요런 무드등도 있었네요~ 왠지 은은해서 분위기 있어 보이네요 ㅎㅎㅎ', '잘 보고 갑니다\n오늘도 행복하세요^^', '때로비님은 손재주가 너무 좋으세요']"
1,https://blog.naver.com/flutter_da?Redirect=Log&logNo=221580970668,"지난 여행 때 캐리어 안에 디카 배터리를 넣고 짐을 붙여서 진짜 식겁했음 ㅠ_ㅠ (배터리는 폭팔 위험으로 수화물칸 노노...)디카를 핸드백 안에 넣어서 별 생각 없었는데 나중에 보니 디카 안에 배터리가 없고-ㅅ-;; 충전된 상태로 충전기와 함께 캐리어 안에 ㅠ_ㅠ다행히 빨리 발견도 했고 좋은 직원분들을 만나서 원래는 폐기되어야 했는데 돌려받았음그때 공항에서 캐리어 풀고 배터리 찾느라고 완전 개고생했는데..거기서 옷이고 속옷이고 강제노출 ㅋㅋㅋ ㅠㅠ 그 이유는 바로.. 이렇게 짐을 싸다보니 ㅋㅋ 뭐가 어딨는지 몰라서 다 열고 ㅋㅋㅋ 완전 난리였음 ㅠ_ㅠ부끄러웠던 그 날.. 또 그 시간 ㅠ_ㅠ안에 뭐가 들어있는지 알수가 없으니 그 점이 가장 답답했던듯 엄청 압축되는지도 모르겠고;ㅡ; 이건 몇년전 여행사에서 선물로 받은 여행 비닐팩! 이제 바꿔야할때가 되었음...요즘 나의 2박 3일 정도의 여행때의 짐 꾸리는 스타일 ㅋㅋㅋㅋㅋ 대충대충이긴함 ㅋㅋ기내용 캐리어에 한쪽엔 옷, 한쪽엔 화장품 고데기 세면 도구 등등등 넣는데 확실히 구별 없이 넣다보니 달그락 거릴때도 있고 해외여행처럼 긴 일정이나 혼자의 짐만을 꾸릴 땐 괜찮은데 함께가는 여행때는 어려움이 있음하여 퍼니메이드 여행용 파티션 4종을 마련해봤음!!여행파우치 세트인데 요 속옷 넣는 언더웨어백과 슈즈백 보고 완전 이건 대박이다 싶어서 샀음뭐 남자들도 그렇겠지만 여자들은.. 여행갈때마다 사진을 위해서는 굽 높은 신발도 갖고 가고 싶은데.. 또 걷고 해야 하니 운동화나 단화도 필요하고특히 나처럼 작은 사람들은 진짜 슬픔 ㅠ_ㅠ하여 신발을 넣고 싶은데 맨날 비닐에 ㅋㅋㅋㅋ 넣어서 가게 되는 슬픔근데 이렇게 깔끔하게 여행가방을 쌀 수 있다니 완전 좋은듯엄마 놀러가는줄 알고 놀란 오드리와 올리브 ㅋㅋㅋㅋ엄마 짐 싸는데 방해하네 ㅋㅋ소형견이 앉으면 요정도 되는 크기로 크기는 않은데 구성 자체도 알차고 퍼니메이드는 국내 제조라 그런지 바느질, 자크 뭐 하나 아쉬운게 없었음짐이 없을땐 얇고 짐을 넣으면 또 커지는 그런 식인데 요거 하나만으로도 1박 2일 여행정도는 충분히 다녀올듯캐리어 가방을 여행용 파우치로 만든듯한 모습!공간 1, 2를 매쉬포켓 들이 구분해주고 있음하여 양쪽을 다 옷으로 넣어도 되지만 간단한 여행이라면 요 트렁크 파티션 하나로 여행도 가능할것 같음디자인까지 깔끔하고 귀여워서 활용도가 높을듯!!얼마나 옷이 들어가는지 넣어봤음살짝 도톰한 원피스 1개, 바지 2개, 상의3개가 하나의 공간에 들어가는데 아무리 여름 옷이지만 나는 빅사이즈임 ㅋㅋㅋㅋ이 많은게 한쪽 공간에 싹 다 들어가버렸음 여기에 지퍼만 채우면 끝 ^^ 한쪽 공간에 이정도니깐 양쪽으로 옷만 넣는다면 여름옷 기준으로 대략 5박 6일정도의 옷은 충분히 될듯 중간 포켓까지 이용한다면!!나는 한쪽에는 파우치, 선글라스, 고데기 등등 넣고..그럼에도 공간이 남아서 뭘 더 넣어야 하지 고민했음 ㅋㅋㅋ1박 2일 여행 정도야 대강 짐싸도 되지만 해외여행 짐쌀땐 여행용 파우치 완전 필요할듯 정말 짐을 효율적으로 쌀 수도 있지만 공간 절약도 완전 되는듯손으로 들고 다니기 부담스럽지도 않아서 앞서 말했듯 짧은 여행에는 요기에 옷만 넣지 말고 나처럼 한쪽에는 옷, 한쪽에는 세면도구나 고데기, 화장품 파우치 등 넣고 이렇게 다녀도 될듯한 모습!! 꽤 많이 수납이 되는데도 그것에 비해서 크거나 하지 않아서 오히려 더 좋았음 요건 언더웨어 여행용 파티션인데 얇지만, 안에 속옷이 무너지지않게 요렇게 형태를 잡아줌아주 배려심이 만점임 ㅋㅋ 요거는 집에 서랍장에 열어둔 상태로 넣어두면 서랍장 파티션처럼 공간을 예쁘게 나눠져서 더 좋음쨌든 브레이지 몇개를 넣어도 될 넉넉한 공간에 양쪽으로는 매쉬 포켓이 있는데 팬티를 하나씩 넣어두면 될듯게다가 중간에  숨은공간은 여성용 팬티라이너나 스타킹도 넣을 수 있을듯속옷뿐 아니라 양말이나 이런것도 얼마든지 넣을 수 있음이번 퍼니메이드 여행용 파우치 중에 반함 포인트 하나가 워시백이였는데나는 사실 대충 여행용세트를 다 쓴거는 빼고 집에 있는것들과 대충 넣어서 쓰는데 그러다 보니 하나의 팩에 들어가지 못하고 보통 이런모습 ㅠㅠ그래서 나중에 캐리어에서 칫솔통은 분리되서 굴러다니곤 하는데 ㅋㅋ요 작은 워시백에 얼마나 수납이 빵빵하게 많이 되는지 깜짝 놀랬음 -ㅁ-;;;게다가 제품의 질은 정말 좋은듯내가 받은건 실밥 하나 뭐 터져 나와있거나 그런게 1도 없었음진짜 재질도 좋고 너무나 튼튼해서 향후 10년 정도는 나와 함께 해줄것 같은 이 느낌오드리도 워시백 안에 들어가고 싶니? ;ㅡ;)여행가방 꾸리기 방해하지 말고 졸리면 가서 자렴;ㅡ; 산발로 졸린눈으로 머하는건지...고리가 있어 3단으로 걸어두고 쓸 수 있는 위시백맨 위에는 샘플화장품이나 일회용 샴푸, 린스, 바디워시 등을 넣어도 되고 팬티라이너를 넣어도 되고그 밑으로는 사용할 세면도구 들을 넣으면 되는데 생각보다 수납공간이 넉넉해서 나는 세면 후 바로 뿌리는 미스트와 휴족시간, 팩 등도 함께 넣었음보기보다 더 많이 수납할 수 있어서 좋고 욕실에 걸어두고 쓰니 깔끔해서 좋음평소에는 세면대에 올려두는데 친구들과 돌아가면서 씻고 나오면 나중엔 다 젖어있음 ㅠㅠㅋㅋ 집에 오는날 물기 제거 후 넣는것도 일임ㅋㅋ근데 이렇게 걸어두고 쓰면 그런 불편함이 반으로 감소할듯접으면 요렇게 작지만, 진짜 든든한 트레블키트이번 퍼니메이드 여행용 파티션은 4종으로만 선택했지만 진짜 알찬구성이였음물론 추가로 더 많은 파티션을 구성해 줄 수는 있음 ㅋㅋㅋㅋ세상은 자본주의자의  색깔도 다양해서 원하는대로 선택하면 되고~정체불명의 검은봉지 ㅋㅋㅋㅋ이건 내가 주로 신발을 싸서 가는 경우 대충 검은봉지에 둘둘 넣어서 한번 더 봉지에 싸주는 방식으로 하는데 ^^;;아주 좋지 못한 방법으로 나도 늘 생각은 하는데 대안방법이 없어서 참 그랬었음..ㅠ_ㅠ하지만 요거요거!! 퍼니페이드 트레블키트 요요요 파티션 슈즈백이라면!!깔끔하게 또 신발 구겨짐이나 그런것 없이 신발을 여행할때 갖고 다니기 좋음!! 완전 설렘포인트이제 사진찍기용 굽높은 신발 신고 ㅋㅋ 편하게 신을 신발 백에 넣어갈 수 있음!!신발 파우치 이거 진짜 너무 좋음 ㅠ_ㅠ천이 안에 또 덧대어 있어서 냄새나 오염에도 강할듯한켤레만 넣어도 되나 나는 이렇게 두켤레정도는 넣고 가고 싶음 ㅋㅋㅋ 밑에 자석으로 확실하게 공간을 나누고 고정시켜줘서 그것도 좋음뭐랄까 퍼니메이드 여행용 키트는 확실히 쓰는 사람 입장에서 만든거 같음짐이 보통일땐 퍼니메이드 파티션으로만 이렇게 여행가능하고 1주일이 넘는 여행은 기존에 쓰던 팩이나 아니면 퍼니메이드 추가 파티션을 이용해서 여행가방을 꾸려도 좋을듯!! 아참 요 캐리어는 기내용 캐리어라서 작은편임! 여행용 파우치는 크기에 따라서도 있는듯하여 내가 자주 이용하는 캐리어에 맞춰서 준비해두면 좋을듯또 하나의 장점 짐이 많은데 캐리어 큰거 갖고 가긴 그럴때! 요렇게 큰 여행용 파티션 가방을 캐리어 위에 손잡이에 끼우면!요렇게 더 유용하게 쓸 수 있음내가 앞서 말했듯 퍼니메이드 파우치 들은 박음질 조차도 엄청 튼튼해서 뜯어질 걱정은 안해도 될듯!!사실 우리집도 캐리어는 3개인데 나는 이상하게 늘 이 작은 기내용 캐리어만 사용하게 됨 ㅋㅋㅋ보통 국내여행은 짐이 줄어와서 상관없지만 해외여행은 짐이 늘어오니 요렇게 활용해도 넘나 좋을듯이제 캐리어 남 앞에서 열기 부끄럽지 않을듯 ㅋㅋ캐리어 열고 뭐 찾다보면 옷이고 속옷이고 ㅋㅋ 아주 엉망진창 ㅠ_ㅠ 이제는 딱 내가 원하는 것만 보고 확인할 수 있으니 이 또한 축복인듯퍼니메이드 트레블키트와 함께라면 여행가방 꾸리기 너무 즐거움아참 회원가입해야 조금 더 저렴하게 살 수 있음 ㅋㅋㅋ​",51,0,0,877,3,1,761.2,5,text_ad,2019. 7. 9. 0:36,1762,1943319,맛집,"['캐리어 짐 챙길때 편해서 좋겠어요', '수납이 효율적이네요~^^']"
2,https://blog.naver.com/flutter_da?Redirect=Log&logNo=221538617147,"예민한 피부를 갖고 있는 삐약씨그런 삐약씨가 선택한 남자 스킨케어 브랜드 디티알티!dtrt는 이미 몇번 포스팅 했었는데이번에 여행갈때 파우치 하나만 챙기면 끝이라는 트래블키트가 있어서 소개해봄박스를 열면 요렇게 파우치부터 안의 구성품까지 뽁뽁이로!심쿵이라니 이거 너무 귀엽자낭 ㅋㅋㅋEnjoy your travel!​깔끔한 블랙매쉬의 파우치를 열면 보이는 살짝보이는 남성용 화장품들 간단해 보이지만 요거 하나면 스킨케어부터 메이크업까지 다 되니 진짜 편함!여행갈때 그냥 요 디티알티 트래블키트만 넣으면 되니! 파우치까지 있으니 좋음안의 구성품들을 보면 얼마전 삐약씨가 썼던 디티알티 삼종세트에 거기에 쉐이빙크림, 퍼스트띵퍼스트(스크럽)에 토너까지!! 요 디티알티 삼종세트엔 비비 보이즈비볼드, 카밍순올인원, 폼클렌저까지!! 미니미니한 사이즈라 여행용파우치로 딱임요 여행용 세트는 딱 필요한것들로 구성되어있음아침에 쉐이빙크림 바르고 면도 후 토너바르고 카밍순올인원하고 비비크림!저녁에 놀다들어와서는 데링이 클렌징으로 비비크림 지우고 스크럽으로 각질제거제로 미세먼지까지 날려보내기 ㅋㅋㅋ이거 구성한 사람 완전 최고임!   칫솔치약만 넣으면 바로 여행 떠나면 됨쉐이빙크림은 이렇게 꼼꼼하게 바른 후 면도 쓱쓱쓱일회용면도기만 챙기면 여행가서도 매끈한 피부를 유지할 수 있음 ㅋㅋㅋ비누칠해서 면도하는것보다 쉐이빙폼을 이용하면 훨씬 부드럽고 깔끔하게 면도 완료그 후 토너와 올인원크림으로 수분감도 빵빵하게 채워주면 되는데수분가득 올인원크림은 끈적임도 없고 수분감도 넘 좋은데 첫 향에 살짝 남자 스킨향 같은게 내가 바로 남자 화장품이다 라고 말해주는듯 하다가도 바로 꽃향 뺀 여자 화장품처럼 순둥한 냄새!! 끈적임을 싫어하는 삐약씨도 요래요래 토너와 올인원 모두 기름기도 없고 끈적임도 없어서 넘 좋아함발랐을때 밀림이나 이런것도 없고 무겁지 않음!아참 발림성이 무거운건 요즘처럼 더워질때 얼굴이 갑갑해서 싫음 ㅜㅜㅜ요 올인원은 그런 갑갑함에서 자유로움 ㅋㅋㅋㅋ비비크림은 적당만 잡티를 가려주면 되는데 나름 커버력도 이만큼이나 좋음  게다가 자외선차단 효과도 있으니 선크림 없을시 꼭 바를것!팔에 낙서하고 비비크림 바른것은 디디알티 클렌징으로 지우자면 요렇게 쓱쓱내가 디티알티 제품 중에 가장 좋아하는게 바로 요 폼클렌저남자화장품이지만 dtrt 클렌징폼은 메이크업 잔여물이 잘 지워져서 넘 좋음게다가 씻고나서 당김도 없으니 내가 더 잘쓰고 있음 :-)이번에 처음 만나본 디티알티 각질제거제는여행가서 미세먼지나 노폐물이 많다 생각될때 한번 해주면 개운도 하고~피부가 보들보들해져서 담날 비비크림이 더 잘 먹는다는 사실!!!!정말 필요한 것들로만 구성된 dtrt 트래블키트!​가격도 합리적이고, 제품들도 모두 순한 남자화장품 전문브랜드라 믿을 수 있음dtrt 트래블키트가 궁금하다면  클릭 고고!!!68
「“
",24,0,2,290,2,0,761.2,8,,2019. 5. 16. 0:34,1762,1943319,맛집,['여행갈때 꼭 필요하겠네요']
