,Post URL,Post,Image num,sticker num,gif num,Paragraph num,Comment num,Video num,weekly viewer mean,Sympathy num,AD,Posting Date,Buddy num,Total visit,Blog category,Comment detail
3,https://blog.naver.com/flutter_da?Redirect=Log&logNo=222084168447,"​나는 맛있는걸 좋아한다... 그래서 냉동식품은 잘 안먹는편... 냉동은 진짜 엥간한거 빼고는 다 별로였다 ㅠㅠ다만 밀키트 같이 신선제품들은 맛있는게 많았다~ 어쨌든.. 쪽갈비도 시제품이 많겠지만 냉장이 가장 누린내 없고 맛있으니깐 ㅋㅋ 나는 집에서 만들어 먹겠음삼겹살이나 목살은 홈플러스 백두대간의 갈비삼겹을 좋아하고~ 돼지갈비나 등갈비는 그 옆의 팔용고기백화점이 싸고 어차피; 양념맛이니깐 그건 여기서 삼 ㅋ냉장으로 사온 등갈비로 쪽갈비 만들기 대충 하기 ㅋ​​지난번 바베큐립 해 먹을땐 칼집만 내서 통으로 했는데 이날은 하나하나 들어서 뜯어 먹자 싶으니깐~ 그냥 뼈에 맞춰서 다 잘라버리기핏물을 빼주면 당연히 좋겠지만, 늘 귀찮기도 하고 시간도 부족해서 핏물은 불순물을 끓여 없애기로 함 :-)​​나중에 손가락으로 잡기 편하려면!!등갈비 뼈랑 살 사이를 한쪽에 칼집을 넣어주면 뼈와 살이 한쪽이 분리되면서 잡고 뜯기 좋음나는 그냥 이 상태로 자르기는 끝! ​​찬물에 등갈비를 넣고 끓이기팔팔 끓을 때 보면 뼈에서 핏물도 나오고 ;ㅡ; 대략 어느정도 상태인지 확인이 되긴하는데..나는 겉만 다 익을만큼만 끓여줬음. 약 10분 정도 끓여줬음아참, 끓는 물에 바로 고기를 넣으면 그게 그 상태로 익어서..불순물 그대로 응고;; 그래서 이렇게 찬물에 넣어서 끓으면서 불순물을 내줘야함팔팔 끓고나서 5분정도 있으면 이렇게 제법 분술물 들이 떠 다닐것임​​그러면 물에 깨끗하게 씻어주기빡빡 문지르라는 것이 아니라 흐르는 물에.. 불순물 찌꺼기를 그냥 떨어지게 한다..라는 생각으로 흐르는 물에 헹구면 됨이러면 이렇게 불순물이 빠진 등갈비 완성​사실 쪽갈비 만들기 어렵지 않은게.. 테크닉한것은 거의 없음끓여서 불순물 버리고, 또 삶아서 익히고, 양념 바르고 구우면 끝이니깐어쨌든 집에 있는 야채 등을 이용해서 삶아주면 되는데.. 우리집에는 양파, 파, 마늘, 후추가 있어서 그걸 넣고 팔팔 끓여줬다매운맛을 좋아해 고추도 하나 넣긴 했는데.. 보통은 다진마늘, 후추, 소주나 맛술, 파, 양파 반개 정도만 넣고 끓이면 될듯.. 생강있으면 넣어도 좋고~​​그렇게 25분 끓이다가 빼기 (더 짧아도 상관은 없음)이날은 소금 등갈비와 양념 등갈비 두개를 할꺼라서 그릇은 우선 따로 담았음 :-)국내산보다 외국산 쪽갈비 들이 고기는 더 붙어 있는것 같지만.. 누린내에 취약한 나라서 이렇게 국내산으로 ㅋㅋㅋ;; ​양념장 만드는 것이 솔직히 가장 귀찮음우리집 냉장고를 찾아보니 데리야끼소스와 화끈매운갈비양념이 있었는데..매운갈비양념이 주메뉴 ㅋㅋ 데리야끼는 단맛 추가용 ㅋㅋㅋㅋ내가 좋아하는 매운갈비양념!  이걸로 바베큐립 만들어 먹었더니 맛있어서 쪽갈비도 해보기로!아무 갈비양념 시판소스 모두 OK임​​돼지갈비찜, 닭볶음탕, 닭갈비 등 집에서 매운요리 하고 싶을때 청청원 화끈한 매운양념갈비 양념 진짜 맛있으니깐 하나 구비해두길 ㅋㅋㅋ그리고 데리야끼는 진짜 단맛 추가였기에 저 소스는 없어도 됨 ㅋㅋ 그냥 물엿 정도 더 하면 될듯그리고 내가 마늘 다진것도 넣어볼까 했는데 에어프라이어에서는 5분 정도만 익힐꺼라 마늘은 패스.. 잘 안익으면 그것도 난감하니깐​​소금구이는 후추에 소금만 뿌렸는데 약간 넉넉하게 넣었음너무 많이는 안넣어야 함. 어차피 싱거우면 뭐라도 찍어먹겠지만 짜면 답이 없기에.. 맛소금은 요 정도에 커피스푼 으로 반 조금 덜 넣은듯.  8개 기준임​에어프라이어에 살짝만 더 구워주면 되는데.. 170도 정도로 앞으로 뒤로 각각 3분정도해서 6분정도 데우면 될듯함처음에 소금구이를 윗칸에 넣어 하다보니 너무 익어서.. 좀 안타까웠음 ㅠ_ㅠ 너무 윗칸에 하지 말고 적당히 내리면 될듯소금구이는 앞뒤로해서 각각 3분씩  양념은 앞뒤로 각각 5분씩 해도 양념이 있어 많이 타지 않고 괜찮음 ​약간 오버쿡 된 느낌이긴하지만 밖은 빠삭하고 속은 촉촉한 느김이였던 소금구이 쪽갈비 만들기 가스렌지와 에어프라이어만 있다면 쉽게 만들 수 있음끓여서 불순물 제거하고, 양파, 마늘, 파, 후추 등 넣고 푹 끓이고 소금과 후추 버무린 후 5분정도 에어프라이어에서 구워주기!시간은 본인이 얼마든 조절 가능에어프라이어 요리 많긴한데, 요것도 술 안주로 괜찮은듯​​그나마 덜 위쪽에 있던 곳은 보기만 해도 윤기가 자르르르르확실히 뭐든 원재료가 좋으면 소금구이가 답인듯 ㅋㅋ 집에서 쪽갈비 만들기 할 때 양념만 하지 말고 이렇게 소금구이도 하면 참 좋을듯​​양념구이는 양념이 조금 더익게 소금구이보다는 조금 더 익혀주면 됨확실히 빨간색이 색깔이 장난아니네 +_+) 곱네고와~​​이날의 술안주는 이렇게 시작되었음 ㅋㅋㅋㅋ사실 이것도 양이 꽤 되는데..이거 먹고 생라면 뽀개 먹고 ㅠㅠ 아이스크림 슈퍼가서 사다먹고 ㅠㅠ 아주아주.. 요즘 술만 먹으면 식신*100배다음에는 쪽갈비 대 한쪽에 칼집을 넣어 손으로 잡고 먹기 편하게 만들어야겠음~​​개인적으로는 소금구이가 더 맛있긴 했지만 매운맛을 좋아한다면~ 양념도 괜찮을듯아참.. 꼭 청정원 화끈한양념갈비 소스 아니여도 .. 그냥 아무 양념갈비 소스를 사면 될듯간혹 간장베이스를 좋아하는 분은 그거에 맞게, 고추장 베이스를 좋아하는 분은 그거에 맞게! 세상은 넓고 시판소스는 너무들 훌륭하니깐 ㅋㅋ 어떤 시판소스든 실패 없이 맛있을것임​​미리 삶아둬서~ 뼈와 살의 분리는 뭐 당연함!아주 야들야들 맛있었음! 에어프라이어에 너무 많이 굽지만 않는다면 촉촉한 육즙으로 맛있게 먹을 수 있는 술안주! 추천추천!! 이날의 교훈.. 시판소스는 실패없다",30,0,0,603,3,0,761.2,11,,2020. 9. 8. 23:56,1762,1943319,맛집,"['아.. 빨간 양념보니까 침샘터지네요', '와 상상되는 맛이라 더 참기힘들어지네요 ㅜ ㅜ', 'e정도님 잘 보고 가요~게시글 올리셨길래 보고 갑니다~ 포스팅 잘 봤어요!항상 행복한 시간으로 하루를 가득 채우시길 바랄께요 e정도님 ^^']"
4,https://blog.naver.com/flutter_da?Redirect=Log&logNo=221800414461,"​대전 성심당 빵추천 전에! 저번에 대전 출장 갔다온걸 또 이야기 해야겠구만..청주살때도 안갔던 성심당을 출장 갔을때 가봤음. 다행히 출장지 근처기도 해서 고고고고!성심당 고객 주차장이 4개인가나 있었는데.. 다 안보이고 ㅋㅋㅋ 그러다가 발견한 이곳! 부장님이  빨리 발견해서 다행인데 다른 건물 주차장을 같이 쓰는것보다 이 전용 주차장이 눈에 더 잘띄긴 했음평일에도 주차장이 꽉 차 있어서 딱 한자리 있는걸 우리가 주차 +_+)​​대전 빵문의 해라니 ㅋㅋㅋㅋ 귀여워! 근데 성심당이 빵만 파는게 아니라 케익부띠끄 외에도 플라잉팬 같은 식당이 함께 있었음다 같은 계열사인가? 과연 맛은 있는건가? 모르겠지만 어쨌든 이렇세 성심당 맛투어로 되어있으니 매우 궁금한건 사실​​내가 20대초반에 기술을 배우러 갔었는데 ㅋㅋㅋ 그때 같이 일했던 언니가 파리바게트 알바를 했던 사람이였는데 언니 말이 대전에 엄청 유명한 빵집이 있다며 이야기 해줘서 처음 알게 되었음 ㅋㅋ 그때야 인터넷이 물론 있었지만 지금처럼 이렇게 엄청 잘 알려지지 않아서 ㅋㅋㅋ 그땐 무려 MP3 시대니깐! ㅋㅋㅋ어쨌든 이렇게 만났네 성심당​​유명한 빵집가면 꼭 어머님께 빵을 사다드리는데 우리집은 나는 떡순이인데 어머님이 빵순이 ㅋㅋ 뭔가 바뀐 느낌~ 쨌든 어머님을 위해 단팥빵부터 겟!근데 생각보다 빵값이 저렴해서 놀랬음-ㅁ- 유명 빵집이라면 보통 빵이 다 비싼데 여긴 빵값이 저렴했음​​다양한 빵들이 있었는데 생긴것 부터가 엄청 폭신폭신 쫄깃쫄깃해 보였음! 내가 좋아하는 빵은 너무 촉촉이나 폭신보다 이렇게 쫄깃한 그런 느낌의 빵을 좋아해서+_+)취저다 취저!근데 사람들이 많아서 빨리빨리 사고 나와야할 것 같은 기분이였음다만 안동 맘모스 제과의 경우 한가지 빵에 사람이 엄청 몰려있었는데 성심당은 조금 그런것이 덜 했음​​한쪽에 자리 잡은 대전 성심당 빵추천 하면 나오는 고로케으음 고로게네; 어쨌든 부추빵도 유명하지만 부추는 다음날 먹으면 숨이 죽으면서 향도 그렇고 식감도 그렇고 그래서 부추빵은 포기하고 고로게만 공략사실 튀김고로케도 기름에 쩌들까봐 꺼려하는데 우리에겐 요즘 1가정 1에어프라이어기가 있으니깐 ㅋㅋㅋㅋㅋ 걍 질렀음사실 에어프라이어기 있으면 다 대박인데 진짜 맘껏 고로케 살껄.. 너무 적게 산 기분 ㅠㅠ​​식빵 및 각종빵! 그리고 가다보니 명란바게트도 있었는데 이것도 여기서 유명한지 줄 앞에 뭐도 써있고해서 ㅋㅋㅋ 나랑 부장님도 줄 서봄 ㅋㅋㅋ그래봤자 앞에 두명이였다만 ^^;;​​아버님 어머님 드릴꺼랑, 우리집 먹을꺼, 부장님네 집에 보낼꺼, 회사에서 먹을꺼 ㅋㅋㅋㅋㅋ 넉넉하게 샀음 ㅋㅋ이정도 사면 한 십만원은 나오겠지? 싶었는데 육만원대-ㅁ- 와.. 나 왠지 합리적 소비한 기분이였음 ㅋㅋㅋ​​이것저것 다 회사갖고가고 어머님네 주고 하니깐 실질적으로 내가 먹어본 빵 종류는 한 8개정도밖에 안되는듯 ;ㅡ;쨌든 아침에 일어났더니 튀김소보로 단빵맛을 먹고있는 삐약씨 ㅋㅋㅋ 원래 출근할때 아무것도 안먹는데 전달 밤 12시 되서 빵을 사들고 오니 안먹고 아침에나 먹기ㅋ쨌든 데우지도 않고 먹고 있길래 불쌍해서 내가 반 먹어줌 ㅋㅋㅋㅋㅋㅋㅋㅋㅋㅋ;;; 진짜 안 따뜻한 빵먹어서 불쌍해서 먹어준거임 ㅋㅋ근데 기름에 좀 쩔어서 ㅠ 별로일것 같았는데 생각보다 맛있어서 좀 놀랬음​​튀소고구마는 원래 맛있어서 ㅋㅋ 내가 좋아했었고!!살까말까 고민했던 대전 성심당 고로게는.. 결국 두개만 사왔는데 안데워먹어도 맛있었음! 에어프라이어에 데워먹으니 뜨겁고 더 맛있긴 했지만 ㅋㅋㅋ생각보다 에어프라이어 없어도 될 것 같은 성심당 빵들! 역시 튀긴빵들이 대전 성심당 빵추천 로 왜 불리는지 알겠음! 맛좋아!​​명란 바게트는.. 개인적으로는 명란이 너무 축축해서 별로였는데.. 에어프라이어에 살짝 구우니 완전 너무 맛있음 ㅠㅠㅠ 부산 옵스보다 개인적으로는 더 좋았음 살짝 김가루가 있어서 너무 술안주 같은 기분이긴 했지만 ㅋㅋㅋ(물론 나도 술먹고 나중에 안주 없어서 이거 먹은거지만 ㅋㅋㅋ)요것도 최애 메뉴 중 하나로 뽑겠음 인기 많은데는 다 이유가 있었어!​​이건 카레 고로케인데 진짜 카레가루 살짝 넣었을것이라 생각했는데 혹은 있어봤자 3분카레 수준 조금? 생각했는데이거 뭐야???!!! 이거 진짜 너무너무너무 맛있었!!! 카레가 이건 진짜였음 ㅋㅋㅋㅋ 나는 고형카레 좋아하는데 약간 그런 느낌? 카레 덕후 삐약씨는 물론 카레를 별로 안 좋아하는 내게도 완전 취저! 진짜 놀랍도록 반전인 빵이였음 ㅋㅋㅋㅋ 진짜 맛있었음 ㅠ_ㅠ​​다른 빵들 몇개는 그냥 쏘쏘해서 따로 언급은 안하겠음 ㅋㅋㅋ쨌든 남들이 다 맛있다 하는 메뉴들은 역시 다 이유가 있는건가봄 ㅋㅋ 다음에 대전 성심당 가면 그때도 카레고로케는 꼭 사와야지!!​",31,0,0,524,0,0,761.2,10,,2020. 2. 7. 23:32,1762,1943319,맛집,0
5,https://blog.naver.com/flutter_da?Redirect=Log&logNo=221605609429,"얼마전 산 로티세리 에어프라이어한달 좀 넘게 사용했는데, 활용도도 높고 청소도 편하고 음식도 맛있게 되어 포스팅해봄사실 뭐든 기름으로 튀기는게 더 맛있는데 굳이 에어프라이어를 사야하나라고 생각해서 안샀는데 요즘 만두를 많이 만들어 먹다보니 다양하게 요리를 해야했음하여 어떤게 나을지 찾다보니 통돌이라고 해야하나 원형 바스켓을 회전할 수 있는 엔뚜마노 제품이 눈에 쏘옥 들어왔음사실 회전가능한 에어프라이어가 몇개 더 있었으나 다른 곳은 별도구매 해야하는 것들이 여기선 무료로 다 구성품에 있었음ㅋㅋ 엔뚜마노 에어프라이어회전메뉴가 있는 로티세리 에어프라이어로 박스에 그려진 요것들은 실제 제품의 기능들조작법도 편하고 뭐 기능도 다양해서 더 괜찮은듯메뉴마다 온도나 시간이 기본적으로는 다르게 측정되지만 수동 조절도 가능했음구성품과 설명서또 각 부위별 명칭에 있는 것들은 다 줌!! 오일 스프레이만 사면 된다는~~바스켓, 메쉬바스켓, 꼬치 구이 도구들, 통닭거치대, 원통형 바스켓까지 완전 풀구성을 10만원 초반의 가격대로 사다니 완전 좋았음뭐 물론 활용도라던지 기능 자체가 좋아야겠지만 ㅋㅋ미리 말하자면 살짝의 단점이라면 메쉬바스켓같은건 좀 마감이 살짝 아쉽긴 하지만 쓰기 불편한 정도는 아니라 괜찮음다른 로티세리 에어프라이어보다 싸길래 12L로 구매했는데 그러길 잘한것 같음 ㅋㅋㅋ 마트에 700g 닭이 잘 빠져서 자꾸 1050g 닭만 남아있는데 요것조차도 잘 조리되는 사이즈~엔뚜마노 에어프라이어로 사기 잘한듯아참 엔뚜마노 커피포트도 샀는데 귀여운 클래식한 느낌에 좋음안에 있는 스트로폼 안에 구성품들이 들어있는데 바스켓이야 뭐 다른 곳에도 다 있는것 같고요 원통형 바스켓과 꼬치구이, 통닭구이 잘 되는 회전형 도구들!에어프라이어는 공회전을 한 후 쓰는게 좋대서 우리도 공회전을 해봤음우와-ㅅ-;; 냄새 안좋았음역시 공회전을 필수인가봄 ㅋ 공회전도 하고 안의 구성품도 다 꼼꼼하게 세척해줬음에어프라이어가 온 날인데 뭐라도 늦은시간이지만 먹어야 할꺼 같아서 ㅋㅋㅋ맥주 한잔 하기 위해 안주를 만들어봤음 ㅋㅋ집에 먹던 삼겹살밖에 없어서 꼬치로 만들어봤음톱니바퀴 같은 것에 꼬치를 꽂은 후 안에 걸어주면 로티세리 기능으로 요 자체가 막 돌아감뭔가 양꼬치 느낌이기도 했고 ㅋㅋ 좋았음 신기하기도 했지만 꼬치할때마다 이제까지 위치에 따라 익는것도 좀 달라서 아쉬웠는데 요건 회전형이니 그런 걱정 없었음 생긴건 영 그렇지만 ㅋㅋㅋ 기름도 쪼옥 빠지고 나름 먹을만했음특히 이날은 채소들이 어찌나 맛있었는지! 물론 채소 단품 말고 고기랑 함께 먹을때 말임 ^-^;삐약씨가 만들어주는 에어프라이어 치킨예전에 광파오븐으로 로스트치킨 만들땐 내가 실수로 닭껍질을 다 벗겨서 완전 뻑뻑하고 맛이 없었음이번엔 삐약씨가 닭껍질 위에 올리브유에 버터, 다진마늘, 후추, 소금 등 잘 발라줘서 또 잘 꼬치에 꽂아서 고정시켜주었음이날은 닭이 넘 컸는데 ㅠ_ㅠ 평소엔 다리랑 날개 등에 이쑤시개를 꽂아 닭사이즈를 고정시켰는데 이날은 닭이 넘 커서 잘 안읽을까봐 오히려 고정을 안함이쑤시개를 꽂아 고정을 시키지 않으면 이렇게 빠진 기름이 또 묻고 또 묻고 반복함 ㅠㅠ물론 나중엔 닭이 읽어가면서 수축이 되서 괜찮지만 ㅋㅋㅋ쨌든 이 기능이 되는 에어프라이어를 저렴하게 사서 완전 좋네 +_+)닭을 좀 작은걸 사면 수월하게 좋을 것 같긴함! 근데 여름이라 그런지 700-800정도의 사이즈는 늘 품절 ㅠ 그래서 우리집은 늘 큰닭만 먹음ㅋ집에 퍼지는 맛있는 냄새껍질이 빠삭해질때까지 잘 굽기!혹시나 닭가슴살쪽이 잘 안읽을까봐 걱정이 되면 회전을 멈추고 가슴을 위로 향해놓고 3-4분 더 오븐을 돌려주면 된다는~~뭔가..소녀와 같은 느낌인데;;;;; 양쪽 눈에 코에 양갈래 머리에 활짝 웃는 입그 이야기 했다가 삐약씨테 이상한 취급을ㅋㅋㅋ;;;; 맥주가 자연스럽게 나오는 그런 맛!치킨값도 비싼 요즘 배달비도 따로줘야 하는 요즘 ㅠ_ㅠ  잘샀다 잘샀어닭은 한 4번쯤 해 먹었는데 ㅋㅋㅋㅋ 어떤날은 소금만, 어떤날은 양념통닭 소스 만들어서 어떤날은 파채랑 함께 어떤것과도 잘 어울림닭을 큰걸로 하면 닭가슴살이 넘 많아서 이날은 또띠아에 채소와 닭가슴살을 맛있게 해치웠음또띠아는 채소랑 먹는게 역시 가장맛있는것 같음 :-) 스위트칠리소스와 함께 ㅋㅋ이날은 파채와 홈플러스 치킨무 사와서 함께 먹은날 ㅋㅋㅋ 에어프라이어 장점이 참 많은데 단점은 살이 넘 잘 찔듯기름이 쏘옥 빠지긴 하는데 맨날맨날 이렇게 진수성찬을 먹다보니 ㅋㅋㅋㅋ군만두와 치킨너겟도 뭐 나쁘진 않은데 나는 역시 이런 안주류가 내게는 딱이네 ㅋㅋ먹요 추천 막창도 에어프라이어로 완성후라이팬에 구워도 몇번씩 뒤집어 줘야 하는데 요건 한번정도만 나중에 뒤집어주면 끝이니 완전 편함맛도 있고~ ㅋㅋㅋ 나중에 청소도 편하니 진짜 좋았음엔뚜마노 에어프라이어 홈베이킹!!다른 제품들은 베이킹이 좀 까다롭다고 하는데 엔뚜마노꺼는 오븐, 토스터, 에어프라이어 3가지 기능이 한곳에 모여있어서인지 케이크도 빵도 잘 만들어졌음!!생선구이도 잘되고 스테이크도 감자튀김도 모두 잘되고! 빵 데우는건 물론 홈베이킹에회전기능을 이용한 바베큐꼬치, 통닭, 원통형 바스킷을 이용한 삼겹살까지 뭐든 완벽한 엔뚜마노 에어프라이어11만원도 안되는 가격에 풀구성으로 받을 수 있으니 아직 에어프라이어 없는 사람이라면 사봐도 좋을듯나는 지마켓에서 스마일클럽 할인까지 받아서 샀었음 ㅋㅋㅋ 공식몰 주소는 한번 남겨보긴하겠음~ 내 돈 주고 산 후기지만 ㅋㅋ ㆍ
",36,0,0,596,22,1,761.2,10,,2019. 8. 4. 23:11,1762,1943319,맛집,"['오~~이거 하나 사고 싶네요', '와 모든 요리가 가능하네요 갖고싶어집니다~^^', '쿡스타헤센12리터 쓰는데 로티세리기능은 있는데 악세사리중 저 꼬치대 꽂아서 돌아가는거는 없더라구요사고싶어서 전화로 문의했더니 무슨소린지 알아듣지도 못하구요 이거 사서 쓸쑤있는거면 사고싶네요 ㅠㅠ', '헉 ㅜㅜ 그 제품엔 아예 꼬치 돌리는게 없나보네요 ㅜㅜ매일 쓰진 않지만 술안주나 간식할때는 넘 좋은데 ㅜㅜ 아쉽네요', '기능은 있고 통닭 통삼겹은 할수 있겟는데 저 꼬치끼워돌리는 도구는 없더라구요없어도 추가구매할수 있으면 하려고했는데...때로비님이 구매하신거 사양이 좋으네요', '호환되면 따로 구매해도 좋을것 같네요 ㅜㅜ', '그러게요^^', '혹시 이거 열순환기능 있던가요? 아니면 그냥 위 열선으로만 익히나요?', '이거손잡이 엄청뜨겁지않나요? 전 맨손으론 절대잡을수없는 뜨거움인데요..제꺼가불량인지 원래그런건지..궁금하네요', '기계 손잡이요?? 저희도 어느정도 뜨거움인지는 모르지만 오래 돌리면 뜨거워져서 실리콘 장갑으로 열어요 ; ㅅ ;', '기존에쓰던거는 아무리뜨거워져도 손잡이가 저리뜨겁진않았는데...저게 불량인건지원래그런건지를모르겠어여. 그리고한가지더 여쭤볼께요.메뉴에없는음식할땐 어떻게하세요? 전원키고 온도나 시간버튼 더하기표누르는데 전혀않움직여여..원래그런가요? 군고구마는 어찌하시나요? 이게중국제조라그런지 판매처에서도 사용법을 모르네요.', '앗 우리집도 그냥은 안되고 메뉴 눌어야 시간 추가랑 빼는거랑 온도조절은 되용 ㅋㅋ특별히 메뉴가 시간하고 온도정도 셋팅했지 큰 기능은 없지 않을까 싶어서 저는 메뉴엔 큰 의미는 안두고 있어요  군고구마도 그냥  첫메뉴 감튀 누르고 그냥 돌리다가10분 좀 넘으면 한번 굴려서 뒷면5분쯤 익히고 끝이요~어차피 메뉴 있어도 크기나 양에 따라 ㅜㅜ 어차피 온도나 시간은 달라져야해서 전 그냥 써용;;', '답글 감사요^^']"
6,https://blog.naver.com/flutter_da?Redirect=Log&logNo=221424557870,"사무실에 히터를 워낙 빵빵하게 틀기도 하고.. 피부가 나이드니 건조해지기도 해서-_ㅠ탁상용 미니 가습기를 찾던 중 대박 귀여운 가습기가 있길래 ㅋㅋ 구매했음 ㅋㅋ가격도 이만원 안되는 가격이였는데 써보니 괜찮아서 포스팅해봄제조국 중국 ㅋㅋㅋ 하지만 귀여운 미니 크리스탈 가습기 +_+근데 왜 크리스탈이지...?;; 어디가??;;나에게는 그냥 선인장 미니 가습기 ㅋㅋㅋ 탁상용 미니 가습기 ㅋㅋ열어보니 귀여운 스티커가 딱!!뭔가 선인장 가습기에 어울리는 선입장 스티커였음이게 왜 들어있나 했더니 스티커로 나만의 귀여운 가습기를 만들라고~~나름 필터가 있는 USB 미니 가습기!사이즈는 작았고 선인장이 위에 올려져 있어서 더 귀여웠음~처음에는 선인장에서 살짝 고무냄새?; 같은게 났었는데 그건 금방 사라졌음바로 물을 넣고 USB를 연결해봤음!예쁘게 무드등까지 들어와서 더 예뻤는데 요 LED는 색이 계속 변함파랑색 보라색 빨강색 분홍색..노란색도 있었던거 같기도 하고..어쨌든 계속 변함.. 이건 한시간정도 켜두면 더 이상 무드등은 안들어오는듯.. 무드등을 원하면 또 다시 전원을 껐다 켜면 됨물은 200ml도 안들어갔는데..분무량 조절이 안되다 보니 몇시간 지나니.. 물이 금방 사라짐.. 하루에 2번 정도는 물을 보충해줘야 회사에서도 빵빵하게 가습기 켜두고 있을듯 ㅋㅋ엄청난 분무량 ㅋㅋㅋ 내가 원하는 곳에 스티커도 붙여주고 +_+) 나만의 탁상용 미니가습기 ㅋㅋ가격대비 괜찮은듯.. ㅋㅋ 근데 분무량이 워낙 있다보니 약간 물 소리가 나는듯 ㅋㅋ나름 필터도 하나 더 들어있었음 ㅋㅋㅋ워낙 물건을 잘 고장내는 나라서.. 너무 비싼거 쓰는것보다..이렇게 귀여운 가습기 대충 쓰다가 또 다른것으로 갈아타는게 좋은듯 ㅋㅋㅋ;;;하루종일 가습기 켜두니깐 화장이 쩍쩍 갈라지지 않고 ㅋㅋㅋ 훨씬 좋은듯 
",12,0,0,193,6,1,761.2,12,,2018. 12. 22. 0:00,1762,1943319,맛집,"['맞아요 !! 요즘 히터바람에 피부도 건조해지더라구요 ㅠㅠ이런 미니가습기 너무 좋네요!!근데 선인장이라뇨~~ ㅋㅋㅋ 이렇게 앙증맞은 가습기도 있다니 신기해요 ㅎㅎ', '저희 회사는 히터 온도를 30정도로 맞춰서 ㅋㅋㅋㅋㅋㅋ 그래야 따뜻하고 좋은데 얼굴은 건조 ㅠㅠ꼭 필요한 템이예요', '맞아요^^ 겨울엔 가습기 꼭 있어야 합니다차량용도 사용하면 좋겠구만~~우리 삼실에 내 차는 한대도 없어서리~~(풍요속 빈곤인강??ㅎㅎㅎ)', '헐 진짜 풍요속 빈곤인데요 ㅋㅋㅋㅋㅋㅋㅋ', '저도 책상에 하나 장만해놓고 싶네요~~^^', '촉촉해집니다 ㅋㅋ']"
