,Post URL,Post,Image num,sticker num,gif num,Paragraph num,Comment num,Video num,weekly viewer mean,Sympathy num,AD,Posting Date,Buddy num,Total visit,Blog category,Comment detail
0,https://blog.naver.com/gks4155?Redirect=Log&logNo=222004149862,안녕하세요.ㅇㅕNA입니다.얼마전 꼬마대장과 함께 본 영화 트롤 월드투어트롤 월드투어를 보고 난 이후 우리 꼬마대장 트롤 캐릭터에 완전 홀릭 되어버렸어요.장난감 가게에 가도 트롤 피규어만 만지작만지작!!!요즘 학교도 격일로 가고...동생들은 유치원가고 집에 혼자 남아있으면 어찌나 지루해하고 심심해하는지꼬마대장을 위한 집콕놀이를 준비해보았어요.​구성품이에요.정말 간단하게 들어있죠?꼬마대장이 고른 캐릭터 도안과 트레이 비즈 펜 고체풀요즘 쌍둥이 겨리차니가 유치원에서 보석비즈를 즐겨 하는지많이 만들어와서 꼬마대장도 무척이나 무러워하더라고요.형아니까 좀 더 난도 높은 비즈를 이용해보았지요​방법은 간단해요.. 구성품을 확인한 후 비즈색과 도안의 색을 확인 후 적당량의 비즈를트레이에 담아주고 살짝 흔들어 비즈를 정렬시켜 주어요.​고체풀을 펜으로 깊게 눌러준 후붙이려는 비즈를 살짝 찍어준 후비닐을 벗긴 도안과 동일한 색상의 비즈를 눌러 붙여주세요.​이렇게 하나하나 붙이다 보면 캐릭터가 완성되는 보석십자수랍니다.어찌나 집중을 잘하는지 집에 아무도 없는줄요~​진짜 몰입도 최고예요.시간이 술술 흘러가는 집콕놀이로 선택하길 잘했군..​어느새 동생들도 합류를 했네요.시끌벅적하던 집안이 한순간 고요~우리집 맞니??ㅋㅋ​삼형제가 집중해서 하는 걸 보니 왜 자꾸 빠져드는지..ㅋㅋㅇㅕNA도 한번 도전해봤어요.우와~이거 정말 시간가는줄 모르겠더라고요.#시간순삭 #취미우리 삼형제가 이렇게까지 집중하는 걸 처음 본지라~어찌나 신기하던지요~겨리 차니도 생각보다 정말 잘하더라고요.비즈가 작어서 사실 기대도 안했거든요..ㅋㅋ너무 과소평가했는가 봐요... 미안~~완성된 비즈는 떼어내면 스티커가 되어서 원하는 곳 어디든 붙일 수 있더라고요.비즈 십자수로 보석십자수로만 끝나는 것이 아니라스티커 활용까지 아주 알차지요??어디에 붙이면 좋을까 고민하다가각자의 핸드폰 케이스를 꾸미기로 했어요.붙이는 재미까지 쏠쏠~​​이렇게 완성하고 나서 서로의 작품도 감상하고어찌나 뿌듯해하던지~원하는 곳에 붙이면 인테리어 효과가지 있을 것 같아요.​따분한 일상~지루한 일상~뭔가 색다른 취미생활을 갖고 싶거나 아무생각 없이 잡생각버리고 어딘가에 몰두 하고 싶을 때...집콕놀이로 고생 중인 아이들과 함께 취미로 해보세요.아이들 집중력 향상에 최고의 집콕놀이였네요.​,24,0,0,213,0,1,2074.2,12,revu,2020. 6. 17. 22:05,3931,7453707,육아·결혼,0
1,https://blog.naver.com/gks4155?Redirect=Log&logNo=222446037916,"안녕하세요. ㅇㅕNA입니다.요즘 집인테리어를 조금씩 바꾸면서 아이들 방을 어떻게 꾸며줄까 아이방인테리어에 조금씩 눈이 가기 시작하더라고요.우리 삼형제는 수면등없이는 잠을 잘 안 자려고 해서잘 때는 꼭 수면등을 켜줘야 하거든요.그래서 수면등을 알아보다 보니 요즘 신혼부부 선물이나집들이 선물로 많이 한다는 아크릴AR무드등이 눈에 들어오더라고요.사진을 넣어 제작할 수 있는것도 참 마을에 들고 선물용으로도 아이방꾸미기도 좋겠다 생각했는데.AR까지 된다고 하니..요즘 젊은층사이에서 AR굿즈나 AR포토카드등이 유행한다고는 들었는데..막상 이렇게 직접 눈으로 보고 나니 정말 신기하더라고요.오웃!!우리 집에도 굿즈 생기는 거임??원하는 사진으로 만들어진 무드등을핸드폰으로 비추면 영상까지 재생된다니!!!왜우!!!배송받기전부터 설렘 설렘~기대가 가득 되더라고요.ㅇㅕNA는 아이들방꾸미기 인테리어로 생각했던 거라일단은 아이들 사진으로 제작을 했어요.제작하는 과정을 사이트에 주문을 하고 사진과 영상을 카카오톡으로 전송해 주면 되는간단한 작업이더라고요.시안 수정은 1번 가능하고요.카카오톡으로 친절하게 설명도 잘해주시고 시안과 영상을 같이 고민해 주시는 친절함~감동이었어요.ㅇㅕNA도 처음 접해보는 신기한거라 처음에는 영상과 사진이 어떻게??라며 제작을 하면서도 참 의아했었고..배송 내내 기다려지더라고요.배송받고도 AR이라고 따로 준비할 것도 없고여느 수면등이나 무드등이랑 같이이렇게 세팅만 해주면된답니다~어디가 잘 어울릴까~~~~어디에 놓아줄까~~~일단 아이들 방으로 옮겨서 설치를 했고요.설치라고 해도 뭐 대단할 것도 없이 USB 포트만 있으면 조명 기능을 사용할 수 있답니다.조명을 끄고 켜는 것을 버튼을 눌러 선택을 할 수 있고요.​참!!처음 사용시에 배송을 받으면 아크릴부분에필름을 제거하고 사용해야 된다고 하네요.ㅇㅕNA는 뭐 모르고.. 어??왜 이렇게 선명하지 않지??했다가 나중에 청소하다가 발견.. ㅋㅋㅋ아이코....​우리 삼형제에게 신기한 선물이될 AR아크릴 무드등아니..아이들방이니 무드등 보다는 수면등..ㅋ낮에는 소품으로 액자로 활용이 되기 때문에어느 장소에 든 공간 연출이 가능하고밤에는 따뜻하고 아늑한 빛으로 조명을 더할 수 있는 분위기를 만들 수 있어요.아이들 방 인테리어로 괜찮죠?남자 셋이 같이 자면서도 왜 이리 환한 걸 좋아하는지...좀 크면 괜찮아지겠죠?자.. 이제 준비는 끝났고..앱 하나만 깔아주면낮에는 액자로 밤에는 무드등으로소중한 추억이 담긴 영상이 재생이 된답니다.스토어에서 피플앱을 다운받아 설치를 해주었어요.​피플앱을 켜고 별도의 장치없이도 앱에 있는 AR카메라를켜고 액자 가까이에 가져가면영상재생!!!와우!!이거 정말 신박하고 신기하고 굿 아이디어 이더라고요.동영상으로도 한번확인해보세요.정말 신기해요.너무너무 신기해서 자꾸만 해보고 싶은 매력!!자꾸 영상을 재생하게 되더라고요.아이들도 한번더 한번더 본인들 모습을 왜자꾸 보고싶어하는지..ㅋㅋ그만큼 AR포토액자 매력에 풍덩 빠져버렸다는증거죠.신혼부부나 부모님께 드릴 특별한 선물이 필요하신분좋아하는 연예인을 내방으로 꾸미고 싶은 분부담되지 않는 가격의 집들이 선물을 준비하시는 분사랑하는 댕냥이들의 모습을 간직하고 싶으신분흔하지 않은 특별한 무드등을 원하는 분​이런모든분들께 추천드리는 AR아크릴 무드등커플템으로도결혼식 영상을 담은 인테리어소품으로도좋아하는 연예인 영상을 담은 나만의 굿즈로친구에게 주는 집들이 선물로 완전 핫하게 누릴 수 있는 핫템인것 같아요.사실, 영상재생을 할때 소리는 안나올줄알았는데..동영상 소리 고스란히 다 나오더라고요.굿굿!!!!!!아이들과 함께한 추억이 담긴 영상이 나와서 그런지더욱더 마음이 가고 애정이 가는 물건이 되었네요.아이들은 뭐 말할 것 없이 좋아하고심심할 때마다 영상을 재상해보면서 보더라고요.주문자의 요청에 따라  사진이나 영상 문구가 입력이 가능하니특별한 선물을 원하시는 분들께는 바로 이거다!! 하고 느낌이 딱 오시죠??작은 소품 하나지만 아이들방의 분위기가 달라지더라고요.소중한 사람과의 소중한 추억특별한 선물을 하고 싶은 분들께는 아주 좋은 것 같아 추천해요.​",28,0,1,382,3,1,2074.4,15,revu,2021. 7. 26. 13:41,3931,7453708,육아·결혼,"['글 잘보고 갑니다^^', '오늘도 좋은 글 감사합니다..ㅎㅎ']"
2,https://blog.naver.com/gks4155?Redirect=Log&logNo=222065144457,"안녕하세요. ㅇㅕNA입니다.건조하고 메마른 곳에 촉촉함을 줄 수 있고인테리어 효과까지 있는 코드26 가정용 미니가습기에요.이 더위가 가고 나면 또 추운 겨울이 찾아올 텐데..겨울 건조함은 또 이루 말할 수 없죠.우리 삼형제는 피부 트러블 때문에 습도 조절이 중요해서 계절에 상관없이 가습기를 사용하고 있어요.오픈을 해보았는데...코드26에서 판매되고 있는 카달로그가 있더라고요~이런거 또 한번 살펴보고 구경해 줘야 주부죠.수납용품.. 조명.. 겨울 용품 등등 제품부터 해서..카트 /공기청정기 / 커피 / 수납함 / 정리함 / 전기온풍기 등등..많은 제품들이 있는데..제일 탐나는 건 올여름 사용할 제빙기가 눈에 띠용!!!!!!!하,, 안돼 ..마음을 가다듬고...미니가습기부터 살펴봐야죠.365일 쾌적한 환경에서 생활하기 위한 코드26에서 제안하는 솔루션!!적정 실내습도를 유지하면바이러스 전파력을 떨어뜨려 독감이나 호흡기 질환 예방에  효과적이라고 해요.요즘은 바이러스에 정말 조심해야 할 때이잖아요.이제 가을 / 겨울도 다가오는데..독감 및 호흡기 질환 정말 걱정이기는 하네요.특히나 기관지 약하고 비염때문에 매일 훌쩍거리고 다니는 아이들이라...더욱더 걱정이에요.그럴수록 관리를 더욱더 철저하게 잘해주어야죠.습도가 낮으면 피부가 건조해져서 피부질환은 물론주름과 트러블도 생긴다고 해요.적정한 습도는 피부를 촉촉하고 건강하게 유지시켜주어서아토피 등 피부질환에 도움을 주지요.아주 작은 미니 가습기이지만기능이 좋은 스마트한 아이랍니다.물분자가 작아 바닥이나 닿는 면이 젖지 않아서 좋고요.미세한 물입자 분무로 보다 효과적인 가습이 가능하답니다.​기분에 따라 6가지 색상으로 컬러 무드등 기능도 함께 되어있어요.취향과 스타일에 맞게 컬러 선택이 가능하기 때문에..원하는 연출에 따라 컬러 선택을 할 수 있는 장점이 있죠.그날그날의 분위기에 따라 6가지 컬러의 빛을 선택해보세요.사용설명서가 함께 들어있어서살펴보았어요.뭐 설명서 없어도 너무 쉽게 사용 가능한 가습기라서..꼭 필요는 없지만,그래도 사용 전 한 번은 봐야죠.​버튼은 파워 버튼과 무드등 기능을 하는 라이트 버튼이 있어요.아래쪽에 있는 것은 분무량을 조절하고요.​파워버튼을 한번 누르면 가습 기능이 켜지고 두 번 누르면 1시간 타이머 세팅이 되며 빨간 표시등이 켜져요.3번은 3시간 타이머 세팅에 녹색등네 번은 6시간 타이머 세팅에 파란 표시등이에요.최대 6시간 타이머 설정이 가능하니 자기 전 미니 가습기를 작동시키고 자도 아침까지 문제없겠네요.​뚜껑이 분리가 되어서 360도 회전 가능한 분사구로 분사구 방향을 전환할 수도 있어요.​바닥은 미끄럼 방지 패드가 부착이 되어서 미끄러운 바닥에서도 안정적으로 사용이 가능하고요.​응결되지 않는 미세분사​책상에 올려두었는데..뭔가 고급스러워 보이는 느낌은??^^색이 나오는 무드등을 켜지 않아도...화이트와 우드톤으로..존재만으로도 감성이 생기네요.​미니가습기라서 분무량이 약할 줄 알았더니..와우 작은 고추가 맵다고..미니가습기 답지 않게 분무량 꽤 괜찮더라고요.게다가 분무량 조절까지 되니 말이에요.​저소음 설계로 아이의 방안에서도 아기가 자는 방에서도 사용이 가능한 초음파가습기오일도 사용이 가능해서 물탱크에 아로마오일 몇 방을 톡톡해주면~향기까지 솔솔~디퓨져 저리 가라~!!!가습기를 사용하면 세척도 불편하고..관리가 너무 힘든데..미니 가습기라 관리도 편하고..게다가 인테리어 효과까지 있으니..진작 갈아탈 걸 그랬어요.덮개만 분리하면 되는 간편한 구조로 분리도 쉽고결합도 쉬워서 세척이 편리하거든요.가성비 최고!!!​부피도 작고 가벼우니 겨울에는 캠핑장에 들려보내야겠어요.미세한 물입자 분무로 효과적인무드등 가정용 미니 가습기 초음파 가습기​",38,0,1,360,1,1,2074.4,9,revu,2020. 8. 19. 20:09,3931,7453708,육아·결혼,['미니 가습기 너무 귀엽네요! 구매욕구 뿜뿜!!']
3,https://blog.naver.com/gks4155?Redirect=Log&logNo=222033973523,안녕하세요. ㅇㅕNA입니다.요즘은 캠핑도 감성 감성~캠핑 용품으로 감성템하나씩은 소지하고 있어야죠.ㅇㅕNA네는 그중 하나가 바로 캠핑랜턴인데요.캠핑은 밤이되어야 빛나는 거라고들 하더라고요.별거 없지만 랜턴 하나로 감성을 즐길 수 있는 캠핑 무드등 감성캠핑감성더하기감정 하나 때문에 캠핑을 떠나시는 분들도 많아지는 추세라..캠핑에 감성을 빼놓으면 안 되더라고요.LED캠핑랜턴인데요...손잡이가 있어서 휴대하기에도 아주 좋아요.캠핑이나 야외용으로 알맞은 LED랜턴이랍니다.들고 다닐 수도 있고... 걸 수도 있는 간편한 랜턴이에요.밤에는 아이들 화장실을 가거나 잠깐 차로 이동할 때나... 랜턴이 꼭 필요한데..굳이 환한 불빛이 아니더라도..은은한 불빛으로... 호롱 불처럼 들고 다니는 것도 아이들이 재미있어하더라고요.충전식이나 오일이 필요 없이AA 건전지 4개를 넣어작동을 하고요.예전에는 기름을 넣거나 하는 방식으로 작동하는 랜턴들이 많았는데..이제는 안전하면서도 감성을 느낄 수 있는 간편한 제품들이 인기이더라고요.번거롭게 오일도 챙겨야 하고.. 무겁고..게다가 뜨겁고 위험하고..아이들은 주위에 얼씬도 못하게 하는...그런 제품은 이제 노노!!!!!건전지만 넣으면 손쉽게 전원을 키고 꿀 수 있는 랜턴이에요.야외에서도 아주 쉽게 사용이 가능하죠.야외에서 특별한 분위기를 연출하고 싶을 때 또는실내 인테리어에도 좋고..파티 / 무드등 / 캠핑시 / 간접조명 등상황에 맞게 다양하게 활용이 가능하겠더라고요.감성을 채워주는 랜캠핑턴낮에 켜본 건데도 은은하게 빛나는 불이캠핑의 분위기를 확 바꿔주더라고요.밤에는 어떨지 기대가 되더라는요.​​클래식하고 빈티지한 디자인으로 분위기 있는 낭만을 채울 수 있는 캠핑..​가격적인 메리트도 있어서 가성비 정말 최고의 랜턴이라호롱 호롱 호롱 불의 감성을 원하시는감성캠핑을 원하시는 분들께 추천드리고 싶어요.촛불의 감성을 느낄 수 있게..LED램프 부분이 촛불처럼 흔들리는 효과가 있더라고요.초를 켜놓은 듯한 효과로 램프가 계속 일렁이는 느낌을 주어서 감성캠핑여행시 필수 아이템인 것 같아요.보통 이 정도 불빛의 감성을 느끼려면 무게가 꽤 나가는 제품들인데...무게도 너무 가볍고 휴대도 편해서 캠핑템으로 매일 함께하게 될 것 같아요.깊어가는 캠핑의 밤..아무래도 아이들과 함께 하는 캠핑이라 감성랜턴도 신중하게 골라야 하는데..건전지로 작동하면서 안전하게..기름을 사용하는 랜턴과 같은 효과를 내주니...너무 좋더라고요.캠핑을 다녀와서는 거실 선반 위에 인테리어 소품으로 전시 중이에요.감성캠핑의 감성소품으로 은은하게 밝혀주는 호롱불 스타일 랜턴..가성비 좋고 안전한 제품으로 아래 링크에서 구입하시면 된답니다.안전하고 즐거운 캠핑하세요!!!​,14,0,1,259,1,2,2074.4,9,revu,2020. 7. 17. 22:07,3931,7453708,육아·결혼,[]
4,https://blog.naver.com/gks4155?Redirect=Log&logNo=221789771747,"​​​​​안녕하세요. ㅇㅕNA입니다.여자라면 누구나 꿈꿔온 나만의 분위기 있는 화장대요즘은 화장대 미러등을 많이들 사용하시더라고요.ㅇㅕNA는 메이크업샵이나 미용실에서만 사용할 줄 알았는데..요즘에는 설치도 간편하게 나오는 화장대 조명이라일반 가정 화장대에서도 많이 사용들 하시더라고요.게다가 DIY라서 나만의 예쁜 조명을 만들 수 있다는거~그럼 지금부터 소개해 드릴께요.로맨틱 DIY 거울조명 데이홈 뷰티온 미러라이터 설명서가 함께 동봉이 되어있네요.구성품은 이렇게 들어있어요.LED조명10구 전용어답터양면폼테이프가이드용흡착판10개 사용설명서간편한 설치스위치타입3가지 색온도밝기 조절USB 호환3가지 다양한 컬러로 원하는 LED색을 선택할 수 있어요.오늘의 메이크업 상태에 미리미리조명 느낌별로 체크해볼 수도 있고요.호텔 같은 분위기의 원화이트 컬러부터은은한 주백색 시원한 쿨화이트 색상까지...보통 화장대 조명은 한 가지 색상이 많던데..3가지 색상 모두 원하는 컬러로 매일매일 바꿔 사용이 가능하니..굿굿!!!게다가 밝기 조절까지 가능하다는 거예요.은은한 밝기 조절로 자연스럽고 디테일한메이크업은 물론이고 분위기 있는 무드 등으로까지 활용 가능~색상 밝기 조절이 가능한 미러 조명이랍니다.USB 타입의 제품으로 국내에서KC 인증을 받은 정품 USB 전원 어댑터를 함께 제공고휘도 LED를 사용해서 충분한 메이크업 밝기를 제공해요.​간편 스위치로 조명 색을 바꾸고 밝기를 조절할 수 있어요.USB 타입으로 안전하게 버튼은 편리하게 ​원하는 길이만큼 늘리거나 줄여서 사용을 할 수 있어요.조명선을 양쪽으로 살살 잡아당겨 늘릴 수 있어요.조명선을 줄일 때는 전구를 한쪽 방향으로 돌려 선을 감아주면 된답니다.​짧게는 3CM 길게는 25CM까지 가능해서 어느 모양의 거울에나 어떠한 거울에나 부착이 가능하답니다.​조명을 붙일 때에는 동봉된 양면테이프를 이용하여 붙여주면 된답니다.폼테이프가 접착력이 강하다 보니 떼어내기 어려워서 가이드용 흡착판으로 미리 위치를 확인한 후 붙여주면 더 좋아요.​이렇게 화장대 거울에 붙여주기만 하면 끝!!여신화장대 만들기 정말 쉽죠??어떠한 거울도 모양에 상관없이원하는 만큼 늘이고 줄여 나만의 로맨틱한 화장대 만들기 성공!!!간편하게 설치가 가능하고 조명 길이가 조절이 되니우리집 화장대 모양이 어떻든 상관없이부착이 가능해서 좋은 것 같아요.​장소별 분위기별 원하는 색상으로 선택!!!​똑똑한 스마트 메모리 기능으로마지막에 사용했던 밝기와 조명 색상을 기억하여 저장!!다음날 사용할 때에도 어제 그대로 그 밝기 조명 색상으로사용이 가능하더라고요.설치도 쉬운데 이런 똑똑한 기능까지 있다니!​우리집도 메이크업샵처럼 빛나는 여신 화장대를 만들어보세요.​​ 
",29,0,1,259,5,2,2074.4,11,text_ad,2020. 1. 30. 9:52,3931,7453708,육아·결혼,"['오늘도 좋은 글 잘 보고 갑니다\n즐거운 하루 되세요', 'ㅇㅕNA님 글 잘 보고 가요~^^\n오늘도 행복한 하루 보내세요~', '포스팅 구독하고 갑니다 \nㅇㅕNA님 즐거운 하루 되세요 ^^', '멋지네요!! 잘보고갑니다😁']"
5,https://blog.naver.com/gks4155?Redirect=Log&logNo=221678951107,​안녕하세요. ㅇㅕNA입니다.쌀쌀한 바람이 불고 난방을 조금씩 시작하다 보니점점 더 건조해지는 것을 느끼겠더라고요.더구나 캠핑장에서는 히터까지 틀고 있기에..앗!! 소중한 내피부 지켜야지!!!건조한 겨울 뽀송뽀송하게 해줄라온하제 스툴 미니 가습기를 선택했어요.​아주 작고 앙증맞은 사이즈지만강한 가습력과 전기요금까지 절약할 수 있는추천받을 만한 귀여운 친구에요.​사용방법은 상자 겉면에도 나와있는데..매우 간단하게 사용할 수 있어요.​위생적이고 저렴한 종이필터 사용으로 간편하고 쉽게 필터도 교체할 수 있고위생적으로 사용할 수 있어요.​세련된 미니가습기사무실에서도 공부방 책상에도 ㅇㅕNA처럼 캠핑장에서도..작은 사이즈라 휴대가 가능하니 어드든 어울리고게다가 세련된 디자인으로 인테리어 효과까지 덤으로 얻을 수 있어요.원터치 버튼으로 간편하게 사용이 가능해요.겨울철이나 환절기에는 피부도 건조해지고 알레르기 질환이나호흡기 질환 / 안구건조증 등 때문에습도를 유지시켜주는 게 위 질병들을 예방하는데가장 좋은 방법이더라고요.쾌적한 습도 유지는 바이러스 전파력을 억제시켜주고 건조한 장소에서메마른 피부를 촉촉하게 유지하는 데 도움을 줄 수 있거든요.​작지만 강한 라온하제 미니가습기는 일반 휴대용 가습기보다 강력한 가습력을갖고 있어요.작다고 절대 무시하면 안되죠!!우리나라 속담에도 작은 고추가 맵다는 속담이 있듯이작지만 강한 가습기랍니다.​미니가습기의 놀라운 가습력 영상으로 직접 확인해 보세요.저소음 초음파 가습기라밤에도 소음 걱정 없이 편히 잘 수 있어요.​한 달 내내 24시간 사용을 해도 월 100원대 전기세라고 해요.우와~정말 실화임?​화장대 의자를 연상시켜주는 스툴 가습기미끄럼 방지 재질로 다리가 설계되어있어서미끄러운 바닥이나 책상에서도안정적으로 사용이 가능하기에사무실이나 공부방 책상 위에는 제격일 듯싶어요.​​은은한 7가지의 무드등이 바뀌어서 무드등 효과까지 있고요.​​시간별로 변하는 무드 등으로 다양한 분위기 연출도 가능하겠네요.여러 가지 색상이 싫으시면 내가 원하는 한가지 색상으로 선택이 가능해요원하는 색이 나왔을 때 버튼을 길게 한번 눌러주면한가지 색상으로만 볼 수도 있답니다.​안전성도 고려해서 물탱크에 물이 없을 경우자동으로 멈추는 안전기능을 갖추고 있어요.4시간 자동 정지(연사 모드) 8시간 자동 정지 ( 분사 모드 )바닥이 축축하게 젖는 일부 가습기와는 다르게최적의 분사량으로 주변도 뽀송뽀송하고바닥도 뽀송뽀송하게 지켜준답니다.​살균제 없이 간편한 세척도 가능하답니다.가습기 살균제 때문에 가습기 사용 꺼려 하시는 분들도 많으시잖아요.ㅇㅕNA도 물론 그렇고요.특히나 아이들과 함께 생활하다 보니더더욱이 신경이 쓰이더라고요.​물컵을 세척하듯 물 세척이 가능해서살균제 없이도 세척이 가능하고 깨끗한 천으로 만으로도 간편한 세척이 가능해요.​안전하고 위생적인 미니가습기로 촉촉한 환절기와 겨울 보내세요.​,13,0,1,273,4,2,2074.4,14,suspect,2019. 10. 16. 0:59,3931,7453708,육아·결혼,"['잘 보고 갑니다~^^', '책상위에 미니가습기 쓰다가.. 방이 넓어서 그런지 습도가 안올라가서대용량으로 바꿨어요.ㅎㅎ미로가습기로 선택했는데 용량이 커서 좋고, 가습량이 좋아서 습도도 빨리 오르더라구요.ㅎ무드등기능에 휴대폰 연동도 되어서 리모컨대신 사용할수 있어서 편해요.ㅎ']"
