,Post URL,Post,Image num,sticker num,gif num,Paragraph num,Comment num,Video num,weekly viewer mean,Sympathy num,AD,Posting Date,Buddy num,Total visit,Blog category,Comment detail
27,https://blog.naver.com/gks4155?Redirect=Log&logNo=221845193803,안녕하세요. ㅇㅕNA입니다.코로나19때문에 집순이만 하고 있는 요즘아이들도 개학과 입학이 다 미루어져서 집에만 있고 학원도 휴원해서집콕중인데...집에서 복작복작 있다보니 오히려 집안공기가 더 안 좋은 것 같더라고요.바깥공기도 마음껏 쐴 수 없는 요즘 집안 공기라도 쾌적하게 만들어주자 싶어서 공기청정기를 알아보게 되었어요.공기청정기가 있기는 했지만 작은 사이즈여서 방에 놓기 적당한 사이즈였었거든요.거실용으로 알아보다 보니 보랄 데일리 제품이 가성비에 비해 괜찮아 보이더라고요.거실용 보랄 공기청정기 거실용은 가성비 크기 효과면 여러 가지를 따져보게 되더라고요.박스를 개봉하면 공기청정기 사용설명서와 제품 보증서가 들어있네요.가성비 좋은 제품이지만 사용설명서도 꼼꼼하게 읽어보고 제품도 보증이 되고 AS도 확실한 제품으로 잘 선택을 해서 사용을 해야겠죠.구성품은 본체 3중필터 / 어댑터 / 전원코드 / 사용설명서 이렇게 간단하게 들어있어요.거실안의 모든 먼지를 잡아내는 360 도 전방향 공기청정기원통형으로 되어있어서 전방항 공기를 흡입하고 원통형 3중필터 적용으로거실 곳곳의 모든 먼지를 잡아낸다고 해요.​보랄의 깔끔함일단은 디자인도 깔끔하고 마음에 들더라고요.어디에 두어도 손색이 없이 깔끔한 디자인~딱 ㅇㅕNA스톼일~​실내 공기청정기에 최적화된 높이로원활한 공기청정을 위한 최적의 높이로 설계해서거실전체의 공기를 정화시킬 수 있다고 해요. 60CM 원활한 공기청정을 위한 높이로 설계가 되었어요.​공기가 멀리 퍼져나갈 수 있도록 디자인되어 있어더 많은 양의 공기를 전 방향으로 더 부드럽고 자연스럽게배출해 주는 유선형 팬으로 되어있고요.살짝 기울어진 느낌 보이시나요?깨끗한 공기를 거실 전체에 배출하기 위한 최적의 기울기로보다 밝고 깨끗한 실내공기를 추구하위한 기울기의 과학이라고 해요.필터교체 알림등 / 저속기능 LED램프꺼짐 / 자동감지및세기조절 / 24시간 타이머 / 4단계 풍량조절다양한 기능이 있어서 적절하게 사용이 가능하네요.터치 형식으로 되어있고요.기능은 여러 가지가 있지만 복잡하지 않아서 복잡한 거 싫어하는 ㅇㅕNA도 기능들을 쉽게 사용할 수 있겠더라고요.복잡한건 정말 딱 질색이거든요.^^;;;뭐든 쉽고 효과 좋은 게 제일 좋아요...공기의 정도를 색으로 표현해 주기 때문에 내가 있는 공간의 공기가 어떤지 한눈에 살표볼 수가 있어요.미세먼지의 농도에 따라서 LED색상이 변화가 되더라고요.거실뿐 아니라 아이들 공부하는 방공기는 물론이고하루를 마무리하는 침실의 공기와 기침이 많은 아이들을 위한 최적의 선물어느 공간에 두어도 인테리어 효과 확실히 해주는 기특한 공기청정기네요.1단 / 2단 / 3단 / 4단으로 풍량을 조절할 수 있는공기 청정 세기 조절 및 무드 등으로도 손색이 없는 공기청정기에요.터치 방식의 LED 컨트롤 패널 동영상으로도 한번 보세요.BLDC저전력 저소음 모터 사용이라 공기청정기를 틀어두어도 틀어둔지도 모르게 소리도 안 나더라고요.​밤에 잘 때는 슬립모드를 선택하면 조용하게 수면에 방해가 되지 않고잘 때도 쾌적하고 깨끗한 공기를 유지할 수 있겠지요.타이머 설정기능은 24시간 설정 가능하고 1시간 단위로 24시간까지 타이머를 설정할 수 있다고 하네요.​앞으로 우리 집 우리 아이들의 건강을 책임져줄 거실 공기청정기보랄데일리공기청정기 잘 부탁해~!!!!!​,19,0,0,338,6,1,2076.2,17,suspect,2020. 3. 9. 17:22,3931,7453717,육아·결혼,"['공감 누르고 갑니다. 건강 조심하시고 좋은하루 되세요 ~^^', '공기청정기 이제 필수가전이죠~자세한 리뷰 잘 보고가욧', 'ㅇㅕNA님,제 블로그에도 놀러와주세요! 서로 이웃해요~', 'ㅇㅕNA님,잘보고 가요~~행복한하루 보내세용!', 'ㅇㅕNA님,서로 이웃하면서 서로 정보공유해요~많이 배우고 갑니다', 'ㅇㅕNA님,매번 좋은글 올려주시네요~공감 꾸욱 하고갑니다*^^*']"
28,https://blog.naver.com/gks4155?Redirect=Log&logNo=221725722654,"안녕하세요. ㅇ ㅕNA입니다. 오늘은 진공청소기로 유명한 독일 청소기 브랜드 카처 12월 이벤트에 대해 소개해볼까 합니다.카처 브랜드는 84년의 역사를 가진 독일 청소기 브랜드 입니다.전세계 70개국에 120개 지사, 13,000여  명의 직원50,000여곳의 서비스센터보유한 글로벌 회사랍니다.​2019년 마지막 프로모션 이벤트!!한국카처 자사몰에서 12월 프로모션이 진행되고 있어요.2019 마지막 이벤트로 포인트 캐쉬백 10%사은품증정 먼지봉투 1세트관련 악세사리 할인행사 제품 구매 시 관련 악세사리 10% 할인(제품과 동시 구매 시에만 할인 적용 별도 구매 시 정가판매)​카처는 독일브랜드로 유럽과 전세계에서매우 유명한 브랜드 / 독일제품의 기술력이지만가격이 외국계 브랜드를 감안해도 저렴하고 AS도 잘 되는 브랜드랍니다.카처 제품은1년 무상이며 AS센터를본사직영으로운영하여 확실하고 믿고 밑길수 있어요.자유의 여신상, 러슈모어 조각바위산, 브라질 예수상, 충주댐, 서울남산타워등 전 세계 문화유적을 세척하는 사회 공헌활동을 진행한 바 있는 캐처​JTBC 드라마 ""일단 뜨겁게 청소하라 "" 공식 스폰서라고 하네요.독일 브랜드답게 축구를 응원하는 브랜드!!AFC챔피언스리그 3년간 공식 스폰서 축구 광고판 등 카처의 로고를 볼 수 있어요.'​카처 2019년 마지막 이벤트 기간은12월3일 ~ 12월 30일까지이니 놓치지 말고 겟하세요.​",6,0,0,139,0,0,2076.2,8,text_ad,2019. 12. 3. 14:26,3931,7453717,육아·결혼,0
29,https://blog.naver.com/gks4155?Redirect=Log&logNo=222003037316,"안녕하세요. ㅇㅕNA에요.집콕만 하다 보니 어느새 봄이 지나가고 여름이 찾아왔네요.삼형제가 개학을 하고 학교 / 유치원에 가기 시작하면서우리 삼형제가 편하게 사용할 수 있는 자외선 차단제를 찾아보았는데요.몽디에스 선쿠션이 손에 묻어나지도 않고 간편하게 사용할 수 있다고 추천받아 사용해보았어요.​신생아부터 어른까지 남녀노소 누구나 마음 놓고 쓸 수 있는 자연에서 얻은 건강한 성분으로 정직하게 만든 패밀리 라이프 스타일 브랜드 몽디에스특히나 피부가 민감하고 연약한 신생아 베이비 선크림으로 유명하고신생아 유아를 위한 베이비케어 제품들이 많은 몽디에스랍니다.​12G의 몽디에스 베이비 선쿠션쿠션타입으로 자외선 차단 약 9시간9시간이 지난 후에는 아이들에게 한 번 더 덧발라 주면 끝!!!비타민 나무 컴플렉스 함유퍼프를 이용해서 두드려 사용하는 쿠션 타입의 무기 자외선 차단제랍니다.야외활동에 꼭 필요한 아이이죠.특히나 여자아이들은 엄마를 따라 화장도 따라 해보고 싶은 마음들이 크기에..같이 톡톡 발라주면 아주 딱이지요~​몽디에스 선 쿠션은 인공향료 인공색소를 사용하지 않았어요.비타민 나무 콤플렉스 함유논란 성분 19가지 무첨가피부 저자극 테스트 완료약국에 입점이 되어있는 베이비 화장품이랍니다.​손에 묻히지 않고 간편하게 두드려 사용할 수 있는 손큐션이에요.비타민 나무 컴플렉스가 햇빛과 외부 환경에 자극받은 피부에 수분과 활력을 부여하여맑고 화사한 피부로 유지해 준답니다.피부 표면에서 자외선을 반사하는 100% 무기자차로 특유의 백탁현상과 건조함을 최소화한 선쿠션이에요.​​퍼프를 톡톡 두드려 사용하는 쿠션타입으로언제 어디서나 편리하게 사용하는 자외선 차단​온 가족이 안심하고 사용 가능하도록자외선 차단 성분 제외한 성분 EWG그린 등급으로 저자극 선케어가 가능해요.​아이들은 피부 장벽이 완성이 되지 않아피부가 여리기 때문에외부 오염 / 유수분 불균형 / 피부건조외부환경으로 자극받은 피부 진정에 도움을 주는세라마이드엔피 / 비타민 나무 컴플레스 처방을 한 선쿠션이에요.​백탁현상도 없고 산듯한 발림성으로 끈적이지 않아 아이들이 좋아하더라고요.​무기자차 특유의 백탁현상과 건조함이 없어서부드럽고 촉촉하게 민감 피부와 아이 피부 모두 사용이 가능하답니다.​얼굴뿐만 아니라 야외활동 시에는 목과 몸 전체에 골고루 발라주고외출을 해서는 2~3시간마다 햇빛 접촉이 많은 부위에 자주 덧발라 주세요.​리필용도 있어서 교체가 가능하답니다.소중한 우리 아이를 위한 몽디에스 선쿠션꼬마대장 학교 가방 속에도 쏘옥~엄마가 없어도 스스로 잘 챙겨 바른다고 하네요.신생아부터 성인까지 ~올여름 몽디에스 선쿠션으로 자외선 걱정 끝!!!​ 
 
",19,0,0,268,0,1,2076.2,7,suspect,2020. 6. 16. 22:32,3931,7453717,육아·결혼,0
30,https://blog.naver.com/gks4155?Redirect=Log&logNo=221596693601,​장마철 빨래는 안전하신가요?꿉꿉한 냄새에... 꿉꿉함까지 더해지니 요즘 같은 날씨에는 빨래가 산더미같이 쌓이기 마련이더라고요.어쩔 수 없이 급한 옷들은 빨아서 실내 건조를 하게 되는데...실내 건조는 자칫 잘못하면 냄새가 나서 잘 건조를 해줘야 되더라고요.​빨래냄새 해결 이제껏 장마철만 되면정말 커다란 숙제였는데...고농축 피죤 리치퍼퓸만 있으면장마철 빨래 냄새 이젠 걱정 없어요.​​피죠니어의 자존심을 지켜주고 있는우리집 빨래는 피죤이 책임을 지고 있지요.빨래엔 피죤~괜히 생겨난 말이 아닌듯싶어요.​​일반세탁기와 드럼용 세탁기 모두겸용으로 용할 수 있는섬유유연제 리치퍼퓸​​인체 유해성분 12가지 무첨가유연제 성분과 향성분을 최대 3배 강화한 고농축미세먼지 부착방지 인증​명품향수를 만드는 조향사 손에서탄생한 풍부한 향기라는 이름처럼향수보다 진하고 오래가는 명품향을 느껴보세요.유럽향수에만 사용하는고농축오일을 사용해서 향이 은은하게 오래 지속이 되더라고요삼형제가 땀도 많이 흘리고여름철에는 세탁후에도 땀냄새때문에세탁후 냄새가 날때도 많은데..피죤은 그런걱정을 전혀 할 필요가 없답니다.​ㅇㅕNA네는 건조기도 함께 사용하고 있기 때문에건조기를 사용하고 나면섬유유연제향은 거의 날아가고 향이 전혀 안 나는데고농축 피죤 리치퍼퓸은 건조기 사용 후에도향이 그대로 남아있어서 꿉꿉한 세탁 냄새가 나지 않아서 좋더라고요.​고농축 오일로 더 깊고 오래가는미스틱레인아이스플라워플라워페스티벌라피에스타다양한 피죤향을 만나보세요.​​대한민국 최초 섬유유연제 이 정도면 믿고 사용할만하죠?장마철 집안 건조에도 냄새 걱정 없는 섬유유연제역시 빨래엔피죤이네요.​우리 삼형제 이불도 뽀송뽀송하게 빨아주고...더불어 향기까지 불어넣어 줬어요.​,11,0,0,157,1,0,2076.2,8,suspect,2019. 7. 26. 23:19,3931,7453717,육아·결혼,[]
31,https://blog.naver.com/gks4155?Redirect=Log&logNo=222212379812,"안녕하세요. ㅇㅕNA입니다.겨울철 건조함에 가습기 많이들 사용하시지요?ㅇㅕNA도 아이들도 있고 특히나 삼형제가 건조하다 보니..집안 온도와 습도에 신경을 많이 쓰고 있어서 가습기를 사용 중인데요.매번 물을 채우고..세척하고.... 가습기 관 라히는 일이 보통 일이 아니더라고요.이번에 세척도 쉽고 편리하면서 물용량도 많이 들어가는대용량 초음파 가습기로 바꿔보았는데요..일단 대용량이다 보니..자다가 꺼질 염려도 없이 사용이 편리하더라고요.​리하스초음파가습기는 코드선길이가 짧다는 고객들의 의견을 반영해서 1.5M로 코드성 길이를 연장했다고 해요.이로마오일트레이도 있고요. 맥반석필터 홈을 보안해서 팔터를 고정할 수 있더라고요.그럼 리하스초음파가습기 장점.. 하나하나 살펴볼까요?바이러스는 건조한 환경을 참 좋아한다고 해요.실내에서는 최소 60%의 가습기를 이용한 습도 유지가 매우 중요한데요.4L 대용량의 360도 분사로 하루 종일 어디에서든지 촉촉하게 사용할 수 있어요.가정에서도.. 사무실에서도 ..물탱크가 투명하게 되어있어서기기의 착동과 청결상태를 육안으로 확인이 가능해요.대용량 물탱크 탑재로 풍부한 분무량과 12시간 이상 지속 사용이 가능하고요.물탱크에 물을 자주 보충해 주지 않아도 돼서..육아에.. 일에.. 조금도 집중할 시간이 생기더라고요.일반의 가습기는 자주자주 수시로 물을 채워주고 관리를 해주어야 하는데..그런 불편함 없이 사용을 할 수 있는 것 같아요.물과 오일을 함께 넣을 필요 없는 전용 아로마 오일트레이가 있어서트레이로 세척 하고 위생적인 사용이 가능하답니다.예전에 사용하던 제품은 물에 함께 넣는 방식이어서..세척하기가 번거로웠었거든요.아로마트레이에 아로마 오일을 몇 방울 떨어뜨리면디퓨저 효과도 있고 물과 오일을 따로 넣을 수 있어서위생적으로 사용할 수 있어요.물탱크가 완전히 분리가 되기 때문에완벽한 통 세척이 가능하고요.분리도 아주 손쉽게 할 수 있어요.세라믹 필터는 세균을 억제해서 최적화된 실내 가습을 유지할 수 있고요.​맥반석필터는맥반석 필터 특유의 산소 함유량으로 높은 산소량의 가습이 분사되며수질을 깨끗하게 정화시켜 준답니다.​3단 조절 터치패널로 자동 습도 조절이 가능하답니다.마이콤 방식의 실내습도 자동조절로설정습도에 도달이 되면 AUTO ON/OFF 기능이 설정한 습도를 유지해 주어요.터치패널을 3초가량 꾹 누르면 AUTO모드가 작동이 되고40~60% 정도의 습도로 자동 유자기 된답니다.오렌지표시등은 습도 45%미세분사그린표시등은 습도 45~65%퍼플표시드은 습도 65%이상하루종일 사용해도 전기세 걱정도 없는 대용량초음파 가습기25w의 저전력으로 최대의 가습효과,24시간 가동시 약100원전후의 전기세로 쾌적한 실내환경을 유지시켜줄 수 있어요.습도센서 불이 이전보다 어둡게 조절이 되어서 불빛 밝기도 조절이 되었다고 하더라고요.물탱크가 투명하기 때문에 가습기가 작동하는 것과내부의 청결상태까지 육안으로 확인이 가능해서 위생관리에도 좋더라고요.35dB저소음설계로 ㅇㅕNA는 침대 옆에 두고 사용해도 잠을 잘 수가 있어요.물을 분자단위로 진동시켜 발생시키는 초음파 방식의 초음파가습이라 물방울이 맺히지 않는 풍부한 미세 가습이 분사되에부식에 강해 오염 걱정도 없어요.가정에서도 사무실에서도 신생아기 있는 집에서도어디서든 편리하게 사용이 가능한 리하스 대용량 초음파 가습기통세척도 편리하고 위생적으로 관리가 가능한 가습기가성비 좋은 가습기 사용하시면서 겨울철 건조함을 없애고건강한 겨울 보내세요.​",23,0,2,328,8,1,2076.2,18,,2021. 1. 19. 12:58,3931,7453717,육아·결혼,"['가습기 너무 예뻐요 :)', '공감누르고 갑니다 ~! ＞∀＜', '안녕하세요. 포스팅 잘보고 갑니다.즐거운 하루 되시고 제 블로그도 한번 들러주세요~']"
32,https://blog.naver.com/gks4155?Redirect=Log&logNo=222134483519,안녕하세요. ㅇㅕNA입니다.우리 삼형제와 ㅇㅕNA는 비염이 심해서 습도에도 매우 민감하게 반응을 하는데요.그래서 날이 쌀쌀해지고 건조해지기 시작하면 여기저기 가습기를 들여놓느라 바쁘답니다.이번에 아이 공부방에서 사용하기 좋은 가습기로듀얼가습기를 사용해보았어요.​데스크용 가습기추천으로 사무실에서 사용하기에도 좋고아이 공부방에 놓고 사용하기도 좋아요.무엇보다도 좋은것은 무선가습기라서 마음에 들더라고요.때에 따라서는 침실에 공부방에 사무실에..어디에 두어도 예쁜 듀얼미니가습기사무실이나 공부방에서 부담없이 사용하기에 좋은 사이즈이고수조에 물이 700ml가 들어가서 일반 미니가습기보다는오래 사용할 수 있어서 중간중간 물을 자주 넣어줘야 하는 번거로움이 없더라고요.​마이버디 미니피규어를 사용해서 나만의 가습기로도 꾸밀 수 있답니다.​필터도 따로 구입이 가능하고 필터를 바꾸는 것도 아주 간단해서 손쉽게 관리할 수 있다는 장점이 있어요.​USB 충전식 무선가습기로어디에서나 간편하게 사용이 가능하다는 장점!!!완충 2시간30분이면 가능하고자동OFF기능까지 가지고 있는 작지만 쓸모 있는 가습기랍니다.2000mAh 배터리가 내장이 되어있어요.데일리라이크 감성이 돋보이는 감각적인 디자인으로인테리어 소품 효과도 줄 수 있고 선물용으로도 추천하기 좋은 것 같아요.​최대 8시간 가습으로 시간당80ML의 풍부한 가습으로 적절한 수분을 유지시켜 준답니다.사이즈는 미니미니한 미니가습기로 귀엽지만미니사이즈라 간편하고 언제 어디서나 충분한 수분을 유지할 수 있다는 장점이 아주 크지요.​간단한 조작 방법으로 듀얼분사 및 싱글 분사가 가능한 가습기랍니다.디자인도 깔끔해서 마음에 들고 미니미니한 사이즈로 어디하나 손색없이 수분을 유지시켜주는장점까지 있는 가습기!!우리 아이 공부방에 놓아주기 아주 딱 좋은것 같아요.​듀얼 무선 가습기 구매 시 마이버디 미니피규어를 50%할인된 가격에 구매할 수 있다고 하니나만의 귀여운 무선가습기를 꾸며보세요.11월3일부터 출시 기념으로 출시기념 10%할인된 가격에 구매할 수 있다고 하네요. ,21,0,1,190,0,1,2076.4,10,99das,2020. 11. 3. 18:22,3931,7453718,육아·결혼,0
33,https://blog.naver.com/gks4155?Redirect=Log&logNo=222065144457,"안녕하세요. ㅇㅕNA입니다.건조하고 메마른 곳에 촉촉함을 줄 수 있고인테리어 효과까지 있는 코드26 가정용 미니가습기에요.이 더위가 가고 나면 또 추운 겨울이 찾아올 텐데..겨울 건조함은 또 이루 말할 수 없죠.우리 삼형제는 피부 트러블 때문에 습도 조절이 중요해서 계절에 상관없이 가습기를 사용하고 있어요.오픈을 해보았는데...코드26에서 판매되고 있는 카달로그가 있더라고요~이런거 또 한번 살펴보고 구경해 줘야 주부죠.수납용품.. 조명.. 겨울 용품 등등 제품부터 해서..카트 /공기청정기 / 커피 / 수납함 / 정리함 / 전기온풍기 등등..많은 제품들이 있는데..제일 탐나는 건 올여름 사용할 제빙기가 눈에 띠용!!!!!!!하,, 안돼 ..마음을 가다듬고...미니가습기부터 살펴봐야죠.365일 쾌적한 환경에서 생활하기 위한 코드26에서 제안하는 솔루션!!적정 실내습도를 유지하면바이러스 전파력을 떨어뜨려 독감이나 호흡기 질환 예방에  효과적이라고 해요.요즘은 바이러스에 정말 조심해야 할 때이잖아요.이제 가을 / 겨울도 다가오는데..독감 및 호흡기 질환 정말 걱정이기는 하네요.특히나 기관지 약하고 비염때문에 매일 훌쩍거리고 다니는 아이들이라...더욱더 걱정이에요.그럴수록 관리를 더욱더 철저하게 잘해주어야죠.습도가 낮으면 피부가 건조해져서 피부질환은 물론주름과 트러블도 생긴다고 해요.적정한 습도는 피부를 촉촉하고 건강하게 유지시켜주어서아토피 등 피부질환에 도움을 주지요.아주 작은 미니 가습기이지만기능이 좋은 스마트한 아이랍니다.물분자가 작아 바닥이나 닿는 면이 젖지 않아서 좋고요.미세한 물입자 분무로 보다 효과적인 가습이 가능하답니다.​기분에 따라 6가지 색상으로 컬러 무드등 기능도 함께 되어있어요.취향과 스타일에 맞게 컬러 선택이 가능하기 때문에..원하는 연출에 따라 컬러 선택을 할 수 있는 장점이 있죠.그날그날의 분위기에 따라 6가지 컬러의 빛을 선택해보세요.사용설명서가 함께 들어있어서살펴보았어요.뭐 설명서 없어도 너무 쉽게 사용 가능한 가습기라서..꼭 필요는 없지만,그래도 사용 전 한 번은 봐야죠.​버튼은 파워 버튼과 무드등 기능을 하는 라이트 버튼이 있어요.아래쪽에 있는 것은 분무량을 조절하고요.​파워버튼을 한번 누르면 가습 기능이 켜지고 두 번 누르면 1시간 타이머 세팅이 되며 빨간 표시등이 켜져요.3번은 3시간 타이머 세팅에 녹색등네 번은 6시간 타이머 세팅에 파란 표시등이에요.최대 6시간 타이머 설정이 가능하니 자기 전 미니 가습기를 작동시키고 자도 아침까지 문제없겠네요.​뚜껑이 분리가 되어서 360도 회전 가능한 분사구로 분사구 방향을 전환할 수도 있어요.​바닥은 미끄럼 방지 패드가 부착이 되어서 미끄러운 바닥에서도 안정적으로 사용이 가능하고요.​응결되지 않는 미세분사​책상에 올려두었는데..뭔가 고급스러워 보이는 느낌은??^^색이 나오는 무드등을 켜지 않아도...화이트와 우드톤으로..존재만으로도 감성이 생기네요.​미니가습기라서 분무량이 약할 줄 알았더니..와우 작은 고추가 맵다고..미니가습기 답지 않게 분무량 꽤 괜찮더라고요.게다가 분무량 조절까지 되니 말이에요.​저소음 설계로 아이의 방안에서도 아기가 자는 방에서도 사용이 가능한 초음파가습기오일도 사용이 가능해서 물탱크에 아로마오일 몇 방을 톡톡해주면~향기까지 솔솔~디퓨져 저리 가라~!!!가습기를 사용하면 세척도 불편하고..관리가 너무 힘든데..미니 가습기라 관리도 편하고..게다가 인테리어 효과까지 있으니..진작 갈아탈 걸 그랬어요.덮개만 분리하면 되는 간편한 구조로 분리도 쉽고결합도 쉬워서 세척이 편리하거든요.가성비 최고!!!​부피도 작고 가벼우니 겨울에는 캠핑장에 들려보내야겠어요.미세한 물입자 분무로 효과적인무드등 가정용 미니 가습기 초음파 가습기​",38,0,1,360,1,1,2076.4,9,revu,2020. 8. 19. 20:09,3931,7453718,육아·결혼,['미니 가습기 너무 귀엽네요! 구매욕구 뿜뿜!!']
