,Post URL,Post,Image num,sticker num,gif num,Paragraph num,Comment num,Video num,weekly viewer mean,Sympathy num,AD,Posting Date,Buddy num,Total visit,Blog category,Comment detail
23,https://blog.naver.com/gks4155?Redirect=Log&logNo=221678640655,"​안녕하세요. ㅇㅕNA입니다.요즘은 어느 집이나 에어프라이어나 오븐은 필수품으로준비가 되어있더라고요.ㅇㅕNA도 신혼 때는 잘 몰랐는데..아이가 생기고 아이들 간식을 챙겨주다 보니에어프라이어와 오븐 그리고 식품건조기는 꼭 필요한 주방필수템 제품 중 하나이더라고요.ㅇㅕNA가 꼭추천하는 주방필수템 이기해요.기름을 사용하지 않으니 만능 재주꾼이기도 하고요..​ㅇㅕNA네는 식구도 많아보니 대용량 12L로~아이들이 잘 먹다 보니 음식을 해도 많은 양을 하게 되더라고요.오븐과 에어프라이어 기능 거기에 식품건조기까지 되는똑똑하고 스마트한 녀석!!바로 도깨비방망이가 만들어 냈더라고요.​​8가지 조리 모드 / 최대 온도 200도LED 터치패널 / 360도 회전 요리 기능 / 간편한 분리세척 장점을 많이도 갖고 있네요.​도깨비방망이 에어프라이어오븐 만이 있으면어떤 요리든지 뚝딱뚝딱..요리에 소질 없는 ㅇㅕNA도 아이들에게극찬을 받으면서 아이들에게 엄지 척 받을 수 있는시간이 된답니다~ㅇㅕNA의 요리 자신감을 업업 시켜주는 신통방통한 녀석!!​사용설명서와 레시피북이 함께 들어있어서손쉽게 사용할 수 있어요.​​ㅇㅕNA도 기존에 타제품 대용량 에어프라이어를 사용하고 있었지만도깨비방망이 제품은 기능도 많고더 유용하게 사용할 구성품들이 많이 있더라고요.따로따로 조리하지 않아도 1대로 모든기능이 가능하니 주방자리차지도 줄일 수 있고요.그리고....좀 더 다양한 요리에 도전해보고자~구성품은 본체 / 어에플로우 랙/ 회전매쉬바스켓 /드립트래이 / 꼬치랙 / 로티세리 / 보호커버 / 로티세리 이동용 집게​1대로 에어프라이어 / 오븐 / 식품건조기3가지의 기능을 할 수 있기에 구성품도 정말 알찬 거 같아요.​보통 구성품들은 추가 구입을 해야 되는 것도 많은데..이 모든 것을 무료제공이라니!!득템이롤쎄~에어프로우랙 3단 트레이로 스테이크나 생선구이뿐 아니라바삭한 쿠기를 만들거나 식품건조 등 다양한 요리를 동시에 할 수 있어요. 회전메쉬바스켓바스켓이 회전하면서 내부 음식을 골고루 섞어주고따로 음식을 뒤집어줄 필요가 없어요.예전에 한참 통돌이라는 거 유행했잖아요.그 기능으로 보시면 될 것 같아요.삼겹살이나 튀김, 견과류와 커피콩 볶기 등에 활용이 가능하답니다.통돌이 유행할때도 사고싶어 엄청난 고민을 했었는데..이젠 통돌기 기능까지 있는 에어프라이어가 있으니걱정이 없네요.​꼬치랙꼬치가 회전하면서 꽂혀있는 음식을 골고루 익혀주고모든 산적 레시피, 육류, 채소를 꼬치에 끼워서 다양하게 사용할 수 있어요.로티세리360도 회전 로티세리 기능으로재료를 골고루 익게 해주고겉은 바삭, 속은 촉촉하게 최고의 맛을 선사해준답니다.​빠르고 강력하게 열을 전달하기 때문에 식재료 본연의 기름만으로 풍미를 살리는 요리가 가능하답니다.​​트립트레이하단 분리가 가능한 트레이판을 꺼내서청소도 간편하답니다.요리 후에는 뜨거울 수 있으니 주의하시고요~바닥에 떨어지는 기름이나 오염물질을 말끔하게 해결해준답니다.​​작은 용량과 한 가지 기능만 있는 틀을 빼버린 도깨비방망이 에어프라이어오븐대용량에 다기능을 갖춘 스마트하고 똑똑한 우리집 만능 요리사랍니다.​도깨비방망이 어디서 많이 들어본 이름이죠?핸드블랜더의 원조 도깨비방망이의 기술력을 그대로24년 노하우의 주방가전 브랜드 도깨비방망이에요.이 정도면 도깨비방망이 이름만 들어도 어느 정도의 기능과기술력을 갖추고 있는지 충분히 설명이 되겠죠?^^도깨비방망이 모르는 주부들은 없을 테니 말이에요.​​​엥? 버튼이 어디 있는 거지? 했더니...비밀의 시크릿디저털 패널이네요.사용하지 않을 때는 안 보이게 숨겨두고절전효과와 인테리어 기능까지!!도깨비방망이의 세심한 배려가 느껴지네요.​8가지의 자동조리 기능으로 쉽고 편하게 사용할 수 있어요.자유로운 온도조절과 시간 조절, 편리한 터치식 LED 패널로 다양한 요리를 손쉽게 조리할 수 있답니다.사용하기 편리하게 상부 LED 패널이라서사용할 때 몸을 숙이지 않아도 되고서서 편안하게 조작이 가능하답니다.​온도조절 보튼은 65도에서 200도까지 온도를 조절할 수 있는 기능이 있어요.​냉동식품 /스테이크 / 생선구이 / 새우치킨 / 베이킹 / 꼬치구이 / 식품건조8가지의 자동조리 기능200도의 열선과 고속 열풍으로 뒤집지 않고요리가 가능하답니다.뒤집어가면서 요리할 번거로움까지 줄여준 센스 있는 도깨비방망이 에어프라어 오븐​강화유리 투시창과 내부램프는수시로 열어보지 않아도조리과정을 한눈에 직접 확인이 가능하면서요리를 할 수 있답니다.2중창으로 단열효과와 내부 투시 효과도 한 번에~2중창이 분리도 되어서 세척도 편리하고 본체 도어도 분리가 되어서 위생적으로 사용이 가능하답니다.​​모든 음식이 닿는 부분은 스테인레스와 크롬 재질이라청결하게 사용할 수 있어요.​​영양만점~식품건조기 기능~이제 ㅇㅕNA네집은 자리 차지하고 있는 식품건조기도 빠이빠이 해도 되겠어요.​​과일을 말려서 칩으로 만들어 놓으면우리 꼬마대장 하나씩 집어먹고 다니고물에 타주면 달달한 과일물을 수시로 마시게 되어서 좋더라고요.​​아이들 간식은 물론 육포 / 과일칩 / 토스트 / 쿠키까지~​닭 한 마리가 들어갈 수 있는 대용량인데..3단 렉 설계로 동시에 다양한 요리도 가능해요.ㅇㅕNA네 삼형제는 워낙 잘 먹기에 사용하던 대용량 에어프라이어는 트레이바스켓이 하나라서한 가지 음식만 조리되는 거라여러 번 조리를 해야 했는데...​이제는 편리하게 한 번에 조리가 가능하게 되었네요.더 많은 양도할 수 있게 되었고요.​조리 중에 문을 열면 자동으로 멈추는 안전을 최우선으로 생각한 제품!!문을 열면 자동 전원 차단되는 시스템ㅇㅕNA처럼 아이가 있는 집이라면 꼭 필요한 필수 기능인 것 같아요.또한 재료를 추가할 때도 문만 열고 추가 후 재어 작동 시키면 다시 재작동이 가능하답니다.​아직도 에어프라이어 사용하시나요?이젠 에어프라이어오븐 시대이니에어프라이어, 오븐, 식품건조까지 되는 스마트하고 똑똑한도깨비방망이 에어프라이어오븐으로 바꿔보세요.​​​",35,0,1,564,0,1,2076.0,17,text_ad,2019. 10. 15. 18:37,3931,7453716,육아·결혼,0
24,https://blog.naver.com/gks4155?Redirect=Log&logNo=221975168303,안녕하세요. ㅇㅕNA에요.365일 쾌적한 환경에서 생활하기 위한코드26에서 제한한 솔루션제습기와 공기청정기가 한번에 되는 소형 제습기가 출시되었더라고요.두 가지를 사용하면서 이것저것 관리하기가 불편했었는데..한 번에 나온 제품은 아무래도 관리하기에 더 편리하겠죠?​​소형이라 미니미니 한 사이즈로원룸이나 사무실 같은 곳에서 사용하게에좋을 것 같아요.​눅눅하고 습할때공기순환이 필요할때..특히나 장마철 같을때는 두가지 기능을 모두 사용하고 싶잖아요.공기청정과 제습의 기능이 동시에!!!유용하고 활용적이게 사용이 가능하겠죠?​눈에 보이지 않는 치명적인 1급 발암물질 PM2.5보다 작은초미세먼지 입자!!각종 호흡기 질환의 원인의 직접적인 원인을 차단해 주는 공기청정기​요즘에는 공기청정기와 제습기 모두 4계절 내내 사용하는 사계절 필수품이죠.미세먼지도 심해지고..여름에는 습하고 겨울에는 환기가 어려워 결로나 곰팡이 때문에 제습기가 필요하고 말이에요.예전에는 장마철 주로 사용되던 제습기가 이제는 4계절 내내 사용하고 있는 거 아시죠?​미세먼지와 황사 / 급격한 기후 변화로 인해 공기청정기와 제습기는사계절 내내 우리 곁에 있어야 하는 필수 가전인것 같아요.​공기청정기 큰거한대?작은거 여러대?공기청정기는 큰 거 한대로 집 전체를 사용하는 것보다방마다 두고 스는것이 더 경제적이고 효율적이라고 해요.미니멀한 사이즈라서 어디에 두어도 잘 어울리고책상 위에도 앙증맞게 올라가네요.사무실이나 아이 방에서 사용하기에 딱이죠.장마철에는 집안의 습기로 인해 비염과 호흡기질환을유발하기 쉬운데요`제습기를 이용해서 고온다습한 환경을 개선하고 쾌적한 집안 환경을 만들 수 있어요.저소음 고효율에저전력 / 헤파필터 13등급 / 저온성에 저게능력가지갖추고 있는 작지만 실속있는 아이에요.​용량대비 저소움 고효율을 구현하기 위해열전반도체 기술활용을 한펠티어 효과두가지 다른 금속의 양단면을 서로 연결하고전기를 통하게 하면 전위의 이동에 의해서 에너지가 이동하게 되고그양 단면에서 발열과 냉각이 동시에 일어나는 효과를 말한다고 해요.기존의 압축기 방식이 아닌펠티어 방식이라저소음 / 고효율을 구현하기 위해 선택한 극소형 열전본도체랍니다.​공기중에 미립자를 여과하는 고성능장치 초미세입자 99%포집가능 강력한 정정능력헤파필터레벨13​세척하는 필터를 사영하지 않고안전한 1회용필터사용으로 세척 시 필터 손상으로 인해 제품의 성능이 저하되는 것을 막고세제 잔존물에 의한 합병증 유발 가능성을 없앴어요.​필터 교환도 어렵지 않게 할 수 있어요.전원을 끄고 옆면 필터 케이스 덮개를 열어준 후 필터의 꼬릴 잡아 분리 후 새 필터로 넣어둔 후 덮개를 덮어 사용하시면 된답니다.작다고 무시하지 마세요.대용량 1L분리 가능한 이동식 물통으로 간편하게 물을 비울 수 있어요.​물통만수시 전원을 끄고 제품 하단 물통손잡이에 손을 넣어물통을 분리한 후 물통 위면 덮개를 분리해줍니다.물통을 기울여 채워진 물을 비우고 제자리에 끼워준 후 사용하면 끝!소형사이즈로 공간을 많이 차지 하지 않아깔끔한 외형으로 인테리어 효과도 더해주는 개인 공간에서 사용하기에 적당한 사이즈랍니다.​공기 청정 버튼 / 제습 기능 버튼 / 모드 선택 버튼(공기 청정 / 제습 기능 모두 적용)​물탱크 만수시에는 물꽉참 표시가 작동하고필터교체시기에는공기청정기 표시등이 주황색으로 바꿔서 깜빡거린다고 해요.​사용방법.소음정도확인해보세요.헤파필터 13사용으로 초미세먼지 99.95케어20㎡의 공기 청정 능력40db로 소음 걱정 없이 사용 가능일750ml 제습과 만수시 자동 정지 기능​,25,0,1,346,1,2,2076.2,9,revu,2020. 5. 23. 2:48,3931,7453717,육아·결혼,['잘 보고가요~~~곧마감되는 소식들 전해 드려요산뜻하고 러블리한 젤네일로 봄맞이 제대로!https://blog.naver.com/bolil/221968686128오늘 저녁 야식으로 닭강정!https://blog.naver.com/bolil/221971947476[구매평 배송형]나도 요리 고수! 소스 하나로 맛있는 요리 완성! (메밀소바 육수)https://blog.naver.com/bolil/221960689811']
25,https://blog.naver.com/gks4155?Redirect=Log&logNo=221879364000,"​안녕하세요. ㅇㅕNA입니다.언제부터 이렇게 집안 공기까지 신경을 쓰게 되었는지..미세먼지 없는 날은 환기 안 하면 그만 외출 안 하면 그만이었었는데...매일매일 집에서 집에 콕 하면서 집순이가 되다 보니아이들 건강도 신경 쓰이고 집안 공기도 깨끗하고 쾌적하게 신경이 안 쓰일 수가 없더라고요.온 가족이 머무는 공간인 만큼...공기가 매우 중요할 텐데요...요즘은 또 면역력도 키워줘야 하고... 집에만 있다고 마냥 건강한 것만은 아니더라고요.이것저것 신경 써줘야 할 것 들이 더 많아진 것 같네요.우리 가족들이 더 나은 삶의 공간에서 생활할 수 있고...지금까지 누리지 못한 최고의 깨끗한 공기를 마실 수 있게에어글과 함께 생활을 해보았어요.깨끗한 공기를 만들어줄 미세먼지공기청정기소음도 적고 전력도 낮아서 조용하고 뛰어난 내구성으로사용 후기들과 사용평들이 좋더라고요.장시간 사용을 해도 소음이 증가하거나 성능이 낮아지지 않는다고 해요.요즘은 외식도 못하니까... 삼시 세끼 대부분을 집에서 해먹고아이들 간식까지 챙기는데..주방에서 나는 생선 냄새 / 식자재 가루 등등 박테리아까지 모두 클리어해주는미세먼지 공기청정기랍니다.특히나 호흡기질환이나 아토피와 같은 피부염의 원인 미세먼지는어린이의 호흡량은 선인의 3~8배라고 하는데...에어글을 사용하면서 아이에게도 건강함을 선물해주려고요.​먼저 바닥에 3개의 구멍에 바퀴를 끼워주면된답니다.실리콘으로 되어있어서 안전하고 튼튼하게 고정이 되고바퀴로 되어있어서 이동이 편리한 장점을 가지고 있지요.이동이 쉽게 가능하다 보니 잘 때는 아토피 피부질환으로 건조한 피부를 갖고 있는 우리 아이들 방에...공기 순환을 시켜주고...낮에는 가장 많이 생활하는 거실에도 와서 전체방의 공기를 정화하는데 도움을 줄 수 있어요.더 나은 공기 순환을 위해서는 대형 가구 사이에 공간을 넓혀두면공기순환이 더 원활하게 된다고 하네요.공기오염은 우리가 가만히 앉아있을 때도 진행이 되고 있기 때문에실내에 머무는 동안에는 항상 공기청정을 유지하기 위해제품을 켜두는 것을 권장한다고 해요.안전성은 물론이고 효율성 탈취효율 / 소음 등등 통과한 에어글 공기청정기리모컨이 있다보니 어디서든 손쉽게 원하는 모드로 조절이 가능한편리함도 있어요.심플한 컨트롤 패널로 모든 상태를 한눈에 파악할 수 있는 지능제어 시스템이에요.실내공기질과 필터수명을 모니터링하는지능형 제어시스템을 갖추고 있고주변 대기환경의 오염 수준 및 기본 설정에 따라 팬속도가 자동으로 조정이 된답니다.​타이머기능은 최대 12시간 연속작동할 수 있도록 성정이 가능해요.모드조정과 취침모드 / 재설정 전원버튼으로 구성이 되어있고시스템을 켜려면 전원 / 속도 노브를 돌리면 된답니다.에어글 공기청정기는 높은 정화력을 제공하는헤파필터와 활성탄손필터가 탑재되어 있고티타늄 프로 UV 모듈(옵션)이 탑재된 3단계 여과 시스템을 장책했어요.​효과적인 공기정화시스템은 실내공기질을 향상시키는데 아주 중요한 역할을 하죠.에어글공기청정기는 뛰어난 여과기술을 사용하여 미립자 요염물질 / 포름알데히드 등의 VOCs를 제거하여 실내공기를 정화하는 필터 테크놀러지랍니다.​친환경 코코넛 껍질 활성탄소필터로 연기 / 냄새 / 휘발성 유기화합물 및 유해성 가스를 여과하고cHEPA 필터의 입자여과기술은 0.3 마이크론 미만의 입자 여과 효율과 꽃가루, 미세먼지, 초미세먼지를 걸러낼 수 있습니다.에어글의 코코넛 쉘 활성탄 기술을 이용해서 유해가스를 혁신적으로 여과시킨답니다.필터수명을 표시하는 필터수명 모니터링 시스템을 갖추고 있어서필터교체시기까지 스마트하게 알려주는 공기청정기에요.간단하고 손쉽게 필터교체도 가능하고요.필터의 한계를 뛰어넘는 공기청정기 에어글 AG600100%밀폐된 디자인반영구적 BLDC모터적외선 원격제어트리플 필터여과알루미늄하우징이동의 편리성​국내외 전문인증기관을 통해 다양한 테스트를 통과한 공기청정기우리가족이 머무는 공간 쾌적하고 깨끗한 공기로미세먼지걱정 날려버리세요.​​",23,0,0,379,0,1,2076.2,5,text_ad,2020. 3. 29. 15:00,3931,7453717,육아·결혼,0
26,https://blog.naver.com/gks4155?Redirect=Log&logNo=221855136045,"안녕하세요. ㅇㅕNA입니다.지난번에 가정용 공기청정기 거실용으로 보랄 더 데일리를 소개해드렸었죠.ㅇㅕNA가 그간 며칠 동안 보랄 더 데일리를 사용해보고 작성하는 후기랍니다.일단 가성비 면에서는 정말 괜찮은 제품인 것 같아요.요즘에는 성능도 성능이고 가격도 많이들 보시고가성비를 많이 따지시잖아요.그런 면에서는 보랄 더 데일리를 추천드리고 싶더라고요.지난번 포스팅에서도 보셨다 싶이 언박싱만 했는데도 이미 디자인이머 성능이며 뭐 마음에 쏙 들었었던 제품이었었죠.​요즘은 그나마 공기청정기가 있으니까 집안 공기라도 안심하고 있는 느낌과 위안이 되는 느낌이 들더라고요.공기청정기라도 빨리 구입 안 했으면 어떻게 지냈을까 싶어요.보랄 더 데일리 원통 공기청정기는거실의 곳곳 거실 안의 모든 먼지를 잡아주는 원통형 3중 필터는고효율 필터 H13적용 + 활성탄 필터 + 프리필터로 되어 있어요.지난번에 설명드렸던 과학적인 기울기 기억나시죠?​아래쪽에 있는 필터커버를 열어서 쉽게 필터도 교체를 할 수 있고요.이게 바로 3중필터랍니다.​3중필터 적용으로 효율성 증가필터 교환 방법도 어렵지 않아요.공기청정기 본체 바닥이 보이도록 뒤집은 후 필터 커버를 반시계 방향으로 돌린 후본체에서 필터 커버와 필터를 분리한 후 포장 비늘을 제거하고새필터로 교체후 조립하면 끝!!!교체방법도 정말 쉽죠??2,000시간 사용 후 필터 교체알림이 뜨기 때문에 교체 시기도 신경 쓰지 않아도 되어서 편리하더라고요.​아랫부분은 공기 흡입구이고요.공기흡입구 뒤쪽에 어댑터를 연결하여 전원코드를 꽂아공기청정기의 전원을 키면 된답니다.​본체에 순정 필터가 없거나 제대로 끼워지지 않은 경우는 대기 상태에 들어가지 않는다고 해요.신속하게 전체 공간의 공지 정제 유선형 토출구 설계로 강력한 전력시스템 및 공기 유선형 토출구 설계로 신속하게 전체 공간의 공기를 정제해 준다고 해요.LED 상태 표시 등으로 초미세먼지 농도감지후 초록 / 파랑 / 노랑 / 빨강 순으로 색상에 변화가 나타나요.공기 청정기의 높이 / 깨끗한 공기를 내보내는 토출구의 각도와 토출구의 날개의 유선형 디자인까지거실전체의 공기를 움직이기 위한 디자인으로 동급 최대 사용면적 유선형 디자인의 비밀을 갖고 있는보랄 데일리 공기청정기랍니다.​공기가 멀리 퍼져 나갈 수 있도록 디자인되어서 더 많은 양의 공기를 전 방향으로 부드럽고 자연스럽게 배출하는 유선형팬으로 되어있어요.​터치형식의 깔끔함과 편리함모두가 꿈꾸던 공기청정기가 바로 이런 게 아닌가 싶어요.가성비 좋은 공기청정기 바로 이런 곳에 붙여지는 거죠.​​실내 공기오염도를 쉽고 빠르게 확인할 수 있는 LED  색상바깥에서 마음껏 뛰놀지도 못하는 아이들에게 참으로 미안한 요즘인데...미세먼지 때문에 환기도 못해주고...집안 공기도 답답했었는데...이제 좀 속 시원해지고 살만한 것 같아요.우리집 어디에 두어도 잘 어울리는 공기청정기우리 집 곳곳의 공기를 깨끗하게 해주는 효자템이에요.시간이 흘러도 촌스럽거나 싫증 나지 않는 모던하고 심플한 디자인으로 고급스러움까지 인테리어 효과까지 톡톡하게 해내네요.​그간 사용해본 보랄 더 데일리 원형 공기청정기 장점 총정리​공기정제 유선형 토출구 설계360도 전방향 공기흡입초미세먼지 농도표시원동형 3중필터 적용편리한 터치 컨트롤저소음 모터 사용터치방식의 LED컨트롤 패널단계조절 무드등 가능간편한 필터교체 방식​코로나 때문에 여러모로 신경 쓰이는 요즘집안 공기라도 깨끗하고 쾌적하니 그래도 집콕하는 맛이 나네요.​ 
",22,0,0,358,2,1,2076.2,10,,2020. 3. 15. 20:09,3931,7453717,육아·결혼,"['덕분에 알아갑니다~~ ^^', '반갑습니다. 방문 드렸다가 메세지 남깁니다~ 오늘도 좋은 하루 되세요 :)']"
