,Post URL,Post,Image num,sticker num,gif num,Paragraph num,Comment num,Video num,weekly viewer mean,Sympathy num,AD,Posting Date,Buddy num,Total visit,Blog category,Comment detail
11,https://blog.naver.com/gksmf1303?Redirect=Log&logNo=221732963583,"@ 르주르 소프트 일반 섬유유연제섬유유연제 추천[ 향 : 프레시 가든 ]​write & photo. 남매마미무단배포,2차수정을 금함추운 겨울이지만 여름만치 빨래가 많이 나와서 ... 자주 세탁기를 돌리다보니세제랑 섬유유연제가 헤퍼질 수 밖에 없는 지경에 이름 ...얼마전에 사용하던 섬유유연제가 똑 떨어져서 새로 사야지 하고 있던중에 이번엔 르주르 소프트 일반 섬유유연제 (프레시 가든 향)를 써보게 되었다.꽤나 은은하면서도 향이 오래가서 아이들이 세탁한 옷 입고 돌아다닐때마다 그 은은한 향이 내 코끝으로 전달되어 기분까지 좋게 만드는게 유아섬유유연제랑은 또 다른 매력을 뿜뿜하게 되는 .. 그래서 다가오는 크리스마스 선물추천 하는 르주르 섬유유연제 르주르는 택배 받을때마다 항상 기분이 좋은이유가 바로 이렇게 따뜻한 글귀를 함께 보내주기 때문인데,일상에 지쳐있었더라도 , 이렇게 따뜻한 글귀 한가득 적힌 카드를 받고나면 나도모르게 입가에 미소가 지어지는 ^^한동안 어떤 한 사람때문에 스트레스 왕창 받았던터라 ... 좀 뭔가 위안을 받고 싶고 했는데 삶은 내 중심이라 말해주는 이 글귀덕에 스트레스를 좀 내려놓고 내 자신을 더 바라보게되었다..!!! ㅎㅎ크리스마스 선물로 해주면 너무 고급진 르주르 섬유유연제는 요즘 sns에서 광고가 심심치 않게 올라오는걸 볼 수 있었는데최근에 팔로우 하고 있는 어떤 유명 인플루언서의 계정에 댓글에 어떤 세제나 섬유유연제를 사용하고 있는지 묻는 질문에 세제는 항상 르주르 꺼만 사용하고 있다는 글을 보고 , '역시 좋은건 누가나가 다 아는구나!' ㅋㅋ 싶었음 ㅎ다른 제품들도 그렇지만, 르주르 섬유유연제 역시 뚜껑이 계량컵으로 되어 있어서 빨래를 하려고 하는 양에 맞추어 양껏 계량해 넣을 수 있어 좋다!적은양이지만 섬유에 향이 깊게 베어있어 꽤나 향이 오래 지속되는듯!내가 요즘 잘 사용하고 있는, 지인들에게 크리스마스 선물로 해주면 좋을  르주르 소프트 일반 섬유유연제는 프레시가든 향이고발효와 숙성을 통해 야자, 올리브 등 식물성 원료의 효능이 극대화 되었고, 르주르 만의 특별한 공법이 더해져 강한 섬유유연성을 발휘한다고 한다!또한 예민한 피부를 가지신 분들도 사용해도 좋은게 피부과 테스트도 완료하였고, 알러지 유발 물질 26가지가 배제되어 조향된 르주르 만의 고농축 프리미엄 섬유유연제!르주르 세제가 아이들 세제, 섬유유연제로도 유명해서 육아맘들에게 인기가 많은만큼 아이들이 사용하는 제품이니 어른들도, 민감한 피부를 가지신분들도 사용하시기 좋다!세제 뒷면에는 빨래양에 따라, 어떤 세탁기를 사용하는지에 따라 표준 사용량이 나와있는데, 손빨래 기준으로도 얼마나 사용해야하는지도 나와있으니까 걱정하지 않아도 된다 !향을 한번 맡아보고 싶어서 뚜껑을 열려고 했더니 비닐로 한번 도 꽉 실링이 되어있다.!!!역시, 크리스마스 선물추천 하기에 안성맞춤이라는 생각이!어떤 제품들은 배송오면서 조금씩 세어 오는 제품이 있던데 ;; 이런 세심함 좋아요~ ㅎㅎ뽀오얀게 아주 푹 잘 고와진 곰국같은 색이라 깜짝놀람ㅋㅋㅋㅋㅋㅋ마침 빨래가 있어서 세탁기에 바로 돌려 첫 개시하던날!빨래 넣고 세제 넣고, 르주르 섬유유연제도 투척!!!빨래 양이 많지 않아서 20ml 한컵 정도만 넣고 세탁기를 돌려주었다 !!!그냥 향 맡았을때도 좋았는데, 빨래 하고나면 얼마나 좋을까 완전 기대 !! ㅋㅋㅋㅋㅋ진짜 르주르세제는 볼때마다 패키지가 넘 이뻐서 선물해주면 딱 좋겠다 싶었는데, 곧 크리스마스도 다가오고 마땅한 선물이 생각나지 않을때!크리스마스 선물로 르주르 섬유유연제 선물 아주아주 강~~~추!앞동에 친구가 두어달 뒤에 출산을 앞두고 있어서 출산선물로 해주면 넘 좋을거같다! 찜콩 ~ ㅎㅎ깨끗하게 잘 된 빨래 건조대에 탁 널어주고 나니 은은하게 향이 나는게 넘나 좋았고자고일어나서 다음날 아침 방문을 열고 건조대 주변으로 지나가니 르주르 섬유유연제의 프레시가든 향이  은은하게 쫙 퍼지는게진짜 너무 마음에 들었다!애들 옷입힐때도 유연제를 사용하지 않았을때보다 옷이 더 부드러워서 아이들 입히기에도 너무나 편하다 !르주르는 어찌 이리 마음에 쏙 들게 제품을 쏙쏙 뽑아내는지 > < ㅎㅎ 제품 볼때마다 심쿵사 o<-<ㅋㅋㅋㅋㅋㅋㅋㅋㅋㅋㅋㅋ 크리스마스 선물 르주르 세제 해주면 센스있다 소리 들을듯?! ㅎㅎ​그리고, 르주르 유튜브에서 르주르 제품 영상 뿐 아니라 다양한 일상 브이로그까지 업로드 되고 있다고 하니평소 르주르 제품을 좋아하셨던 분들은 구독 꾹~ ㅎㅎ그 외에 르주르 홈페이지, 인스타그램이 있으니, 아래 링크 클릭하여 구경 해보세용 :) ​▶ 르주르 인스타그램▶ 르주르 홈페이지▶ 르주르 유튜브​​​​​​​​​​​",13,0,0,511,0,0,664.0,7,suspect,2019. 12. 10. 17:00,2050,4674517,상품리뷰,0
12,https://blog.naver.com/gksmf1303?Redirect=Log&logNo=221679963255,"​@ 베비루미 유아세탁세제 유아섬유유연제육아용품 추천[ 자극없이 깨끗한 빨래 끝~ ]​write & photo. 남매마미무단배포,2차수정을 금함아무래도 아이를 키우다보니 아이들이 입는 옷을 빨래하는 세탁세제나 섬유유연제를 아무제품이나 사용하지 못하게 되는데,  어느제품에 어느성분이 아이의 피부에 자극이 될 지 모르기 때문이다 .. 그래서 아이들 전용 유아세탁세제나 유아섬유유연제를 최대한 사용하려고 노력중인데, 이제 아이들도 어느정도 크고 해서 그나마 아이들이 어릴때보다는 제품을 선택하는 선택의 폭이 조금은 넓어져서 제품구매하는데 조금은 수월하다고 느끼는 요즘.기왕 쓰는거 좀 좋은제품으로 사용해보자 해서 세제랑 섬유유연제 다 써가기에 새롭게 장만하여 사용중인 제품이 있다.바로 베비루미 유아세탁세제와 유아섬유유연제이 두가지 제품이 바로 오늘 소개할 제품인데왼쪽의 갈색 스티커로 붙어있는게  유아섬유유연제 베비루미 웜브리즈오른쪽의 흰색 스티커로 붙어있는게 유아세탁세제 베비루미 네추럴 선샤인베비루미 제품같은 경우는 전에도 유아로션을 사용해본적이 있는데 사용감이 꽤나 괜찮아서 주변에 추천해줬던 기억이 난다.좋은 인상을 갖고있던 브랜드라서 이번에 세제 선택을 할때도 구매해야하나 말아야하는 망설임따위는 1초도 하지 않았다는것~두 제품 모두 뚜껑에 계량컵이 붙어있고 세제같은 경우는 스티커로만 부착이 되어있는 반면 , 섬유유연제는 비닐포장이 한번 더 덧대어 있다.왜그런지는 모르겠지만 ^^; ㅎㅎ아무튼 베비루미 유아세탁세제 내추럴션샤인은 EWG 그린등급 전성분의 코코넛 유래 식물성 계면활성제로 풍부한 거품과 뛰어난 세정력을 자랑하는 제품으로 제품 뒷면에 보면 드럼세탁기 표준사용량, 일반세탁기 표준사용량이 적혀져있어서 사용량을 제대로 준수했을때 최상의 세탁효과를 기대할 수 있다. 다만 나는 좀 귀찮아서 그냥 눈대중으로 사용한다는게 문제긴 하지만 ^^; 성분을 보면 정제수, 베이킹소다가 들어가 좀 더 안심하고 사용할 수 있다고 생각되기도 했음 ~ ㅎㅎ 논란되는 유해성분들은 배제하였기 때문에 아마 나처럼 생각하는 어뭉님들이 많지 않을까 ^^ ㅎ아이의 피부에 닿는 옷이기 때문에 아무 제품이나 사용할 수 없지~베비루미 웜브리즈 유아섬유유연제는 세탁후에도 따뜻한 봄바람과 같은 잔향이 남아 입가를 살짝 미소짓게 만들어준다는 향으로내가 사용해봤을때 진짜 막 진하게 남아있는것보다 움직일때마다 은은하게 계속 느껴지는 그 향이 오히려 더 기분좋게 만들었고, 자꾸만 손이가게 만들어지는 제품이 아닌가 싶었다.집청소를 하는데도 어디선가 자꾸 좋은냄새가 나길래 따라가보니 건조대에 걸려있던 빨래에서 전해져오는 그 은은한 향내가 어떤 제품을 썻지? 싶었는데 바로 베비루미 웜브리즈 섬유유연제였다.나는 코가 약하고 민감하기 때문에 향이 조금만 진하면 코나 머리가 너무 아픈데, 이 제품은 은은하게 퍼지는 향때문인지 그런게 1도 없었다.역시나 사용방법은 제품 뒷면에 나와있고, 알러지프리로 피부에 순하고 따뜻한 향을 전해준다고 하니까 더 손이가요 손이가!는 새우깡템이 되지 않았나 싶다.더군다나 더 손이가는 이유는 바로 이 뚜껑에 있는것도 같은데,지금까지 써왔던 다른 제품들과는 다르게 생긴거 여러분들도 사진 보자마자 바로 캐치했을거같은데.세제를 사용하려면 뚜껑을 돌려써야만 했던 기존의 제품들과는 다르게 한번의 터치로 뚜껑을 여닫을 수 있어서 사용하기 정말 편리하다 !뚜껑을 살짝 열어 부어주기만 하면 세제가 나오니까 굳이 돌려서 쓰는 세제는 손이 잘 안간다는점.............. ㅎㅎ역시나 전성분 EWG Green 등급의 전성분 100% 공개로 안심하고 사용할 수 있게 만들어진 제품~갑작스럽게 추워진 날씨탓에 갑작스럽게 더 빨리 옷장정리에 들어가서 ㅠㅠㅠ 지금 빨아야 할 옷이 산더미처럼 몰려있는데 빨래는 빨리 안마르고 ㅠㅠ 요즘처럼 이렇게 빨래가 많아지면 건조기 구입하고싶은 마음이 굴뚝같지만 그것도 잠깐씩이기에 ... 자연건조의 힘을 믿으며 빨리 말라라고 ... 기도하며 말리는 중원래는 계랑컵을 써야하는게 맞지만, 보시다시피 뚜껑이 그냥 한손으로 여닫기 쉽고 한손으로 들고 쭉 짜서 쓰기 넘 편하기 때문에 대략적으로 눈대중하여 제품을 사용중이다.컵에 계량해서 사용해보니 대충 요정도 양이 나오는거 같아서 그뒤로는 그냥 쭉 쭉 짜줌 ㅎㅎㅎㅎㅎ세제가 투명한 느낌이라면, 섬유유연제는 불투명한 제형이 특징이다.하얀 우윳빛깔의 유아섬유유연제 베비루미 웜브리즈 ~뚜껑 열자마자 은은하게 퍼지는 향덕분에 기분까지 좋아져서 빨리 옷 빨구 말려서 입고싶은 느낌이 들게만드는 , 딱 지금같이 찬바람 불며 따스함을 더 느끼고싶을때 사용하면 좋은 제품이다 ~한여름이 아니라서 빨래가 많이 안나올거같으면서도 많이나오는 요즘 ㅠ한바탕 장롱과 박스를 다 뒤져 옷을 걸러내고나니 빨아야할 옷도 이렇게나 많이 나오네 ㅠㅠ드럼세탁기, 일반세탁기, 손빨래 모두 사용이 가능하고옷에 오염이 있어도 쉽게 빨린다고 하니까, 옷에 뭔가 묻었을땐 바로바로 애벌 빨래 후 세탁해주면 더 깔끔한 세탁효과를 기대할 수 있다는것~요며칠 비오고 궂은 날씨탓에 빨래를 널어도 빨리 마르지 않아서 ㅠㅠ한이틀 더 걸려있는 건조대의 빨래들 ...신에게는 아직도 빨아야 할 옷들이 산더미처럼 쌓여있사옵니다 ㅠㅠㅠㅠㅠ제발 빨리 말라주소서 ㅠㅠ아무래도 내일 오전까지 더 말렸다가 2차 세탁 들어가야할듯 ...한 3~4차까지 빨아야 할거같은데 ㅠㅠ언제다빨고있나 싶어도, 베비루미 유아섬유유연제, 유아세제로 빨면 우리아이들옷도 엄마아빠 옷도 모두 향기롭고 깨끗해게 빨래 끝~ ㅎㅎ​​지금 베비루미 사이트 들어가시면각 제품을 1+1으로 할인된가격에 저렴하게 구매가 가능하답니다 !구매하고자 하시는 분들은 어서 베비루미 사이트로 고고띵~​​​​​​​​​​​​​​​​​​​​- 해당업체로부터 제품만을 무상제공받아 실사용 후 솔직하게 작성되었습니다 -",16,0,2,605,0,0,664.0,4,text_ad,2019. 10. 16. 23:33,2050,4674517,상품리뷰,0
13,https://blog.naver.com/gksmf1303?Redirect=Log&logNo=221637887468,"유아섬유유연제 추천르주르 구연산 유아 섬유유연제[ 고농축 대용량, 코튼캔디 향 ]​write & photo. 남매마미무단배포,2차수정을 금함​​​​​​​​​​​더운여름이 지나갔지만요새도 하루에 한번은 꼭 빨래를 돌리기때문에세제랑 섬유유연제가 너무나 헤프게 사라지는중 ㅠㅠ그래서 또 새로운 섬유유연제를구매했어야했는데 좋은기회로 르주르 구연산 섬유유연제를 사용해보게 되었다.​르주르 답게 포장부터 고급지게 되어 있음​​​​​​​​​이번 제품은 리뉴얼 된 퓨어라인 제품 중의 하나이고USDA 오가닉 인증을 받은병풀, 겐티아나, 갈근, 쐐기풀, 파파야잎, 비누풀뿌리가첨가되었고향균효과가 있는 원적외선 나노필터가 적용된 정제수가 들어갔으며높은 세척력과 섬유유연성을 겸비한 프리미엄 세제와 섬유유연제라고 하는데내가 사용해본 제품은 섬유유연제 !​​​​​​​​​​이 하나의 용량은 1000ml 이고코튼 캔디향이 은은하게 오랫동안 퍼지는 넘나 기분좋은 향이다.뚜껑열자마자 향이 너무 마음에 들어서 ㅋ요즘 빨래할때 매일 사용하고 있는 중이다.​​​​​​​​​​뚜껑을 열기 전 스티커를 제거하면 되는데이 스티커를 제거하게 되면 교환이나 환불이불가하니 이점 참고하시면 될 듯 하다 :)​​​​​​​​​제품의 표준사용량은 제품 뒷면에 있는표를 보면 되고손빨래를 할경우 물 10L에 섬유유연제 5ml사용하면 된다.나는 손빨래 잘 안해서 ㅋㅋㅋㅋㅋㅋ​의류나 섬유, 신발 빨래에도 사용이 가능한 액체형, 농축형 구연산 섬유유연제이고르주르 제품은 출산선물하기에도 워낙 좋기 때문에안그래도 주변에 출산한 지인들이 많아서선물해주려고 한다 !! ㅎㅎ​​​​​​​​​르주르 구연선 섬유유연제는정전기방지도 되고 구김이 잘 가는 옷에도구김없이 세탁이 가능하다는 장점이 있는데아직 건조한 계절이 아니라정전기는 잘 모르겠다 .. ㅎㅎ​그렇지만 구김은 쓰기 전보다는 그나마 좀 덜가는거 같기도 하고 ㅎㅎ​​​​​​​​​​색깔을 보여드리기 위해서뚜껑에 덜다가 옆에 좀 흘림 ㅠㅠㅠㅠㅠ흐미 아까운거 ㅠㅠ​​​​​​​​​​약간 누런빛을 띄는데 색은 그닥 예쁘진 않지만향이 진짜 좋음 !!!르주르에서 그동안 꽤나 많은 섬유유연제를 써봤는데그 중 가장 향이 좋은거 같다.​선물할때 꼭 요제품으로 , 이 향으로 선물해줘야지!라는 생각 ㅎㅎㅎㅎㅎ​​​​​​​​​뚜껑에 덜어서 계량해서 사용해도 되지만나는 그냥 귀찮아서 ... ^^;헹굼하기 전에 세탁기에 바로 섬유유연제 넣고 사용함...ㅋㅋㅋㅋㅋㅋㅋㅋㅋㅋㅋㅋㅋ​​​​​​​​빨래가 끝나고 세탁기 뚜껑을 열고 빨래를 꺼내는그 순간부터 건조대에 널어 말리고옷입었을때도 은은하게 퍼지는 코튼캔디향에기분이 좋아진다.​아이들이 입는 옷이라면 아이가 움직일때마다 이 향덕분에 아이들의사랑스러움도 극대화 된다고 해야할까 ㅋㅋㅋㅋㅋㅋㅋ​너무 마음에 드는 제품이라 나만알고싶지만강추강추 > < ​​​​▶ 르주르 홈페이지 바로가기 ▶ 르주르 인스타그램 바로가기 ​​​​​​​​​​​​- 본 포스팅은 해당업체로부터 제품만을 무상제공받아 실사용 후 솔직하게 작성되었습니다 - 
 
 
",13,1,1,272,0,0,664.0,2,text_ad,2019. 9. 3. 23:03,2050,4674517,상품리뷰,0
14,https://blog.naver.com/gksmf1303?Redirect=Log&logNo=221439138530,"♬살림백서 섬유유연제photo & write by. 남매마미​​​​​​​​아이들이 어릴땐 아이들빨래와 어른빨래를 구분해서 세탁했었어요. 근데, 그렇게 빨래를 돌리다보니 빨래양이 많은 날은 나눠 돌리다보면 하루에 2~3번씩 돌려야하는 경우도 있더라구요.. 그래서 아이들이 어느정도 좀 커가면서는 같이 돌리고 있는데요. 대신 세제는 좀 순한제품으로 그리고 애들아빠 출근할때 입었던 군복은 별개로 빨아주고 있어요. 평상복들만 아이들 빨래와 같이 돌리고 있답니다 . 물론 내 운동복도 같이 !! 기존에 쓰던 세제가 있었는데 마침 다 써서 어떤제품을 구매할까 알아보다가 이번에 처음써보는 브랜드이지만 꽤나 마음에 들어서 리뷰하려고 합니다.​​​​​​​​자연에서 온 오가닉케이. 살림백서 액체세제, 섬유유연제 인데요.  이미 매니아층이 꽤 되는 제품 같더라구요 ! 재구매해서 쓰시는 분들도 굉장히 많구요. 저는 처음 써봤지만 마음에 들어서 다 쓰면 저도 웬지 재구매할거 같아요. 가격도 나쁘지 않더라구요 ^^ ​​​​​​​상자에서 꺼내보니 깔끔한 통에 들은 세제들이 너무 마음에 들었어요. 그 옆엔 설명서 같은게 하나 들어있었는데 문구가 참 마음에 들더라구요 !  우선, 살림백서라는 브랜드에 대해서 아시는 분들이 계실지 모르겠지만, 살림백서는 그냥 단순한 제품이 아닌 우리 모두의 안전을 함께 책임질 수 있는 제품을 희망하고, 바디버든을 줄이는 착한제품을 연구, 개발하는 브랜드기업이라고 합니다. ​​​​​​​​또한 화학성분을 최소화 해서 착한성분과 부담없는 순수한 가격이 동시에 보여지는 진솔한 브랜드로, 화학성분을 강조하고 있어요. 세탁을 하는 세제이기 때문에 아무래도 화학성분이 어느정도 포함이 될 수는 있겠지만, 그로인해 우리몸에 남겨지는 화학성분들을 최소화 하기 위해서 노력하는 브랜드라고 하니까 더 믿음이 가요.  특히나 가정에서 사용하는 과탄산소다와 코코넛계면활성제, 착한성분으로 착하더라도 필요한 만큼 과하지 않은 가족의 건강과 자연을 지키는 세제니까 ^^ 섬유유연제 추천 ​​​​​​​​그리고, 살림백서에서 강조하는 ""바디버든"" 바디버든이 대체 뭘까요 ???? 바디버든은 주어진시간에 신체에 축적된 화학물질의 양을 '바디버든'이라고 한다 합니다. 그 바디버든을 제거하는 방법은 여러가지가 있는데, 식이섬유 섭취를 한다거나, 충분한 수분 섭취를 하거나, 규칙적인 운동을 해서 땀을 배출하거나, 혹은 안전한 제품을 사용하던지. 아마 세제는 가장 후자가 아닐까 싶어요 . 섬유유연제 추천 ​​​​​​​​살림백서 액체세제와 섬유유연제예요.  뒤에 보시면 세제의 표준사용량이 나와 있는데요. 아시다시피 세제는 적정량을 써야지 너무 많은 양을 사용하게 되면 오히려 좋지 않아요 ! 다들 알고 계시죠? 과유불급 ! 뭐든 적정량! ㅋㅋㅋㅋㅋ일반세탁기, 드럼세탁기 모두 사용이 가능하기때문에 사용하시는 세탁기와 빨래양에 맞추어 사용하시면 될것 같습니다 !살림백서 섬유유연제 추천 ​​​​​​​​그럼 섬유유연제 추천 살림백서의 세제를 가지고 빨래를 해볼까용!!!!! 많은 양은 아니지만, 제 운동복과 아이들의 내복 , 어린이집 다녀온 후 벗어놓은 옷들이 들어가있어요 ~ ​​​​​​​​​빨래양과 물에양에 맞추어 적정량의 세제를 뚜껑에 덜어서 세제통에 넣어주고요​​​​​​​​섬유유연제 역시 적정량을 뚜껑에 덜어 max위로 넘치지 않도록 넣어 줍니다.  그런다음에 표준 세탁모드로 빨래를 돌려주고요.​​​​​​​​깨끗하게 잘 빨려나온 옷가지들 탈탈 털어서 건조대에 널어두었어요. 세탁기에서 빨래를 꺼낼때부터  상쾌한 향이 나서 기분이 좋았어요, 살림백서 섬유유연제 덕분일까요 ? ㅎㅎ 그리고 빨래도 되게 깨끗하게 빨린 기분이랄까 ~ 섬유유연제 추천  살림백서의 세제가 더 궁금하신 분들이나 구매를 하고자 하시는 분들은 아래 링크를 클릭해주시면 됩니다 ^^ ​​​​​​​​​​​​​​ 
",20,0,0,404,0,0,664.0,10,suspect,2019. 1. 10. 23:01,2050,4674517,상품리뷰,0
