,Post URL,Post,Image num,sticker num,gif num,Paragraph num,Comment num,Video num,weekly viewer mean,Sympathy num,AD,Posting Date,Buddy num,Total visit,Blog category,Comment detail
3,https://blog.naver.com/gksmf1303?Redirect=Log&logNo=221768334270,"​@ 아기상어 버블바스, 전동칫솔, 스폰지육아용품 추천[ 아이의 목욕시간이 더 즐거워 ]​write & photo. 남매마미무단배포,2차수정을 금함아이들은 노는건 그렇게도 좋아하면서 왜 !! 왜 !! 씻자고 하면 도망갈까 ?지금 우리애들은 씻자고 하면 바로바로 오지만 전엔 씻자고 하면 서로 먼저 씻어라 미루기 바쁘고 , 도망가기 바쁘고, 잡혀서 씻으러 화장실가면 마지못해 가는느낌이 들었는데, 요즘 아기상어 제품 몇가지를 만나고나선 씻자고 하면 바로먼저 달려오고, 물놀이하자고 하면 누가 먼저라고 할것없이 서로 화장실 먼저 들어가려고 난리다 ㅎㅎㅎ내가 요즘 넘나 고마워 하는 #아기상어_버블바스 그리고 #아기상어진동칫솔 이 바로 그 주인공들이다.귀여운 아기상어와 아빠상어 모양의 입욕제듀오 ! 그리고 그 뒤에 아기상어의 버블바스! 목욕스폰지까지 진짜 아이들의 목욕용품에 꼭 필요한 제품들이 이렇게 아이들 취향저격으로 나오니까 엄마아빠들이 지갑을 열수밖에 ㅋㅋㅋㅋㅋㅋ 우선 칫솔먼저 보여드리면 여분의 칫솔이 하나 더 들어가있고 전동칫솔답게 건전지가 필요한데 감사하게도 건전지가 애초에 들어가있다.그래서 이 칫솔을 처음 쓸때 건전지를 따로 구비해놔야 하는 상황은 면함! ㅋㅋㅋ AA건전지가 들어가니 참고하시고, 첨에 버튼이 어디있나 두리번 두리번 했는데 (전동칫솔 처음 써봐서 ㅋㅋㅋ) 칫솔 하단에 버튼이 있었다.화살표로 표시해두었는데 저 부분을 꾹 하고 눌르면 바로 작동이 된다.버튼을 누르고 진동의 세기를 보여드리기 위해 동영상으로 찍어보았다.아이들이 닦는 칫솔이기 때문에 (그리고 난 진동칫솔 처음이라) 이정도의 진동세기가 괜찮은건지는 잘 모르겠다 ^^ 맞겠지 ㅎㅎㅎ 울 아이두 이번에 진동칫솔 처음 써보는건데, 자기가 칫솔을 움직여가며 많이 닦지 않아도 되서 편한지 이닦자고 할때마다 재빠르게 달려온다. ㅋ안그래도 이 치료하고 나서 아이 칫솔질에 더 신경이 쓰였는데 잘됐다 ^^ 짜잔!! 그리고 오늘 포스팅의 주인공!바로 #아기상어버블바스이다. 동그란 지구모양의 귀여운 아기상어 포장이 되어 있는데다가 상자를 여는순간부터 달콤한 향이 코끝을 자극하는바람에 ㅋㅋ 한참동안 킁킁대고 냄새 맡기 바빴다.그리고 굉장히 향이 진하고 오래가는편이다. 그리고 이 안에 비밀의 무기가 숨어있는데  뭘까요~~~~~오? ㅎㅎ자! 아기상어 버블바스의 비밀은 이렇게 물에 넣으면 알 수 있다!바스를 물에 넣자마자 물 색이 투명에서 초록색으로 변하니까 애들이 어찌나 놀래던지 ㅎㅎㅎ자기네들이 그동안 물받아서 씻을때는 투명했었는데 이 작은 동그란 볼이 들어오자마자 거품이 나면서 초록색으로 변하니까 ㅋㅋㅋ울 딸아이는 앉아있다가 갑자기 일어나서 손으로 초록물을 치워내기 바빴다 ㅋㅋㅋㅋㅋㅋㅋㅋ그 모습이 어찌나 귀엽고 재밌던지 ㅎㅎ그리고, 어느정도 바스가 녹아내리면 안에 이렇게 귀여운 아기상어 피규어가 들어있다.너무 크지는 않고 정말 작은 아기상어피규어인데 열쇠고리처럼 어디 달아둘 수 있어서 나는 아이 어린이집 가방에 달아주었다.잘 달려있는데, 3월에 유치원으로 옮기면 유치원가방에 다시 옮겨달아줘야지 ㅎㅎ귀여워서 그런가 보자마자 딸아이 차지가 되었다는 소문이 ㅋㅋㅋㅋ처음엔 이 물색깔 뭐냐고 그냥 나간다고 했다가 좋은향이 나고 색이 변하니 재밌긴 했는지 나중에는 앉아서 파도라며 물 밀어내기 놀이도 하고 장난감 가지구 동생하고 어찌나 신나게 놀던지 한참을 물놀이했던것 같다.난 그냥 ..  따뜻한물에 몸 좀 푹 담그고 쉬고싶다 ㅋㅋㅋㅋㅋ.. 한참을 재미지게 놀았으니까 이제 씻고 나가야쥐 ~ ?? ㅎㅎ마지막으로 소개할 제품은 #아기상어목욕스폰지 ㅋㅋ귀여운 아기상어가 박힌 스펀지로 목욕할때 사용해주면 되는데, 나는 아이들 피부가 예민해서 그냥 손에 거품내서 닦아주고는 있는데, 이 스펀지에 아이들 바디워시를 펌핑해 조물조물 해주면 풍성한 거품이나와 아이들의 재미있는 목욕시간을 만들어준다 ^^무엇보다 귀여우니까 애들이 자꾸 가져감 ㅋㅋㅋ그리고 또 굉장히 폭신하다 ! 목욕 스폰지에 바디워시를 펌핑 후 손으로 조물조물 해주면 풍성한 거품이 나기 시작한다. 다만, 스펀지 같은 경우 사용하면서 조금 아쉬웠던 점을 말하면 제품 자체에서는 거품이 풍성하게 나는데 비해서 아이들 몸에 문질해주면 제품자체에서만큼 풍성한 거품이 묻어나오지는 않는다.그 부분 빼면 디자인적인 면에선 귀여워서 굉장히 만족 :)어쨋거나 오늘 소개한 #아기상어목욕용품 다 만족하면서 잘 사용중이다 ~ ㅎㅎ ▶ 큐티버블 아기상어 제품 구매좌표 ​​​​​​​​​​​ 글은 블로그원평대을 동해 해당 업체에게
자 또느 서비스유언 솜자게작성된글 니다
",17,0,4,480,0,1,664.0,6,text_ad,2020. 1. 11. 23:54,2050,4674517,상품리뷰,0
4,https://blog.naver.com/gksmf1303?Redirect=Log&logNo=222079010386,"​아이들간식추천오뚜기 빅핫도그, 모짜소떡핫도그copyrightⓒ남매마미.all rights reserved​​​[ 본 포스팅은 (주)오뚜기에서 제품을 지원받아 작성됨 ]​​​코로나19로 많은것이 변했다.지금 벌써 2020년 9월인데 집에있던 시간이 반이상인듯그러다보니 항상 어린이집 다니던날보다반찬값이며, 간식값이 배로 더 들어간다 ㅠㅠ 이번에도 급작스럽게 가정보육을 2주하게 되서데리고 있는데 매일 끼니는 뭘 챙겨줘야하나간식은 뭘 줘야하나 걱정이었는데 갑자기 내 머릿속을 스친 핫도그그냥 핫도그가 아니라 지난번 마트에서 장보다가세일한다며 시식했던 그 핫도그맛이 좋아서 비싼데도 구매했던 기억이 떠올랐다.그래서 이번엔 2종류 모두 장만했음 ㅎ하나는 지난번 먹어봤던 모짜소떡핫도그그리고 빅핫도그모짜소떡핫도그는 지난번에도 먹어본적있어서또 사러갓었지만 마트에서는 찾아볼 수 없었다는 ^^;-18도에서 냉동보관을 해주어야하고한포장당 총 4개의 핫도그가 들어있다.나는 2봉이라 총 8개의 핫도그를 가지고 있는 셈 ㅎㅎ무엇보다 사이즈가 진짜 빅 사이즈고애들은 이거 하나면 간식으로 어느정도 배가 차기때문에내가 엄청 좋아하는 오뚜기핫도그 리얼 바삭한 빅핫도그는참나무로 훈연한 프리미엄 스모크소세지가들어간 빅사이즈의 핫도그고전자레인지에 돌릴경우 포장을 살짝 뜯어2분정도 돌려주면 된다. 바삭한 모짜소떡핫도그 역시조리방법은 같으나전자레인지 말고 이번엔 에어프라이어에 돌려보도록 하겠음에어프라이어 조리법 역시 간단하다.해동하지 않은 핫도그를 에프에 넣고 180도에서약 15분 정도 조리하기근데 조리시간은 각 가정에서 사용하는 에어프라이어 기종에 따라차이가 있을 수 있으니깐 참고.나는 15분정도 돌렸는데 엄청나게 바삭했음 ㅎㅎ처음엔 애들하고 같이 든든한 사이즈오뚜기 리얼 바삭한 모짜소떡핫도그를 먹으려고 했지만그냥 바삭한 빅핫도그의 맛은 어떨까 궁금해서애들은 모짜소떡핫도그, 나는 빅핫도그로 마음을 바꿈 ㅎ헷갈리지 않기 위해서 방향을 달리해봤다.2개는 애들꺼 모짜소떡핫도그. 하나는 내꺼 빅핫도그사이즈는 확실히 모짜소떡 핫도그보다일반 리얼빅핫도그가 더 큰걸 확인할 수 있음 ㅎㅎㅎ약간 휴게소에서 파는 사이즈의 핫도그랄까 ㅎ근데 난 이것보다도 더 큰 핫도그를 원한다 ㅋㅋㅋㅋㅋ(돼지 ㅋㅋㅋㅋ)설명서에 쓰여있는것보다더 바삭하게 먹기위해 나는 15분을 돌려주었고 15분 뒤 정말 터질듯 바삭해보이는 비주얼의핫도그가 완성되었다.예전에 사람들이 에프로 고기도 구워먹고뭐도 먹고 뭐도해먹고 에프가 뭐 그리 쓸모가 있나? 했는데 ㅎㅎㅎㅎ막상 내가 구매해서 쓰다보니 첨엔 손이 잘 안갔는데요새는 에프없음 어쩔뻔했나 싶은게 너무너무 유용하게 잘 쓰고 있다.애들꺼는 같은방향으로 내껀 따로 ㅎㅎ근데 이렇게 보니까 진짜 사이즈 차이가 확 느껴진다.빅핫도그가 사이즈가 훨씬 큼모짜렐라치즈도 들어가고, 소떡도 들어간 모짜소떡핫도그가 훨씬 더 클거같다는 예상과 다르게일반 빅핫도그가 더 큼 ㅎ역시 보기만해도 든든한 사이즈 ~ 맛이 어떨까 궁금해서 한입 딱 베어물어봤다.베어무는순간부터 바삭함이 느껴지는게진짜 내 귓가에 바삭! 하는 소리가먹는내내 바삭바삭바삭 ㅎㅎㅎㅎㅎ소세지가 정말 맛있었다.바삭한 겉 빵도 맛있고 ㅎㅎㅎㅎㅎㅎ맛이 없을래야 없을수가 없는 오뚜기핫도그 우리아들 먹는것도 찍어보려고했지만 너무 움직이는터라 사진이 다 흔들림ㅋㅋ딸아이가 한입 딱 베어물고 핫도그 빼는순간쭉 늘어나는 치즈핫도그추천 오뚜기핫도그 모짜소떡핫도그는사진 순서대로 젤 위에가 쭉~ 늘어나는 치즈가운데가 떡, 그리고 젤 하단이 소세지로 되어있다.전에 나도 이거 먹고 넘 맛있어서 또 사먹어야지 했었는데 구하질 못해서 ㅠㅠ이제야 다시 먹어보게되었다 ㅎㅎ집에 아이들 친구들이 와도 간식으로 하나씩 돌려주면 좋지~15분보다 더 돌렸으면 탔을뻔했다.완전 바삭하게 쫀득하게 맛있게 잘 먹었다 ㅎㅎ글 쓰면서도 또 침이 넘어가네 ~ ​​​​​​​​#쫄깃바삭한 #오뚜기핫도그 #에어프라이어 #와플기계 #직접훈연한 #든든한사이즈 #핫도그추천 ",18,0,0,374,0,0,664.0,6,text_ad,2020. 9. 3. 10:57,2050,4674517,상품리뷰,0
5,https://blog.naver.com/gksmf1303?Redirect=Log&logNo=222275882037,"​차모아 차량컵홀더 & 무선충전테이블copyrightⓒ남매마미.all rights reserved​​​​​​우리는 시댁도, 친정도 먼 곳에 떨어져 살고있어서항상 시댁이나 친정갈때 기본 4시간 찍고 가는터라차에 머무는 시간이 길기도 하고그러다보니 차에서 뭔가를 마시거나 먹는일도 많은데신랑과 나만 있음 괜찮지만아무래도 아이들이 같이 있다보니 짐도 두배 더 ㅋㅋ아이들이 아직 카시트를 쓰긴 하지만이제 조만간 다 치워버리면 장거리 이동시 우리 네사람의음료를 어디다 둘곳이 없다 ..그냥 두었다간 또 줄줄 흐를수도 있고 차량컵홀더 괜찮은것어디없나 싶어 찾아봤는데 여기 있었네 ~ 내가 오늘 리뷰할 차량컵홀더는 바로 ""차모아"" 제품으로차량컵홀더는 물론 무선충전패드까지 셋뚜셋뚜로같이 사용하고있다.컵홀더는 장거리갈때 사용할거라 지금 잠시 휴식중이지만무선충전테이블은 내가 차 탈때마다 유용하게 쓰인다는고 ~ ㅎㅎ​​​​♥ 차량컵홀더우선 내가 오늘 소개할 메인 제품차모아 차량컵홀더에 대해서 먼저 이야기를 해보자면클로버 멀티 컵홀더로  자동차 실내 수납공간을좀 더 편리하게 확장시켜주는 제품으로 우리처럼 4인가족이 한 차로 움직일때정말정말 유용하다.물론 혼자 차를 타고 이동하거나 옆에 사람이 한명더 타고 있을때도 좋겠지만 ~우선 차량컵홀더의 깊이나 형태에 관계없이 68~98mm크기면안정적으로 고정이 가능하고, 높이 조절가능한데다가수평은 물론 360도 회전까지 되니까 좀 더 편리하게사용할 수 있다는 점 ~ 완성된 모습을 사진으로 먼저보자면 요런 모습이 될듯하다 ~ 사용하지 않을땐 겹쳐두고, 사용할때 펼쳐 사용하면 되니내차같이 작은 차들이 쓰기엔 특히나자리차지를 많이 하지 않아서 더 만족스러움! 차모아 차량컵홀더를 설치사용하는 방법은 간단하다.아래 사진을 계속보면서 설명을 이어나가자면 꺼내보면 구성품은 fix body와 컵4p, r-link가 있다. 컵홀더와 컵은 옆에 움짤에서 보이는것처럼살짝 빼면 빠지는 구조로 되어있는데,테이크아웃 음료잔의 크기가 컵홀더에 안들어간다면이렇게 빼고 사용해줘도 되겠지 ~차량내의 컵홀더부분에 고정되어야 하는 fix body는첨엔 왼쪽 사진처럼 날개가 졉혀있는 상태로 오는데빨간 오픈스티커 방향으로 뚜껑을 돌려주게 되면숨어져있던 날개가 슝~ 하고 나타나게 된다.이걸 차량의 자체 컵홀더 부분에 맞게 조절하여 고정시키면 되는데웬만하면 아마 다 잘 맞게 고정이 될것이다. r-link와 fix body를 연결하는것 역시 어렵지 않다.fix body가운데 구멍에 r-link를 껴주면 끝~그러니 fix body의 날개를 펼치고 고정하게 될 경우나사를 조여주면 되는데이때 나사도 힘주어 꽉 돌리게 되면 제품 파손의 우려가 있기 때문에1~1.5바퀴 정도 돌려주면 된다고 한다 .나도 살짝만 돌려서 고정했는데, 아직까지 고정 잘 되어 있다 :) 짜잔~이렇게 쉽게 차모아 차량컵홀더가 완성되었다.물론 이상태 그대로 바로 차에 쓰셔도 되지만나는 여기서 옵션을 하나 더 넣었다.바로 무선충전테이블 이란 옵션인데 나는 차가 옛날모닝이라최신 기종의 모닝의 내부와는 다르게안에 수납? 할수있는 공간이 없다 ...그래서 폰을 거치해둘곳도 없어서 폰거치대를 구매해서 사용했는데이게 아무래도 끼웠다뺐다 해야하고 충전이 따로 되지 않는제품이다보니 사용률이 현저히 떨어져서이번에 차모아 차량컵홀더와 무선충전테이블을 들이면서기존에 차에 있던 폰거치대를 과감하게 빼버렸다. ㅎㅎ 자동차용품 10년의 노하우로 탄생하게 된프리미엄 차량컵홀더 그리고 무선충전테이블보통 시중에서 무선충전거치대는 많이 봤지만 차량용 무선충전테이블은 본적이 없어서 신기하기도 했다.요게 잘만쓰면 폰을 충전하기도 하지만요즘같은 시국에 차안에서 미니카페로도 변신할 수 있게해준다는 점이 굉장히 메리트 있고 신선하게 다가왔다. 우선 제품뒷면에보면 무선충전이 가능한 기종들이 있다.무조건 모든 폰이 다 되는건 아니기 때문에기종을 확인해보는게 좋은데내 생각엔 완전 오래된 폰 아니면 거진 다 무선충전이가능할 듯 싶다. ^^차량컵홀더에 같이 연결해서 사용할 무선충전테이블의설치방법이다.사실, 설치 라고 하기에는 거창해보여서 ㅋㅋㅋㅋㅋ그만큼 너무 간편해서 부모님 차에 놓을용도로 선물해드려도쉽게 조립하실 수 있다.그림과 설명이 있지만 내가 직접 연결해서 보여드리는게훨씬 빠를것 같음 ^^ 꺼내보면 구성품은 굉장히 간단하다.무선충전패드, 케이블, 그리고 테이블~ 끝위의 영상에서 확인해주셔도 되지만시간이 없으신 분들은 그냥 사진으로만 확인해주셔도 되는데배송왔던 상태 그대로의 테이블을 뒤집어주면걸림쇠가 하나 보인다.그 걸림쇠를 손으로 밀어주면 딸깍 하고 열리면서 분리가 되는데그때 무선충전패드와 뚜껑을 조립하여 다시 끼워주면 끝근데 무선충전패드를 끼울때 검은 부분이 위로 가게끼워서 조립해주면 된다.그러면 짜잔~ 이렇게 조립 완료 ㅎ굉장히 쉽고 간단해서 첨엔 뭔말이지? 하더라도금방내 아~ 하고 조립할 수 있다.근데 무선충전 제품들이 거의 대부분 그렇듯이가장 좋은건 생폰으로 충전하는게 가장 좋고차선으로는 케이스가 두껍지 않은 제품을 쓰는것.나처럼 뒤에 그립톡 있고, 케이스 자체가 두꺼운걸 쓰는 분들은무선충전이 안되기떄문에 충전할때 케이스를분리해야하는 번거로움이 있다.근데 그런 번거로움을 감수하고라도 충분히 쓸만한 메리트가 있음그래서 나는 이번에 우리 지민이 그립톡을 떼고좀 얇은 케이스를 사용 ,, 또르르 지민아 잠시만 안녕 ㅠㅠ 차량컵홀더와 연결시켜주면 완성된 모습은 짜잔!아까 박스에서 봤던 모습과 동일하다.요것이 바로 상하 높이조절도 되고 , 회전이 된단 말이다.이제 나는 차안에서도 빵을 편하게 먹을 수 있다,ㅋㅋㅋㅋㅋㅋㅋㅋㅋㅋㅋㅋㅋㅋㅋㅋㅋㅋㅋㅋㅋㅋㅋㅋㅋㅋㅋ먹어질지는 모르겠지만 우선 차에서 무선으로 그것도 테이블위에 올려바로 충전이 가능하다는 점이 아주아주 매력적임 ㅎㅎㅎ 차에 고정해주었다.다행스럽게도 큰 흔들림 없이 잘 고정되어 있고운전할때마다 저렇게 폰 올려두기만해도무선고속충전이 되니까 어찌 사랑하지 않으리오 ~차량컵홀더에 은혜로운 무선충전테이블까지 :)올려두자마자 바로 충전이 되는데햇빛때문에 글자가 안보여서 손으로 빛을 가리고찍어보았다.영상으로도 올려두었으니 못믿으실 분들은 영상을 눌러확인해보시면 좋을것 같다 ^^차에서 나오는 방탄 노래와 함께 차량컵홀더와 무선충전테이블까지자꾸만 차에 가고싶게하는 매력들 무엇!? ㅎㅎㅎ내차에 꽂아두고 사용하다가장거리 이동할때는 애아빠 차로 옮겨가서 사용할려고 한다.아주 꾸르템!! ㅎㅎㅎㅎㅎㅎㅎㅎ 굿굿굿~ 가격이 조금 있어서 비싸다 싶은감도 있지만진짜 그만큼 값어치를 하는 제품이라서 차에 머무시는 시간이긴 분들, 4인가족 차량이동시 마땅히 음료 둘곳이 없다 하시는분들께도추천드려본다 . *^^*더 자세한 설명이나 가격이 궁금하신 분들은 아래링크를 클릭▶ 차모아 차량컵홀더, 무선충전테이블 ​​​​​​​​​​​​- 업체로부터 제품만을 무상제공받아 작성되었습니다 -#차모아 #차량컵홀더 #차량무선충전테이블 #차량컵홀더추천  
 
 
",31,9,2,672,0,2,664.0,3,text_ad,2021. 3. 15. 11:29,2050,4674517,상품리뷰,0
6,https://blog.naver.com/gksmf1303?Redirect=Log&logNo=222112835886,"​휴대용공기청정기추천violeds 휴대용공기살균기copyrightⓒ남매마미.all rights reserved​​​​​훗날 2020년은 '코로나' , '마스크'라는 두 단어로만 설명이 다 되지 않을까 하는생각이 드는게올 1월 코로나 확진자가 조금씩 나오기 시작하더니마스크 쓰며, 사회적거리두기 시작한지벌써 10개월이 되었다....와 세상에 정말 미칠듯이 힘들었던 시간도 지나가고물론 , 지금도 힘이들지만 처음보다는 많이 무뎌진것같은 기분이 든다.하지만, 개인 방역 역시 소홀히 할 수 없기에최선을 다해 손,발을 깨끗하게 씻고외출해서는 마스크 착용을 꼭 하고, 소독제도 수시로 뿌리는데작고 오래된 내 차이지만그래도 외출하고 나 발이되어주는 공간인만큼차안의 공기도 깨끗하게 걸러주어야마음이 더 편해서 요즘 아주 차에 꽂아두고 잘 쓰고 있는#휴대용공기청정기 가 하나 있다.바로 바이오레즈 의 휴대용공청기 !usb연결 잭만 있으면 공부방에서도, 차안에서도아가들 방에서도 사용할 수 있다.휴대가 가능하다는 장점이 가장 크지만코로나바이러스까지 살균할 수 있는uv led를 장착한 공기살균기라고 하니 차에 아니둘수가 없겠구만 !!! 코로나바이러스 뿐 아니라 초미세먼지나,매연,담배연기도 같이 차단해준다고하니담배 많이 피시는 분들도 차에 하나 두면 좋을듯 ~위에서도 언급했듯이 usb전원공급방식으로usb포트만 있으면 차나 사무실, 침실 등어디에서든 사용이 가능하다.모터가 돌아가지만 소음이 큰편이 아니라서소음에 민감하신 분들도 꽤나 괜찮게 사용할 수 있는 제품~~더군다나 작지만 알차게 3단계로 조절이 가능!또한, 수은램프 및 화학약품을 사용하지 않아서유아, 임산부, 노약자 분들도 사용이 가능하다고 한다.나는 흰색으로 초이스 ~ 제품상자를 열어보면 보증서와 사용방법이자세히 적인 설명서가 같이 동봉되어 있으니까사용전에 꼭 한번 읽어보시고 사용하면 좋겠다.꺼내보니 더 예쁘구먼 ㅎㅎ그리고 안에 필터도 같이 하나 동봉되어 있는데이 필터는 H13헤파필터로초미세먼지, 미세먼지, 매연, 담배연기등을 차단하고Violeds가 세균이나 바이러스를 99.9% 살균해준다고 한다,우리가 익히 알고있는 유해균 (폐렴, 대장,녹농,살모렐라, 황색포도상구 등)전에 집에서 사용했던 공기청정기도 헤파필터를 사용했다고 하는데이 필터와 같은게 아닐까 싶다 ~ ㅎㅎ 디자인은 굉장히 심플하고 깔끔한편내가 선호하는 디자인이다.뭐가 여러가지 복잡하면 잘 쓰지도않지만 머리만아픔ㅋㅋㅋㅋㅋㅋㅋㅋㅋㅋㅋ원터치조작으로 3단계까지 바람조절이 된다.그럼 이제 필터교체를 해보아야할차례 하단 덮개를 분리하고사진에 보이는것처럼 상단덮개를 open으로 돌려서분리해준뒤이렇게 필터 삽입구가 보일만큼 상단덮개를살짝 내려주고 필터를 사진과 같은 방향으로 넣어주고다시 닫아주면 끝! 굉장히 쉬운방법으로 필터 장착이 가능하며나는 차에 두고 사용고 있다. 항상 꽂아두면 혹시나 차량 배터리 나갈까 싶어서내가 차에 탈때마다 usb잭에 연결해서 사용해주고 있는데버튼을 한번 누르면 약풍으로, 2번이면 중, 3번이면 강풍한번 더 누르면 off되는 형식으로 원터치 조작이 가능해서너무너무 편하다.이렇게 간편하게 차안에서도 코로나바이러스를 살균할 수 있다니.사실 눈에 보이지 않는 바이러스라 더 무섭다 ㅠㅠ 1단으로 놓았을때 연두색 불빛이 들어온다.자외선 파장 중 가장 강력한 살균력을 지닌 uv-c로필터에 남은 바이러스가 재활성화되기전 30초만에파괴가 된다고 하니 내눈에 보이진 않아도믿고 사용하고, 나중에 필터 교체시 확인해보면 정말 제대로 바아리서나 미세먼지들이 걸러졌는지알 수 있겠지 ^^ 필터를 거치며 살균된 깨끗한 공기는차량 실내로 배출되고 주변공기 주 오염물질의 밀도도줄어든다고 하니 혼자 타고다닐때보다 아이들과 함께 타고 있을때더 신경써서 틀게되는 바이오레즈 휴대용공기청정기 ~필터의 교체주기는 6개월이지만 사용자의 환경에 따라 바뀔 수 있다고 한다.허나 필터교체를 하지 않고 계속 사용할 경우필터에 쌓인 바이러스와 유해균이 재배출 되어 2차감염의 원인이 된다고하니꼭! 필터교체주기를 확인 후 교체해주면 좋겠다 ~필터는 바이오레즈 홈페이지에서 추가적으로 구매가 가능해서나도 미리미리 필터 구매했다가 교체시기에 맞춰바꿔주고 내 차환경을 더 깨끗하게 유지해야겠다 ^^ ▶ 바이오레즈 블로그 바로가기 ▶ 바이오레즈 판매몰 바로가기 ​​​​​​​​​​​​​#코로나 #살균 #바이러스 #코로나19 #바이오레즈 #초미세먼지 #vac #서울바이오시스 #휴대용공기청정기 #차량용공기청정기 #공기살균기  
 
 
",22,1,1,423,0,0,664.0,6,,2020. 10. 11. 21:35,2050,4674517,상품리뷰,0
