,Post URL,Post,Image num,sticker num,gif num,Paragraph num,Comment num,Video num,weekly viewer mean,Sympathy num,AD,Posting Date,Buddy num,Total visit,Blog category,Comment detail
0,https://blog.naver.com/gksmf1303?Redirect=Log&logNo=222266690632,"​BTS굿즈 타이니탄 보석십자수copyrightⓒ남매마미.all rights reserved​​​​작년 한해.. 코로나로 정말  심신이 많이 지쳐있었다.나 뿐만 아니라 많은 분들이 그랬겠지만 그럼에도 시간은 흘러가고, 코로나사태도 1년이란 시간이 지났다.요즘같이 집에 머물러있는 시간이 길면 길수록사람이 점점 더 무료해지고, 잡생각이 많아지는데,뭔가 딱 집중해서 할 수 있는 새로운 취미생활추천 으로도괜찮을것같은 요즘 핫한 비즈십자수 하나 소개할까 한다.내가 BTS 팬이라 ^^;;;요즘 BTS굿즈 를 집에 많이 쟁여두고언젠가 굿즈존을 만들고싶은 꿈이 생겨서 ㅎㅎㅎㅎㅎ야금야금 하나씩 모으고 있는데오늘 소개하는 비즈십자수 역시 빅힛트 공식 BTS굿즈로요즘 보석십자수로 많이 알고있는 그것 맞다 ~ ㅎㅎBTS를 대표하는 캐릭터 2가지가 있는데하나는 멤버들이 직접 그려 론칭한 BT21캐릭터와멤버들의 축소판으로 주머니에 넣어다니고 싶게 생긴타이니탄 ! ㅎㅎ오늘은 타이니탄 비즈십자수를 해볼까 한다.내가 고른 캐릭터는 모두 지민~ 내가 올 멤버 다 좋아하지만, 유독 작은새끼손가락의지민이를 더 애정하기때문에 ^^ ㅎㅎ제품 한쪽켠에 타이니탄이라고 쓰여있고 뒷면을 보면 하단에는 제품이미지가 작게 나와있다.저 이미지를 따라 내가 비즈를 붙여 십자수를 완성.옛날엔 진짜 실 꿰어 십자수를 만들었는데지금은 비즈로 붙여서 십자수를 할 수 있다니~ ㅎㅎ 점점 더 발전하는 세상 ! 빅히트엔터테인먼트 정품 로고 스티커가 붙어있고사용방법이 간단하게 설명되어있다,사실 거창하게 비즈십자수, 보석십자수라 하지만초보들도 , 어린아이들도 할 수 있는 아주 극강초보레벨의 도안및 난이도이기때문에 아이들과 같이하실 분들혹은 나 혼자 뭔가 집중해서 작품을 하나 완성해보고싶다하시는 분들께 강추 ~ ㅎㅎ다만 , 하다보면 약간 목,어깨에 담이 올 수 있음ㅋㅋㅋ주의 ~ 아이러브페인팅 보석십자수를 하며 주의해야할 점도나와있으니, 시작하기 전 참고하시기 바란다.실사이즈는 가로세로 25*25cm꺼내놓고나면 위 설명서에 나와있는대로 제품구성품 및 하는 방법에 대해 자세하게 설명이 되어있는데,아무래도 비즈가 작다보니 더 어린아이가 있는 집에서는아이가 비즈를 먹지 않도록 굉장히 주의해주셔야할듯한데 ,가장 좋은방법은 아이들이 자고 있을때 하는게가장 좋긴 하더라는 ^^ 완성 후 벽에 걸어두실 분들을 위해 필요한 부속품들도안에 같이 동봉되어 있어서 굉장히 좋다.내가 따로 부품을 사서 달아야한다거나 하는 번거로움이 없어서요거 하나면 제품을 만드는것부터 벽에 거는 마무리까지한번에 okay ~ 측면에 박혀있는 빅히트 엔터테인먼트 그리고, 제품겉에 붙어있는 보호필름, 작품을 시작할때는반드시 요 보호필름을 살짝 제거해주면서 비즈를 붙여나가는게 좋은데확실히 타이니탄 비즈십자수를 할때저 보호필름은 전부 다 제거하지 않는게 좋다.겉면에 끈끈이가 붙어있고, 그 위에 비즈가 붙여지는거라서접착력을 조금이나마 더 높이기 위해서는사전에 먼지나 손지문이 자꾸 붙는걸 방지하기 위해서보호필름은 꼭 붙이고 작업하는것을 추천한다 . 캔버스형이라 완성되었을때 굉장히 예쁠것 같다는 느낌이 든다.우리 지민이라 더 이쁠거같다.하지만 붙이기 전에 보이는 이 숫자들은 마치 환공포증을 유발하는..내 눈알이 마구 흔들거리고, 어지럽고 괴로웠다.ㅋㅋㅋㅋㅋㅋㅋㅋㅋㅋㅋㅋㅋㅋㅋㅋ ;;; 하지만 누나가 참아볼게 지민아.. ㅎㅎㅎ 요거는 고체풀이다.요거를 핑크 펜 안쪽 깊숙하게 넣어 준 다음작은 초록 트레이 안에 비즈를 조금씩 덜어펜에 비즈를 붙여 캔버스에 붙이면 끝~뭔소린가 싶을텐데 요런식으로 작업을 해주면 된다.비즈색별로 번호가 있고. 캔버스에 적힌 그 숫자를 따라비즈를 붙여나가면 되는데요게 , 유튜브에서도 봤지만 굉장히 시간이 오래걸리는 작업이라.................... ㅠㅠ 힘들 수 있다.이게 저 펜을 1구, 3구, 5구로 바꿔 쓸 수 있는데이게 비즈를 트레이에 꺼내면서 뒤집어져있기도 하고 해서일일이 한번에 붙이기가 어려워나는 오로지 1구 펜으로만 저 작업을 완료하였다. 3구도 써봤지만 난 실패 ㅋㅋ빨리 붙여지기는 하나, 위에서 말했던것처럼비즈들이 뒤집어져있는것들도 많아서 ..암튼 직접 해보지 않으면 뭔소리하나 모를지도 모름 ^^; ㅎ고도의 집중력을 요하며 붙여보긴했지만 좀 어렵긴하다.차라리 1구가 훨씬 편하고 금방 붙일 수 있어서 말이지 ~ ㅎㅎ영상으로도 찍어봤는데 굉장히 느려서 속도를 높여 편집해보았다. 위 영상은 속도를 굉장히 높인거라 빨라보이지만막상 하게되면 , 약간 시간이 더디게 걸리긴 한다.캔버스 위에 숫자를 비즈로 잘 가려야하고칸에 빗나가지 않게 붙이는게쉬운듯 하면서도 난이도가 있고, 가장 힘든건 이게 숙이면서 봐야해서 목이랑 어깨가 좀 아프다는 점 ??? ㅎㅎ예쁜 지민이로 탈바꿈 될 이 고되면서도행복한 작업은 역시나 방탄 노래를 들으며 해야겠지? ㅎㅎ작업하는 내내 방탄 노래들으며 하고신랑이 휴가나와있을땐 신랑이랑 이야기 주고받으며 했었는데신랑도 궁금하고, 한번 해보고싶었는지자꾸 관심을 보이길래 해보라했더니 아주 느~으릿 느으릿 하게 ㅎ몇개 붙여주더니 너무 힘들다고 ^^; ㅎㅎ결국 내가 후딱 또 완성했다. ㅎㅎ맘만먹고하면 하루이틀이면 끝날거같은데, 이번에 신랑이 휴가라서좀 길게 있는바람에 오랜시간이 걸려 완성되었다. 완성된 모습은 짜란~ ㅎㅎㅎ사실, 요런거 처음해봐서 잘 할 수 있을까 걱정되었는데웬걸 ? 완성된 모습 보니까너무 이뻐서 괜히 막 더 뿌듯하고 ㅠㅠㅠㅠㅠㅠㅠ우리 지민이 너무 이뻐서 너무 좋고 ㅠㅠ 엉엉 지금 이게 사진으론 다 못담아 내는데실제로 보면 더 예뿌다.빛을 받으면 반짝반짝 거려서 보석십자수 라는 별칭이 붙었는가 싶고 ^^BTS굿즈 타이니탄 보석십자수 지민은우리집 지민이 시계 옆에 나란히 걸어두었다.ㅋㅋㅋㅋㅋㅋㅋㅋㅋㅋㅋㅋㅋㅋㅋㅋㅋㅋㅋㅋㅋㅋㅋㅋㅋㅋㅋ지민이 시계가 좀 더 큰줄알고 구매했는데좀 작아서 ㅠㅠ 아쉽지만그래도 이렇게 예뿐 지민이가 우리집 벽에 나란히 붙어있으니까너무 이뿌다 :) 아직 내 고된 여정의 끝이 아니라 작업할 캔버스가하나 더있어서 그건 이제 다음주에 오로지 나 혼자 있을때조용하게 ,  그 누구보다도 빠르게 작업해야겠다 ^^취미도 즐기고, 무엇보다도 완성되면 인테리어 효과까지 줄 수 있어서선물로도 추천 ~ ㅎㅎ ​구매링크는 아래 걸어두겠습니다 ^^▶ 타이니탄 보석십자수 구매하기 ​​​​​​​​​​#아이러브페인팅 #보석십자수 #타이니탄 #비즈십자수 #BTS캐릭터 #BTS굿즈 #취미생활추천 #비즈십자수 #큐빅십자수",25,0,1,653,0,1,663.8,13,revu,2021. 3. 6. 21:48,2050,4674516,상품리뷰,0
1,https://blog.naver.com/gksmf1303?Redirect=Log&logNo=221459235688,"엣츠바 신발클리너photo & write by. 남매마미(사진, 글 무단도용시 처벌 받을 수 있습니다)​​​​​​​​​​​​​​​​저는 나름 소나무 취향을 가지고 있는사람이라서 .....옷을 사던, 가방을 사던, 악세서리를 사던심지어 핸드폰 유료폰트를 구매하던대체로 다 비슷비슷한 것들을 구매하는 편이에요;;​운동화도 예외는 아닌데요.신발장을 열어보니까 대체로 흰색 아니면검정색 이더라고요 캌하하하핫​흰 운동화가 관리하기는 좀 까탈스럽지만어느옷에나 매치하기 좋아서옷을 잘 못입는 제게는 가장 무난한 아이템이아닐까 싶어요 ..무의식중에 흰신발을 찾고 있으니 ㅋㅋ​​​​​​​​​​​​울 남편몬도 주로 흰색운동화를 즐겨신는 편인데그렇다고 조금 드러워졌을때마다매번 신발을 빨기는 힘든지라..빨리 마르지도 않고요 ^^;그래서 어떤 제품을 써야 간편하게 흰 신발의얼룩을 제거할 수 있을까 찾아보다가이번에 아주 기똥찬 제품을 발견했답니다 !​저처럼 흰운동화 좋아하시는 분들께는아주 그뤠잇 한 잇 아이템이 되지 않을까 싶은데요.​​​​​​엣츠바 신발클리너​​​​바로 엣츠바 신발클리너에요.흰 운동화나스웨이드/매쉬 소재의 운동화에만 사용할 수 있는 제품으로사용 후 제품이 변질되지 않도록 햇빛이 닿지 않는그늘지고 서늘한 곳에 보관해야해요!​​​​​​엣츠바 슈클리너 100ml 1ea - 4cm.100ml. 11cm엣츠바 슈어솔 1ea - 3.2 / 6.5 / 9.2cm엣츠바 타월 1ea - 29cm/29cm엣츠바 소프트브러쉬 1ea - 3.3 / 5 / 19.2cm케이스 1ea - 16 / 11.5cm일회용 비닐 1장, 설명서 1장 ​​​​​​​​​​​​키트 뚜껑을 열어보았습니다.키트 안에 들은 구성이 매우 푸짐한것 같은데요.하나씩 소개해드리자면엣츠바 신발클리너 원액1통 브러쉬, 타월이 들어있구요.부드러운 모 하나까지 추가 증정해주셨어요 !신발의 종류에 따라모질도 다른 것으로 선택해서 신발 세척해주시면될 것 같아요 ^^세척하는 과정은 아래에서 계속 보여드릴게용 ^^​​​​​​​​​​​​​두 슈즈솔을 비교해드릴게요.사진에도 한번에 표가 나지만 검은색 슈즈솔이 좀 더 거칠고 단단하고갈색 슈즈솔이 좀 더 부드러운 편이예요.동영상을 눌러보시면 확인이 가능하시답니다 ~​​​​​​​​​​​​​​이것이 바로 우리의 흰 운동화를간편하게 세척해주는 엣츠바 슈클리너 인데요.용량은 100ml ​천연원료를 베이스로 개발해서세척은 물론, 세척과정에서 발생하는 신발의 손상까지 방지해준다고 해요.사용해보니 정말 깨끗하게 닦여서 깜놀한 제품 !​​​​​​​​​​​그럼, 직접 슈클리너를 사용해서신발을 닦아봐야 진가를 알 수 있겠죠 ? ^^이번에 우리가 커플로 장만했던아디다스 팔콘​아주 잘 신고있는편인데흰 신발이라 조심해서 신으려고 해도아이들이랑 같이 다니다 보면애들이 밟을때도 있고 ,,,, ( 그럴땐 눙무리... )무튼 조심한다고 해도일상생활 하다보면 더러워 지더라고요 ㅠㅠ​​​​​​​​​​​​​제 신발보다는 남편몬 신발이 더 더러워서 오늘은 남편몬 신발을 깨끗하게 닦아볼거예요.어디어디 더러워졌는가 확인해보긔 ~ ㅎ흰 운동화 이래 더러워지면 마이아파 ㅠㅠ​​​​​​​​​​​​​​아무래도 처음사용하는 제품이니 만큼사용하기 전에 사용설명서를 꼼꼼하게 읽어보앗어요.사용하기 전에는 꼭!손에 비닐장갑이나 고무장갑을 끼고 사용해야해요.맨피부에 닿았을때는 물로 깨끗하게 씻어주기!아이들의 손이 닿지 않는 곳에 보관하기!제품을 삼켰을 경우 많은 양의 물을 섭취하고반드시 병원에 방문치료 받기!​​​​​​​​​​​​​그리고 하나의 준비물이 더 필요한데요.그건 바로 물 !안쓰는 그릇에 물을 담아주면 되요.그럼 정말 신발 세척 준비 끄읏 ~ ㅎㅎㅎㅎㅎㅎ​​​​​​​​​​​​신발 소재별 세척 팁 입니다.스니커즈, 스웨이드, 메쉬 재질모두세척하는 브러쉬가 다르니까 꼭 읽어보시고맞게 사용해주세요.그래야 신발 손상없이 깨끗하게 세척이 된답니다 :)​​​​​​​​​​​​​​우선 애들아빠가 사용한 브러쉬는바로 소프트브러쉬예요.소프트브러쉬는 100% 말모브러쉬고요.민감한 소재의 신발도 문제없이세척이 가능하지만말모 특성상 세척과정에서 털이 빠질 수 있으니알아두시면 좋을듯 합니다 - ​​​소프트브러쉬는스웨이드,메쉬,후리스,나일론,가죽 등민감한소재 세척에 적합하고신발 중창과 밑창세척에는 부적합 합니다 !!!​​​​​​​​​​​​​​엣츠바 신발클리너 사용법은 간단해요.브러쉬에 먼저 물을 묻혀주고적당량의 슈클리너를 브러쉬에 덜어낸다음​​​​​​​​​​​​​​거품을 내서 세척하면 됩니다.세상에나 이 거품 무엇 ?!거품 너무 풍성하게 잘 나죠 ?????사진으로 다 못담았어여 ;; ㅋㅋ​​​​​​​​​​​​​거품을 내어 세척한다음에는키트 안에 들어있던 타월로 거품을 재빠르게닦아내어 주면 됩니다.​와, 운동화 세탁은 무조건 물에 세제풀어서솔로 박박 문질러서 며칠간 널어놔야했던거아니었었나요 ????​​세상에나 엣츠바 신발클리너 세정력 무엇 ?번거롭게 물빨래 할 필요없이외출전에도 간단하게 신발세척이 가능한 신발클리닝의 신세계 -​아끼는 신발이라 어디 맡기기도 불안했던 분들꼭 엣츠바 신발클리너 사용해보세요.정말 잇템 ,꾸르템 !! ​​​​​​​​​​​​​운동화에 묻은 이물질을기호에 맞는 브러쉬나 슈어솔로 털어낸 다음위에 저희가 세척한 방법대로오염부위를 세척한다음, 타월로 거품을 충분히닦아내주면 이렇게 깨끗한 운동화로 재탄생 아까전에 그 더러웠던 운동화는 어디갔뉴??????​​​​​​​​​​​​​​​외출 전에 세척했다면세제를 충분히 헹궈서 통풍이 잘 되는햇빛이 없는 공간에 자연건조를 시킵니다.​바로 외출할 경우에도거품을 충분히 닦아내주어야 하는데요.​​​​​여기서 주의사항 !​​세제를 덜 닦아내고 햇빛에 장시간 노출시신발의 변색을 우려할 수 있으니꼭!! 꼭!! 세제의 거품을 충분히 닦아내고통풍이 잘되는 그늘에서 충분히 건조시켜주세요!​​​​​​​​​​​​​잠깐의 세척으로 이렇게 다시 깨끗한 운동화를되찾을 수 있다늬이이이이!!!이거슨 신세계 ~​​저처럼 흰운동화 즐겨신는 분들흰운동화를 좋아하시는 분들신발을 자주 빨기 힘드신 분들​​엣츠바 슈클리너엣츠바 신발클리너 (클릭)​​​사용해보세요.​​★ 제품의 사용기한 : 개봉 후 2년 ​​​​​​​​이 글은 위블을 통해 본 업체에서
제품 또는 서비스를 제공받아 작성된 글 입니다.

세
 
10045 11태
 
",23,7,2,537,2,1,664.0,8,text_ad,2019. 2. 6. 12:23,2050,4674517,상품리뷰,"['소프트브러쉬는 어디서 사나요?', '해당 사이트에는 키트와 브러쉬 구성으로 파는데 엣츠바라고 검색하시면 소프트브러쉬만 7900원에 떠있는게 보이네요^^;']"
2,https://blog.naver.com/gksmf1303?Redirect=Log&logNo=221430035099,"아디다스 팔콘 화이트​​​​​photo & write by. 남매마미(사진,글 무단도용시 처벌 받을 수 있습니다)요즘 어글리슈즈가 대세라죠?저는 구두보다도 운동화를 더 좋아하는 1인으로운동화 예쁜것만 보면 환장합니다.구매욕구 뿜뿜.허나 억누르고 그냥 거의 신던것만 신었는데이번에 sns보다가 블핑이 아디다스의 새로운 뮤즈가 되고광고하는 이 팔콘 운동화가 존예로운것.아 이건 무조건 구매각이다 싶어서 애들아빠랑 커플운동화로 겟겟 하였답니다 ^^​​​​​​​​조금 더 저렴한 사이트가 있어서 구매했는데해외배송으로 배송중이라 떠있는데배송을 안해서 문의를 몇번을 했는지2주넘게 기다렸다가 결국 취소하고abc마트에서 돈 조금 더주고 구매했어요 온라인에서 구매한거라서 조금 더 저렴하게 샀구요.사이즈는 검색해보시면 아시곘지만이 아디다스팔콘이 사이즈가 크게 나온편이라서사이즈는 무조건 다운시켜야해요.울 신랑은 5사이즈 다운저는 10다운시켜서 구매했답니다.​​​​​​​​저는 본래 운동화 240신어요.발에 볼이 좀 있는편이라서 어떤 브랜드는240이 딱맞는게 있고어떤 브랜드는 편하게 맞는게 있고그래서 이번에 구매할때도235사야하나 230을 사야하나엄청고민하다가 ㅋㅋ 230샀는데잘산듯 ㅋ​​​​​​​​색상은 한 5~6가지 종류가 되는걸로 기억하는데가장 무난한게 블랙.화이트이지만어느 옷에든지 잘 어울릴 수 있는게블랙, 화이트잖아요 ^^화이트에 포인트 색 들어간걸로 할까하다가요새 왜때문인지 ㅋㅋ화이트에 꽂혀가지고 패딩도 화이트운동화도 화이트로 구매했어요.​​​​​​​​근데, 보시면 아시겠지만화이트라고 해서 완전 전부 하얀건 아니고군데군데 라이트그레이 색상도섞여있어요.그래서 더 예쁜거 같은 아디다스팔콘진짜 옆모습도 존예롭지만​​​​​​​​위에서 봤을때도 존예롭습니다.신발 받아보고 내 발에 대봤을때 어?230도 큰데?했는데 막상 신어보니까 편하게 딱 맞더라구요 ㅎ역시 신발은 그냥 볼때랑 신었을때랑은또 느낌이 다른거 같아요 ㅎ​​​​​​​​오리지널아디다스 로고로 더 멋스러움ㅋㅋ요즘 아디다스 왤케 좋지 ㅋㅋ​​​​​​​​애들아빠는 265, 저는 230사이즈 비교해보려고 같이 놓고 찍어봤어요 ㅎ어때요? 제 신발만 단독으로 봤을때 커보였지만애들아빠꺼랑 옆에 두니 제꺼 완전 작죠 ㅎㅎㅎ세상에나 제가 신발을 230을 신다니팔콘이 사이즈가 넘 크게 나온덕분인가 ㅋㅋㅋ​​​​​​​​그냥 봤을때보다 신었을때 더 예쁜아디다스 팔콘 화이트보는사람의 눈에 따라, 개인의 취향에 따라호불호가 갈릴 수 있지만대체적으로 많이들 좋아해주시는거 같더라구요.어떤 사이트가면 사이즈 대체로 품절인경우가 많았어요.​​​​​​​​오늘 아디다스 팔콘 신고 병원도 갔다가마트도 다녀왔는데신발 정말 편함ㅋㅋㅋㅋㅋ발 뒷꿈치부분이 불편하단 리뷰도 간간히 있어서걱정했는데제발엔 넘 편하게 잘 맞더라구요.남편몬도 잘 맞는듯​넘 만족스럽게 잘 구매했어요.한켤레당 64천원 정도 주고 구매!!좀 더 저렴하게 살 수 있긴했지만해외배송이라 그냥 좀 더 주고 빨리 받았답니다.​​​완전 만족스러워요. :)담주에 애들 등원하고 운동갈때도맨날 신고가야징 *_*​커플운동화로도 안성맞춤임 ! ​​​​아차차사이즈는 가까운 매장 있으면 가서 신어보시고인터넷으로 주문하는게 좀 더 저렴하고실패없이구매하실 수 있다는 구매팁을 남기며 ㅋㅋㅋㅋㅋ저는 이만 빠빠시 !! ㅎㅎ​​​​​​​​- 직접 돈주고 구매했어요 -​​",12,0,0,293,11,0,664.0,20,,2018. 12. 29. 21:29,2050,4674517,상품리뷰,"['이쁘다~ 팔콘♡', '저도 운동화249신고발볼넓은편인데 ..아디다스 슈퍼스타도230신었거든요 커가지고이것도230사면될까요?', '저도 약간 발볼있는편인데 글쎄용 제가 아디다스 슈퍼스타는 신어본적이 없는데 그것도 크게 나온편이고 230이 맞으셨다면 팔콘도 230사시면 될거같은데 근처에 혹시 아디다스나 abc마트있다면 그래도 사시기전에 한번 신어보시고 사시는것도 나쁘지않을거같아요^^', '감사해요~^^', '아니예용 ㅠㅠ ㅋㅋ 즐거운 하루 되세요♡', '원래신는 아디다스 사이즈보다 작은거시켜야하나요?', 'ㅇㅏ마 그래야하지 않을까 싶어요 그래도 혹시 모르니 주변에 abc마트나 아디다스 매장이 있다면 신어보시고 구매하시는걸 추천드려요~^^']"
