,Post URL,Post,Image num,sticker num,gif num,Paragraph num,Comment num,Video num,weekly viewer mean,Sympathy num,AD,Posting Date,Buddy num,Total visit,Blog category,Comment detail
5,https://blog.naver.com/hsh0744?Redirect=Log&logNo=221811285625,"#인더파우치#사가미002#사가미러브미골드#응응주사위#커플선물#부부선물#사가미콘돔세트#신혼부부#집들이#술게임​​인더파우치 쇼핑몰 아시나요?성인전문쇼핑몰인데 신혼부부 선물 또는 커플 선물하기좋은 아이템들이 굉장히 많은 신선한 플레이스 ^^;;​성인들을 위한 용품 !!ㅋㅋㅋㅋㅋㅋㅋㅋㅋㅋㅋㅋㅋㅋ​​배송은 박스포장이 되어서 비밀배송완료^^ㅋㅋㅋㅋㅋㅋ누군가 내 물품 걱정이 되어도 안전하게 보안을 해주니 걱정마세요~​​​콘돔은 약국이나 편의점에서 쉽게 구할수 있지만항상 ~ 같은 제품들 밖에 없어서 이번에는 '인더파우치'를 선택;​​그래도, 콘돔은 부부생활이나 커플들에게 필수품;그러기 때문에 아무 콘돔이나 사용할수 없는데좋은 제품도 있으면서 내가 몰랐던 많은 제품들이 있는 핫플레이스;'인더파우치'​​사가미 콘돔을 선택한 것은기존에 내가 알고 있던 0.03mm보다 0.01mm 얇아졌기 때문이다;개인적으로 0.03mm 최고로 얇은 줄 알았는데'인더파우치' 쇼핑몰을 검색하다가 더 얇은 콘돔이 있어서 와우 !!​​초박형 콘돔은 밀착감 형성을 극대화를시켜주면서 안전한 피임을 할수 있기 때문에남성,여성분들에게 가장 많은 사랑을 받는 제품 중 하나라고 하더라고요;​1box에 6pcs 들어있는 사가미 002 콘돔;​​0.02mm 믿을수 없는 두꼐의 폴리우레탄 재질로 지닌 초박형 콘돔;재질의 생체 적합성이 우수한 극 초박형 콘돔으로써브리스타팩에 포장되어 있는 사가미 오리지널 002 !!​​​국내에서 가장 많은 커플이 찾는 초박형콘돔;드디어, Gosoe Daddy도??ㅋㅋㅋㅋㅋㅋㅋㅋㅋㅋㅋㅋㅋㅋㅋㅋㅋ​일반 콘돔보다 몇배 강한 내구성을 지니고 있으면서두께도 얇고, 냄새도 나지 않은 큰 장점이라서부부생활, 연애하시는 분들에게 적극 추천 하는사가미 오리지널 002 콘돔;​유통기한은 5년까지 되기 때문에사용하시고 꼭 버리고 재사용은 금지 !!​콘돔은 일회용품이기 때문에 사랑하는 당신, 그녀를 지켜줍시다;​다음으로는 커플들이나 신혼부부집들이 선물로 최강인 '응응 주사위'ㅋㅋㅋㅋㅋTV 속 화제의 주사위로 알려진 제품인데회사 동생 선물 강력하게 해줘야겠습니다;ㅋㅋㅋㅋㅋㅋㅋㅋㅋ​​연인과 특별한 이벤트로 만들고 싶거나색다른 추척, 잠자리에서 연인과 더욱즐거운 성생활을 원한다면 '응응 주사위'ㅋㅋㅋㅋㅋㅋㅋ​핫 하다 핫 해 ~ㅋㅋㅋㅋㅋㅋㅋㅋㅋ​96가지 미션 가능한 스페셜한 주사위;ㅋㅋㅋㅋㅋ술자리에 들고 갔다가 난리가 날수 있는잇츠 핫 아이템 !!​연인들과 즐거운 경험, 부부에게는 친밀감을 더 형성 시킬수 있는 이벤트;센스있는 남여가 될수 있으니 누가 먼저 할것 없이'인더파우치' 쇼핑몰에서 같이 구매하자 !!​'인더파우치' 쇼핑몰에서만 불수 있는 콘돔 세트;사가미 002 / 사가미 러브미 골드 콘돔이다;​맨 위에 사가미 오리지널 002 콘돔 잘보셨쥬??ㅋㅋㅋㅋㅋㅋㅋㅋ​​사가미 러브미 골드 콘돔은 1box 10pcs 구성되어 있는사가미 콘돔이다;​다른 제품의 콘돔을 사용하셨더라도 사가미 콘돔에 빠진 당신!!더이상 돌아보지 못할 것이라고 하는데 ~음 ~~~ 그렇게 좋은 제품인가봐요;​​'인더파우치' 쇼핑몰에서 저렴한 가격에좋은 품질에 사가미 콘돔세트를 구매할수 있다;그러기 때문에 걱정하지 말고 얼른 주문해보세요;​저도, 지인들에게 선물을 할 생각인데 ~아름다운 성생활을 위해서 피임이 중요하다고 봅니다.​그리고, 성생활은 나쁜 행동이 아니고 일상생활이라고 느끼면 좋겠고그 성생황을 나쁜 시점에서 보시면 안좋으니 !!​내 몸을 위해 ~ 사랑하는 사람을 위해 지킬수 있는 매너;콘돔은 연인, 부부생활 필수품 !!​그러기 때문에 , 조그마한 이벤트를 통해 분위기를 맞춰'응응 주사위'와 함께 기분도 Up, 사가미 0.02mm 초박형 콘돔으로아름다운 사랑을 나누시기 바랄게요 !!​Hot한 사가미 002 콘돔 세트;그리고, 응응 주사위 까지 챙겨서집들이 선물이나 신혼부부, 커플템으로 챙기시길 바랄게요 !!ㅋㅋㅋㅋㅋㅋㅋㅋㅋ​'인더파우치' 쇼핑몰에서는 콘돔뿐만 아니라커플 용품, 속옷, 러브젤 등등 여러한 종류들이 많기 때문에아래 사이트 접속후 만족해보시길 바랍니다^^​​↓↓↓↓↓​​​​​​​본 리뷰는 무상으로 제공을 받은 서비스에 대하여 솔직한 후기이면서​정직한 포스팅으로 작성하였음을 밝힙니다.​​​ 
 
 
",17,1,0,376,9,0,247.2,43,text_ad,2020. 2. 17. 0:00,2573,721831,,"['포스팅 잘 보고갑니다^^새로운 한주 활기차고 행운이넘치는 날들 되길 바랍니다~~', '감사합니다', '', '', '좋은글 잘보고 갑니다. 오늘도 더없이 행복한 하루 되세요 ^^', '땡큐입니닷 ^^', '포스팅 잘 보고가요!! 선물용으로 참신하네요ㅋㅋㅋ 굿굿', '커플이나 신혼부부한테 딱!!!', '또 너무 얇으면 성병균이 침투 가능하다네요?']"
6,https://blog.naver.com/hsh0744?Redirect=Log&logNo=221628128228,"#배틀그라운드#에너지파밍#스킨로션#파우치#배틀그라운드에너지파밍#배틀그라운드스킨로션세트#남친선물#남동생선물​이번 리뷰는 스킨,로션 세트를 하나 보여드리려고 합니다;​혹시, 내 남친 or 내 동생 or 내 오빠 스킨하고 로션을 선물을 하고 싶은데하필이면 배틀그라운드에 빠진 그대 !!ㅋㅋㅋㅋㅋㅋ​그렇다면, 그대를 위해서 선물하나 준비하면 좋지 않을까요?​​그래서, 제가 보여드리는 이 상품 !!​배틀그라운드 에너지파밍 스킨 로션 세트입니다.​딱, 보면 배틀그라운데 게임에서 나오는 박스 ㅋㅋㅋㅋㅋㅋㅋ​​이 박스에는 에너지파밍 스킨, 로션 세트가 들어있다는 사실 !!​ㅋㅋㅋㅋㅋㅋㅋㅋ​이 박스를 열고 싶은 이 마음 !!​도대체 어떻게 들어있을지 !!​​ㅋㅋㅋㅋㅋ​그 전에 옆면을 살펴 보니 기능성화장품으로 되어 있는배틀그라운드 에너지 파밍 스킨, 로션 기획세트 !!​마음에 든다 마음에 들어 ^^​미백 주름개선 기능성화장품으로 구성이 되어 있는 배틀그라운드 에너지 파밍 세트 !!​그리고, 파우치까지 증정을 하니 완벽하다 !!​​오호 ~ 박스를 한번 열어보니 스킨 로션 파우치가 들어있더라고요;​​우선 파우치를 살펴볼게요 !!​파우치는 남성도 사용해야할 필수품 중 하나 !!​귀찮아서 우리 남성분들은 그냥 일회용 비닐봉지에 세면도구나 화장품을 넣기 마련;​그러나 여행이나 출장갈 때 파우치에 넣고 다니면 참 편리하겠죠?​​파우치를 뒤로하고 에너지 파밍 스킨 로션 세트를 꺼내봅니다;ㅋㅋㅋㅋㅋ​이거 완전 뭥미 ^^​신기방기하고 완전 귀여운 스킨로션세트 !!​​배틀그라운드를 연상시키는 에너지 파밍 스킨은외부 환경에서 자극 받기 쉬운 남자의 피부를 보호하고,피부 에너지를 채워주어 활기 있고 건강한 피부로 가꾸는데 도움을 준다고 되어 있어요;​​에너지 파밍 로션도 스킨과 동일하여천연 빙하수와 해조류 추출물이 건조한 남자의 피부에 보습과 영양을 빠르게 공급을 해줘요;​와일드한 환경에서도 강인한 생명력을 지닌 자연 유래 추출물이 피부 진정에 도움을 주기 때문에스페셜 에디션으로 나온 기획세트 하나 준비해서 다가오는 추석에 선물하나 어떨까 합니다;​​미리 준비해서 우리 남편, 우리 동생, 우리 오빠, 우리 남친을 위한 귀경길에세면도구나 화장품을 넣어 다니면 좋지 않을까 합니다.​수납공간도 넉넉하게 되어 있어서 남성분들 아주 좋아할것 같아요 ^^​배틀그라운드를 좋아하는 우리 남성분들을 위한 배틀그라운드 에너지 파밍 스킨 로션 세트를한번 선택하시면 좋지 않을까 합니다 ^^​ㅋㅋㅋㅋㅋㅋㅋㅋㅋ본 리뷰는 제품을 실구매를 하였으며주관적으로 솔직하게 작성하였음을 밝힙니다;",12,0,0,248,8,0,247.2,45,text_ad,2019. 8. 25. 21:17,2573,721831,,"['우와ㅋㅋㅋㅋ 이런 제품이 다 있군요!!!! 배그 좋아하는 친구한테 선물하면 정말 좋아할것같아요ㅎㅎㅎㅎㅎㅎ', '기가막히죠잉ㅋㅋ', '패키지가 완전 남자분들 취저네요 ㅋㅋ', 'ㅋㅋㅋ저에게선물하나했어요', '배틀그라운드 에너지파밍 좋은데요^^좋은 상품 정보 잘보고가요~~~', '감사해요~~^^', '박스 센스 ㅎㅎㅎ파우치 깔끔하고 이쁘네요 ~ 왠지 갖고싶은 ㅋㅋ', 'ㅋㅋㅋ얼른구매하시길']"
7,https://blog.naver.com/hsh0744?Redirect=Log&logNo=222005803589,"#리복#리복_온라인스토어#50%할인판매#리복_운동화#리복_7인치쇼츠#운동하자​​​리복 온라인 스토어에서 50% 이상 할인 판매를하고 있는 운동화/의류 등등 있는데 며칠 전까지#피한런운동화 사이즈를 확인했는데 ... 띠로리 ~~265mm가 매진이 되어 270mm 주문을 했지요 ~​그리고, 또 7인치 쇼츠까지 구매해서 Total 50,100원.5만원 이상 구매시 무료배송인데 100원이 넘어서 무배가 되었지요ㅋㅋㅋㅋㅋㅋ​운동화 욕심이 많은 Gosoe Daddy 이지만이제 많이 신고 오래된 운동화 Bye ;​핑계가 될수 있지만 낡은 나이키운동화 신고 달리기를 오래해서발뒤꿈치가 너무 아파서 1주이상 걷기 참 힘들었어요;​마음먹고 운동해서 살빼려고 애플워치3 구매도 했는데 ...하;;​핑계는 핑계가 되지만 한 예능프로그램 #배태랑 을 보고 나서나도 한번 다시 마음먹고 살을 빼자!!!​바로 야간근무인데 자꾸 피한런4.0 운동화를 신고열심히 살빼자는 마음을 먹고 자다가 벌떡 일어나서피한런4.0 운동화 270mm / RE 7인치 쇼츠 까지 구매 !!​​주문을 했으니 다음주에는 회사로 도착을 하겠지요??​보면 볼수록 가격도 저렴하고 상품도 나쁘지 않은 디자인이있어서 구매충동이 계속 일어났지만 ~~ 일단 Pass;​좋아하는 연예인분들과 왕년의 스포츠 스타들도 나와서나름 재미있게 보는 #배태랑 프로그램 ;​저도 이제 같이 한번 운동하려고 마음먹었는데 될지 모르겠네요;​리복 온라인 스토어에서 지금 50% 이상 할인 판매를 하고 있는데여러 제품들은 사이즈도 별로 없더라고요 ;​그만큼, 가격대비 디자인도 좋고 품질도 좋은 리복 브랜드;​운동화하고 쇼츠가 오면 진짜 무슨일이 있어도 운동을 하려고 합니다.​그리고~ 제품 리뷰도 한번 올리고 운동하는 포토도 올려보고 할테니 ~ 잇님들 유저분들도 얼른 지금이라도 열심히 운동 시작 하자고요 !!​그런 의미에서 리복 온라인 스토어에서 저렴한 세일가격으로 운동화, 의류구매해보시는 것도 나쁘지 않다고 생각합니다 ^^​​​​​​​​ 
 
 
",1,0,0,195,2,0,247.2,33,,2020. 6. 19. 12:08,2573,721831,,"['저도 요거 봣는데이미 운동복을 많이 질러서 포기했쥬.. 가격 좋더라구요 ㅎ', '더 지르고 싶었는데 꾹~~~']"
8,https://blog.naver.com/hsh0744?Redirect=Log&logNo=221458869676,"새해 福 많이 받으세요 ~~​다들 연휴 잘 지내고 계시나요??​귀경길에 힘들게 성묘길도 다녀오고 그렇다 보니 신발도 흙에 묻고 먼지에 쌓이고 말이죠.​그렇다면, 운동화 관리를 간편하게 빠르게 하기 위한 제품을하나 소개하려고 합니다.​Goose Daddy가 준비한 '엣츠바 에센셜키트'입니다.​이 제품 같은 경우, 빠른배송으로 저에게 달려오고추가로 소프트브러쉬까지 왔는데요.​일단, 키트 제품이여서 그런지 세련된 케이스와 함께 왔습니다.​번거롭게 물빨래 할 필요 없이 외출 전에 간단하게 신발을 세척할 수 있는 클리닝 키트 !!​새롭게 추가된 소프트 브러쉬로 기존에는 불가능했던 스웨이드&메시 소재 신발까지 세척할 수 있어요!!​천연 유래 성분을 함유해 맨손으로 세탁해도 안심할수 있으며세탁 맡기기도 불안한 아끼는 신발을 손상없이 쉽게 세탁할 수 있는 장점이 있어요.손상 없이 간단하게 세척이 가능해서 매일 외출 전에 시간내서 사용하기 딱이야!!​신발클리너 제품으로 보면 너무 세련되게 보관할수 있도록되어 있어서 신발장에 콕 ~ 박아 놓으면 좋을것 같아요.​구성품을 살펴보겠습니다.↓↓↓- 엣츠바 슈클리너(100ml)1개-4cm/100ml/11cm- 엣츠바 슈어솔1개-3.2cm/6.5cm/9.2cm 엣츠바 타월1매- 29cm/29cm- 엣츠바 소프트 브러시1개 3.3cm/ 5cm/ 19.2cm 케이스-16cm/11.5cm- 일회용비닐1장, 설명서 1장 - 사용기한 또는 개봉 후 사용기간 : 개봉 후 사용기간 2년​​그리고, 프리미엄 소프트브러쉬는 키트와 같이 사용하시면좋은 제품으로 사용될 수 있는데요.​하드브러쉬와 달리 스프트브러쉬는 기존의 슈어 솔보다 더욱섬세한 세척이 가능하여, 고급가죽/스웨이드/코튼/메시와 같은 민감한 소재에 사용하기 아주 적합한 브러쉬!!​브러쉬만 따로 뺐는데, 구분하기 참 쉽죠?​나무에 색을 지니고 있는 소프트브러쉬와블랙으로 칠한 하드브러쉬는 구분하기 쉬우면서솔을 만졌을때에도 구분하기 참 쉬워요!!​하드브러쉬는 밑창부분을 클리너와 사용하면 좋으면서소프트브러쉬는 발등이나 뒷꿈치 부분에 사용하면 좋을것 같다는 생각이 들어요.브랜드명은 엣츠비!! 소비자의 고민에서 시작해 물세탁의 번거로움을 없앤 초간단 슈케어 브랜드로써우리의 편리함을 극대화 시켜준 제품이에요.저의 조던운동화를 먼저세척을 하기 전 사진입니다.으아 ~ 드럽드럽 ~~ㅋㅋㅋㅋ​그리고, 또하나의 에어모나크 화이트도보시면 완전 개더럽ㅋㅋㅋ​이제 세척을 하기 위해서 세척 전 사진 투척!!​우선, 저는 일회용 비닐을 이용하여키트 뚜껑에 물을 받아서 진행을 해보려고 합니다.​원래는 대야에 운동화를 살짝 물을 묻혀야 하지만바로 렛츠고 !!​우선, 키트 뚜껑을 이용하여 물을 담은 후하드브러쉬와 소프트브러쉬를 물에 담궜습니다.​그리고, 물을 믇힌 하드브러쉬에엣츠바 슈클리너를 도포를 해주세요.​화장실에서 진행을 한 Goose Daddy.​보이시나요?? 빡빡 하드브러쉬를 이용하여꺠끗하게 세척을 해주세요!!​엣츠바 에센셜키트를 이용하여하드브러쉬로 깨끗하게 운동화 세척을 해주세요.​너무나 편안하게 빡빡 문질문질 하면거품이 생기면서 더러운 이물질이 나오는 것이 보입니다.​그리고, 바로 엣츠바 타월을 이용하여거품을 제거를 해주세요.​거품을 제거를 해주실때, 꼭 잘 닦아주셔야 합니다.​그래야, 색상이 변하지 않고 상태가 그대로 되기 때문에꼭~~ 거품 제거를 확실하게 해주세요!!​와우 ~ Goose Daddy 에어모나크가 새롭게 다시깨끗하게 태어났습니다.​바로 요래 밑창부분을 세척을 해주었는데완벽하게 이물질제거와 더럽게 되어 있던 것들이싸~~악 제거가 되었습니다.​그리고, 조던운동화는 밑창부분에는 하드브러쉬를 이용하고윗부분에는 소프트브러쉬로 사용하였는데제품에 이상이 없으면서 아주 완벽하게 세척이 되었습니다.​운동화 관리는 역시 ~ 엣츠바 슈케어 제품을 이용하며손쉽게 빠르게 세척을 할수 있으면서편리하게 작업을 하실수 있어요.​하얀신발을 신으면 더러우면 조금 찝찝하기도 그렇고보기도 안좋잖아요??​엣츠바 신발클리너를 이용하여깨끗한 운동화를 만들면 좋을듯 합니다.​귀경길에 제품을 구입을 해서집에서 간편하게 운동화 관리 어때요??​​​​​​​​​​​​​​​제품 사용 방법 안내↓↓↓① 운동화 케어 시- 운동화의 이물질을 기호에 맞는 브러시 또는 슈어솔로 1차 세척한다.- 대야에 운동화를 넣고 슈클리너를 운동화에 조금씩 부어 기호에 맞는 브러시 또는 슈어솔로 오염된 부위 세척한다.- 세제를 충분히 헹궈 통풍이 잘되는 햇빛이 없는 공간에 자연 건조한다. ​② 바로 외출 시- 운동화에 묻은 이물질을 기호에 맞는 브러시 또는 슈어솔로 털어낸다.- 세척 상태를 육안으로 판단 후 마른 타월로 거품을 충분히 닦아낸다.※ 주의사항 : 세제를 덜 닦아내고 햇빛에 장시간 노출 시, 변색될 수 있습니다.​​​위 사용 방법을 토대로 이용하시면완벽하게 운동화 케어와 세척이 가능하니꼬~~옥 지켜주세요^^​​​​​​​​​​​​#엣츠바 #Etsba #슈케어 #신발클리너 #슈즈클리너 #슈클리너 #신발세탁법 #신발세탁 #운동화세탁#흰운동화세탁 #운동화하얗게 #스웨이드운동화세탁 #스웨이드운동화관리 #메쉬운동화세탁 ​​​​​​​​​​​​​​​​​​​이 글은 위블을 통해 본 업체에서
제품 또는 서비스를 제공받아 작성된 글 입니다.

세
",27,0,0,473,0,2,247.2,30,text_ad,2019. 2. 5. 20:50,2573,721831,,0
9,https://blog.naver.com/hsh0744?Redirect=Log&logNo=222165180112,"#큐티버블#아기상어#아기상어전동칫솔#아기상어버블바스#아기상어바스밤​​​아이들 굉장히 좋아하는 아기상어 !!​아기상어 시리즈 전동칫솔, 버블바스, 바스밤 주문을 하였어요 ^^ㅋㅋㅋ​지금 저렴한 가격에 구매를 할수 있는큐티버블 !!​​영국 Corsair 사의 디자인과 라이센스 인증 !!​CE 유럽인증 정품 수입제품 !!​유럽 귀한 자녀분들도 함께 사용하는프리미엄 캐릭터 제품이라는 것 !!​​​큐티버블은 유럽 정통 화장품제조사가 만든 정식라이센스를 얻은CE 유럽인증 등 있는 정품 제품만 엄선하여 정식 수입하여판매하는 프리미엄 브랜드에요 ~​아기상어 포함 하여 미니언즈, 플러피 , 트롤스 , 추파춥스 , 어벤져스 , 배트맨 , 마블코믹스 까지 있는 ' 큐티버블 ' 브랜드 !!​이러한 것 중 아들이 좋아하는 아기상어 ~​다른 배트맨이나 어벤저스 좋아하는데 전동칫솔 있는 아기상어로선택을 하게 되었어요 ^^​전동칫솔하고 버블바스는 집에 사용하고 바쓰밤은선물용으로 하려고 해요 ~​집에 욕조가 있으면 좋지만 욕조가 따로 없어서 ...바쓰밤은 지인에게 선물을 하고버블바스도 욕조가 있어야 하지만 바디워시로 사용할수 있기 때문에아들 사용하게 해주려고 합니다.​​아기상어 전동칫솔을 사용하기 위하여 화장실로 ~가져온 Goose Daddy ;​​아기상어 전동칫솔 우리 아이 양치질도자신감 있게 할수 있도록  !!​만 3세 이상 사용 가능하고 초 미세 전동과 부드러운 칫솔모를자랑하고 있는 ' 큐티버블 ' 아기상어 전동칫솔 ;​​사용방법은 아주 간단해요 ~칫솔 바닥에 있는 버튼을 누르면전원은 On/Off 할수 있고​헤드를 잡고 오른쪽으로 돌리면 리필헤드로 교체할수 있답니다.​지금 아기상어 전동칫솔 에는 리필용 칫솔모 1개더 들어있기 때문에 보관하면 되요 ;​건전지 교체는 아이들이 쉽게 풀리지 않도록볼트가 있어서 하단부 볼트를 분리하여 건전지 교체를 해주시면 끝 !!​기본적으로 새 제품 안에 들어있는 건전지 !!건전지 없는 줄 알고 냉동실에 있는 새 건전지를꺼낼뻔 했지만 ~ 자체적으로 건전지 들어있습니다. ​​아기상어 전동칫솔 칫솔모에 아들이 사용하고 있는치약을 올려주고 이제 치카치카 시작 ~ ♬​완전 좋아하는 아들 보이시죠 ??ㅋㅋㅋ​치카치카 열심히 하라고 전동칫솔 선물 성공 !!​나름 열심히 치카치카 하여서 썩은 이가 없는 아들 ~딸램도 조만간 하나 구매해야 할 듯 합니다 ^^​굉장히 좋아하는 아들 이제 전동칫솔 Start !!​처음 사용하는 전동칫솔이라 조금 힘들었지만옆에서 Gosoe Daddy가 도와줌으로써 열심히 사용하는 아들 ~​진동이 강하지 않아서 아이들 잡고 혼자서 열심히양치질 할수 있도록 되어 있어요 .​또 , 제품 바디 일체형이라서 물이 들어가도 걱정 없는아기상어 전동칫솔 ;​​이제 더욱 더 열심히 양치질 하겠다고 ~또 하려고 하는 아들 ^^​양치질 굉장히 아이들 하기 힘들어 하고싫어하는데 아기상어 전동칫솔 사용하니알아서 척척 하려고 해서 너무 편리하네요 ~​처음에는 아이들 당황하고 힘들어 할수 있으니부모님분들 옆에서 지켜봐주세요 ^^ㅋㅋㅋ​치카치카 열심히 했으니 이제 샤워도 한번 하자 !!​​​영국 Corsair 사의 캐릭터 목욕용품 !!영국 디자인과 제품력으로 Corsair 아기상어 제품들은영국 Corsair사에서 개발한 독창적인 디자인과품질의 영국 대표상품이라고 해요 ~​​버블바스는 거품목욕을 즐겁게 하는 것인데욕조가 없는 Goose Daddy 집에서는 그냥 바디워시로 사용할까해요 ~​​아니면 , 조만간 아이들 놀수 있는 욕조 하나를 구입을 해야하나 ~ㅋㅋㅋㅋㅋ​몇 달 전 까지 아이들 개별 욕조가 있었는데 ...기부를 해버렸지만 그래도 ~ 버블바스 거품목욕은아빠가 직접 바디워시로 해주겠어 ^^ㅎㅎ​​아기상어 거품목욕을 해주고 싶었지만 ~욕조가 없으니 바디워시로 하자 ^^ㅋㅋㅋ​​​아기상어 버블바스는 부드럽고 투명한 젤타입으로촉촉하게 되요 ~  400ml 대용량으로 오랫동안사용할 수 있는 제품 !!​바디워시처럼 이용하는데 거품도 잘 나오면서달콤한 향이 아들이 너무 좋아하더군요 ^^​대용량 바디워시로 사용할수 있고 촉촉하게 발라지니너무 편리하고 목욕하는 동안 아이들도 굉장히 활기차더라고요 ~​​개인적으로 느끼지만 싫어한다는 아이들은 없을듯 합니다 ~ㅋㅋㅋㅋ​냄새가 너무 좋고 세정력도 좋은 아기상어 버블바스 !!​​샤워 마치고 난후, 아들은 또 뛰어다니지만 땀이 나지만 ...아기상어 버블바스 향기가 유지되는 듯 하였어요 ^^​씻는 동안 조금 더 힘이 안나고 혼자서 하려고 하니 ~ 좋구만요 ^^ㅎㅎ​이제는 사용중이었던 바디워시 필요없고' 큐티버블 ' 아기상어 버블바스 사용한다고 말하네요 ^^​바쓰밤도 사용하고 싶지만 못하고 욕조 있는 지인에게 선물을 해야겠습니다.​지금 , 가격도 저렴하게 세일 중인 ' 큐티버블 ' 접속해서좋은 제품으로 연말 선물용으로 참 좋을듯 합니다.​아이들이 좋아할 캐릭터 상품들이 많은 ' 큐티버블 ' ​얼른 얼른 기회 잡아보세요 ^^​​​​​​​​​​​​​​​​​​​​​단을 통해 업1         학성된리뷰입니다
체험단을 통해 업체에서 제공받아 작성된리뷰입!
기글은 놀러와체험단을 통해 업체
 
 
",20,2,0,505,6,3,247.2,20,text_ad,2020. 12. 11. 0:00,2573,721831,,"['포스팅 좋으네요  ❛ᴗ❛', '땡큐요 ㅋㅋ', '너무 귀여워요 ! ㅋㅋ', '감사합니다 ㅋㅋㅋ 오랜만이네용ㅋㅋㅋ', '어휴 손으로..']"
