,Post URL,Post,Image num,sticker num,gif num,Paragraph num,Comment num,Video num,weekly viewer mean,Sympathy num,AD,Posting Date,Buddy num,Total visit,Blog category,Comment detail
0,https://blog.naver.com/hsh0744?Redirect=Log&logNo=222033135349,"#휴대용선풍기추천#블루필휴대용선풍기#블루필미니선풍기#미니선풍기추천#손선풍기#휴대용미니선풍기#블루필미니헤드팬프로#여행용선풍기추천​​으아 ~ 진짜 요즘 날씨 무척 더워져서 외출할 때꼭 들고다녀야 되는 필수품 !!​손선풍기 잘 챙기시나요??엄청 저렴한 제품을 사용하다보면 ....금방 고장이 나거나 모터 타는 냄새가 올라오는 경우가 있어서이번에는 튼튼하고 오래 사용하면 좋을만한 휴대용미니선풍기 준비를 했어요;​​Goose Daddy 외출시 휴대용선풍기 들고 다녔는데...모터 타는 냄새와 동시에 작동이 멈춰 ... 2주를 못 넘기더라고요 ...그래서, 건전지가 아닌 usb 타입으로 충전되는블루필 미니헤드 팬 프로 손선풍기를 찾았습니다 !!​​블루필 휴대용 미니선풍기는 포장된 박스를 보면 쉽게 알수 있어요;일단, 6cm 스타일으 완성하는 작은 크기와99g 오래 들어도 부담없는 무게 !!40km/h 터보로 맞이하는 강력한 바람, 한 번 충전으로 24시간 사용!!​​크기도 무게도 반으로 줄어든 블루필 휴대용 선풍기 !!한 손으로 부담없이 편안하게 무더운 여름 산뜻하고 가볍게외출시 들고 다니기 참 좋은 휴대용 핸디선풍기 !!​​색상은 스노우 화이트 인데 마카롱 핑크, 아이스 블루, 스페이스 그레이4가지 색상을 지니고 있습니다;​​제품 마감처리도 완벽하게 되어 있어서어디 하자 있나 찾아보아도 빈틈이 안보이더라고요 !!​많고 많은 휴대용 핸디선풍기 !!무광으로 더 예쁘게, 더 세련되게 변신한 미니헤드 팬 프로 !!땀이 나도 덜 미끌거리도록 마감처리가 완벽하니 남녀노소 누구나가볍게 휴대성 좋게 사용할 수 있는 제품인 것 확실해요 !!​​본 상품은 구성품도 따로 있는데매뉴얼, 스탠드, 스트랩, 충전 케이블​​스탠드는 본체를 꽂아서 사용할 수 있도록만들었는데 밑에 부분은 미끌림 방지를 할수 있도록 만들었더라고요;​​스탠드에 꽂아주면 바로 책상용 미니선풍기로 변신 !!강력한 바람으로 시원하게 학업 및 직장에서 유용하게 사용할 수 있는블루필 휴대용 미니선풍기에요 !!​​스트랩은 본체 하단 홈에 꽂아서 사용하시면 되는데손목에 걸어서 쉽게 패션을 맞춰낼 수 있답니다.​더군다나 , 워낙 가벼운 휴대용 핸디선풍기라서~너무 편해요 !!​​5시간 완충시 (1단 풍속) 24시간 사용 가능하다고 합니다;3단 풍속 사용시 5시간 연속 사용가능하니 참고 하시고요 ~보조배터리가 필요없는 스태미나 휴대용 미니선풍기 !!배터리사양은 2,200mAh 참고하시길 ~​스탠드에 꽂아 탁상에 놓으면 참 좋네 좋아 !!​​하나의 스위치로 간편하게 원하는바람을 조절할수 있는데요 ~~​1단 2단 3단 off 초강풍 !!무더운 여름 날, 더 강한 바람을 원한다면 길게 눌러 사용하면되는데 터보 동작으로 더욱 더 시원함을 느껴보시기 바랍니다;​​​1단/2단/3단/off 이루어지는 미니헤드 팬프로 손선풍기 !!강력한 바람이 나와서 터보는 사용안해도 3단으로도 충분하고2단으로도 만족감이 나오는 휴대용 미니선풍기 !!​1단으로도 어느정도 시원한 바람이 잘 나오기 때문에 꾸준히 사용할수 있을 듯 해요;​​드론모터 기술을 바탕으로 크기는 반으로 줄이고성능은 높인 미니헤드 팬 프로 들고 기숙사 밖에 나왔어요 ;​소화도 잘 안되고 답답하여 나왔더니 너무 더워 ~~바로 다시 올라가 블루필 미니헤드 팬프로 들고 나왔습니다.​작고 가벼워 휴대하기 좋아서직장에 나갈 때 미니 가방에 쏙 넣어서 들고 다니는데 참 좋더라고요;​​어린 아이들도 들고 다니기 쉬운 가벼움과강력한 바람으로 시원함을 느낄수 있는 블루필 미니선풍기 !!​이 정도의 가격으로 성능 좋고 마감처리 완벽하고가볍고, 휴대성 용이한 휴대용선풍기추천 상품 !!​올 여름 , 블루필미니선풍기 구입해서 시원하게 외출하세요 ^^​​​​​​​​​​​",23,1,0,371,0,1,247.2,23,revu,2020. 7. 17. 0:47,2573,721831,,0
1,https://blog.naver.com/hsh0744?Redirect=Log&logNo=221594501898,"#차량용디퓨저 #차량용방향제 #플렌느유럽에서 온 전통있는 향기 ""플렌느""​시들지 않는 사계절 향기로움을 담은 플렌느.​디퓨저의 고장 유럽의 역사와 전통을 그대로 담아 탄생된 프리미엄 디퓨저;​​자연을 담은 원료와 유럽 최고의 조향사들이만들어내는 하모니는 누구도 따라올 수 없는 깊은 발향과 품격있는 향;​그 향을 전달하기 위해서 빠른배송 아주좋아♥​​가격도 착한 플렌느 자동차방향제를다양하게 만나볼수 있는 쇼핑몰에서 확인을 해보세요 !!​​빠른배송도 좋은데 제품이 안좋거나파손이 되면 속상한데, 플렌느 자동차 디퓨저는 전혀 그러지 않아도 됩니다;​뾱뾱이로 제품 포장을 했기 떄문에 전혀 파손되지 않을것 같더라고요;​물론, 저에게 날아온 자동차 방향제 플렌느는 안전하게 와서 땡큐 !!​​이번에는 왜 플렌느 ??​유럽에서 직수입한 원액 오일 그대로 담았으며최고의 조향사와 자연을 담은 원료가 만든 제품;​유럽에서도 인정하는 오일 전문 제조회사가꼼꼼하게 만든 품질 좋은 오일로 플렌느만의 풍부하고깊이있는 향을 느낄수 있다고 하니 완전 기대 !!​또, 선물용으로 아주 좋은 차량용 디퓨저는중세 유럽에서부터 사용되기 시작한 방향제로 오래된 역사를 지니고 있어요;​유럽 전통의 기술과 노하우를 담아낸 플렌느 디퓨저는 안전한 성분을바탕으로 만들어진 디퓨저로 까다롭고 철저한 유럽의안전성 기준을 충족하는 제품 ;;​​제품 박스를 열었을 때는, 흔들림 없이잘 고정이 되어 있었습니다;​​디퓨저 본고장 유럽의 최고 조향사와원료로 뛰어난 발향력 선사를 하며,까다로운 유럽 기준 충족하고안전한 원료 사용으로 안전한 믿을 수 있는 플렌느 디퓨저;​​Goose Daddy가 선택한 플렌느 자동차 방향제는""스위트 그레이프 프룻""​​자몽의 시트러스 하고 상쾌한 느낌과달달함이 어울어져 분위기 전환과 싱그러움을 선사를 하는 향 ~​이 향은 분위기 전환을 하고 싶을 때 강력추천하는 디퓨저입니다;​​차량용 디퓨져 제품이지만 3M 양면테이프가 되어 있어서디퓨저 하단에 붙히고 테이프 한면은 원하는 곳에 부착을 하면 됩니다.​굳이 , 차량용이 아니더라도 거실,욕식,침실 등등향이 발산이 되면 좋아질 곳에 설치를 하셔도 좋을것 같다는 생각이 들어요;​​회사 동생은 차량에 디퓨저를 설치하기 전에향을 맡았는데, 아주 좋으면서 스타일이 맞아서차량 실내로 가져오게 되었어요 ;​대쉬보드커버가 있어서 컵홀더에 넣을까 고민했지만50ml 작은 용량이면서 고정도 잘되어지는 테이플 사용할수 없어요;​네비게이션 상부에 한번 부착을 해보았습니다;​자동차 디퓨저 '플렌느'는 유럽에서 직수입한 원액 오일 그댈대로 ~유럽의 100년 전통 FRAGRANCE 전문 기업의 기술과 최고의조향사가 만들어내는 깊이있는 발향의 디퓨저; 일정한 발향력을 선사하는 디퓨저로 마지막 한방울까지다 쓸 수 있는 경제성을 자랑하고까다로운 유럽기준을 충족시키며 안저한원료를 사용한 자연의 향기로 타 디퓨저와는차별성을 느낄수 있어요;​그리고, 실내에 바로 퍼지는 자동차 방향제 플렌느 ""스위트 그레이프 프룻""은달달하고 아주 재미나게 살고 있습니다 ;ㅋㅋㅋㅋㅋㅋㅋ​이제 날씨도 구리구리하고 습하고 덥고 했는데차량에 탑승을 하니 상큼하면서 달달한 향이 퍼져서 넘나 좋더라고요 ~​신차구입or중고차구입을 한 지인에게 조그마한매력적인 향이 퍼지는 플렌느 자동차 디퓨저 선물하시면 좋을것 같다는 생각이 들어요 ^^​​​​​​​​​​​​​​ 
",23,1,0,334,0,0,247.2,45,,2019. 7. 24. 21:54,2573,721831,,0
2,https://blog.naver.com/hsh0744?Redirect=Log&logNo=221562307981,"#차량용방향제 #메이튼 #차량실내인테리어 #차량용디퓨저#피미르디퓨저 #블랙체리향 #메이튼디퓨저 #메이튼차량용방향제​요즘 참, 셀프 세차 하기 참 좋은 날씨입니다.그리고, 기분 좋게 손세차를 하고 나면 실내도 하면뭔가 빠진 듯한 부족한 것이 있기 마련.​그렇다면, 차량 실내인테리어에도 좋으면서세차를 하고 난후, 상큼하고 달달한 향이 은은하게퍼지면 얼마나 좋을까요??​그렇다면, 차량용방향제를 선택을 해야하는데제가 소개해드릴 <메이튼> 피미르 디퓨저를 보여드리겠습니다.​나의 일상의 공긴이 새로워지는 <메이튼> 차량용 디퓨저. 제품 케이스를 보게 되면선물용 하기 딱 좋지 않으세요??​신차 선물하기 아주 좋은 차량용방향제.​#피미르방향제 는 오로지 <메이튼>에서만제작이 되는 차량용방향제입니다.​제품구성은 고급스러운 패키지 구성으로선물하기에 매우 좋아요. 또, 편리하고깔끔하게 거치할 수 있도록 부착용 패드가 제공이 된다는데요.​차에 타는 사람에게 좋은 이미지를 주고 싶거나송풍구에서 곰팡이 냄새가 신경쓰인다면 <메이튼>​차량 실내 인테리어 효과도 볼수 있고좋은 향이 실내에 퍼진다면 완벽 그자체.​​차량용디퓨저에 사용 될플라워스틱1p, 디퓨저스틱2p, 접착패드​메이튼 피미르 프리미엄디퓨저하나로 모두 해결할수 있는데,악취제거/인테리어효과/색다른공간연출을지닐수 있는 차량용디퓨저.​​저의 플루언스 실내인테리어 효과와은은하고 달달한 향을 퍼트리기 위해서검은 캡을 돌려 뺀 후, 마개를 빼주셔야 사용이 됩니다.​퇴근을 마치고 차량으로 돌진!!나의 차량용디퓨저를 열었더니 완전 잘 고름.​블랙체리향을 골랐는데 완전 내 스탈~ㅋㅋㅋ​또, <메이튼> 차량용디퓨저의 향은 3가지로 분류가 되는데블랙체리/화이트머스크/블루밍부케​​나와 잘어울리는(?) 블렉체리향을 은은하게 퍼트릴플라워스틱을 꽂아주었습니다.​오~~ 느낌 완전 살아 ^^ 집에서는 이렇게 장식효과로 아주 좋던데 내 차량에도이렇게 실내 감각을 올려주는 디퓨저.​​가볍게 쏙 ~ 컵홀더에 넣어두어도아주 좋지 말입니다~♬​​혹시, 대쉬보드에도 장착이 될까??당연히 가능하더라고요. 동봉되어 있는접착패드를 사용하니 느낌있고 살아있네 ~ ♥​​아니면, 팔걸이에 딱 달라붙고 좋더라고요.​블렉체리향 <메이튼> 차량용방향제는로맨틱하게 끌리는 분위기가 필요한 날에,촉촉하고 잘 익은 달콤한 체리의 향. 사랑에 빠진큐피트의 순간을 담은 체리, 스윗한 연인의 애정어린 향기로써내 와이프, 내 여자친구를 위한 실내차량인테리어.​내 남친, 내 남편의 차량을 화사하게 기분좋은 향을 위해서차량용방향제 선물 좋지 않으신가요??​​이제, 열심히 또 매주 손세차를 해서 블렉체리향이은은하게 오래가도록 잘 해줘야겠습니다.​체크를 해주셔야 하는데, 디퓨저스틱 사용시발향기간이 20~25일 정도 되고, 플라워스틱은발향기간이 10~15일 정도 되기 때문에한개씩 먼저 사용하면 충분히 1달가량 사용이 가능해요.​그러나, 접착패드를 이용해서 대쉬보드 위에 설치가능하지만왠만하면 ~ 컵홀더에 넣어 사용을 하시면 보다 안전하게사용하실 수 있을겁니다 !!​아래링크에 접속하시면 디퓨저를 구입할수 있는데구입하고 바로 셀프실내세차 완벽하게 하고나의 향을 실내에 쫙쫙~~~ ㅋㅋㅋㅋㅋ​​​​",18,0,0,278,4,0,247.2,31,text_ad,2019. 6. 15. 15:10,2573,721831,,"['제가 제일 좋아하는 블랙체리향 이네요', '역시ㅋㅋㅋ향을아시네요', '블랙체리향 저도 담에맡아보고싶네요 ㅎㅎㅎ', '향을알아보시는구만요ㅋㅋ']"
3,https://blog.naver.com/hsh0744?Redirect=Log&logNo=222031150081,"#마스크보관케이스#마스크파우치#마스크보관#마스크케이스#비스코랩​​아직까지 시국이 시국인 만큼 마스크를 사용해야하는 전세계 ;코로나19 바이러스는 언제쯤 ....마스크공급이 원활하게 되는 현 시점이지만 외출시 마스크 보관하기참 어려운 사정입니다.​그렇다고, 점심시간이나 저녁시간 or 외출시 잠시 벗어 둘때 보관하기 참 곤란해요;​​이 불편함이 있는 Goose Daddy 뿐만 아니라 모든 유저분들...불편함을 해결할 수 있는 마스크보관케이스를 보여드릴까 합니다;총 10EA 준비를 한 Gosoe Daddy 입니다.가족들하고 지인분들에게 선물을 하고자 준비한 마스크케이스 ;​​2가지 타입이 있는 비스코랩 마스크케이스는흰색, 반투명으로 구분이 되어 있습니다;​그냥 마스크보관케이스 아니냐는 의문이 있지만현존하는 하드케이스 마스크케이스 중에 가장 가성비 좋은 제품이라서10EA를 준비를 한 것이에요;​​​시중에 대부분 판매되는 비닐지퍼팩 스타일은PVC 재질이라서 인체에 접촉하는 제품에는사용이 금지되어 있다고 합니다.​​그리고 , 구리필름도 준비를 해보았는데구리필름은 특허권을 보유한 ""닥터씨유""사의정품 구리필름을 사용을 해요 ;현재 소방청을 비롯한 공공기관에서 사용하고 있으니더욱 믿음이 가는 구리필름;​​이러한 구리필름을 마스크보관케이스에 부착을 하면어떨까 싶었습니다; 비스코랩 마스크케이스와 옵션으로제공 되는 닥터CU 항균동필름 !!​뛰어난 세균박멸 효과와 반영구적인 사용기간으로 안전하게마스크를 보관할수 있기 때문에 챙기면 참 좋겠죠?​​​특히 항균 동필름의 특징을 아시나요??세균 박멸 효과 99.99% 라고 나와있는데세균박멸 효과가 뛰어나 감염을 일으키는 세균을지속적으로 박멸하고 세균의 분화 및 분열을 억제한다고 해요;반영구적인 소재로서 습기와 건조로 인한 반복적인 마모에도존재하는 한 항균작용은 끊임없이 지속되며 100% 재활용 가능한친환경 소개라서 인체와 환경에 무해한 항균 소재임을 알려주더라고요 ;​구리필름까지 부착을 하였으니 이제 더 위생적으로마스크 보관을 할수 있겠다는 생각을 했습니다;​​No PVC 무독성 하드타입의 비스코랩 마스크케이스;코로나와 미세먼지로 인하여 이젠 필수품이 되어버린 마스크 ....이러한 필수품을 아무렇게나 보관하면오염의 위험과 세균 번식도 쉬워지고 있으니 마스크케이스 사용하면참 편리함이 좋다는 것을 느낄수 있어요 ~​​현존하는 하드케이스 마스크케이스 중 가장 작고 슬림하고고급스러운 디자인으로 만들었고 Made in Korea 제품으로써믿고 쓸 수 있으니 참 좋은 마스크보관케이스;​​2가지 타입으로 되어 있는 마스크보관케이스는회사용 일상용으로 구분을 하려고 해요 ~​​일회용마스크를 사용하거나 KF마스크를 사용하시는분들도반으로 접어서 그대로 넣으면 끝 !!​책상이나, 사무실, 주방, 탁자, 자동차 위에 올려 놓아도나름 산뜻한 디자인 연출을 낼수 있는 마스크파우치입니다.​​제공 되는 구리필름은 스티커 형식으로 되어 있으니간편하게 마스크케이스 안쪽 양면에 부착하여 사용하면 되는데Goose Daddy는 1매만 부착을 하였습니다; ^^​동영상을 보시면 참 편리하게 휴대성있게 사용할수 있는 마스크케이스;슬림한 사이즈이지만 덴탈마스크 뿐만 아니라일반 두툼한 천마스크도 한번만 접으면 케이스 안에 잘 들어가기 때문에걱정하지말고 나를 위해 타인을 위해 마스크보관케이스 사용하시면 좋을듯 합니다;​​컴팩트한 사이즈이기 때문에 주머니나 가방에 쏙 들어가는비스코랩 마스크보관케이스 ;​이제 마스크케이스도 일상생활 필수품으로 구분이 되서1인 1EA 사용할 수 있으면 참 좋겠다는 생각이 들었습니다;​금주 , 주말 집에 가면 와이프 , 딸, 아들, 부모님께 하나씩 챙겨드려야 겠어요 !!​​아래 좌표 클릭해서 들어가시면 가성비 좋은 마스크케이스를 만날수 있습니다;↓↓↓​​​​​ 

-
트 086비610
04066

본 포스팅은 실제 상품이나 서비스를 제공받아
건강한 리뷰문화를 만들기위해 작성한 진솔한 후기입니다.

 

 
",17,0,0,346,0,1,247.2,15,text_ad,2020. 7. 15. 0:01,2573,721831,,0
4,https://blog.naver.com/hsh0744?Redirect=Log&logNo=221977976845,"#아이폰11#아이폰케이스#카드수납케이스#카드지갑케이스#교통카드지갑#핸드폰카드수납#아이폰11케이스#부착형케이스#세렌디​​많은 직장인분들 교통카드를 이용을 하시게 되는데카드를 일일이 꺼내고 넣고 하기 귀찮잖아요;​그래서, 제가 개인적으로 좋아하는 휴대폰악세사리 쇼핑몰'세렌디' 에서 카드수납 가능한 파우치 하나 소개할까 해요 !!​​휴대폰 후면에 부착도 가능하지만왠만하면 케이스 부착하시면 아주 좋을듯 합니다.​일단, '세렌디' 업체에서 2가지를 선택을 하게 되었는데 ~베이직 + 덮개식 파우치를 선택을 했습니다.​또, 색상은 개인 취향대로 여러가지 있기 때문에 고르면 되는데Goose Daddy는 덮개식으로 브라운 색상과베이직으로 레드 색상을 택하였어요 ;​​우선, 덮개식 브라운 색상을 보여드릴텐데요 ~​개별 포장이 되어서 오기 때문에 걱정 안하셔도 되고1개당 1클리닝제품도 동봉 되어 있습니다.​저는 일반적인 케이스가 아닌 투명 케이스에 부착을 하려고 하는데요 ~​​카드수납 파우치는 후면에 3M으로부착이 가능하도록 되어 있어요 ;​​일단, 덮개식 브라운 색상을 부착하기 전클리닝 제품을 이용해서 케이스 겉면을 깨끗하게 먼지를 제거를 합니다.​​제품 후면에 있는 보호필름을 제거를 해주시고요 ~​​그대로 케이스 뒷면에 부착을 하시면 되는데위치가 맞지 않을 경우 뗴어서 재부착이 가능하니 걱정 안해도 되요;​​표면이 고른곳이라면 부착하여 다기능으로 사용 가능한 만능 케이스 !!고급 접착식 카드 케이스 이면서 최고급 라이크라 원단을사용했다고 합니다. 또, 2~5장 정도 수납 가능하더라고요;​​이렇게 깔끔하게 카드수납케이스 완성이 되지요 ^^ㅋㅋㅋㅋㅋ또, 풀 덮개식으로 깔끔하게 디자인 연출이 되기 떄문에내가 좋아하는 색상을 골라서 케이스에 부착하면 아주 깔끔해보인다는 것;​​-다음으로는 베이직 카드 수납 파우치를보여드릴텐데요 ~~​​기본적으로 케이스 후면을 꺠끗하게 닦아주신 후윗 방법처럼 사용하시면 끝 !!​​원하는 위치에 알맞게 설정을 하신 뒤 부착을 하시면간편하게 부착이 됩니다.세렌디 심플 베이직 카드 수납 파우치도덮개식 카드 수납과 동일하게 최고급 라이크라 원단 사용이 되고여러장 수납이 가능해요 ~ 그리고 걱정하시겠지만쉽게 늘어나지 않는 뛰어난 복원력이 있고 ,특수 제작된 원단으로 들뜸 최소화 시켰기 떄문에 문제 없다는 것;​​교통카드나 사원증 등 다양하게 활용이 가능하여편리성이 뛰어나는 것도 있어요; 따로 카드를 빼내어 사용해야하는 수고를덜어주는 똑똑한 세렌디 카드수납 케이스 파우치 ;​​이 제품 하나로 깔끔하게 심플하게 꾸며보시면 참 좋을테고 ~직장인분들에게 적극 추천하고 싶은 제품이네요 ^^​Goose Daddy는 출근 할 때 기숙사 카드를 소지하고 다녀야 하는 번거로움이 있는데이제 세렌디 카드수납 파우치 덕분에 편안하게 들고 다닐수 있겠습니다 ^^​​​​​​​​​​​본 리뷰는 무상으로 제공을 받은 서비스에 대하여 솔직한 후기이면서​정직한 포스팅으로 작성하였음을 밝힙니다.",17,0,0,285,2,0,247.2,13,text_ad,2020. 5. 31. 0:00,2573,721831,,"['오 진짜 편할듯요 >.<', '나 하나 줘 ㅋㅋ']"
