,Post URL,Post,Image num,sticker num,gif num,Paragraph num,Comment num,Video num,weekly viewer mean,Sympathy num,AD,Posting Date,Buddy num,Total visit,Blog category,Comment detail
0,https://blog.naver.com/innerdark?Redirect=Log&logNo=222277373861,"꽃다발 받거나 결혼 후 부케 버리긴 아깝고 말리고 보관할 장소 없어서 고민 중이던 분들께 완전 추천 드리는 #부케 DIY #무드등 이에요♡​#로건부케유리돔무드등 인데 배송 받자마자 집에 있는 튤립으로 만들어 봤어요.​​​​​​짠!개봉해보니 로건에서 직접 디자인 제작된 선물 상자랑 백,​그리고 대형 유리돔과 받침대, 고정용 고무, 전구, 건전지가 들어 있어요.이거 #신혼부부 #집들이선물 로도 엄청 좋은 DIY키트인만큼 #선물 할 때 위에 같이 온 선물 상자로 포장할 수 있어서 더 만족 만족~ 🥰​​​​​​제가 준비한 건 #튤립 #꽃다발 ♥︎#리허설 용 #조화 부케 였는데 요렇게 재탄생합니다.​​​​​​요게 동봉된 고정 고무인데 저거 위에 꽃을 꽂아주는 거예요!​​​​​​짠 #어린왕자 나 #미녀와야수 에 나오는장미 유리돔 느낌이죠?이거로도 너무너무 예쁘지만 이번에 만드는건#꽃다발무드등 이니까이제 여러다발 한 번에 꽂아봅니다.​​​​​​​열심열심~펜치로 자르고 선물 포장 테이프로 붙이고~​​​​​​​마지막에는 전구를 휙휙 감아줍니다.어떻게 감아도 예쁘니까손재주 걱정하지 마세요~​​​​​​배터리를 삽입하고 버튼을 on으로 밀어줍니다.​​​​​​​불 켰을 때​불 껐을 때​​대.존.예.....❤❤❤❤​​​​​​피카츄 피규어랑 향수로 장식해봤어요.​진짜 너무 예쁘죠?#인테리어소품 으로 짱짱..👍👍👍은은한 불빛이어서 #무드등 으로도 제격특히! 신혼집 침실에 두면 대박이에요.​만드는 내내 온가족 함께 자르고 붙이고 해서 재밌고 행복한 시간을 보냈습니다.❤​​​​​​https://bit.ly/3aX3T4x",22,0,1,146,0,1,54.8,0,suspect,2021. 3. 16. 15:56,48,348117,상품리뷰,0
1,https://blog.naver.com/innerdark?Redirect=Log&logNo=222371629200,"​줌으로 온라인수업을 진행하시거나 화상회의를 하시는 분들말하고 들어야할 인원은 많은데 핸드폰 스피커폰으로는 들리는 거리도 음성을 잡는 정도도 약해서그동안 많이 불편하셨죠?​혹시 컨퍼러스콜 이라는 걸 아시나요?​단체콜 할 때 불편한 걸 한 방에 해결해주는 #스피커폰 이에요.​이번에 리뷰할 제품은 화상회의스피커폰 앤커 컨퍼러스콜 입니다.​​​​제품을 개봉해보면 스피커폰을 보호하고 있는 보호 파우치와 함께설명서, 보증서, 주의사항이 적혀있는 페이퍼북이 있어요.​​​​​​​연결하는 방법은 두 가지인데줌이나 화상회의 프로그램을 실행 중인 컴퓨터에 USB를 통해 직접 연결 하는 방법과블루투스 페어링을 통해 모바일기기나 컴퓨터에 연결하는 방법이에요.​​​​​제품을 통해 볼륨 조절과 전화 받기/끊기, 마이크 음소거, 음악 재생 및 중지를 실행할 수 있어요.​​​​​​​​스펙을 살펴봅니다.​기본 통화 시간이 길어서 화상회의스피커폰 으로 쓰기에 적당합니다.​​​​​​보호 파우치를 열어보면 딱 맞게 스피커폰이 짠 하고 튀어 나와요.​평소에는 이 파우치에 보관하면 되니까 따로 보관용 파우치를 살 필요가 없다는게 깨알 같은 장점이에요.​​​​​앞면​​​뒷면​​​​전원 버튼과 블루투스 페어링 버튼​​​​​usb, 외부 Aux out 포트, 충전 포트​​​​​전원 버튼을 수 초 동안 꾹 누르면 하얗게 점등이 되면서 전원이 켜집니다.​​​​​​​​저는 스마트폰과 블루투스 페어링을 통해 연결해보았어요.블루투스 목록에서 Anker PowerConf 를 눌러서 페어링 시켜줍니다.​​​​​페어링이 완료되면 블루투스 쪽에 파란색 led가 들어옵니다.​​​​​​​​전화가 오면 녹색 led 등이 켜집니다.전화를 받아볼까요 ?​​​​굉장히 큰 소리로 쩌렁쩌렁 울리는 벨소리와 전화 소리 :)화상회의스피커폰 다운 소리 입니다.​​​​​볼륨 조절을 하면 파란색 led가 켜집니다.​​​​​​음소거를 하면 빨간색 led가 켜집니다.​​​​​​​통화 종료도 제품을 통해 할 수 있습니다.​완전 만능이라 컴퓨터나 핸드폰의 통화 기능을 대체할 수 있답니다.그룹 회의나 수업으로 고생하시던 분들,앤커 파워 컨퍼런스콜 블루투스 스피커폰 마련해보시는건 어떤가요?​​​​​​https://bit.ly/2Ta3XHJ​​ 

얼체로부터 상품(서비스)만 제공받아 작성한 실제 후기임니다.
 
",28,0,0,204,0,0,54.8,0,text_ad,2021. 5. 28. 13:53,48,348117,상품리뷰,0
2,https://blog.naver.com/innerdark?Redirect=Log&logNo=222165630271,"오늘 리뷰할 제품은 브리사에서 나온 블루투스 동글이 4.2예요!요거는 별도의 설치 드라이버 없이 블루투스가 지원되지 않는 구형 컴퓨터, 노트북, TV, 헤드셋, 스피커, 오디오, 차량 등에 블루투스 기능을 만들어주는 역할을 해요~즉 선이 필요했던 제품들이 선 없이도 연결이 되는 거죠!다만 블루투스 미지원 기기에 AUX 단자 (이어폰 단자) 가 있어야 합니다 :)​최근 나온 차량들은 블루투스를 지원하지만 구형 차량은 그렇지 않아서 스마트폰 음악 들을 때 불편하고는 하죠 ㅠ_ㅠ그럴 때 가장 유용해요~또 예전에 샀던 스피커들!!!성능은 아직도 쓸만한데 블루투스를 지원 안 해서...음악이나 영상 좀 스피커 통해 듣고 싶은데 도저히... 도저히.. 주륵....ㅠㅠ맨날 동글이 동글이 동글이 노래를 부르고는 하다가 이번에 송신과 수신 양방향 다 지원하는 브리사 동글이를 마련하게 됐어용!!​짠!포장은 요즘 트렌드에 맞게 엄청 심플하고 컴팩트해요.들어있을거만 딱 들어있고 직관적인게 좋죠.​​뒷면도 마찬가지로 이 제품이 어떤 제품인지 구매하기 전에 충분히 알 수 있도록소비자에게 전달하는데 충실합니다.Brisa 엄청 맘에 들어요!!!​​​내용물을 열어보면 봉지 안에 케이블 선 하나, USB 수신기 하나, 설명서 하나가 있습니다.케이블선의 양 쪽이 모두 이어폰 모양인건 양방향 수신을 위해서예요 :)USB 수신기(동글이)끝 쪽에도 케이블선 한쪽을 꽂을 수 있는 구조로 되어 있어요.​​1. 우선 나는 블루투스 이어폰이나 헤드셋을 가지고 있는데, 내 TV나 PC가 블루투스를 지원하지 않을 경우: 송신기 모드​이럴 때는 PC나 TV에 동글이를 꽂아서 블루투스를 지원하게끔 만들어줘야 합니다.PC나 TV에 USB 단자가 있으면 USB 수신기(동글이)를 직접 연결하시면 되고,USB 포트가 없을 경우 AUX 단자를 찾아서 케이블을 꽂은 후 반대쪽 케이블은 USB에 꽂고 USB는 충전기에 꽂으시면 됩니다.그리고 수신기의 불이 빨간색으로 들어오게 하면 됩니다.그런 후 블루투스 이어폰이나 헤드셋을 페어링하면 끝!​2. 나는 스마트폰이나 스마트TV를 갖고 있는데 내 이어폰이나 스피커, 차량 오디오 등이 블루투스 지원을 안한다.: 수신기 모드​이때는 스피커나 차량 오디오 등 블루투스 미지원 기기에 케이블을 꽂아 블루투스 페어링이 가능하게끔 만들어줘야 합니다.따라서 스피커나 오디오 등 해당 기기의 AUX 단자를 찾아 케이블 선을 연결 후,반대 쪽 케이블 선을 USB 수신기에 꽂고 RX 스위치를 수신 모드에 둡니다.스마트폰이나 스마트TV 블루투스 창에서 BRISA-042를 페어링하면 끝!​​​저는 2번을 아주 자세하게 예시로 들어 설명해볼게요~​제게는 구형 스피커bar가 하나 있어요~쓸만은 한데 블루투스 기능이 없어서 한계가 있는 슬픈 제품이죠..ㅠ_ㅠ가뜩이나 줄도 짧은데...이 스피커의 AUX 단자를 찾습니다.헤드셋 모양의 단자가 AUX 단자이기도 해요 !​​​한 쪽을 스피커에 꽂았으니 한 쪽은 저렇게 남겠죠?남은 한 쪽은 USB 수신기, 즉 brisa 라고 깜찍하게 쓰여있는 동글이에 꽂아 줍니다!​​짠!이렇게하면 합체!!저 USB 수신기에 저런식으로 이어폰 케이블을 꽂을 수 있는 구멍이 있어요.그렇게 양방향은 완성되고~​그럼 이제 의문이 들거예요.이 USB는 그럼 어디에.. 쓰는 거지...?​​​바로 전원이에요!동글이에 전류를 공급해야 수신기 역할을 하겠죠?아마 이거는 차량에서 많이 쓸 거기 때문에 차량용 시거잭을 가져왔어요~차량용 시거잭 충전기에 연결!집에서는 일반 핸드폰 충전기에 연결하시면 돼요 :)​​​완성하면 이런 모양이에요!아직 불이 안 들어온 상태입니다 ㅎㅎ그럼 스피커의 전원을 켜볼까요?​​​​전원을 킨 후에 해야할 일은 수신기의 버튼을 RX로 바꿔주는 거예요.이게 가장 핵심 포인트!!!!TX가 송신모드고 RX가 수신모드인데 RX로 바꿔주어서 불빛이 파란색으로 바뀌는걸 확인해야해요.​​동영상으로 한 번 볼까요?​​위와 같이 빨간색에서 파란색으로 수신기의 불빛이 바뀌면 페어링 준비 끝!!!그러면 블루투스를 잡으러 스마트폰의 설정>블루투스 고고~~​​​​​블루투스 목록에서 BRISA-042를 찾아서 연결을 하면 위와 같이 스피커와 연결이 돼요.스마트폰 상태바에도 제대로 블루투스 이어폰 표시가 뜨고 있는거 보이시나요? :)​​​이제 원하는 음악을 재생해볼까요 > < !!!!​​​이제 다시 한 번 동영상으로 복습해 보아요~~~​​​​​​​문득 하다가 떠오른 의문인데그럼 이 블루투스... 보조배터리로도 될까!? 였어요.보조배터리로도 되면 밖에서도 할 수 있으니 대박인데!​보조배터리에 꽂는 순간 파란 불은 들어오고 페어링도 정상적으로 되긴 합니다.​하.지.만....​​위와 같이 몇 초 후 보조배터리에서 전력공급을 자동으로 멈춥니다.아무 반응이 없으면 멈추게 되어 있으니까요.다른 보조배터리로 해도 다 같은 반응이에요.슬프게도 보조배터리로는 불가능하다는 결론.보조배터리 자체가 방전 방지를 위해 전력 공급이 필요한 기기에 충전을 해주는 방식을 택하고 있기 때문이에요.​​​오늘은 이렇게 브리사 동글이에 대해 아~주 자세히 알아봤어요!역시 IT에 대해 리뷰하는 날은 기분이 좋아요 >_<다음 번 리뷰도 기대해주세요!!!​​구매처 :https://smartstore.naver.com/sinpungin/products/4628911056​​​​#블루투스오디오동글 #컴퓨터블루투스 #PC블루투스 #TV블루투스 #무선동글 #블루투스USB #차량블루투스 #차량용블루투스리시버 #블루투스리시버 #TV블루투스 #동글블루투스동글이 #데스크탑동글[것
",24,0,0,539,1,2,54.8,1,text_ad,2020. 12. 7. 14:02,48,348117,상품리뷰,['블로그 글 잘 봤습니다소통하고 지내요!!답방도 부탁드려용 >_<']
3,https://blog.naver.com/innerdark?Redirect=Log&logNo=222234594242,"할머니가 충수염 수술을 하신 이후계속 대소변을 못가리셔서 간병용으로 여러가지 환자용기저귀를 샀었어요.​아기 기자귀도 그렇지만 노인기저귀도 종류도 많고 까다롭게 골라야하더라고요.​이 기저귀는 테나의 간병용기저귀예요.테나는 선진복지국가 스웨덴 브랜드이고60년 이상의 연구개발을 통해 세계 1위를 지키고 있는 브랜드로 국내에서는 일반 소비자보다는 요양원이나 전문 시설에서 더 유명하고 간병인들과 전문가들 사이에서 알려진 브랜드예요.​​종류가 엄청 많죠?그 중에 어디에 속하는지 위에 그림으로 보여줍니다.​​윗 부분을 양 손으로 뜯어서 개봉합니다.​​​​아기 귀저기나 여성용품에 비해 엄청 크고 두꺼워요.그동안 쓰던 성인용기저귀들에 비해 소변 흡수율도 더 좋았어요.​​신축성 있는 밴드와 접착 스티커가 있어서 어르신과 환자에게 편한 디자인이에요.엉덩이 부분도 다 커버되어서 좋네요.​​http://www.tenamall.co.kr/goods/goods_view.php?goodsNo=274&NaPm=ct%3Dkhtsw66w%7Cci%3D0Au00027ZVDtnJxWW0XE%7Ctr%3Dbrnd%7Chk%3De081ba5411862be02a3726111c4d1384dd6154da​현재 1+1 이벤트를 하고 있어요!​​​#환자용기저귀 #노인기저귀 #성인용기저귀 #간병기저귀​​<img src=""https://www.revu.net/campaign/img.php?p=8a02424a104bb7d69a747660263d0aa7db693e19d302716ac8028b44ed9b2578&amp;v=4"" title=""wb-sponsored"" alt="""" />",20,0,0,95,1,1,54.8,0,,2021. 2. 6. 22:54,48,348117,상품리뷰,[]
4,https://blog.naver.com/innerdark?Redirect=Log&logNo=222354450261,"​오늘은 긴긴 자동차 여행에 필수품인차량용공기청정기를 개봉해볼 예정이에요.​이번주에 여행을 갈 예정인데강원도까지 무려 3시간 거리를 차 안에서 지내야하니쾌적한 공기가 필수 중에 필수!!​기존에 갖고 있던 초미니 공기청정기는 사실상 무용지물이라서 여러가지 차량용공기청정기를 고민해봤어요.​그러다 로엘 블랙홀Z10이 H13등급 헤파필터를 적용했다는 말을 듣고 이거다 싶었습니다.​차량용공기청정기에 차량용헤파필터라니!!이거야말로 차박 필수템 아닌가요?​​​​​포장은 정말 심플하고 깨끗하게 되어 있어서 마음에 듭니다.​깔끔하게 회사명, 제품 사진, 제품타입, 모델명필요한 정보만 딱딱 전달하는 외관에서부터 신뢰도가 높아집니다.​​​​양 쪽면에 초기씰로 밀봉이 되어 있는 모습입니다.​​​​​개봉을 해보면 사용설명서와 제품 본품, 제품 악세사리 박스 3가지로 구성되어 있습니다.​​​​​​사용설명서에는 구성품과 주의사항그리고 사용법이 자세히 나와있습니다.​​​​​위의 사항을 잘 기억하시면 됩니다 :)​​​​공기청정기 본품은 윗면은 보호필름이 붙어있고아랫면은 충격흡수용 망이 하나 깔려있습니다.​과대포장 없이 딱 제품만 안전하게 포장되어 있어서박스 모으는 IT마니아의 심장을 저격합니다.​박스까지 모으는 입장에서 봤을 때,쓰잘데 없이 부피만 큰 상자는 오히려 비호감입니다.이렇게 단아한 모습이 박스 마니아에게도 좋고환경에도 좋고분리수거하기도 좋죠.​​박스 디자인 점수 ★★★★★​​​​​​박스에서 꺼내 본 본품 모습입니다.맨 위에 ROEL 이라고 차량용공기청정기 회사 로고가 크게 박혀있습니다.​​​​제품 바닥면입니다.네 방항에 고무로 미끄럼방지 처리가 되어있습니다.​KC인증마크도 보입니다.​​​​​차량용공기청정기 Z10 옆면과 전원 버튼 입니다.​​​​​​​​보호 필름을 제거해봅니다.늘어나는 비닐 제형으로 되어 있습니다.생각보다 두꺼운 보호 필름이라 기스 하나 없이 깨끗한 모습을 볼 수 있습니다.​​​​​차량용 헤파필터를 적용한 Z10 차량용공기청정기는당언히 필터를 분리하기 쉽도록 설계되어 있습니다.​우선 회사 로고가 박힌 상단부를 손으로 살짝 눌러 돌려줍니다.​달칵하면서 상단부가 열린 구조로 되어 있습니다.​​​​​상단부를 제거하면 차랑용 헤파필터가 보입니다.지금은 완전 새제품이라 깨끗한 파란색이네요.​차량용헤파필터 아래부분에 보이면 회색 종이 손잡이가 보입니다.(포스트잇 같은 느낌)이 회색 네모 종이를 쭉 잡아당기면 필터를 분리할 수 있습니다.​​​​​​​필터까지 분리한 모습입니다.아래에 붉은색 쿨러가 보이네요.​라데온이라고 크게 쓰여 있는 모습 보이나요.​어러분이 생각하는 그 라데온이 맞습니다.블랙홀Z10은 세계 최초로 라데온 쿨러를 내장한 차량용 공기청정기입니다.​초 저소음 팬을 적용해서 저소음모드로 공기청정기를 작동할 시에는 여행과 차박에 방해가 되지 않을 정도의 소리라서 귀가 편하다는게 또 다른 특징입니다.​​​​만약 필터의 상태가 교체가 필요하다 느껴지면위의 방법대로 필터를 꺼내 새 필터를 넣으시면 됩니다.​닫는 방법 역시 필터를 넣고다시 상단부를 시계 방향으로 달칵 하고 돌려주면 끝​​​​​​구성 악세사리도 심플하게 단싱자에 들어있습니다시가잭과 헤드레스트 단 두 개 뿐입니다.​​​​​​이 헤드레스트는 아이가 있는 집이나 강아지를 키우은 집에게 좋습니다.보통은 앞좌석에 공기청정기를 두지만손님이나 아이를 태울 때 뒷좌석을 향하게 하고 싶으면 이용하시면 됩니다.​운전석이나 보조석의 목받침 부분(헤드레스트)에공기청정기를 연결하는 끈입니다.​위에 개봉기를 보시면 제품 아랫면에 금속이 보이는데 이 헤드레스트가 지나가는 자리 입니다.​​​​​​​​공기청정기 작동을 위한 필수품인 시거잭입니다.​굉장히 마음에 드는 점은 usb 포트가 내장되어 있다는 점 입니다.아무래도 차량에 시거잭 포트가 한정적인데 공기청정기를 꽂아버리면 네비게이션이나 휴대폰 충전을 못하는 불상사가 걱정이 되고는 하죠.​그 걱정을 덜어주는 usb 포트입니다.​​​​시동을 키면 usb 포트도 붉은 램프가 들어옵니다.​​​​​또한 공기청정기 전원 버튼도 붉은색이 들어옵니다.​​​​​​장거리 여행이나 차박의 필수품이라 여행 전에 주섬주섬 챙겨줍니다.​​​​​이건 모드에 따른 색깔 변화입니다.버튼을 한 번 누를 따마다 램프 색상이 바뀌며 단수도 바뀝니다.​​​ ​​​​꾹 눌러주면 전원이 꺼집니다.​자동과 수동 전환도 되고모드도 4개나 되고라데온 쿨러에 헤파필터까지 적용한 최강의 차량용 충전기​이번 여행은 덕분에 쾌적한 공기와 함께할 수 있어 너무 기쁩니다. 😘​​​​https://m.smartstore.naver.com/roelinc/products/3472727989​",39,0,0,407,0,1,54.8,0,suspect,2021. 5. 17. 14:34,48,348117,상품리뷰,0
