,Post URL,Post,Image num,sticker num,gif num,Paragraph num,Comment num,Video num,weekly viewer mean,Sympathy num,AD,Posting Date,Buddy num,Total visit,Blog category,Comment detail
0,https://blog.naver.com/kimint8?Redirect=Log&logNo=221976839574,"올해 다이어리 꾸준히 작성하고 계신가요? 저는 띄엄띄엄 쓰다보니.. 다이어리가 휑~한 부분이 꽤 많은데요.그래서 잠깐이라도 카페가거나 나갈 때, 외출 시간에도 다이어리를 파우치에 가지고 다니는 게 낫겟다!싶어 북 파우치에 넣어가지고 다녀요!요즘 다꾸(다이어리 꾸미기)에 다시 열정적?이에요. 얼마나 갈지는 모르겠지만요 ㅋㅋㅋ아무튼!! 텐바이텐에서만 볼 수 있는 단독 상품인 이번 스누피굿즈! 중 찰리브라운 파우치가 수납이 잘 되고, 예쁘더라고요'-'​​텐바이텐에는 찰리브라운, 스누피굿즈의 종류들이 참 많은데요.다꾸에 없어서는 안될 스티커, 마스킹테이프부터 머그컵, 엽서, 노트 등등 다양한 상품들이 있어요!저는 그 중 찰리브라운 북파우치,  사각 펜 케이스, 그리고 노란색의 우드스탁 통통 키링을 사용해보았어요.​키링의 같은 경우에는 우드스탁말고도 스누피, 찰리브라운의 디자인도 있어요.모두 공식라이센스가 있는 상품이랍니다.​​스누피도 물론 귀엽지만 저는 찰리브라운의 얼굴(?)도 좋아해요!이번에 북파우치와 팬케이스(필통) 파우치 모두 찰리브라운이 그려있는 텐바이텐 상품이에요.키링은 포인트로 에코백이나 필통, 파우치 지퍼링에 달고 다니면 더 귀여워요^^​​스누피굿즈 우드스탁 키링 앞/뒷면 뒷면은 빨간색의 피너츠 정품 라벨이 부착되어 있고요!파우치, 백 등에 달 수 있는 키링 고리 부분은 하얀색이에요!에어팟에 달고 다녀도 귀여울 것 같아요.​​그리고 다이어리나 책을 넣고 다닐 수 있는 피너츠 TIME 북파우치!! 찰리브라운 스타일이에요.같은 디자인의 ""스누피""가 그려진 스타일도 있어요.찰리브라운 북파우치는 네이비 컬러, 스누피는 북파우치는 브라운 컬러로 나왔더라고요!​뒷면에는 찰리브라운 얼굴이 덩그러니!있고, 파우치를 열어보면 안에도 찰리브라운이 웃고 있어요!​​왼쪽에는 다꾸에 필요한 마스킹 테이프, 수정테이프를 자크 안에 넣어두고 가위와 스티커..!!그리고 안쪽에 엽서까지 수납공간은 3곳이 있어요!​그리고 오른쪽에는 2020 다이어리와 펜을 하나 넣고 다녀요.​​그리고 북 파우치 왼쪽 수납란 지퍼링에 노란색의 우드스탁 키링을 한번 달아봤어요!뽀인트로 잘 어울리는 키링이에요 ㅋㅋㅋ 베이지 컬러 에코백에 달아도 예쁠 것 같아요!스누피 굿즈.. 디자인 예쁘죠!?​월간으로 시리즈물로 출시 예정이라고 하는데.. 다음에는 어떤 시리즈물이 나올기 벌써 기대되네요.​​다이어리를 메인으로 이것저것 파우치에 넣어 둔 상태에서, 닫아보니 생각보다 빵빵하지 않아요!무게도 들만한 무게에요.​​그리고 북파우치와 함께 사용 중인 스누피굿즈, 찰리브라운 TIME 사각 펜 케이스도 깔끔하게 나왔어요!앞면에 찰리브라운 얼굴이 있고, 뒷면에는 캐릭터가 따로 그려있지는 않아요.​​각이 잡힌 사각 모양이라 꽤 수납이 많이 되는게 장점이에요.저는 아이보리 컬러의 바탕에 네이비 컬러의 테두리 케이스이지만 반대로 네이비 컬러 바탕에 아이보리 테두리로 나온 펜 케이스도 있어요!처음에는 필통으로 쓸까..?아니면 립스틱, 화장품 등을 넣는 파우치 용도로 쓸까? 하다가..!!​​저는 노트북 충전 케이블 + 무선 마우스 + 이어폰을 넣는 용도로 사용하고 있어요!이렇게 3가지를 모두 넣었는데도 공간이 넉넉해 USB나 외장하드도 추가로 들어갈 것 같더라고요!O링 지퍼에 키링을 달고 다니면 더 예쁠 것 같아요!​​​ 

얼체로부터 상품(서비스)만 제공받아 작성한 실제 후기임니다.
",29,0,0,326,37,1,2817.0,33,text_ad,2020. 5. 24. 17:57,1911,5962530,일상·생각,"['스누피 넘 귀여워요 ㅠ_ㅠ다이어리 쓰다가 잊고, 또 쓰고 가끔씩 까먹게되요', '깔끔하고 너무 귀여워요!저는 다이어리 쓰고 싶어서 쓰다 말다...한 3개 돌려가면서 쓰다 말다 하네요.ㅎㅎㅎㅎㅎ 이쁜 거 보면 또 쓰고싶어져요~~', '블로그 소통하러 왔어요~ 공감 누르고 갑니다!', '놀러왔어요~ 잘보고가요~', '즐점하세요.', '잘 보았습니다~^^', '꾸벅', '', '안녕하세요^^ 방문 했다가 메시지 남깁니다~ 좋은하루되세요!!', '좋은제품 잘보고 갑니다~앞으로 자주 찾아뵐게요^^', '구경하고 갑니다^^', '마실이님 블로그 놀러왔다 갑니다 ;)', '헐 너무 귀여워요?? 꺅ㄴㅋㅋㅋㅋ', '글 잘 보고갑니다. 즐거운 하루 보내세요~', '스누피굿즈 넘 귀여워서 다 사고싶어요ㅠㅠㅠ', '마실이님 안녕하세요 ^^\n블로그 공부하다가 서이추신청 살짝 해봅니다\n친하게 지내고 싶어요 ~']"
1,https://blog.naver.com/kimint8?Redirect=Log&logNo=222208701373,"2021년 1월 1일 새해 첫날 ㅋㅋㅋ눈 뜨자마자 이마트 트레이더스가서 에어프라이어 7.2L AFG-1901T 에어프라이어를 구매해왔어요.에어프라이어 없는 집 요즘 없잖아요?? 사실 베이킹하면서 오븐을 들이고 나니 마땅히 주방에 둘만한 자리가 없기도 하여,여태껏 구매를 미루어왔었는데 더 맛있게 이것저것(?)해 먹어 보고 싶어서 이마트 트레이더스 출똥!!!​+내 돈 내고 구매한 후기​​참고로 에어프라이어는 어느 브랜드 제품을 살까하다가 이마트 트레이더스 에어프라이어가 국민 에어프라이어기 같아서 매장으로 향했는데요.​큰게 아무래도 작은 것 보다는 나을것 같아 7.2L모델인 AFG-1901를 생각하고 갔는데막상 매장에 도착하여 보니 7.2L 사이즈가 어마어마하게 많이 크더라고요. ㅋㅋㅋㅋ 탱크인줄..!!!​ 7.2L를 사야하냐!! 5.2L를 사야하냐!! 한 1분 정도 고민한 뒤 큰걸로 담아 넣었어요.​​이마트 트레이더스 에어프라이어 가격은더 에어프라이어 플러스 AFG-1702T (5.2L) 79,800원더 에어프라이어-X AFG-1901T (7.2L) 89,800원​저는 운좋게 삼성카드 할인기간이어서, 만 오천원 할인받아 74,800원에 구매했어요 >.<​​5.2L와 7.2L 사이즈 비교!!! 차이가 꽤 나죠??!!저희는 4인 가족이라서 에어프라이어 용량을 7.2L로 선택했는데,2인 가족이었어도.. 7.2L로 선택했을 것 같아요..!!​ 2주동안 실제로 사용해보니 작은것 보다는 큰게 훨씬 편하고 좋더라고요 ㅋㅋ4인가족이 삼겹살을 에어프라이어로 해서 먹을 때 7.2L로 두번은 돌려야 양이 부족함 없이 맞는 거 같아요.(대식가 분들은 무조건 큰걸로!!!!)​​그리고 에어프라이어와 세트로 꼭! 구매하면 좋은 종이호일!!!가격은 90매에 9,980원입니다. ​함께 구매하세요.​​그 이외 AFG-1901T 7.2L 바스켓(ABG-1901T)도 추가로 구매 가능한데요.저는 종이호일만 일단 구매했고 바스켓은 살까?하다가 당장 필요할 것 같지는 않아서,담지는 않았어요 ㅎㅎㅎ​​트레이더스 에어프라이어 THE AIRFRYER-X 특징​확 커진 용량!, 테프론 코팅 바스켓, 2시간 보온기능 추가, 바스켓 분리 가능, 바스켓 추가 구매 가능, 세척 가능온도, 시간 조절 당연히 가능, 스페셜 전용매트 포함되어있음!!​​사용설명서와 레시피북 함께 들어있었어요.레시피북은 처음 개봉 이후로 한번도 펴본적은 없지만 ㅋㅋㅋㅋㅋ언젠가 보게 되겠죠?!!!​제품 사이즈에 맞게 나온 전용 매트는 나름 두툼하고 퀄리티 있어요.​​우리집만 없었던 에어프라이어 개봉 ㅋㅋㅋㅋㅋ​​모든게 다 큼직큼직 바스켓도 본체도.. *.*​​바스켓 분리는 손잡이 투명 캡을 밀면 나오는 버튼?을 꾹 누른 상태에서 들어 올리면 쉽게 빠진답니다.처음에는 바스켓과 그리고 바스켓 통까지 함께 세척해주었어요. (식초 이용)​그리고 공회전!!! 꼭 돌려주세요.새 제품 냄새..를 빼주는 효과?? 냄새가 꽤 많이 나요..ㅋㅋㅋㅋㅋㅋ공회전은 200도에 30분 1번 돌리고 냄새가 계속 나길래180도에 15분 한번 더 돌린 후.. 사용했어요. ​공회전 및 제품 사용시에는 베란다문 창문 다 활짝활짝 열어 환기 시켜줘용.​​그리고 이마트 트레이더스에서 함께 구매한 종이호일!!! 아주 잘 쓰고 있답니다.한장씩 깔아서 사용하는데, 삼겹살 구울때도 기름이 새지 않고 가성비 괜찮아요.호일깔고, 김치도 구워먹었어요.​​가장 첫번째로 해먹은 ""감자튀김""트레이더스에서 구매했고 짭짤하니 간도 괜찮아요.양도 엄청 많고 가격도 착하고..한번 구워두면 TV보면서 계속 집어먹게 되어요...ㅋㅋㅋㅋㅋㅋ​제품명은케번디시 크리스피 케이준 양념감자 2KG가격은 6,980원​​그리고 두번째로 에어프라이어에 돌린 제품은 역시나 이마트 트레이더스에서 함께 구매한 ""더블 바베큐폭립""가격은 9,980원!!!! 폭립 두덩이인데 여자 3명이서 나눠먹기 양 괜찮아요!마늘도 같이 구웠어요!​​달달한 바베큐 소스에 고기 냄새도 안나고..!!! 재구매 의사 있는 제품!이에요.찬밥이랑 같이 먹었는데.. 반찬으로?ㅋㅋㅋㅋ 맛있어요!!​아웃백 폭립도 물론 맛있지만집에서 간편하게!!가성비 좋은 트레이더스 폭립도 추천 추천!b​​그이 외 스모크 닭다리도 구워먹고... ㅋㅋㅋㅋㅋ(닭다리는 그냥그랬어요 ㅋㅋㅋ)​​대망의 삼겹살도 구워먹어봤어요'-'에어프라이어에 구워먹는 삼겹살!! 프라이팬에 구워먹는 삼겹살과는 또 살짝 다른 느낌의 맛?둘다 맛있지만 기름 안튀기고 옷에 냄새 안베기 좋더라고요!! 식감 좋아요b​현재 구매한지 딱 2주가 흘렀는데요, 아직 단점은 잘 모르겠고!!진작 살걸!!한 이마트 트레이더스 에어프라이어 후기였어요..ㅋㅋㅋ  ~ 2
이
",45,0,0,425,24,0,2817.0,51,,2021. 1. 15. 21:35,1911,5962530,일상·생각,"['거거익선이랬어요 ㅋㅋㅋㅋ무조건 큰거!!! 이마트꺼가 유명한데 역시! 잘 사셨네요>_< 전 냉동식품 정도만 돌려먹는데 역시 제대로 된 요리를 해드시네요!! ♡', '으아아아ㅏㅏㅏㅏ 너무 맛있어보여요!! 당장 이마트 달려가야겠네요 ㅎㅎ 정보 감사합니다♡', '요즘 트레이더스가 괜찮은 물건이 많은 것 같아요~오늘도 신랑이 아침에 한번 다녀왔네요^^;;', '에어프라이기는 역시 큰게 짱이에요ㅎㅎ', '마실이 자주 자주 놀러올게요', '삼겹살구울때 냄새날까요~?', '에어프라이어 지금 엄청 고민중인데,,, 트레이더스 제품이 가성비 좋다 하긴하는데... 괜찮을까요??', '안녕하세요. 저도 집앞에 트레이더스가 있어 이제품 알아 보고 있는데 쓸만 한지 알려주시면 너무 감사드려요.', '정보  감사합니다~혹시 가로 세로 사이즈 좀 알수있을까요?', '저희 집은 AFG-1702T를 샀는데 바스켓 5.2L도 따로 팔던가요??', '안녕하세요 ㅎㅎ 세척이 번거롭거나 하진않나요 ?!', '내일 사러가야긋다 ㄱㅅ요', '저도 살까 하는데, 삼겹살 구울때 냄새랑 소음은 어떠세요~? 프라이중에 겉면 많이 뜨거워요? 집에 아이들이 있어서 걱정이네요 ㅠ']"
