,Post URL,Post,Image num,sticker num,gif num,Paragraph num,Comment num,Video num,weekly viewer mean,Sympathy num,AD,Posting Date,Buddy num,Total visit,Blog category,Comment detail
0,https://blog.naver.com/mjati?Redirect=Log&logNo=221918352279,"안녕하세요~ 뷰스타 루인입니다.집에 있는 동안 어느덧 날씨가 많이 따뜻해졌더라구요.그래서 그동안 미루어 두었던 겨울옷 세탁도 하고,침구류도 빨면서 지내고 있는데,전 오랫동안 가루세제가 아닌 액체 세탁세제를 사용하고 있었거든요.근데 매번 얼마만큼을 넣어야하는지 확인하고계량컵에 따르고 하는 게 불편했는데,계량할 필요가 없는 캡슐세제를 사용하기 시작했답니다.​​​계량컵 사용하지 않고 그냥 넣기만 하니까정말 편하긴 하더라구요.​​제가 사용한 캡슐세제는 나노클린에서 나오는 화이트 일반용 세탁세제예요.​http://www.nanoclean.kr​​제가 사용한 일반용 이외에도부드럽고 순한 유아와 속옷용, 이불 속 살균까지 책임져주는 이불용으로나누어져서 용도에 맞게 구입해서 사용해도 되더라구요.​각각 구매하면 유아&속옷용 45개입 : 21300원일반용 35개입 : 18900원이불용 18개입 : 11700원 모두 합해서51900원으로 적지 않은 금액이지만세트로 한번에 구매하면 30% 할인이 되어서36300원으로 저렴하게 구매할 수 있더라구요!​​​​이것저것 나누어서 넣는 것이 불편하다면 그냥 저처럼 일반용으로 사용하시면 될 것 같아요. 같은 캡슐세제 3개를 구매하면 1개를 증정하는 이벤트도 현재 진행 중이라서구입하실 때 3개 한번에 구입하면 자동으로 1개가 증정되어서 총 4개가 온답니다.​​​​나노클린 화이트캡슐세제는 한통에 총 35개의 캡슐이 들어있어요.​​​15g의 액체세제가 캡슐에 담겨있어서 기본 빨래 정도는 이거 하나 넣고 돌리면 되더라구요.하나의 캡슐세제에는 6배 고눙축 세탁세제와 섬유유연제 그리고 기분좋은 향기까지 모두 담고 있어서 따로 다른 것을 넣을 필요가 없어요.유해물질, 알러젠 프리로 99.9% 분해되는 식물성 계면활성제를 사용해서민감하고 예민한 모찌군 피부에 닿는 옷, 이불 등을 마음놓고 세탁할 수 있어요.​​​​8중  파워효소로 얼룩, 찌든 때까지 강력하게 모두 세탁해준다고 하는데오래된 얼룩까지 모두 지우기엔 힘드니까그런 것들을 애벌빨래해서 넣는 것이 좋더라구요.​​​​보통 7kg 이하의 빨래는 캡슐세제를 1개만 넣으면 되는데,이불빨래같이 양이 많은 빨래는 2개를 넣어주면 된답니다.근데 이렇게 위에 넣어주는 거 아니고 아래에 넣어주어야 한다고 해요~!​​​​제가 가루세제를 사용하지 않게 된 건 꽤 오래 되었는데그게 빨래를 하고 난 후에 가루 찌꺼기가 남아 있는 것을 보고 난 후였어요.그 뒤로 액체세제를 사용하기 시작했는데매번 무거운 액체세제를 들었다 놨다 하는 것도 번거롭고..너무 큰 세제를 어딘가에 두는 것도 작은 집에선 공간을 너무 차지하고..매번 계량컵을 사용해서 적당량을 따라서 넣어주는 것도 번거롭더라구요...​그러던 차에 캡슐세제를 사용해볼 기회가 생겼었는데,사용해보니까 세상 간편하더라구요!​그렇게 캡슐세제의 매력에 빠졌었는데..​​​​세제가 섬유에 남는 것이 신경 쓰여서 바꾼 세제인데과연 캡슐이 정말 잘 녹는 걸까..섬유에 들러붙어 있진 않을까 싶은 걱정이 되잖아요?​물론 빨래 하고 나서 세제가 들러붙어 있던 적은 없었지만 그래도 괜히 궁금해서​​​탱탱했던 액체세제를 물에 넣어봤어요!​이 액체세제가 제가 손으로 눌러도 쉽게 터지지 않는데,과연 잘 녹을까 싶었거든요.​​초반에는 모양을 잘 유지하고 있어서손가락을 살짝 들어보니까 살짝 느른~하게 캡슐이 녹아가고 있더라구요.​​찬물에도 잘 녹는 수용성 필름이라고 해서저도 찬물에 캡슐세제를 넣어서 실험해봤어요.​조금 지나니까 거의 필름이 다 녹어서​​​​안에 들어 있는 세탁세제가 흘러나오고 있더라구요~넘나 신기~!​​​​말랑해지고 느른해진 캡슐세제가 너무 신기하더라구요.​세탁기에서 빙글빙글 돌아가면서 더 빠르게 녹을테니확실하게 옷에 잔여물이 남지 않겠더라구요!​​​​며칠 동안 액체세제로 신나게 빨래했더니,금세 많이 없어진 액체세제.​그래도 매번 계량하고 컵 씻어내고 그러는 번거로운 과정이 없어서빨래하는 시간이 단축되기도 했고 세탁실도 깔끔해져서 마음에 들어요!​​​​https://smartstore.naver.com/nanocleanw/products/4778203137​​​​​​​​",20,1,0,382,6,1,1713.4,37,text_ad,2020. 4. 20. 12:38,8946,9441522,패션·미용,"['캡슐세제는 처음 봤어요! 좋은 정보 보고 갑니다~', '새로운 한 주가 시작 되었네요!와우 포스팅 대박~ 성실 눈에 속속 들어오네요!오늘하루도 멋진 포스팅 잘 보고 갑니다!멋진 포스팅 만드는 월요일 되세요!', '포스팅 잘보고 갑니다~ : - )', '자알 보고 갑니다 ~!!', '나우먼트 쇼핑몰입니다. 아직은 작은 쇼핑몰인데ㅎㅎ 열심히 해보려구요. 시간날때 검색한번 해보고 놀러와주심 좋을듯해요']"
1,https://blog.naver.com/mjati?Redirect=Log&logNo=221506757440,"​안녕하세요~ 루인입니다!예전엔 그렇게 집 꾸미기에 관심이 있지 않았는데,요즘은 괜히 이사도 가고 싶고 집도 꾸미고 싶고새삼스럽게 리빙에 관심이 생겼어요.​그래서 막 집 예쁘게 꾸미고 사는 티니 언니한테도 리빙은 어떠냐고물어보기도 하고..ㅎㅎ​그런데 제가 아직 좀 게을러서 아직 시작도 하지 못 했지만,그래도 관심이 생긴 건 또 제가 막 괜히 들쑤시고 다니는 편이라서이번에 코엑스에서 서울리빙디자인페어한다길래또 냉큼 다녀왔어용!​​​​초대장 들고 쫄래쫄래~!​근데 코엑스는 왜 이렇게 갈 때마다 헷갈리죠?어제도 길 엄청 헤메고..ㅠㅠㅠ​​전 삼성역에서 내려서 갔어용.ㅎ​​전에 코엑스에서 하는 다른 행사할 때 몇번 가봤던 전시회장인데,이번에 서울리빙디자인페어 열리는 거 보니까 지금까지 제가 봤던 건 진짜 작은 행사였더라구요.와...이번에 진짜 넓고 진짜 많은 업체들이 참여해서정말 봐도봐도 끝이 없었던 것 같아요!ㅋ​​​​모찌군이 같이 왔다면 더없이 좋았을 서울리빙디자인페어.​모찌군이 진짜 완전 엘지빠거든요.ㅋㅋㅋㅋ본인은 아니라고 펄쩍 뛰지만..=ㅅ=누가 봐돠 그냥 엘지빠임.ㅋ​근데 저도 좋긴 하더라구요.ㅋㅋ​​특히 클로이 너무 귀엽..ㅠㅠ목소리도 다정한 목소리에,특히 이름 부르면 반응할 때의 모습이 꼭 주인이 강아지 부르면바라보는 것처럼 쫑긋~ 하는 게 정말 귀엽더라구요.​점점 생활은 엄청 편리해지는데뭔가 그걸 따라가지 못하고 있는 느낌.ㅋ​​​​​가전제품 뿐만 아니라, 가구, 그리고 소품들까지 가득가득해서정말 볼거리가 많았어요.​​그리고 요즘 모찌군이랑 관심있게 보던 스피커!​요즘에 모찌군이랑 맨날 스피커 있는 곳보면 꼭 들려서 구경하곤 했거든요.​​​이번 서울리빙디자인페어에도 많은 브랜드가 참여했더라구요~!​그 중에서 매번 스피커 코너에서 보았던 달리!​​특히 달리 블루투스 스피커 캣치는 심플한 디자인에, 예쁘기까지 해서저도 기억하고 있는 스피커거든요.​서울리빙디자인페어에서 만나니까 괜히 더 반가운 느낌.ㅋ​​​덴마크 라이프스타일 오디오인 달리를 중심으로다양한 사운드 시스템을 경험할 수 있는 ODE PORT가 신사동에 있다고 하더라구요.​달리 뿐만 아니라 다양한 제품을 취급하고 있다고 하니까음향기기에 관심이 있으시다면 신사동 복합문화공간 오드포트(@ode.port)에 방문해보시면 좋을 것 같아요!​달리 인스타그램은 @dali.korea​​​예술의 전당에서 열렸던 존레논 전시회에도 사운드플랫폼 ODE에서 음향기기들을 협찬했었다고 하더라구요~!​​​이번 서울리빙디자인페어에도 그 때 전신에 사용되었던 것들 중 일부를볼 수 있게 전시되어 있었답니다~!​​전 지금 집이 막 엄청 공간이 널널한 상황이 아니어서이런 작고 심플한 스피커를 하나 구입하고 싶다고 생각하고 있었거든요.요즘 블루투스 스피커 추천으로 검색하면 정말 많은 스피커들이 검색되는데막상 오프라인에서 소리를 들어보면 생각한 소리가 아니어서실망하게 되더라구요.ㅠㅠ​이어폰도 왜, 잘 못 사면 진짜 막귀인 제가 듣기에도 이건 좀..싶은 것들이 많잖아요...​그래서 특히 이런 스피커들은 사실 가격이 엄청 저렴하고 그렇진 않잖아요.그러니 더 꼼꼼하게 직접 소리 들어 보시는 것이 좋을 것 같아요.​​​달리 블루투스 스피커는 앞에 2개, 뒷 쪽도 2개의 스피커가 달려서양방향으로 소리가 나더라구요.​그래서 하나만 있어도 어디에서든 풍부한 사운드를 즐길 수 있어서좋겠더라구요!​그런데 이게 또 2대가 있으면,2대를 페어링해서오른쪽, 왼쪽으로 사운드를 나누어서 틀 수도 있다고 해요~​​​​서울리빙디자인페어에서 20% 할인으로 저렴하게 만날 수 있으니까블루투스 스피커를 찾으시는 분들은 달리 부스 한번 가보시면 좋을 것 같아요!​노래 틀어주시는데 진짜 소리가 다르더라구요!​색도 5가지로 선택지가 다양했어용.​전 파란색이랑, 그레이 블루투스 스피커가 마음에 들더라구용~​​​​다른 스피커들도 구경했는데, 스피커 자체는 깔끔하고 예쁘지만,선이 나와서 좀 고민이 되는 분들에겐,​​​칼리스토 스피커가 깔금해서 좋겠더라구요!​​​​여기선 전선이 이렇게 나와 있는데원래는 봉 안 쪽으로 넣어서 더 깔끔하게 사용할 수가 있다고해요!​​​디자인도 깔끔하고, 앰프가 스피커 안에 내장되어 있어서,불필요한 선 노출이 없어서 더 깔끔하게 사용할 수 있어서더 인기가 있겠더라구용.ㅎ​​​조작도 간단하게 리모콘으로도 할 수있는데,리모콘 말고도, ​​스피커의 상단부분을 손가락으로 터치해서 음량을 조절할 수 있다고 하더라구요?!​대박이죵?!딱히 버튼이 막 있거나 보이지 않는데,​​​​음량이 조절되는 것이 아랫쪽 불빛으로 표시가 된답니다!​소리를 들려드리고 싶은데 저작권이..;ㅅ;ㅋㅋㅋ​​​특히 가게하는 분들께 인기가 좋다는 벽에 걸 수도 있는 스피커들!​그렇게 달리 부스에서 막 궁금한거 물어보고 설명도 듣고나왔는데, 다른 곳 다니다 보니까 아까 만났던 달리 스피커들이다른 곳에도 함께 전시가 되어 있더라구요~!​​​덴마크 프리미엄 가구로 유명한 프리츠한센에도곳곳에 ODE 스피커가 있더라구요~​​​인테리어에 자연스럽게 녹아서 진짜 나중에 이사가면 집에 두고 싶더라구요.ㅠ!​​​​정글집같은 USM.​전 이번 서울리빙디자인페어에서 처음 봤는데,너무 신기하더라구용~!​스위스 엔지니어와 건축가의 합작으로 탄생한세게 최초의 모듈러 퍼니쳐라고 하더라구요~​​​​그리고 여기서도 만났던 ODE 스피커!이렇게 USM의 디자인과 만나서 뭔가 또다른 느낌이더라구요.​사운드 플렛폼 ODE가 서울리빙디자인페어 다른 부스에도 협찬을 해서인테리어적으로 어우러져 있는 모습을 보니까,전체적으로 아, 이런 느낌으로 집에 두면 되는구나 라고 보여서좋았던 것 같아용.​특히 전 아무래도 아직 인테리어가 너무 어려운완전 초초초초초초초보이다 보니까이렇게 인테리어로 다 어우러져 있는게 더 볼만 했던 것 같아용.ㅋ​​​​여기저기 돌아다니다 보니 네스프레소도 참여를 했더라구요.버추오 시음을 진행하고 있어서 저도 한잔 마셨어용.ㅋㅋ​집에서 내려간 커피가 있었지만..ㅎ​역시 버추오는 크레마가 장난 아니죵.ㅋ​​​​인테리어 소품도 너무 예쁜 것들이 많더라구요.ㅠㅠ이렇게 또 리빙, 인테리어의 꿈을 꿔봅니다.​그전에 이사부터 가야함.ㅋㅋㅋㅋㅋ​​​아이용 메모리폼 의자도 있었는데,진짜 너무 귀엽더라구요.ㅠㅠ전 아이가 없어서 그런지 이거 보고 우리 토끼님들 앉음 귀엽겠다고생각해서 모찌군에게 슬며시 톡을 보냈지만..모찌군의 반응이 없었다는 슬픈 이야기.ㅋ​​진짜 너무너무 넓고 볼 것도 많고, 여러 이벤트나 행사도 많이 하고 있더라구요~!​​​​이 글은 위블을 통해 본 업체에서
제품 또는 서비스를 제공받아 작성된 글 입니다.

세
",38,1,1,603,3,1,1713.4,14,text_ad,2019. 4. 6. 4:59,8946,9441522,패션·미용,"['블로거 검색으로 통하여  블로그에 들어왔는데,  쓰신 글이 너무 맘에 들어요. 정독  하고  갑니다또 드릴께요^^꼭 행복하세요~~', '네~ 반갑습니다~', '감사합니다 한주도 건강한 행복 되세요']"
2,https://blog.naver.com/mjati?Redirect=Log&logNo=221925823705,"안녕하세요~ 인플루언서 뷰스타 루인입니다.요즘 저희집 거실에서 사용 중인 디퓨저 어도르 베이직 실내방향제!요즘 인테리어 디퓨저들이 많아지면서,다양한 제품들이 나오는데 매번 인테리어로 화려한 제품을 사용하다가다시 베이직으로 넘어오게 되는 것 같아요.ㅎㅎ​​어디에 두어도 깔끔하고 잘 어우러지니까,사무실 디퓨저로 사용하기도 좋고 저처럼 집에서 사용할 때도어디에나 둘 수 있어서 좋더라구요.​​​좁은 공간에서 여러가지의 디퓨저를 사용한다고 한다면되도록이면 말리고 싶지만 그래도 꼭 사용하고 싶다면전 너무 튀는 향 말고 이미 사용 중인 향들과 어우러지는 향을 선택하시면 좋을 것 같아요.​​저희집은 넓은 집은 아니지만 제가 향기로운 집을 만들고 싶은 마음에침실 디퓨저로는 마음을 편안하게 해줄 은은한 라벤더를일하는 공간에는 에너지를 얻을 수 있게 상큼한 시트러스계의 디퓨저를 두었는데저희집은 거의 문을 다 열어놓고 살기 때문에다양한 향들이 섞이면서 어느 지점에서는 굉장히 머리 아픈 향기가 나기도 하더라구요.문을 꼭꼭 닫고 다니는 집이라면 각각의 공간에 다른 향기를 두어도 괜찮겠지만저처럼 문을 다 활짝활짝 열고 생활하는 집이라면대략적으로 비슷한 계열의 향기로 통일을 해주시는 것이 좋답니다.​​​전 플로랄계의 향수를 무척이나 좋아하는데 그래서 그런지집에 플로랄계와 코튼계의 향수와 디퓨저가 많은 편이에요.​이번엔 거실디퓨저로 들인 거라서 플로랄계의 실내방향제를 선택했답니다.​​​​​깔끔하게 포장되어 도착해서, 선물용으로도 좋을 것 같던 어도르 더모멘트 디퓨저!​리드스틱은 옆 쪽에 부러지지 않게 꼽혀서 왔더라구요.기본 스틱은 5개가 들어 있어요.​​​​​100ml의 대용량이라서 사무실에 두고 쓰기에도 좋을 것 같더라구요~​어도르 베이직 디퓨저는 클린민트, 화이트리넨, 로맨틱 블로썸. 사봉블랑, 식물원으로 총 5가지의 향이 있는데,이 중에서 제가 선택한 것은 로맨틱한 벚꽃향의 로맨틱 블로썸을 선택했어요.​​뭔가 올해 꽃보러 못 나간 걸 이런걸로 풀고 싶어하는 심리가 무의식중에 발동된 것 같아요.ㅋㅋ​​다른 향들도 궁금했는데 이렇게 다른 향들을 시향 해볼 수 있게 같이 와서다음에 거실디퓨저 고를 땐 여기서 시향해본 걸로 선택하려구용.​​​​어도르 더모멘트는 깔끔하고 예쁜 나무모양의 뚜껑이 세트로 오는데상자 열어서 보니까 이 뚜껑이 벗겨져 있었더라구요;;;그래서 상자 열 때 향이 확 풍겼나 싶었지만,안에는 이렇게 한번 더 마개로 막혀 있어서 내용물이 흘러나오진 않았더라구요.​​​안에 마개까지 모두 뽑아내면 이제 리드스틱만 꼽아주면 끝이에요!​​​리드스틱 5개가 오면 5개를 한번에 몽땅 꼽으시는 분들도 계시는데,그러면 자칫 향이 너무 독해질 수도 있어요!그러니까 2-3개 정도 먼저 꼽아 보시고며칠 지낸 다음에 발향이 조금 더 있었으면 좋겠다~ 싶으면그 때 추가로 꼽는 것이 좋답니다!​​​​거실 어디에 둘까~ 고민하다가우리 귀여운 구르미 옆에 디퓨저를 두었어요.구름이는 산책을 좋아하는 편이 아니어서 살아생전에 한번도 꽃놀이를 가보지 못 했는데가끔은 싫어했어도 사진이라도 하나쯤 찍으러 나갈 걸 그랬다 싶기도 하더라구요.​괜한 후회.ㅎ​계속 생각나면 다음에 구르미 양모인형 들고 나가서 찍어줄까봐요.​​​​요렇게 완성~!​요즈 집에만 있었더니 집을 좀 둘러보게 되고,뭔가 정리하고 싶어지더라구요.ㅋㅋ진짜 지금까지 금방이라도 이사갈, 아니면 금방 이사온 사람들처럼 하고 살았는데..-ㅅ-ㅋㅋ​조금씩 정리라는 걸 해보려고 노력 중입니다.​요즘 아주 그냥 오늘의집 어플을 끼고 살아요.ㅋㅋ​​​​전 리드스틱이 나란이 이렇게 있는 것보다,​​​​살짝 이렇게 각각 벌어져 있는 모습이 좋더라구요.ㅎㅎ일부러 한번씩 만져주고 있어요.ㅎㅎ​​​향이 조금 약하다 싶으면,리드스틱을 빼서 병 안에 담겼던 부분을 위로 가게 한번씩 바꿔 끼워주면좀더 발향률이 좋더라구요~​집이 너무 건조해도 발향률이 약해지기도 한대요.​​남은 2개는 잘 보관했다가, 향이 많이 약하다~ 싶을 때 추가로 꼽아줘야겠어용!​​​​어도르는 부산 부산조향공방에서 만드는 디퓨저더라구요.전문 조향사가 직접 조향을 해서 그런지 독하고 머리아픈 향이 아닌기분 좋게 달콤하고 은은한 꽃향기가 살며시 풍겨서 거실에 있는 시간이 즐거워졌어요~다음엔 어도르의 시그니처 사봉블랑과 식물원 집에 들이고 싶네용~!ㅎㅎ​​​​​https://smartstore.naver.com/ador_/products/4823121052​​​​​​글은 블로그원평대을 동해 해당 업체에게
자 또느 서비스유언 솜자게작성된글 니다
|,
 
",20,1,0,432,4,1,1713.4,24,text_ad,2020. 4. 24. 3:49,8946,9441522,패션·미용,"['저도 리드스틱은 나란히보다 벌어져있는게 좋은거같아요! 은은한 꽃향기라니..좋아요 꽃향기!!!!!', '구리미 액자 너무 예쁘네요~ 다음에 구르미 인형이랑 바깥에서 사진 하나 찍어서 옆에 놓으면 마음이 더 편해지실 것 같네요 😊 왜 인생은 항상 후회가 남는 건지 .. 😭', '혹시 아가 액자 어디서 제작하신건지 알수있을까요~?', '구르미 액자는 https://idus.kr/dWaM 에서 구입했습니다.']"
