,Post URL,Post,Image num,sticker num,gif num,Paragraph num,Comment num,Video num,weekly viewer mean,Sympathy num,AD,Posting Date,Buddy num,Total visit,Blog category,Comment detail
0,https://blog.naver.com/mkhiya1?Redirect=Log&logNo=222229348408,"언제 한파였냐는 듯 요즘엔 한낮 기온이 8~12도까지 올라가더라구요.미세먼지도 아주 청정하고~이 정도면 근처 공원에 점심때 잠깐 산책하기 너무 괜찮은 날씨~^^조만간 또 우리는 무박 차박 캠핑을 계획하고 있는데요야외 나들이나 캠핑 필수템으로 음악이 빠질 수 없죠.분위기를 업해주는데 필수 요소니까요!이런 음악을 야외에서 제대로 들을 수 있는 아이템이 스피커잖아요.이왕이면 예쁘고 작으면서 파워 짱짱한 것이 가지고 다니기 참 좋은데요~​​​​​​얼마 전 출시된 LG엑스붐Go PL2 블루투스 스피커가 딱이라는 생각^^PL 시리즈 중 깜찍한 모양과 컬러가 제대로 눈길을 사로잡는존재감 갑 캠핑 아이템이에요!여기에 가벼워서 휴대하기 좋고어마무시한 음질과 오래가는 파워는야외용으로 정말 최고라는 찬사를 보낼 수 있는데요어떤 기능들과 특장점들이 있는지 꼼꼼히 살펴볼게요~^^​​​​​LG 엑스붐 Go PL2는 화사한 컬러와 한손에 쏙 들어오는귀여운 젤리빈 디자인이 정말 매력 포인트에요!​앞태 뒤태 다 깜찍하고 깔끔하고~~^^​아이스민트, 버블검, 사우어 레몬 3가지 컬러가 있습니다.가격은 출하가 기준으로 99,000원인데요디자인과 퀼리티 대박인 음질, 휴대성 등등 살펴보면합리적인 가격이라는 생각이 들어요^^​​​​​3가지 톡톡 튀는 컬러는 개인의 취향이나 사용하는 장소의 분위기에 따라선택하기에도 너무 좋은데요~저는 상큼하고 깜찍한 사우어 레몬을 사용하고 있어요.집도 그린그린 자연물이 많고 야외를 나갈 때도 나무가 많은 곳을 선택하는데산뜻하고 밝은 사우어 레몬 컬러는주변 그린 컬러의 자연물과 너무 조화롭게 잘 어울리더라구요^^거실에서 요즘 아이들과 댄스 타임, 홈트레이닝을 하면서 음악을 사용할 때가 많은데요이렇게 행잉 플렌트와 함께 걸어두면 인테리어 효과도 나고 너무 자연스럽게 잘 어울려서 더 사랑스러워요.진짜 깜찍 디자인의 최고봉!​​​​​​컴팩트한 사이즈와 350g의 가벼운 무게가 주는 유용함이 너무 좋아요.한 손에 쥐고 이동하기 좋고여기 저기 걸어서 사용할 수도 있고휴대하기도 좋고~진짜 짱이죠?​​​​​전체적으로 매트한 러버 코팅이 되어 있고바닥은 논슬립 처리가 되어 있어서어디에서 사용하든 미끄러짐 없는 안정감을 제공해준답니다^^​​​​​버튼부의 피팅라인도 끝내주죠?^^스피커 홀도 하나하나 깔끔하게 마감 처리가 되어 있어서날카로운 곳 하나 없이 정말 매끈하게 잘 빠졌어요~​전체적으로 깔끔하고 고급스러움이 함께 느껴지는깜찍한 블루투스 스피커 랍니다^^​​​​​스피커의 제일 중요한 요소는 바로 고퀄리티의 빵빵한 사운드가 기본잖아요~LG 엑스붐 Go PL2를 야외 용 캠핑 필수템으로 추천하는 이유에는음질 깡패 기능도 있답니다^^​미니멀한 디자인이지만 음질은 맥시멀!프리미엄 메리디안 사운드가 적용되어 있는데요영국 하이엔드 오디오 브랜드 메리디안과 파트너쉽을 통해결이 다른 사운드를 제공하기에언제 어디서든 어떤 음악이든 정말 생생하게 귀 호강할 수 있어요^^​​​​​그리고 너무 유용한 사우드 부스트 기능!!요 버튼 한 번만 눌러주면작은 음악 소리도 복잡한 설정 없이공간을 가득 채워주는 생동감 있는 소리로 증폭시켜 주어서더 크고 웅장한 사운드를 느낄 수 있어요.특히나 저음이 강조되는 음악은 더욱 생동감 있게 감상할 수 있다는 거~^^또 강력한 무선 파티 링크 기능이 있어요.2대의 스피커를 무선으로 연결하면 출력이 2배로 업된다는 거!!!!더욱 파워풀한 고출력 사운드는 넓은 공간에서도얼마든지 제대로 풍부한 사운드 즐길 수 있답니다^^​​​​​저는 야외에서 음악을 틀어 보았어요.요즘 제가 푹 빠진 남성 4중창 포레스텔라의 엔젤이라는 노래인데요남성 4중창이다보니 저음과 고음이 공존하는데어떤 음도 놓치지 않고 정말 깔끔하고 풍성하게 들려주죠?​친구도 함께 듣더니 음질이 왜이리 좋냐며 아주 깜짝 놀랐어요.진짜 이런건 소장템이에요^^​아 힐링 제대로다!​​​​​​컴팩트한 사이즈와 350g이라는 가벼운 무게는야외 아웃도어 활동에서도 활용도 만점이에요.어디에 걸어도 부담감 없거든요~​라이딩 할때 자전거 손잡이에 걸고 사용하기에도 딱임!ㅋ등산 시 가방에 걸수도 있죠^^​​​​​​캠핑, 라이딩, 등산 등 단시간에 이루어지는게 아니잖아요~그래서 야외용 블루투스 스피커를 고를 때최대 사용 시간도 꼼꼼히 따져봐야하는데요~​블루투스 스피커 LG 엑스붐 Go PL2는완전 충전 시 최대 10시간 사용 가능한 1,500mAh의 대용량 배터리라서야외에서도 충전 걱정 없이 오랜 시간 음악을 즐길 수 있어요^^​​*10시간 재생 시간은 EQ 모드 OFF, 볼륨 15 (50%) 작동, LG전자 내부 테스트 음원 12곡 기준이며, 실제 구동 시간은 사용 환경에 따라 달라질 수 있습니다.​​​​​그리고 돌밥돌밥 시대!!제가 하루 중 가장 많이 있는 곳이 주방이에요.힘들지만 즐거운 요리를 위해 좋아하는 음악을 들으며 준비하는데요리 하다보면 언제 어디서 물이 튈지 모르는데요이건  IPX5 등급의 생활방수 기능이 적용되어 있어서운동 중에 흘리는 땀이나 눈, 비와 같은 갑작스러운 기상 변화에도안심하고 야외 활동 가능한 아이템이기에주방에서 살짝 튀는 물방울 정도는 일도 아니에요.~ㅎㅎ​​​*모든 방향에서 분사되는 낮은 수준의 물방울로부터 보호가 가능합니다.​​​​​​오른쪽 측면의 홀더를 열면충전단자와 AUX 단자 등등이 있습니다.​그리도 또 다른 기능으로 음성으로 간편하게 제어하는 구글 어시스턴트, 시리 지원이되는데요재생 버튼을 2초간 누르면 연결 가능하며 실시간 음성 명령으로 간편하게 음악 재생이 가능해요.​​​​​언제 어디든 휴대하기 좋고야외에서도 풍부한 고퀄리티 음질로 음악을 즐길 수 있는블루투스 스피커 LG 엑스붐 Go PL2 !!깜찍한 디자인으로 인테리어 효과도 있고좋아하는 음악을 고퀄리티 음질로 들려주어요즘 제 힐링템이 되어주고 있어요. 진짜 애정함!3가지 컬러풀한 젤리빈 스피커 외에도 매트 블랙, 실버화이트 컬러 및출력, 사이즈에 따라 PL5, PL7 제품도 출시되었으니취향이나 사용 환경에 따라 폭넓게 선택 가능하니 꼼꼼하게 살펴보세요^^​​​​​[LG전자로부터 소정의 제작비와 함께 제품을 대여 받아 제작했습니다. ]​​​​#캠핑필수템 #블루투스스피커 #블루투스스피커#LG엑스붐GoPL2 #블루투스스피커추천",15,0,0,616,6,1,11665.2,29,text_ad,2021. 2. 2. 21:06,8270,27317175,패션·미용,"['디자인도 너무 예쁘고 야외 활동에도 안심하고 사용할 수 있다니 하나 장만해봐야겠어요~', '스피커 고르는 중이었는데이거 딱이네요^^', '디자인도 색감도 완전 깜찍한걸요사이즈도 아담해서 캠핑가서 사용하기 완전 좋네요~', '', '디자인 컬러너무예쁘네요+_+사운드 부스터기능 넘 맘에들어요!!!!!ㅋㅋ', '깜찍하고 색이 넘 이뻐요 캠핑감성 스피커네요']"
1,https://blog.naver.com/mkhiya1?Redirect=Log&logNo=221573038297,"미사신도시로 이사 온 뒤로 바뀐 라이프스타일에 맞춰필요한 것들을 장만하는 재미에 푹 빠졌어요~특히나 집 옆에 물, 잔디밭, 하늘이 너무 조화롭게 예쁜경정장 공원에 주말 마다 놀러 가고강원도와 경기도 여행 인기 지역이 너무 가까워지면서월에 1~2회는 여행도 꼭 가기에 나들이와 여행에 필요한 장비들 구입이 늘었는데요거기에 우리 아이들의 니즈에 부응하여여행과 나들이를 더욱 신나게 만들어줄 수 있는음질 깡패 LG 엑스붐Go PK7 블루투스 스피커를 장만했는데완전 내 선택을 칭찬해~~^^​​​​​사운드, 디자인, 기능 어떤거 하나 바찜 없이모두 뛰어난 LG 엑스붐Go PK7 블루투스 스피커 추천~~!!실내에서도 감각적으로~실외에서는 스타일리쉬하면서 강력하고 풍성한 고퀄리티 사운드로 분위기 제대로 압도!그래..이 정도는 되어야 탁 트인 실외에서 제대로 즐길 수 있지~​​​​​우리 집에도 무선 충전식 블루투스 없는 건 아닌데요.그런데 미니멀한 크기이다 보니실내에서는 유용하지만이렇게 탁 트인 실외에서는 소리가 제대로 전달되지 않고소리를 최대치로 높이다 보면 음질이 좀 떨어지는 현상이 발생해서실외라도 텐트 한정이었는데LG 엑스붐Go PK7는 정말 탁 트인 넓은 실외 어디에 두어도 빵빵하고 깨끗한 음질이 잘 전달이 돼요.​​​​​​바로 음질 테스트~볼륨을 최대치로 높여도 절때 깨지지 않는 고퀄리티~저음으로 낮춰도 또렷 또렷!​영국의 하이엔드 오디오 명가인 메리디안 오디오와 공동 개발한 고음질 음향 기술-메리안 사운드 기술이 적용되어서음향의 폭이 넓고 음상도 높아져, 어디에서나 현장감 넘치는 고음질의 풍부한 사운드를 감상할 수 있다는 거!!!​​​​​​메리디안 오디오가 튜닝한 “저음강화(ENHANCED BASS)”와 “목소리보정(CLEAR VOCAL)” 기능은사운드를 더욱 웅장하고 명료하게 전달해주어이렇게 넓은 공원, 시끄러운 사람들의 소음 속에서도 우리 아이들이 좋아하는 음악을 아이들 귀에 제대로 전달해 준다죠^^​​​​​​ 어찌 된 게...동요를 좋아할 나이에..재롱잔치 이후로 가요를 사랑하게 된 여니와 후니~지금도 최신 가요 들으면서 덩실 덩실 선풍기 댄스를 추고 있어요.자신이 좋아하는 음악에 방해되는 소리가 조금만 끼어들어도울고 불고 떼쓰는 후니인데LG 엑스붐Go PK7를 사용한 이후로는 밖에서 언제나 해맑은 모습만 보여주고 있기에사운드 깡패 블루투스 스피커 추천! 강력합니다​​​​​​그리고 정말 완전 무선!완충하면 최대 22시간 사용 가능한 것도 너무 좋고~aptX HD 적용으로 24비트 음원을 손실 없이 무선 수신 해주고고음질 음원의 블루투스 스트리밍도 가능하고~!​ ​​- 정면에 위치한 듀얼 트위터와 듀얼 패시브 레디에이터가명료한 고음과 웅장한 저음을 전달하는데여기에 측면에 위치한 사이드우퍼 액션이 전해주는 웅장한 저음까지 시너지 효과를 내서어떤 음악이든 전체적으로 소리의 균형이 맞게 고르게 들리는 느낌!정말 고퀄리티 사운드란 이런 거 구나를 알게 해주는 블루투스 스피커에요^^​​​​ 스피커의 제일 우선인 음질만 잡은 게 아니라스타일리쉬한 디자인에단단하고 튼튼한 프레임까지~​정말 실외 안성맞춤 블루투스 스피커라는 거~!​​​​​​게다가 음악이 재생되면비트 라이팅이 지원되는 멀티컬러 라이팅 기능이 작동하면서음악의 비트에 맞춰 라이팅이 번쩍 번쩍 하니 더욱 스타일리쉬함이 살아 살아~어디를 가지고 다니든 뽀대가 나!!!어플을 사용하면파티, 워터, 포레스트, 마이스타일 총 4가지 컨셉의 라이팅 모드로 멀티컬러 라이팅을 설정할 수 있는데요저는 개인적으로 파티 모드 대박 강추!!ㅋㅋ아주 현란하게 번쩍 번쩍 내 취향이얌!! ​​​​아이들도 음악에 라이팅까지 더해지니 더욱 신나 해요.이번에 여행갈 때 가지고 가서 밤에 신나게 놀아볼까 봐요.사이키가 따로 필요 없을 듯.ㅋㅋ​​​​​야외에서 들기 편한 X그립 디자인!!어디든 간편하게 한 손으로 잡고 이동 이동~^^​​​​​​그리고 상단에 마이크 버튼 보이시죠?블루투스 스피커 추천 하는 LG 엑스붐Go PK7에는음성작동기능으로 연결된 스마트폰의 구글어시스턴트 / siri 등이 사용 가능해서시간, 날씨 등 정보도 알려줄 뿐만 아니라듣고 싶은 음악이 있을 때 실시간으로 음성으로 주문하면 알아서 척척 들려준답니다.​​​​​게다가 생활 방수 기능도 있다는 거!이날 정말 멀쩡하던 날씨에 잠깐 5분 약한 소나기가 쏟아져서 정말 어찌나 놀랬던지신나게 노래 들으면서 아이들과 놀다가 날벼락!!​아이들 챙기느라..뒤늦게 챙긴 LG블루투스 스피커였지만무사했네요^^좋다 생활방수기능!​​​​​기본 구성에 충전 어탭터 들어 있구요~AUX 단자로 유선연결, 스피커폰, 듀얼 플레이 기능 활용 가능합니다.​​​​​요즘 예비초등 여니는 줄넘기 연습 한창인데요신나는 노래를 들으며 연습하면 더 즐거워하고 에너지도 더 내는 것 같더라구요.그래서 줄넘기 연습할 때도 꼭 챙기게 되더라구요.ㅎㅎ​​​​  고퀄리티의 웅장한 사운드와스타일리쉬하고 내구성 강한 디자인에22시간 재생, 생활방수기능, 즐거움을 더해줄 멀티 컬러 라이팅까지!이건 정말 우리 가족의 바뀐 라이프스타일에 즐거움을 더해주는 아이템으로 정착하였습니다^^​나들이, 캠핑, 운동 좋아하고즐거운 음악으로 더욱 분위기 업하고 싶은 분들께LG 엑스붐Go PK7 블루투스 스피커 추천해요^^​​​https://goo.gl/9effWT​​[이 글은 LG전자로부터 소정의 저작권료와 함께 제품을 무상 대여받아 작성했습니다.]​​1! 9
",19,0,0,535,17,1,11665.2,35,text_ad,2019. 6. 28. 17:31,8270,27317175,패션·미용,"['음질도 좋고 디자인도 깔끔하니 이뻐요^^후니 너무 신나보이는데요나들이 가서 더 신나게 보낼수 있을것 같아요', '현장감있고 풍부한 사운드좋네요시간 날씨등도 알려주고 똑똑한데요나들이가서 분위기 확 업시키겠어요', '음질이 제일 중요한데 좋군요~ 밖에서 사실 너무 작은건 소리가 아쉬움이 있는데 그런 아쉬움은 없겠어요~ 여기에 음악 재생시 라이트가 나온다니 저녁에 들어도 재미있을것 같아요~', '사운드가 가장 중요하다고 생각 되는데 이거는 그걸 만족 시켜 주는 제품이네요', '야외에서 사용하기 좋겠는데요~사운드 디자인 기능 모두 만족스러운 제품이네요야외에서도 고퀄리티 사운드를 들을수 있는. 블루투스 스피커 디자인도 스타일리쉬하네요실외에서도 빵빵하게 깨끗한 음질로 들을수 있어 너무 매력있네요', '예전 오디오 옆 큰 스피커 미니미로 만들어놓은듯 손잡이 있어 간편하게 들고 다닐수 있겠네요', '우와ㅋㅋ미니멀한크기에 사운드까지 빵빵하니 좋네용 ^^', '꺄아음질도 빵빵하게 넘나 좋을거 같아요소풍가서 들어도 만족스려울듯해요', '우왕~ 손잡이 있으니 좋은거 같아요 ㅎㅎ디자인이 깔끔하니 마음에 드네요 ~~ 음악 재생시 라이트가 나오니 좋으네요 ㅎㅎ', '가요를 사랑하는 여니와 후니 ~넘 신나보이는데요 ! 공원으로 나가서 음악만 틀고 놀아두 시간 금방 갈거 같아요 ~', '이 제품 저도 눈여겨 보고 있었는데요~빵빵한 사운드에  거기다 믿을수 있는 브랜드라 선택에 어려움이 없는것 같아요.야외에서도 헌장감 넘치는 고음질이라 최고~~! 나들이 갈때도 꼭꼭 챙겨가고 싶어요^^', 'ㅎㅎㅎ 아이들 신나하는 모습 왜이리 귀엽나요가지고 다니며 뿜뿜 좋아하는음악도 듣고아이들 좋아하는모습 너무 보기 좋아요', '외부에서도 음질 짱짱한 블루투스 스피커 찾고 있었는데 짱이네요 !!저도 집에서 쓰는 블루투스 스피커가 있는데 밖에선 아무래도 약하더라구요', '어머디자인너무예뻐요! 사운드도 괜찮고이제막놀러가는휴가기간이돌아오는데이거 아이들하고놀러갈때 사용하기도너무좋은데요!', '외부에서도 음질이 괜찮은 것 같아요 이런 거 하나 있으면 아이들하고 놀게에도 좋더라구요', '완전무선이라 진짜 밖에서 편하게 음악 듣기 좋겠어요 들고 다닐 수도 있고 말이죠', '꺄음질스티일게다가 무선이라니요너무 써보고싶어요갖고픈걸요활용도가 높겠어요^^']"
