,Post URL,Post,Image num,sticker num,gif num,Paragraph num,Comment num,Video num,weekly viewer mean,Sympathy num,AD,Posting Date,Buddy num,Total visit,Blog category,Comment detail
0,https://blog.naver.com/page56_?Redirect=Log&logNo=222154640433,"한번 해보고 싶었던 #취미생활 중에하나인데 마음에 드는 디자인이 없어서그냥 포기하고 있어요. ​그런데 요즘 #집콕 하는 분들이많아서 그런 지 너무 이쁜 게 많이 나와요. ​그렇지 않아도 #외장하드 케이스 지저분해져서 장식도 할겸해서직접 만들어 보면 더 좋을 것 같아서#디즈니보석십자수 한번 해봤어요.​처음 해보는 거라서 작은 사이즈의 #보석십자수 부터 해봤는데이거 완전 #꿀잼 이여서강추하고 싶어요. #시간순삭 시키는 꿀템이에요 👍그리고 이렇게 #스티커 장식으로도활용 할 수 있어요.​#오십육페이지 처음에 완성하고나면 #폰케이스 장식하고 싶었는데다음에 또 하면 해봐야겠어요. ​​​며칠 전에 보니까 #토이스토리세상에 나온 지 25주 년 이래요 ~​제 인생의 함께 해 온 😢처음에 옆집에 사는 동생이 너무 좋아해서 몇 번이고 보니까자주 놀러가서 같이 보게 되서 처음 알게 됐는데 ​작년에 개봉했을 땐 이라고 적고찾아보니까 2019년 개봉이였어요.​어째든 친구랑 극장에서 보고 왔는데 그때 #포키 매력이란 💖보신 분들은 알 듯해요.​​​말이 필요없음 그래서 고민없이 고른#보석십자수 세트 ​제가 주문한 곳은 #아이러브페인팅 이에요.​이름 때문에 #명화그리기 같은 것만있는 줄 알았는데 다양한 #집콕취미생활 즐길 수 있도록 있어요. ​​​저도 초보자인데 다행이 뒷면에간단하게 설명이 있어요. ​​완성한 거 보시면 아시겠지만누구나 할 수 있어서 요즘 상황이상황인지라 😢​아이들이랑 같이 #취미 즐기는 분들도아이러브페인팅에서 주문을 많이하는 것 같아요. ​​​​오십육페이지는 손으로 하는 건다 좋아해서 웬만한 건 다 거쳐지나갔어요(?) 그런데 이번에 하는 건 처음이라서신기하고 궁금했는데 #취미패키지구매 하면 다른 재료 준비 할 필요없어간편하고 좋아서 바로 시작해요 ! ​이건 진짜 #가위 조차 준비 할 필요없어요 😊#캔버스 #고체풀 #트레이 #펜 #비즈 이렇게 재료가 들어 가 있어요. ​​​캔버스에 그려져 있는 스케치를 자세히 보면 부호가 그려져 있어요. ​그리고 그에 맞는 비즈를붙여주는 거에요.​붙이기 전에 미리 번호를 확인해요. ​​​​이제 트레이에 그에 맞는 비즈를담아주는데 약간씩 담아서 사용해요포키 보석 십자수는 사이즈가많이 큰 편이 아니라 귀찮아서그냥 한꺼번에 담았어요.​어느 정도 사이즈가 있는 작품을취미로 즐기시려면 소량으로나눠서 담아서 하는 게 편해요.​​​고체풀을 펜으로 깊에 눌러요.​이게 과연 붙을까 궁금했는데비즈 찍으니까 붙어서 신기했어요. ​캔버스에 보호필름이 덮여져 있는데붙이려는 부분만 살짝 벗겨서 비즈를 눌러서 붙여요. ​​​​​​드라마 정주행 하면서 하니까 시간 더 잘 흘러가는 것 같아요. ​간단하게 #꼼지락 할 수 있는 것 찾는 분#디즈니 좋아하는 분들 해보세요.진짜 재미있어요 ~~ ​​그리고 아이러브페인팅보석십자수 중에 #방탄 있어요.저도 #내적팬 인거 같긴해요 ㅋㅋㅋ ​또 포키 외에도 다른 토이스토리와디즈니 캐릭터들도 있어요.​​#앨리스 해보고 싶었는데인기 많아서 품절이였어요. ​​하나 완성 해놓고 보니까 너무 재미있어서 또 해봐야겠어요.​​​​​​완성한 건 #스티커 처럼 부착 할 수 있어서 그냥 보기만하는 게 아니라 원하는 곳에 붙일 수 있어요.너무 자주 사용해서 지저분 해지고 칙칙한 외장하드케이스에 붙여놓으니까 귀여워요. ​​​2
",13,0,0,344,8,2,715.8,14,,2020. 11. 25. 23:37,5625,9289519,인테리어·DIY,"['오 십자수이긴한데 신기하네용 😁', '심심하지 않겠다집중력도 생기고', '역시 꼼지락하는 게 심심함 + 우울함 날릴 수 있는 최고의 취미인 것 같아요 ㅎㅎ저는 역동적이지 못하고 정적인 스타일이라, 페이지님의 취미생활을 보다보면 마음이 고요해져요.... !어렸을 때 엄청 열심히 하던 스킬 자수가 생각납니당']"
1,https://blog.naver.com/page56_?Redirect=Log&logNo=222110663514,"지난 번에 펀치니들 한번 도전해봤는데 생각보다 쉽고 너무 재미있어요.​​​물론 아직 초보라서 계속 해봐야겠지만다른 취미 보다는 결과물을 단시간에 바로 낼 수 있기 때문에 코로나 때문에 집콕하면서 뭐하지 심심하신 분들 하시면 좋을 것 같아요. ​​펀치니들 소품 쉽게 만들어서 인테리어 소품으로활용해도 이뻐서 만족스러워요 😉​​이번에 해 본 건 101도 트로피칼 시리즈 중에 아보카도랑 몬스테라가 있었는데 오십육페이지는 이걸로 ​요즘 날씨 선선해져서 좋아하는 초록색 나뭇잎보기 힘든데 이렇게 털실로 따스하게 만드는 몬스테라는 또 다른 느낌이여서 재미있어요. ​​​​​​깔끔하게 상자에 배송오고 열면 지퍼백에 담겨져 있어요.​​집에서 하거나 혹시나 카페나 다른 공간에서 취미생활 즐기고 싶다면 지퍼백 그대로들고 다니면 되니까 편해요 😁​​​​​구성품은 자수틀 / 울실 / 펀치니들 원단(도안) / 펀치니들 바늘 / 플라스틱 바늘로 DIY 풀세트여서 오십육페이지는 가위만 준비했어요. ​​​​​​​본격적으로 시작하기 전에 실 끼우는 방법과 펀칭하는 방법 읽어봐요. ​101도 홈페이지 들어가시면 영상도 있어서 초보이신 분들은 한번 참고하시면 도움이 많이 될거에요.​오십육페이지는 지난 번에 하긴 했는데두번째 여서 그런 지 바늘방향을 잘못 잡은거에요 ㅋㅋㅋ 나중에 바탕할 때에서야 깨달았어요. ​설명서 열심히 읽었는데 눈은 장식이였어요 👀​​​​​​이렇게 기본 도안이 그려져 있어서 따로 그리거나할 필요도 없고 펀치니들 취미 생활 즐기다 보면 검은색 도안은 저절로 사라지기 때문에 걱정하지 않아도 괜찮아요. ​​​​설명서 보니까 몬스테라 줄기부터 먼저 하는 거에요. 그래서 차례대로 차근차근 하지만 초보이기도 하고 펀치니들 바늘 위치를 잘 못 봐서 초반에 좀 힘들었어요 ㅋㅋㅋ​​끝날 때 쯤에 알게 된 거 진짜 설명서 제대로 읽으세요 😨​​​​​​​​넷플릭스 켜놓고 드라마랑 영화보면서 쉬엄쉬엄 했어요. ​도안 테두리 따라서 한다고 했는데 너무 밖으로 했나봐요 ^^; 바탕 실 넣어줄 공간이부족했어요. 조금 안쪽으로 하는 게 더 쉽게 할 수 있어요. ​​​​​잎 모양 완성하고 나서 이제 바탕으로 ~ 같은 일 반복이기 때문에 계속 하다보면적응이 되서 어렵지 않았어요 ^^ ​근데 아직은 실 땀 길이 조절하는 게 어려워서짧은 편이여서 다음엔 좀 넓게 해봐야지 ~ 하다보니까 알 것 같아요.​​탄력을 받아서 다른 핸드메이드 취미 생활도 즐겨야겠어요. 그리고 뒷변은 이렇게 남은 울실로 홈질 한 다음에당겨서 묶어주면 끝이에요 ~ ​지저분보이는 게 싫다면 원단을 덧대거나가자 쉬운 건 접착제로 펠트 붙여서 깔끔하게 마무리 해도 좋아요.​그럼 인테리어 소품으로 사용해도 손색없어요 ^^ ​​​​​​​​​오십육페이지는 집순이 이지만 카페 가는 건 좋아하는데 요즘은 코로나 때문에 진짜 드문드문 가서 ㅠㅠㅠㅠ ​집에서 이것저것 하면서 지내고 있어요.사실 집순이가 제일 바쁘다는 거 ㅋㅋㅋㅋ ​어째든 그래서 해봤는데 재미있어요.털실이 주는 느낌이 포근하고 부드러워서 그런지 요즘같이 선선한 날씨에 더 잘 어울려요 ! ​펀치니들 풀세트 DIY 소품 만들기 하면따로 준비할 게 없기 때문에 더 간단하게 시작할 수 있어서 추천하고 싶어요 💖​| @%'
",17,0,0,359,1,2,715.8,16,,2020. 10. 8. 23:46,5625,9289519,인테리어·DIY,"['이거 몬가 예전에 초딩때 햇던 스킬자수 생각나요 ㅋㅋㅋㅋ털실이 굵어서 그런가 요즘 찾아보니 가격이 가격이,,ㅠㅠㅠ이런거 은근 집중력 항상에도 도움되고 좋은 것 같아요😆']"
2,https://blog.naver.com/page56_?Redirect=Log&logNo=222025715704,"잠잠 해지는 가 싶다가도 확진자가 계속 나오는 상태여서 최대한 외출을 피하면서코로나 집콕 하면서 보내고 있어요. ​오십육페이지 집순이 이긴하지만강제 집콕놀이는 사실 조금 지겹기도 해요. ​그래서 초반에는 잠만 많이 자다가요즘에는 조금씩 취미생활 중 이랍니다 : ) ​이번에는 예전부터 도전해보고 싶었던 것 중에하나인 펀치니들로 귀여운동물 만들기 해봤어요.​보들보들 하기도 하고 생동감 있는 모습이 귀여운 숲속 작은 동물 DIY 중에서 제가 만들어 본 건 라이언이예요. ​처음에 새로운 취미 시작할 때는준비물 준비하는 것도 어려워요.​다행이 재료를 따로 구매하는 번거로움과어려움 줄여주는 101도의 DIY 키트 덕분에초보자도 가벼운 마음으로 즐겁게 시작 할 수 있어 좋았어요.​​​​​​배송받았을 때 생각보다커다란 패키지 박스에 놀랐어요.​귀여운동물을 만들 수 있는 도안과 설명서재료가 포함 되어있어서 그런가봐요! ​​그리고 나중에 남은 취미 재료 보관할 때도 편해서 좋았어요. ​​​​초보도 어렵지 않게 완성 할 수 있는집콕 취미생활 세트 재료 소개 해볼게요.​일단 원목형의 자수틀 , 설명서 , 보들보들한 울실 . 원단 , 도안과 수성펜 , 펀치니들 도구 , 마무리 할 때 사용하는 실과 바늘 , 부직포 ​​​​​울실이 진짜 보들보들 기분 좋은데 라이언 완성하고 나서 갈기 부분 만지면더 좋아요 ㅋㅋㅋㅋㅋ ​​펀치니들도구 궁금했는데 이렇게 생겼어요 ^^옆면에 단계(?) 조절 하는 게 있는데 만드는 작품마다 조절해서 만드는 거에요. ​​​​​설명서도 있지만 헷갈린다면 101도 운영하는 유튜브 참고하면 실꿰기 , 마무리 하는 방법 등 볼 수 있어요.​오십육페이지는 설명서로는 헷갈려서알고보니까 꺼꾸로 해놓고 왜 이렇게 실이 안들어가지 하고 있었어요.​그래서 영상 보면서 하니까 아하 !하면서 금새 끼웠어요 ^^ ​​​이제 부직포랑 천에 도안을 그리고 수틀을 끼워서 펀치니들 도구를 이용해서 집콕놀이 시작해요 ~ ​​​​​​​설명서 순서대로 눈 , 코 , 입 부터 먼저 수놓고(?) 이걸 수놓는 다고 해야하는 지 모르겠어요. 바느질 한다?? 어째든 쉽게 말하면 천에 펀칭 도구를 넣었다 뺏다 하는데방법은 쉬운데 요령이 좀 필요해요.​간격이나 힘을 일정하게 줘야지 이쁘게 나오는 거 같아요. 그렇지 않으니까 실이 빠져나오기도 해요; 그냥 처음이니까 ! 하면서 마음을 놓고 하기 시작하니까 재미있어요 ^^ ​그 와 중에 비밀의 숲 틀어놓고 보고 ~ 올해에 비숲 시즌 2 나온다고 하잖아요.​코로나 집콕생활 하면서 밀린 영화나 드라마도 재미있게 보는 것도 하나의 취미가 됐어요. ​그 사이 얼굴 완성 ^^ 양으로 만들어도 귀여울 것 같아요 ㅠ ♥​​​​​​이제 갈기를 만들어 줄 차례 ~ 이건 어떻게 표현하지 ? 궁금했는데뒤집어서 하는 거래요. 오호! ​근데 아직 일정하게 하는 게 어려워서 갈기 길이가 조금 일정하지 않아요.​그래도 그것도 매력이라며 ㅋㅋ 우겨보는 오십육페이지의 첫 펀치니들 도전! ​​​​​​뒷면에는 부직포로 깔끔하게 마무리해서 인테리어 소품으로 활용해도 손색 없어요.​처음 만들어 봤는데 재료로 함께 구성이라서가위만 준비해고 다른 건 1도 필요없었어요.​간편해서 좋음, 손으로 하는 건 다 좋아해서프랑스자수나 뜨개질 같은 취미도 많이 해봤는데 그 중에서이게 제일 쉬워요(소근소근) ​101도 숲속 작은 동물 DIY 만들기 패지키 이용하고 궁금한 부분 유튜브 영상 참고 하면되니까 초보자들 하기에 더 좋아요 !!! ​​​​​​​​​​​방 꾸미기 특히 아기방 감성인테리어로꾸며 줄 때 사용하면 너무 이쁠 것 같아요.​개인적으로 저는 벽에 못질 하는 건 별로 안 좋아해서 거울 옆에살포시 놔두기! ​​​코로나로 집콕 하느라 심심하거나새로운 취미생활 찾는 분들에게 추천해요 ♥​​​",21,0,0,425,1,2,715.8,18,,2020. 7. 9. 12:10,5625,9289519,인테리어·DIY,['재주가 좋다~억수로이뿌네']
3,https://blog.naver.com/page56_?Redirect=Log&logNo=221679946186,"​​​​인스타나 블로그 보다가 새로운 공예 취미생활인 것 같은데어떤 건지 궁금했는데 바로 펀치니들 이라는 거에요 ~ 쌀쌀해진 날씨에 어느 때 보다잘어울리는 취미여서 오십육페이지도 도전 해보고 싶은 공예인데 책 보면서차근 차근 따라해보면 좋을 것 같아요. ​​​​​​​인스타 20만 팔로워가 열광한부쿠의 펀치 니들 소품 오십육페이지도 그 중에 한명인데 아마존 분야 베스트셀러 1위라고 하니 말 다 한 것 같아요 ㅋㅋㅋㅋ ​​​​부쿠의 니들 소품은 처음 시직하는 분들 위해서사용하는 재료 부터 도안 , 설명이 적혀 있어요. ​​​​​​​​사실 새로운 취미 특히 무언 가 만드는공예를 한다면 어떤 재료부터 구매해야할지 고민하게 되는데독학이라면 더욱더 어려워요.그런 분들위 해서 사진으로 자세하게 설명하고 글로 친절하게 적혀 있어요. ​펀치니들 시작해보고 싶다면 한번 읽어 보시면 좋을 듯 해요. ​​다양한 털실과 자수실도 활용해 만들어 가면서 다양한 느낌을 낼 수 있어요. 어느 실이나 따스한 느낌은 영원한 것 같아 지금 딱 시작하기좋아서 오십육페이지도 한번 해봐야겠어요. 어떤 작품을 만들어 봐야할지 행복한 고민이네요. ​​책 속에 감성적인 쿠션 , 가방 그리고 블랭킷 , 러그 등 만들 수 있도록설명과 도안이 있어요. ​​​​​​​그리고 사진을 보면서 펀치니들소품활용하는 방법 , 인테리어 팁 까지 얻을 수 있으니 ~ 이보다 보는 것도 재미가 있을 수 밖에 없음! ​또 , 정말 다양하게 활용되는 거라서 신기했어요. ​정말 다양한 소품을 만들 수 있어 어디까지가 한계일까 ~ 궁금쓰 ^^ ​​​​​​​​먼저 이책의 활용법을 읽어보고 인스타에서 작가의 작품도 구경해보고참고해서 따라 해보면 더 재미있을 것 같아요.​인스타 20만 팔로워가 반한 모던 펀치 니들작품 ​​​​​​​​​​날씨 쌀쌀하니까 따듯한 쿠션 만들 때 한번 참고해서 활용해 만들어 보고 싶어요.​​​",16,0,0,219,0,0,715.8,2,revu,2019. 10. 16. 23:13,5625,9289519,인테리어·DIY,0
4,https://blog.naver.com/page56_?Redirect=Log&logNo=221575884671,"​​​​요즘 3d펜 , 프린트 하면서 여기저기 많이 보여요 ~ ​이걸로 화분꽂이 , 피규어 , 인형 소품 등 진짜 별거별거다 만들어내는 거에요 ~​너무 신기하고 재미있어서 저도 해보고 싶었는데 ​​​근데 초기에는 알아보니 가격이 만만치 않아서 이걸 꾸준히 할까 ? 하면서 갈등이 있어서 그냥 구경만 했는데 요즘은 유튜브랑 여기저기 많이 보이더니 아이들 장난감 , 교육으로 많이 활용해서 그런 지 가성비 좋은 제품도많이 나오네요 ^^ ​오십육페이지 뿐 아니라 동생도 만져 보고 싶다고 하더라구요 ~​손으로 꼼지락 하는 걸 좋아하는데요건 아빠를 닮은 것 같아요. ​아빠 손재주가 좋으세요 ♥​​아직 초보라서 그 만큼 퀄리티는안 나오지만 그래도 흥미를 갖는 것만으로 만족합니다 ㅋㅋㅋ ​​그래서 초록색 창에 검색 해 찾았어요. 여러 곳 있지만 홍스마켓에서 가성비 좋은 걸로P64 3D펜으로 주문했어요. ​​​​본품 1대 , 케이블과 어댑터 1개 , 사용설명서 , 도안 1권 , OHP필름 1장 손가락 골무 , 고정대 또 , 필라멘트 이렇게 구성되어 있어요.​처음 시작 해보시는 분들 사용해보시면 부담없을 거에요.​동생이 재미있다고 해서 연습하다보니 필라멘트 다 써서 주말에 다시 주문해놨어요 ^^​아까 문자로 오늘 도착 한다고 했는데열심히 연습해서 제가 좋아하는에펠탑 동생이 만들어 주기로 했어요. ​​​​​​​간단하게 사용방법 설명 하자면 3D펜 도안 위에 OHP 필름을 올려놓고이때 움직이 않도록 테이브로 양쪽 고정 해주시면 훨씬 나아요 ^^ ​그 다음 도안을 따라서 그려주는 거에요. 영상에서 볼때는 쓱 ~ 쓱 ~ 시원보였는데막상 해보니까 쉽지 않아요.​동생이 하면서 생각만큼 안되네 ㅜ _ ㅜ 해서 금새 싫증 낼 줄 알았는데재미있다고 ㅋㅋㅋㅋㅋ ​그래서 홍스마켓에서 주문한 패키지 안에들어있던 필라멘트는 연습용으로다 사용하고 재주문 해놨어요. ​​​​​​초보 연습용으로는 괜찮은데 무언가 본격적으로 만들어 보려면양이 부족한 편이라 미리 구비 해두시는 게 좋을 것 같아요. ​다양한 쓰리디펜 도안이 있는데 마음 같아선 에펠탑 부터 해보고 싶은데직접 사용하는 동생이 어려워 보인다고그나마 쉬운 자전거 먼저 도전 해봤어요 ^^따로 전원 버턴은 없고 상단에 잭을 연결하면 상태창에 불이들어오면서 작동이 되요. ​처음 연결하고는 약 3 ~ 5분 정도예열 한 다음 사용해줘야 해요 ^^​어려울줄 알았는데 생긴 건 의외로 단순해서 아이들 교육용으로 장난감으로 많이 사용하는 거같아요 ^^ 재미이도 있고 ~ ​​​​근데 아무래도 전기 사용하고 예열해서 뜨거우니까 어린 아이들은 부모님이나 보호자와 함께 사용 하시길 ♥​​​​​​처음에는 조절 하는 것도 어려워서 유튜브에서 보는 것 처럼 안된다고 ​표면이 매끄럽게 표현 되지는 않지만그래도 바퀴 하나 , 페달 만들다 보니점점 나아지는 게 눈에 보여요 ^^ 아래로 향하는 건 필라멘트를 출력하게 하는 버튼이에요. ​계속 누르고 있을 필요없이 한번만 눌러주면 쭈 ~ 욱 나와서 초보는 양조절이 넘나 어려움^^;​그 상태에서 다시 한번 누르면 정지가 되는 거에요. ​​​​위로 향하는 건 퇴출버튼이라고 해서출력 정지 된 상태에서 펜에 꽂혀있던필라멘트가 뒤로 빠져 나오는 거에요.​그만 사용하거나 다른 색상으로교체하고 싶을 때 사용하면 되는 것! ​​PLA / ABS / PCL 3종류의 필라멘트 있는데홍스마켓의 3d펜은 모드를 변경 해모두 사용 할 수 있어요 ^^ ​그리고 출력 스피드를 조절 할 수 있어 단순하면서도 초보가 사용하는 것 치곤 가성비 좋아 마음에 들어요. ​​​​​​본 건 있어가지고 ㅋㅋㅋㅋㅋ 쓰리디펜 신인 유투버 분이 이렇게 정리 한대요. ​​자전거 바퀴 , 페달 , 본체 각각 만든 다음이게 실밥이라고 해야하나 ㅜ _ ㅜ ?실리콘 쓰다보면 자투리 같은 거 있잖아요.이것도 그런게 있어서 라이터로 살짝 깔끔하게 마무리해요.​​​​​​그런 다음 조립을 해주는데 라이터로살짝 녹여서 붙여도 되고 필라멘트 녹여연결해도 되고 편한 방법으로 하세요. 오십육페이지 동생은 후자의 방법으로 ^^그리고 깨알같이 페달 위치 다르게 했어요. 그래야지 자전거가 움직이 ~이래서 ㅋㅋㅋㅋ ​​​​​​​​​못 서 있을 것 같아서 아 , 그래 초보니까 하면서 그랬는데 페달의 도움 때문인 지 어찌 어찌 해서 세울 수 있어요. 오 ~~~ ​같이 박수 쳐 주고 ㅋㅋㅋㅋ 에펠탑은 시도 해보긴 했는데 어렵다고 ㅜ _ ㅜ 게다가 재료 부족해서이 정도만 ㅋㅋㅋㅋㅋ ​​​재료 주문 해놨으니 재미 붙인 김에 열심히 해서 예쁘게 만들어 주면 좋겠어요. ​​​​ 
",22,0,0,532,4,2,715.8,20,suspect,2019. 7. 2. 20:10,5625,9289519,인테리어·DIY,"['옴마야심심하지 않겠당', '네, 재미있는 거 진짜 많아요 ^^', '뭐죠 ㅋㅋㅋㅋㅋ너무신기해욬ㅋㅋㅋㅋㅋ이제 3d이런쪽 까지 배워야할 판이네요ㅠㅠㅠ세상 발전이 너무 빨라요 ㅋㅋㅋ', '진짜 별거 별거 다 있죠 ㅋㅋㅋㅋㅋㅋㅋ세상은 넓고 할 것도 많고 해보고 싶은 것도 많아요 ^^']"
