,Post URL,Post,Image num,sticker num,gif num,Paragraph num,Comment num,Video num,weekly viewer mean,Sympathy num,AD,Posting Date,Buddy num,Total visit,Blog category,Comment detail
5,https://blog.naver.com/prettyh90?Redirect=Log&logNo=222201348806,"​​안녕하세요. 프로다이어터이자 유지어터 연쁘에요. 날이 정말 많이 추워졌는데, 다들 건강 잘 챙기고 있나요?개인적으로 겨울에는 몸이 움츠러들어서 무기력해지기 쉽더라고요.이럴 때 일 수록 의식을 해서 몸을 계속해서 움직여줘야 몸도 마음도 건강해지는건 자명하고요.​그래서 저도 운동을 꾸준히 하려고 부단히 노력하는데, 요즘 같은 날씨에 기존에 입던 레깅스를 입어보니 너무 X 100 추운거에요.ㅠㅠㅠㅠ​특히 추운 겨울에는 얇은 레깅스 하나만 의지하고 실외는 물론 실내 운동까지 하기엔 부담이 많이 되는데요.​이런 소비자들의 아쉬움과 어려움을 포착했는지 다양한 브랜드에서 '여자 기모레깅스'를 올 겨울에 많이 출시했더라고요.​그 중에서도 제가 정말 좋아하는 브랜드 디스커버리에서도 '플렉스 기모 레깅스'를 출시했다는 소식!​지난 여름 제가 정말 극찬하며 내내 잘 입고 다녔던 플렉스 레깅스의 겨울버전이라 더욱 기대가 되었는데요. 디스커버리 운동화 조거플렉스 신상 컬러와 함께 사이즈 고르는 방법부터 소재까지 자세히 후기 담아볼게요 :)​​​​​ 디스커버리 조거플렉스 ​어글리슈즈는 무겁다는 선입견을 타파한 가볍고 편하고 그리고 예쁜 조거화 + 어글리 슈즈랍니다.워낙 유명한 운동화라 설명이 더는 필요 없을 정도인데요. ​여러 컬러들 중에 이번에 나온 신상 '베이지'컬러가 저어어엉말 너무 예쁘게 나왔어요!!베이지컬러가 너무 진하지도 않고 딱 깔끔하고 예뻐서 신발 다들 너무 예쁘다고 칭찬을 해줄 정도! ㅎㅎ​사이즈는 평소대로 정사이즈 230에 딱 맞게 했는데 꼭 맞춘듯 편하게 맞았답니다.​다만, 겨울 특성상 두꺼운 스포츠 양말과 함께 착용할 경우에는여유롭게 5mm 업하는 것도 나쁘지 않을 듯 해요.​저는 발볼 영향을 받지 않는 완전한 칼발이어서 정사이즈로 주문했더니 아주 편한 착화감이었어요!​​​​​​옆모습도 너무나 예쁜...♥︎극세사 고급 소재를 사용해 더욱 퀄리티를 높였고요.숨겨진 4cm 키높이 기능은 덤! ㅎㅎㅎ덕분에 다리가 더 길어보여요.​​​​​제가 발목을 많이 접지르는 편이라 (국토대장정 때 크게 접질러 통깁스한 전적 보유)​그래서 여자운동화 고를 때는 무조건 발목을 안정적으로 잡아주는 것을 최우선으로 보는데요. 디스커버리 운동화 조거플렉스는 발등을 흔들림없이 견고한 설계로 안정감있게 잡아줘요. ​디자인뿐만 아니라 기능면에서도 충실한 슈즈랄까?​​​​​​발목 뿐만 아니라 이전에는 족저근막염을 앓았을 정도로 예민한 발을 가지고 있는데요.​이런 제가 장시간 착용한 결과, 가벼운 착용감으로 발에 피로가 훨씬 덜하고 편안한 쿠션감으로 자연스러운 활동을 도와주더라고요.즉, 예민한 발에도 편한 착화감을 선사해준답니다.역시 디스커버리 운동화...♥︎​​​​​​뒷 부분 모습도 담아봤답니다.보다시피 발뒤꿈치도 단단히 잡아주고요.무게 중심에 따라 이동해주는 flex zone 설계가 들어가 덕분에 한발 한발 내딛을 때 마다 걸음이 무척 편해요.​​​​실제 착용 모습은 영상으로 꼼꼼히 확인해보세요:)​​​​​​디스커버리 플렉스 기모 레깅스 ​조거플렉스와 함께 매치한 올 겨울 저의 원픽 여자 기모레깅스!ㅎㅎ여름에 나온 플렉스 레깅스의 기모버전이고요.사이즈는 평소대로 S사이즈로 했답니다.​평소 55사이즈를 입는다면 무조건 S사이즈 픽하는 걸 권해볼게요.​​​​​기존 여름 버전은허리밴드가 6cm로 넉넉했다면겨울버전은 허리밴드가 9cm로 더욱 더 넓어져 안정감있게 보정을 하며 잡아준달까요?​하이웨스트 설계를 가지고 있어서 허리~배까지 단단하고 안정감있게 잡아주고요.Y존 부각도 없어서 핏도 예뻐요.​디스커버리 레깅스가 Y존 커버를 유독 잘하는 Y존커버 맛집인걸원래도 알고 있었지만... 입을 때 마다 놀라움♥︎​​​​​​보다시피 허리밴드는 앞 뒤로 탄탄하고 넓게 잡아주고요. 힙라인과 다리라인 설계가 서로 연결되면서다리 안쪽으로 시선을 분산시켜줘서 더욱 날씬해보여요!ㅎㅎ​​​​​제가 입은 것을 보면 겉으로 보기에는 기모 특유의 느낌이 전혀 아닌데 안감을 보면 슬림 기모 처리가 꼼꼼하게 되어있어요.​덕분에 착용하는 내내 쾌적하면서도 따땃한 보온성까지 챙겨 겨울철 활동성을 한껏 끌어 올릴 수 있었답니다.​​​​​디스커버리 브랜드 로고는 은근하면서도 심플한 포인트가 되어주고요 :) ​허벅지~종아리 부분 절개선을 보다시피 안쪽으로 더블 라인이 들어가 다리를 잘 잡아주면서 슬림해보이는 효과까지 선사해준답니다.​​​실제 착용 모습은 영상으로 확인해보세요.​조거플렉스 운동화와 디스커버리 여자 기모레깅스 코디 같이하니 스포티하면서도 멋까지 살아있달까!ㅎㅎ​​​​착용감, 기능성, 실루엣까지 얇지만, 따뜻하고, 핏과 컬러까지 예쁘게 ! 어느 하나 빠질 것 없이 전부 다 만족스러운 디스커버리 레깅스 & 여자 운동화 신상♥︎​아직까지 겨울 여자 기모레깅스 코디 아이템 구비를 못했다면,디스커버리 운동화와 레깅스까지 한꺼번에 마련해보길 강력하게! 적극! 권해볼게요.​/공식 홈페이지 바로 가기/​​​",22,0,0,486,1,2,7196.4,16,,2021. 1. 8. 23:53,6485,17924536,패션·미용,['운동화 디자인이 아주 안정감있게 잘빠졌네용~운동할때 뿐 아니라 일상에서도 신기 좋을거 같아용~디스커버리 레깅스는 완전 호감가는군요~몸에 착 달라붙어 착용감도 좋을거 같고 보기에도 다리가 예뻐보이네용^^']
6,https://blog.naver.com/prettyh90?Redirect=Log&logNo=221858704836,"​​​안녕하세요 연쁘입니다!이번에 박보검이 신고 나왔던 아이더 운동화!아이더 퀀텀 인피니티 워킹화 저도 신어봤답니다.​평소 발이 무척이나 예민한 타입에 속하는데(족저근막염도 앓았던 1인)아이더 워킹화는 가볍고 편안하고 시원한거 있죠?자세한 후기 상세하게 남겨볼게요.​​​​​아이더 퀀텀 인피니티​품번 : DUS20G14 컬러 : 그레이, 챠콜, 핑크, 화이트 사이즈 : 230~285 (5단위, 그레이시 핑크는 255까지 출시)​컬러는 박보검과 똑같은 '그레이'컬러로 골랐어요.사이즈는 평소 230 신어서 230 정사이즈로 했는데 딱 좋았고요.​원단과 갑피가 합쳐져 있는 고어텍스 인비저블 핏으로 만들어졌고 충격흡수력을 한껏 강화시킨 기술이 들어간 BOOM 미드솔 덕분에 오랜시간 동안 다양한 상황에서 편하게 신을 수 있어요.​​​​​정면에서 바라봤을 때얄쌍하게 잘 빠진 라인으로 예쁨 ♥︎다양한 과학적 설계가 들어가서 그런지 ​발걸음 한걸음 한걸음이전부 다 경쾌하고 쾌적한 느낌이에요.​​​​​그라데이션으로 된 디자인은유니크하면서도 세련된 느낌도 가득하고요.​​​​발가락을 보호해주는토캡 사출이 들어가 안정성을 높였어요.그래서 발가락이 아프지 않고 탄탄하게 감싸져요.​​​​유연하게 내 발에 꼭 맞게!고어텍스가 일체형으로 설계되어 발을 전반적으로 유연하게 감싸줘서걸을 때 마다 원래 내 발 같은 느낌?이질감없이 편안해요.​​​​​고어텍스뿐만 아니라중앙에는 에어 니트가 들어가 쾌적한 통풍까지!덕분에 갑갑함없이 걸음걸이가 시원해져요.​​​​요건 '보아 다이얼'인데신발끈을 따로 묶을 필요 없이 다이얼을 돌리면알아서 자동으로 신발끈이 조여지니 너무 편하더라고요!ㅎㅎ​어렸을 때 아이디어 상품 만들기 하면요런 신발끈 다이얼 아이디어가 나오곤 했는데그게 딱 적용되니 신기하기도하고 편하기도 하고요 ㅎㅎ​​​​실제로 다이얼을 사용하는 모습은영상으로 담아봤답니다.​​​​​박보검과 커플 운동화라니,,,기분도 좋은데다 기능까지 너무 좋아서 만족!​​​20SS 신상!아이더 퀀텀 인피니티 워킹화 세심한 설계와 과학적인 기능까지 한번에!발걸음 한 걸음 내딛을 때 마다 편해요.날이 더 풀려 일찌감치 품절되기전에얼른 꼬까신 장만해보세요♥︎​​​​​",17,0,0,201,8,1,7196.6,29,,2020. 3. 23. 12:24,6485,17924537,패션·미용,"['헐 조깅용으로 딱이네요 신발끈 조절 넘 신기해용ㅋㅋㅋㅋ  조깅룩 입으시니 더 멋지신 연쁘님😍', '뭔가 달리고싶은 컬러감의 운동화예요ㅎㅎ', '왕.. 모델핏 짱!! 신발 색감도 이쁘고 편해보여요~!', '신발 이쁘네요~~~ 다이얼 방식이라 편해 보입니다~ ^^', '글 너무 재밌어요 ㅎㅎ', '👍👍', '워... 핏 대박.. 인스타에서도 봤지만 역시 ..운동의 힘인가요   \\(◡̈)/♥']"
7,https://blog.naver.com/prettyh90?Redirect=Log&logNo=221804533367,"​​안녕하세요 연쁘입니다!평소에는 아주 아주 편하게 입고 다니는데편하고 가볍고 예쁘기까지한 운동화 하나 소개해볼게요.참고로 발이 편해도 지이이인짜 엄청 편함(!!!)​​​​​카파 니트운동화 웨이브엣지​KLWK133UM컬러 : 화이트 / 블랙 사이즈 : 230~280 (10단위)​요즘 매일 신고 다니는 카파운동화!화이트도 예쁘고 블랙도 예뻐서 어떤걸 골라야할까엄청 고민하다가.. 집에 화이트 운동화가 많아서블랙 컬러로 선택했답니다!​근데 실물을 보면둘다 너무 예쁨....ㅋㅋㅋㅋㅋ​​​​​카파 웨이브엣지는니트스타일을 베이스로 하고사이드는 엮어서 트렌디하게 표현했어요.같이 세트로 온 운동화끈도 톡톡 튀는 디자인으로밋밋하지 않게 포인트를 준답니다.​사이즈는 230 칼발인데230 주문했고 더도말고 딱 맞았어요!​​​​​굽도 제법 있는 편이라다리를 길어보이게 만들어주고요?근데 굽이 있는데도 무겁지 않고 가벼워요.깃털처럼 가벼워서 러닝화로도 제격!​​​​​발 전체를 한번 쓱- 감싸주는 디자인으로 설계되어가볍고, 편하고, 안정감있게발목과 발을 잡아줘요.​​​​​운동할 때 신어도 제격 :)레깅스와 같이 매치했는데 너무 잘 어울려요!이전 챔프 웨이브에 비해 발등이 높게 설계되어서안정감있는 러닝을 도와주고요?ㅎㅎㅎ​​​​​평소에는 가볍게 툭!패딩을 걸치고 신어주면 편하답니다.사계절 내내 신어도 좋은 소재로데일리 슈즈로 딱이에요.​카파운동화 시리즈 중에가장 가볍고 편한 라인업 아닐까 싶습니다.사이즈도 280까지 나와서 패밀리룩 연출하기도 좋고커플운동화로 장만하기도 좋은 거 같아요 :)​족저근막염을 앓았을 정도로발바닥이 진짜 예민한 편에 속하는데이런 예민함을 다 잡아줘서완전 만족합니다!​​​​​​현재 3월 1일까지챔프맥스 1+1 행사도 진행중이니카파 웨이브엣지 구매도 할 겸 챔프맥스도 함께 장만해보세요 :)​​​▲이전에 리뷰했던 링크 첨부해봅니다.​​​​​ 
",13,0,0,162,6,0,7197.2,16,suspect,2020. 2. 11. 12:54,6485,17924540,패션·미용,"['키높이로도 좋겠네요.!', '키가 자연스레 커져요! ㅎㅎ', '신발은 디자인도 디자인이지만 확실히 가벼워야 손이 가더라고요~', '맞아요 가벼우니까 자주 신게 되네요 ㅎㅎ', '얼마에요?']"
8,https://blog.naver.com/prettyh90?Redirect=Log&logNo=221717729443,"​안녕하세요. 연쁘입니다.  다들 청소 매일 꾸준히 하고 계시나요?연쁘네 집은 예쁘고 귀여운 반려묘 똘망이가 있고 비염을 앓고 있는 가족이 있어 청소기를 매일 돌려야하는데 가족들이 전부 다 직장을 다니고 있어 생각보다... 평일에는 막상 청소할 시간이 거의 없더라고요. ​​​​청소 패턴을 살펴보면 주로 주말에만 전체적으로 청소기를 돌리고, 퇴근 후에 청소하려고 하면 기진맥진하고요. 매일 일하고 돌아와서 고양이와 놀아주고, 악기 연주회도 준비하느랴, 문제 출제하느랴 바쁜데 소소한 청소까지 하면 체력이 거의 남아나질 않고요. 그래서 사용자가 집에 없어도 쓱쓱 싹싹 청소를 다 해주는 '로봇청소기'를 알아봤어요. 시중에는 다양한 브랜드가 있었고 여러 기준을 나눠 후보를 간추리다보니,  아무래도 전자 제품의 성능뿐만 아니라 '디자인'도 생각하는 저에겐 뛰어난 성능과 빼어난 디자인으로 사랑받고 있는 '샤오미 로봇청소기'가 가장 눈에 띄어 주문했답니다.​​​​S6은 고급형 모델로 기기가 집의 구조를 파악해서 청소할 수 있는 '매핑능력'이 한층 더 개선되었고, 소음 또한 이전보다 줄어들었다고 해요. 강력한 흡입력과 넉넉한 배터리용량으로 오래도록 사용가능한건 물론, 미세먼지도 흡입할 수 있을 정도로 업그레이드 되었고요. 거기다 따로 물을 채워서 사용하는 물걸레 기능까지 추가되었다는 사실! 샤오미 로봇청소기는 세대별로 담당하는 브랜드가 다른데 같은 그 중에 가장 인기 있는 라인은 '로보락'이에요. 우리에게 익히 알려진 샤오미 청소기 2세대도 로보락에서 만든 제품이고요. 제목에도 '2세대'를 강조한건 타 세대와는 다르기 때문(!)​​​​구성품에 필터도 따로 제공되더라고요. 집에 있는 공기청정기에도 비슷한 모양의 필터가 들어가는데 확실히 먼지를 걸러내 주는 기능이 강화되었어요.​​​​물걸레로 한번 바닥을 쓱- 닦고 나면 청소포에 먼지가 가득가득-! 로봇이 청소를 다해주니 참 편리해요 ㅎㅎ​​​​Mi Home 어플을 이용하면 실시간으로 청소를 한 구역과, 아직 청소 하지 않은 구역을 한눈에 파악하기도 쉬워요. 무엇보다 직접 내가 전원을 켜야 하는게 아닌 원하는 시간대에 청소할 수 있도록 '예약'이 가능해 퇴근 바로 직전에 가동시켜 깨끗한 집안을 느낄 수도 있답니다. 혹시나 청소를 원하지 않는 구역이 있다면 따로이 설정해서 스킵할 수 있는 똑똑한 기능을 갖춰 가족들의 프라이버시도 지킬 수 있고 내가 원하는 방만 청소할 수 있는 기능 또한 추가되어, 쓸데 없는 전력낭비를 막을 수도 있고요.​​​​그리고 많은 분들이 잘 모르는 사실인데 샤오미 로봇청소기는 직구와 국내 정발판이 따로 존재한답니다.국내 정발판으로 구매했을 때는 보다시피 설명서에 한국어 지원도 가능하고, 아이나비를 통해 1년간 무상 A/S가 가능하단 사실! 가전제품 특성상 A/S는 자가로 하기 어려운데  전국 아이나비 서비스센터에서 지원해주니 든든하고요. 직구는 한글을 지원해주지도 않고, 한국 내 A/S를 지원해주지 않기 때문에, 길게 본다면 정발판이 좋아요.​​​​퇴근 후 집에 갔을 때 말끔한 바닥을 보면 정말 주문하기 잘했다 생각이 들어요. 고급형이 왜 고급형인지 알 것 같은게, 집 문턱도 다 넘어들고 어플 활용도가 너무 너무 좋거든요. 소리도 기존 모델보다 작아서 소리게 예민한 반려묘도 이내 적응할 수 있다는 것도 장점이고요. 반려묘의 털날림으로 실시간 청소기를 돌려야하는데.. 그럴 수 없는 상황이잖아요 그렇다고 따로 사람을 불러서 집안을 청소시키자니 비용도 비용이고, 집을 공개한다는 것도 신경쓰이고요. 그럴 땐 스마트한 기기의 도움을 받으면 이래서 주문하길 잘했구나..싶어요ㅎㅎ​​​​비단 반려동물뿐만 아니라 집에 아이를 키우는 맞벌이 집이나, 혼자 사는 집에서 사용해도 참 좋을 거 같아요. 저도 나중에 독립하면 꼭꼭 로봇청소기 놓으려고요 ㅎㅎ 12월 2일부터는 다른 프로모션으로 정가 629,000원에서 599,000원으로 만나볼 수 있다고하며, 포토상품평 장성 후 메일 접수 시 메인브러시 1개가 100% 증정된다고 하니 참고하세요!​​​​ 
",11,0,0,448,3,1,7197.4,20,text_ad,2019. 12. 1. 23:10,6485,17924541,패션·미용,"['굉장히 편해보이네여!', '우연히 방문했다가 인사드립니다. 좋은 하루 되세요 (•ө•)♡']"
9,https://blog.naver.com/prettyh90?Redirect=Log&logNo=222254566705,"​​안녕하세요. 연쁘에요! 지난 12월부터 3개월째 꾸준히 사용하고 있는 오랄비 전동칫솔! ​저의 치아 생활은 전동칫솔을 만나기 전과 후로 나누어질 만큼 정말 달라진 삶을 살고 있는데요.​일반 칫솔에 비해서 어떤 점이 좋은지,  치아교정을 하거나 유지 장치를 착용하는 '교정인'의 입장에서 어떻게 와닿는지 속시원히 후기 남겨볼까 해요.​​​요건 12월에 썼던 글!지금 2월 말이니까 진짜 꼬박 3개월째... 그러고 보니 조금 있으면 4월인데.... ... 내 나이 눈감아...★​​​​​ 오랄비 전동칫솔 지니어스 9000 ​'플래그십' 모델에 해당되는 대표적인 모델인 만큼 다양한 기능을 제공해줘요. ​칫솔모는 총 세 가지를 따로 주는데 저는 이중 가장 인기가 많은 '크로스액션'으로 계속해서 사용 중이랍니다 :) ​​​​​늘씬하게 잘 빠진 디자인과 입안 구석구석 닦을 수 있게끔 기둥도 길쭉하게 나왔어요 :) ​​​작동하는 모습은 영상으로 담아봤어요.보다시피 다양한 모드에 따른 작동을 해요.​​​​오랫동안 사용해서 강한 진동에 익숙해진 저는 총 여섯 가지 모드 중에 집중관리 모드인 '프로 클린'을 가장 많이 사용하고 있어요. ​부드러운 세정은 잇몸이 특히나 부었다고 느끼는 여성들에게 한 달에 한 번 오는 그날에 집중해서 쓰고 있고요 ㅎㅎㅎ​​​​전동칫솔 사용하면 일반 칫솔에 비해 어떤 점이 좋은지 비교하는 질문을 정말 많이 듣더라고요.지금부터 자세히 분석해볼게요.​​​​​우선, 오랄비 전동 칫솔모는 마치 치과도구를 닮은 작고 둥근 쉐입을 가져서 잇몸 구석구석 잘 닿지 않는 곳까지 꼼꼼하게 닦을 수 있게끔 설계되어 있어요.​​​​​일반 칫솔모는 네모진 쉐입으로 입안 구석까지 닦기는 조금 어려운 구조랄까요?​생각해 보면 입 자체가 둥근 구조인데 안에 들어가는 칫솔은 네모난 게 좀 의아하기도 해요.​​​​​바로 그런 점에 착안해서 인체공학적으로 둥글게 설계한 원형 칫솔모!둘을 비교해보면 그 차이가 확연히 보인답니다. 그리고 다각도로 칫솔모를 설계해서 치아를 완벽하게 세정해 주고요.​​​​​계속해서 매일 사용하고 있는데 처음에는 진동이 강하다고 느꼈거든요.근데 계속 사용해보니 이제 익숙해져서 더 쎘으면 하는..그런... 바램이 ㅋㅋ​​​​​지금은 여행을 많이 안 다니지만 원래 평소에 여행을 많이 다녔던 입장으로 UBS 충전되는 '휴대용 케이스'를 따로이제공해 주는 것도 맘에 들었고요.​여행 뿐만 아니라 직장 <-> 집 왔다 갔다 할 때 갖고 다니기 좋고요 ㅎㅎ​​​​​​컴팩트한 크기로 휴대성까지 다 잡아서 만족!​​​​​그리고 마지막으로 교정을 하고 있거나 유지 장치가 있으면 전동칫솔 사용해도 되는 걸까..? 의문이 있었는데근데 오히려 더욱 더 사용해 줘야 되겠더라고요. ​교정기로 인해 플라그가 더 잘 쌓이므로 진동과 회전을 이용해서 치석이 되기 전에 깨끗하게 플라그를 제거해주는 건 이제 필수인 듯해요.​그리고 교정기와 유지 장치에 전-혀! 영향을 주지 않고요 ㅎㅎㅎㅎ​아무래도 교정하다 보면 자연스레 잇몸이 약해지기 마련인데, 그럴 때 잇몸을 감싸주는 원형 칫솔모를 가진 오랄비로 평소 닿지 않는 부분까지 꼼꼼히 케어해주는 것이 잇몸을 위한 최적의 선택 아닐까 싶어요.​저는 앞으로 꾸준히 계-속!칫솔모 리필하면서 사용할 예정이랍니다.혹시 사용을 망설이셨던 분들이라면 지금 바로 시작해보길 권해볼게요.​​​마지막으로 제대로 된 사용법을 담은 영상 첨부해볼게요 :) ​(절대로 일반 칫솔처럼 마구 왔다갔다하면 안되고 가만히 잇몸과 치아를 감싸주고 이동해줘야 된답니다. 꼭 기억해두세요! ㅎㅎㅎ)​​​​​",23,0,1,386,2,2,7197.8,10,text_ad,2021. 3. 8. 20:05,6485,17924543,패션·미용,"['좋은 칫솔 들고다니네', '오랄비 칫솔 많이 들어보기만 했지 궁금하네요 :)']"
