,Post URL,Post,Image num,sticker num,gif num,Paragraph num,Comment num,Video num,weekly viewer mean,Sympathy num,AD,Posting Date,Buddy num,Total visit,Blog category,Comment detail
0,https://blog.naver.com/prettyh90?Redirect=Log&logNo=222267791700,"​​안녕하세요. 복층 오피스텔에 살고 있는 연쁘에요 :) 벌써 혼자 독립해서 이사온지도 반 년이 넘었는데요. 많은 사람들이 복층에서 살면 사는데 있어서불편하지 않냐고 물어보더라고요.​예를 들면, 여름에 너무 덥지 않냐 겨울에 너무 춥지 않냐 왔다갔다 하는거 힘들지 않냐..천장은 다락방 아니냐..같은거?​그렇지만 제가 사는 곳은 신축이라 복층 천장에 에어컨이 달려있어 온도 조절도 잘 되고, 층고도 높아서 불편함을 전혀 1도 모르고 지내고 있답니다.왔다갔다 하는건 2층을 아예 침실로 쓰고 있어서 잘 때만 가서 편하고요 ㅎㅎㅎ​다만 반 년 정도 지내보니 1층과 2층의 조명이 서로 분리가 되어있다는게 은근히 불편하더라고요...?​2층 복층에서 1층 조명을 끄고 켤 수가 없음...ㅋㅋㅋㅋㅋㅋㅋㅋ​그래서 저녁에 1층 불을 끄고 2층에 계단을 올라가면 너무 어두 컴컴한거에요?그렇다고 항상 미리 2층 불을 켜두고 1층을 왔다갔다 하기에는 그만큼의 밝기도 필요 없거니와 전기세가 은근 낭비되고요.​그래서 복층 계단 쪽에 모션감지 되는 조명을 설치하기로 결정했어요.​​​​​컴스마트 충전식 모션센서 LED 라이트 ​모션감지가 되는 LED 조명!크기별로, 조명 밝기 별로 종류가 나뉘어져있어요.저는 이왕 주문하는거 20cm와 50cm 서로 다른 크기와 4000K, 6000K 서로 다른 밝기로 주문했어요.​​​​​조명설치는 자석부착, 3M 플레이트부착, 고리부착 총 세가지 형태로 붙일 수 있고요.저는 복층 난간이 철제로 되어서 자석부착하기로 결정 ! ​​​​​모션감지 LED조명 중에 컴스마트 제품은 USB 충전식이라 간편해요. 케이블도 따로 내장되어서 오고요 ㅎㅎ ​​​​USB 연결 부분하고 전원버튼은 한쪽에 있어요!전원버튼은 슬라이딩 형식으로  ON/OFF/AUTO 가능해요.​AUTO 모드는 모션센서를 활용해 움직임을 감지하면 20초동안 조명이 켜지고, 자동으로 소등되는 시스템으로 되어있답니다 :) ​저는 복층 오피스텔 계단에 설치했으니 AUTO모드로 사용하고 있어요.​​​​​​계단 난간이 철제라 자석으로 딱! 고정된 모습!따로 전선을 연결하거나 수작업 필요 없이​붙이기만하면 설치가 완료되니 굉장히 편리해요. ㅎㅎㅎ​설치 하는데 걸린 시간1초...?​​​​​​AUTO모드는 밝은 곳에서는 작동안하고 어두운 곳에서 작동하기 때문에 밝을 때 사용하려면 ON모드로 바꿔주는것이 좋답니다.​근데 밝을 때 쓸 일은 없으니까그냥... 예시를 들기 위해 ON모드로 해봤어요.​​​​​어두울 때 모션감지 센서가 작동한 모습!앞으로 계단 오르락 내리락 할 때 헤매지 않아도 되어서 넘나 좋은 것.​스마트 스위치도 알아봤는데 개인적으로 모션센서 있는 조명이 설치도 간편해서 굿 :) ​​​​실제 밝기는 영상으로 확인해보세요!​​[홈페이지 바로 가기]​​​ 
 
 
",16,1,0,282,0,1,7194.2,3,revu,2021. 3. 7. 23:33,6485,17924525,패션·미용,0
1,https://blog.naver.com/prettyh90?Redirect=Log&logNo=222415842919," ​​​​​안녕하세요. 집순이 연쁘입니다 :) ​제가 알아주는 이 구역 집순이인데, 얼마나 집순이 지수가 높냐면,,,,블로그 활동 외에는 집 밖에 1도 나가지 않아요. 즉, 블로그를 안했으면 집을 아예 안나가는 수준?​그래서 처음에 블로그 시작했을 때 가족들이 눈물을 흘리며(?) 밖에 나가니 너무 보기 좋다고 극찬을 했었다죠,,,?​그런데 독립해서 나만의 공간이 생긴데다, 사랑스러운 똘망이까지 함께 있으니 더 집콕하고,  코로나까지 있으니 이건 그야말로 합법적인그야말로 집순이 대전성시대!행복해요...주말에 뭐했냐고 어디 갔냐고 누구 만났냐고 안물어보는 요즘 너무 좋아요.......​(연쁘는 스몰톡 부담스러운 INTP입니다)​그 와중에 집순력을 높이기 위해 음질 짱짱하고, 디자인도 예쁘고, 휴대용 블루투스 스피커(!)까지 되는가성비 좋은 음향 기기를 장만해서 ​드디어 만렙 집순이가 되었습니다.​제가 주문한 음향기기 후기 지금부터 자세히 시작해볼게요!​​​​​아이노트 BT-V7 ​블루투스 5.0 버전을 지원해주고 풀충전시 약 6시간 무선으로 사용할 수 있는 선이 필요 없는 무선 블루투스 스피커!​가격은 약 10만원이 안되는입문자-중급자 사이에 위치한 포지션이에요.​​​​​구성품은 본체, 사용 설명서, 케이블, 오디오 케이블까지 전부 지원해주고 충전은 5핀 USB 케이블이랍니다.​​​​​깔끔한 디자인에 터치로 깔끔하게 조작할 수 있어요.버튼보다는 요런 터치가 디자인면에서 심플하고 인테리어 효과도 뛰어난 :)​​​​​옆면에는 전문적인 음향 앰프가 있어서 공진음을 최소화해 음질을 탁월하게 향상시켰고요.​뒷면에는 오디오 잭 연결 부분TF, USB 연결부분, 충전부분 있고 ON/OFF로 전원 조작 가능해요.​개인적으로 간편하게 USB만 연결해서음악을 재생할 수 있어서 휴대용 블루투스 스피커 용도로도 딱 적합한 타입이에요 ㅎㅎㅎ​특히나 앰프까지 달린 휴대용은 흔하지 않은 편이라 고오급 음질이 나온달까요 ㅎㅎ​​​​​브라운 & 그레이 깔끔한 디테일과 디자인으로 어느 인테리어에도 잘 어우러지는 ! 현대적이면서도 레트로한 감성을 적절하게 믹스한 듯 싶어요.​​​​​밑에 받침 부분도 있어 훨씬 안정적으로 설치 가능하고 음악도 더 입체적이게 감상 가능!​​​​​그렇게 연쁘집에 입성한 아이노트 블루투스 스피커....♥︎세트로 맞춘거 마냥 찰떡!​요즘 화이트 & 우드 인테리어 많이하는데 딱이에요 ㅎㅎ​​​저는 주로 맥북, 아이패드, 아이폰 요 셋과 연결해서 재생하는데 금방 인식되고요.최신 블루투스 5.0 버전이라 막힘없어요!​또한 10m 거리 내에서 재생이 되기 때문에 방에서 틀고 거실에서 빵빵하게 들을 수도 있답니다.저는 반대로 거실에서 맥북으로 블루투스 연결하고 침실에서 빵빵하게 음악 듣곤해요 ㅎㅎ​​​​​앞, 뒤, 옆 전부 깔끔해서 마음에 쏙!이왕 블루투스 스피커 쓰는거 디자인도 예쁘면 을마나 좋게요.​​​​​안락함 그 자체...♥︎소리에 예민한 고양이도 맘에 들어해요.​​​실제로 출력되는 모습은 영상으로 확인해보세요 :) ​개인적으로 M사 뺨치는 베이스 둥둥 저음 + 깔끔한 고음을 뽑아서음향 기기 입문용으로도 너무나 좋음(!)​덕분에 아이패드 맥북으로 듣는 것 보다블루투스 연결해서 듣는 것이 훨씬 웅장하고 입체적이라요즘에 매일 연결해서 음악 듣고 있어요 ㅎㅎ​​​​​예쁘고, 음질 좋고, 튼튼하고, 휴대용 블루투스 스피커 기능까지 두루두루 갖춘 아이노트 만족 또 만족해요! ㅎㅎㅎ​제가 주문한 BT-V7 제품은 아래 네이버 스토어에서 만날 수 있답니다.스토어찜하면 할인까지 챙길 수 있으니 참고 :)​[바로 가기]​​​ 
 
 
",25,1,0,359,1,1,7194.6,12,text_ad,2021. 6. 30. 23:37,6485,17924527,패션·미용,['INPT 이게 무슨뜻이고??']
2,https://blog.naver.com/prettyh90?Redirect=Log&logNo=221911444764,"​​ ""BANG & OLUFSEN"" ​​​​감각적인 사운드 브랜드 '뱅앤올룹슨'  세련된 라이프스타일을 지향하는 편집숍 '에디토리' ​에디토리 편집숍이 오는 5월 12일까지 뱅앤올룹슨 프로모션을 한달 간 진행하고 있다는 소식! 본격적으로 시작하기 전에 초대를 받아서 라인업을 전부 살펴 보고 왔답니다.프로모션에 참여한 라인부터 시작해 다양한 에디토리의 모습까지자세하게 꼼꼼히 담아내볼게요 :) ​​​​​​들어서자마자 반겨주는 BEOPLAY A9 4th GEN과 BEOSOUND1, 2인테리어 소품 역할로도 톡톡히 하는 BEOPLAY A9은 둥근 곡선의 미학이 듬뿍 담긴데다 1500W의 강력한 출력까지 표현해요.인공지능 멀티룸 스피커로써 구글보이스까지 지원해주는 똑똑하고유려한 뱅앤올룹슨의 대표적인 스피커 라인업이랄까요.​BEOSOUND 1은 알루미늄 소재로 깔끔한 멋을 표현하고무선으로 최대 16시간까지 사용할 수 있는 장점이 있어요.원하는 위치에 부담없이 설치할 수 있고요.​​​​​BEOPALY H9, E8은각각 헤드셋과 무선이어폰 라인업인데 실제로 들어보니 몰입감이 상당해서 놀랐어요.둥근 모양의 BEOPLAY A1은 너무 귀엽고휴대성이 뛰어나서 소품과 보관하기도 좋았고요.​에디토리 제작가구 Release 원목 테이블도 화이트 오크로 우수한 디테일이며 마감이며 소재며너무 따뜻하고 예뻐서 소장욕구 가득!ㅎㅎ​​​​​​​BEOLIT 17은 피크닉이 생각나는 듯한 디자인으로손잡이까지 있어 언제 어디서든 들고 다니기 좋아요.뱅앤올룹슨 최초의 사운드바 BEOSOUND STAGE와 BEOPLAY A9 4th GEN 조합도 너무 세련되고 우수하고 강력한 파워에 놀랐답니다 @.@​사운드 바는 최신 오디오 기술이 한껏 담겨 서브우퍼가 필요 없을 만큼 살아있는 사운드를 선보이고요.영화관에 들어가는 돌비 애트모스 기술이 탑재되어 생동감이 뛰어나요.와이어리스로 깔끔하게 설치되어 인테리어 효과도 톡톡하고요.​BEOSOUND 1, 2와 같이프로모션에 들어가는 라인이라 특별함이 가득!​​​​​​사운드를 영상으로도 담아봤어요.+) 실제로는 훨씬 더 생동감 있게 들린다는 점 참고해주세요!​​​​​​뱅앤올룹슨 라인업을 전부 살펴보고 난 뒤에는에디토리 곳곳에 있는 인테리어를 하나하나 감상하기로 했어요.SPENDOR 브랜드의 우드스피커 분위기가 참 따스하게 다가오더라고요.​​​​​조명부터 시작해 오브제 하나하나배치며 조화며 너무 잘 어우러지게 세팅해놔서 인테리어 공부도 제대로 되는 느낌이랄까?​하나하나 의미있는 배치에예사롭지 않은 본격적인 디자인이라 보는 눈이 정말 즐겁더라고요.​​​​​​​인테리어 소품 하나하나트랜디하면서도 라이프스타일에 자연스럽게 스며들게끔  그 어떤것들과 함께해도 튀지 않고 어우러지는 가치를 제시해준달까요.​​​​​​​​에디토리 편집샵 3층에 이어서 2층에는 다양한 일상 생활 소품들도 함께 있는데커피도 즐길 수 있는 카페테리어도 마련되어서여유를 듬뿍 느낄 수 있었답니다 ㅎㅎ​​​​​​​클래식함과 트랜디함이 서로 공존하면서 흔히 접할 수 없는 독창적이고 유니크한 소품들까지 가득하니 하나하나 구경하느라 시간 가는 줄 모르겠더라고요 ㅎㅎ​​​​​​감각적인 인테리어를 지향하는 에디토리 X 뱅앤올룹슨 프로모션은 4월 13일(수)부터 5월 12일(화)까지 한달 간 진행 중이니특별한 혜택 놓치지 말고 챙겨보세요! ​​​​ 
 
",26,0,0,307,16,1,7195.2,30,text_ad,2020. 4. 16. 23:07,6485,17924530,패션·미용,"['사운드도 좋고 인테리어로도 너무 예쁘네요!', '그쵸! 인테리어와 사운드 전부 다 잡았어요 :)', '스피커도 요즘은 인테리어에 한 자리를 매김한거 같더라구요!스피커 넘나 예쁩니다😊', '스피커 너무 예뻐서 반해버렸어요..★', '캬 인테리어에 잘 어울리는 제품들이 가득하네요', '전부 다 너무 예뻐서 시간 가는 줄 몰랐어요!ㅎㅎㅎ 너무 예쁜 스피커에 반해버렸답니다 ㅎㅎ', '연쁘님~ 구경 잘하다갑니다~ 자주 놀러올께요', '네~^^', '와, 세트 인테리어가 너무 예쁘네요. 제품도 잘 어울리고. ㅎ', '그쵸 진짜 예뻐서 구매욕구 뿜뿜!ㅎㅎ', '캬 대박 ~ 나중에 집사면 이거부터 들여놓고 싶네요!!! 음향장비 입문하면 정말 대박이라는데 말이죠~', '실제로 들으면 더 장난 아니더라구요!ㅎㅎ 저두 독립하면 꼭 스피커 놓아야겠더란!! ㅎㅎ', '앜 처음에 연쁘님 집 엄청 이쁘게 꾸며놓으셨다 생각했는데 뱅앤울룹슨 스튜디오였군요 ㅠㅠㅋㅋ 저도 무선이어폰 가지고 있는데 성능이 좋아서 에어팟보다 자주 들고다니는 갓 같아요!', '증맬루 제 집이었음 좋겠어요..⭐️ 스피커 정말 좋더라구요! ㅎㅎ']"
3,https://blog.naver.com/prettyh90?Redirect=Log&logNo=222217646931,"​​​​​​안녕하세요. 연쁘에요. 제가 반려동물을 키우다보니 비건소재와 비건화장품에 무척이나 관심을 가지게 되었는데요. 비건레더로 만든 실용적인 아이패드파우치가 새로이 출시되었다고해서 주문해봤어요.​'밀리의서재 X PAPPER 패키지' 자세히 리뷰해볼게요:)​​​​​PAPPER 페퍼 X 밀리 비건 태블릿파우치​자연섬유로 만든 '식물성 가죽' 비건레더 소재를 적용한 아이패드 파우치!소재에 가벼움과 튼튼함 생활방수까지 꼼꼼하게 적용되었고, 파우치 크기는 아이패드 프로 4세대 12.9형까지 완벽하게 수납할 수 있는 크기에요.​컬러는 샌드 베이지, 라이트 그레이, 블랙 중에 무난하게 쓰려고 블랙 컬러로 골랐어요.​​​​​브랜드 네임택 깔끔하게 들어갔고,지퍼도 사선 디테일을 적용해 심플하면서도 밋밋하지 않은 포인트를 적용했어요.​특히 지퍼 소재는 지퍼계의 에르메르스로 유명한YKK 방수 지퍼를 사용했고요.​​​​​앞부분에도 수납 공간이 있어 가벼운 시집, 펜슬 수납이 가능한 것도 장점!​​​​​손목으로 가볍게 들거나어깨에 멜 수 있도록 스트랩이 있어서 경우에 따라 숄더백으로도 활용 가능해요.​​​​프로4세대 12.9인치가 들어가고도 여백의 공간이 살짝 있고요.​기기가 직접적으로 닿는 내부에는 쿠셔닝이 앞 뒤, 옆으로 되어있어 기기 소중하게 보호 가능!​보다시피 아이패드파우치 역할을 톡톡히 한답니다.​​​​​아이패드 프로 4세대를PAPPER파우치 위에 올려놔봤어요. 어느 정도의 크기감인지 와닿을거에요 ㅎㅎ보다시피 수납력 완전 깔끔하고요!​​​​​페퍼 X 밀리의 서재 콜라보로  밀리 오리지널 책과 김영하의 서재 필사노트까지 함께 세트로 받아볼 수 있는 특전까지! ㅎㅎ​​​​밀리의 서재 오리지널 '시티 픽션'은 7명의 작가들이 모여 만든 테마소설집으로 마치 네이버웹툰의 단편 특별집 모음 느낌!​'필사노트'는 옆에 빈 공간에 김영하 작가의 대표작 문장을 따라 적으며 작가의 표현을 한번 더 되새기며, 내면화할 수 있어요.​아이패드파우치 구매 시, 필사노트와 서적까지 패키지로 받을 수 있다니 굉장히 특별한 일상을 선물 받는 기분이랄까?​​​​​같이 받은 필사노트 서적까지 쏘옥 들어가는 수납력! ㅎㅎ​​​​ 밀리의서재 X PAPPER ​가볍고, 생활 방수 되고, 쿠셔닝까지 갖춘,기본에 충실하면서도 실용성을 다 잡은 아이패드 파우치! '비건레더'여서 더욱 의미있는 가치 지향 소비 해보세요:)​덧붙여, 밀리의 서재 서적까지소장해보세요 ㅎㅎㅎ​​​실제 디테일은 영상으로 첨부:)​​/공식홈페이지//스마트스토어/​​​",21,0,0,238,1,1,7195.4,4,revu,2021. 1. 23. 21:59,6485,17924531,패션·미용,['아이패드 비건 가죽케이스 보고있는데 넘 좋은거 같아요 좋은 정보 감사합니다 ㅎㅎ']
4,https://blog.naver.com/prettyh90?Redirect=Log&logNo=221712393842,"​​​​​​​안녕하세요. 연쁘입니다!수능 끝난 뒤로 날이 계속 추워지는거 같아요.급기야 오늘은 한파주의보까지 내리곤 했는데요.날이 추워지면 가장 먼저 생각나는 향은역시 '머스크' 아닐까 싶어요.​머스크와 우디 계열을너어어어무나 좋아하는 연쁘에겐​겨울이란... 그 동안 나의 향수 컬렉션(?)을전부 다 마음껏 쓸 수 있는 계절이랄까요.​​​​​​​​그런 저에게 최근 파우치 필수템으로 등극한 머스크와 우디 계열의 아이템이 있으니​​ 향수의 향은 그대로!헤어에 수분과 고정력까지 부여해주는쌀쌀하고 건조한 계절, 겨울에 너무나도 제격인 #페라가모 세뇨리나 헤어미스트 랍니다.​ 향부터 바틀 디자인 그리고 분사력까지 자세히 리뷰해볼게요 :)​​​​​세뇨리나 리벨 헤어 미스트 Signorina Ribelle Hair Mist 30ml 60,000원​​세뇨리나만의 시그니처 직사각 바틀 쉐입이 특징! 강렬한 푸시아 컬러 리본이 굉장히 매력적이에요♥무광으로 되어있는 바틀은 살바토레 페라가모 브랜드만의피니싱과 고급진 무드를 연출해준답니다.​첫향은 핑크페퍼로 도발적인 아우라로 톡(!)쏘는 느낌이라면미들노트는 만다린과 레드 페어의 조합으로 달달하면서도 신선하고 베이스는 머스크와 우디로 우아하고 따스한 향이 가득해요.​요약하자면,1초간 톡 쏘는 강렬한 첫인상으로 시작해잔향은 달달하면서도 부드러운 향으로 남는답니다.잔향 지속력도 3-4시간 이상 오래도록 지속되는 것이 특징이에요.​​​​​​​한 손에 쏙 들어오는 디자인!'페가라모'하면 바로 생각나는 리본 디자인이 소장가치를 더욱 더 더해준답니다 :)​​​​​푸시아 핑크로 세련된 마젠타 컬러감의 리본!볼 때마다 너무 예뻐서 뿌리기도 전에 힐링하는 기분이에요 ㅎㅎ​​​​ 세뇨리나 리벨 헤어미스트는'퀵 드라이 포뮬러'로 머릿결에 산뜻함까지 선사해줘요.단순히 향기만 가지고 있는 것이 아니라 기능까지 가지고 있어우아하고 부드러운 향과 헤어 연출도 같이 할 수 있어요.일석이조 아이템이랄까요?ㅎㅎ​​​​​한 두어번헤어에 펌핑해주면 된답니다.​사용 상의 팁을 주자면 머리 바로 앞에서 분사 하는 것 보다는20~30cm 떨어진 상태에서 분사하는 것이 좋아요.살짝 떨어진 상태에서 분사하면 골고루 향이 남겨진답니다 :)​​​​​​분사력 테스트는영상으로 자세히 담아봤어요.보다시피 뭉침없이 끊김없이 확산시켜줘요.​​​​​춥고 건조한 겨울 날 헤어에 수분도 공급해주고 자연스러운 향도 연출해주는살바토레 페라가모 세뇨리나 리벨 헤어미스트 !​30ml는 들고 다니기도 좋아서최근 연쁘의 #파우치필수템 No.1이랍니다.볼 때마다 너무 예쁘고.. 향도 좋고..♥​제가 이 구역의 머스크와 우디 애호가(요즘 언어로 처돌이)인데향이 부드러워도 너어무~~~부드럽고 좋아서머스크와 우디 계열을 좋아한다면꼭 마련하길 권해볼게요 :)​**현재 카카오톡 선물하기에서도 만나볼 수 있으니의미있는 연말 선물, 크리스마스 선물,기념일 선물로도 추천해볼게요!​​​​​마지막으로 세뇨리나 리벨 X 손나은 화보컷과 화보 영상 첨부!나은이가 직접 픽(pick)한 향으로도 유명한데나은이의 취향은 탁월한 것으로..♥​​​",20,0,0,279,1,2,7195.8,22,,2019. 11. 19. 16:24,6485,17924533,패션·미용,['특별함이 보이는군요 헤어에도 이렇게 디테일한 미스트를 사용한다면 머리결 뿐만아니라 전체적인 향이 굉장히 은은하고 좋을거같습니다선물용으로도 참으로 부족함이 없어보이네요 참 ~수능 감독하시느라 고생하셨습니다']
