,Post URL,Post,Image num,sticker num,gif num,Paragraph num,Comment num,Video num,weekly viewer mean,Sympathy num,AD,Posting Date,Buddy num,Total visit,Blog category,Comment detail
0,https://blog.naver.com/psw415?Redirect=Log&logNo=222036362767,"안녕하세요 Blend입니다.제 블로그를 자주 들어오시는 분들은 아시겠지만,사진이외에 얼마전부터 가죽공예에취미를 붙이고 이것저것 만들고 있는데요,​얼마전, 시를 쓰는 친구를 위하여 펜파우치를한번 만들어보았는데요,​간단하게 만드는 과정을 적어볼까 합니다.​​​제일먼저 재단을 해줘야겠죠?저는 투명한 플라스틱 자를 쓰는걸 선호합니다.왜냐면 투명해서 밑에가 잘 보이거든요!​​​​자와 함께 하얀색의 초크를 사용하는데요,하얀색이 그래도 잘 보이는편이라저는 이걸 사용합니다.​​​​그리고 커터를 가지고 재단한 크기대로 잘라줍니다.​​​​사용할 가죽을 모두 잘라놓았습니다.​​​​이제 펜의 두께와 깊이를 생각하여크기를 다시한번 확인해봅니다.​왜냐면 입체적으로 만드는거라 생각했던게다를 수 있거든요​​​​확정이 되면 사용할 크기에 맞게 잘라줍니다.​​​​자른다음 할일은바느질 할 구멍을 뚫는 일이겠죠?!집이 1층이라 그냥 바닥에서 해도 아무일 없어서정말 좋은 것 같습니다.​그게 아니더라도 소리가 안울리게끔하기는 하는데그래도 아래집에서 올라올 일은 없으니까요!​​​​구멍을 다 뚫고나면본드를 각 가장자리에 잘 발라주는데요,바느질로도 충분히 튼튼 할 수 있지만,그래도 본드로 붙여주는게훨씬 견고하기도 하고,나중에 옆에 부분이 갈라지지 않게 하기 위함입니다.​​​​그래서 ㄷ자 모양으로만본드를 발라주었는데요,다 붙일건 아니기 때문이죠!​​​​크기에 맞춰서 잘 붙여주고나서약간 굳을 시간을 주고나서한쪽에만 뚫은 구멍을반대쪽도 똑같이 뚫어야겠죠?​​​​원래 구멍을 뚫었던 그 자리에 다시구멍을 뚫어줍니다.이번에는 가죽 2장을 뚫는거다보니조금 더 깊게 뚫어줍니다.​​​​신나는 망치질~~​​​​ㄷ자 모양의 구멍을 따라서 뚫다가이제 위로 쭉쭉 올라가줍니다.왜냐하면스티치를 넣어주기 위해서인데요,안넣어주셔도 된다 싶으신분은굳이 안하셔도 상관은 없습니다.​​​구멍을 뚫는일이 끝나면정말 시간이 오래걸리는 노동이 있죠.장인정신으로 한땀한땀 바느질을 해나갑니다.​​​​이제 몇번 했다고 비교적 바느질이조금은 가지런해진 모습입니다.처음에는 엄청 삐뚤삐뚤했었는데,장족의 발전이네요​​​​바느질을 마치고 난 뒤에저는 실부분을 망치질을 해주는데요,원래 실이 조금 울퉁불퉁하기도 하고,왠만하면 조금 깔끔했으면해서살살 망치질을 해주곤 합니다.​​​​망치질을 해주고나면실밥이 조금 튀어나오는 경우가 있는데요,그런 부분까지도 확인하고 잘 잘라주면 됩니다.​​​​이제 끝이 났는데요,모서리부분 라운딩커트해주고똑딱이만 달아주면 이제 모든 작업이 끝이납니다.​​​​부드럽게 라운드를 지게잘라주면됩니다.​​​​잠그고 열 수 있도록똑딱이도 잘 달아주고나면이제 엣지코트만 발라서 말려주면 되는데요,엣지코트는 꼭 안해도 되지만,깔끔한 끝을 위하여!​​​​아까운 엣지코트..뚜껑에 있는것도 알뜰하게 잘 쓰고,​​​​발라줍니다.그냥 열심히 꼼꼼하게 발라줍니다.​​​​그리고 말려주면 끝인데요,엣지코트는 1차로 끝이 아니라2~3차정도는 발라줘야 합니다.​생각보다 마르는 시간은 빠른편이라열심히 하다보면 끝이나죠!​​​​그냥 꼼꼼하게 잘 발라주기만 하면되는데요,말그대로 가죽의 끝단면 부분을정리해주는 역할을 합니다.​이제 가죽공예는 어느정도 할 수 있을 것 같습니다.독학으로 이정도면 정말 잘하는편이 아닐까요?!​다음에는 친구가 이번에 새로 차를 샀다고 해서벨로스터N 가죽키케이스를 만들어줄까하고 생각을 하고 있습니다.​실물 키가 있어야 재단하고 만드는데,그 키를 가지고 있는 사람이 주변에 없네요 ㅠㅠㅠ​조만간 키를 구해서 그것도 만들어보려 합니다 ㅎㅎ​터 ㅣ
",47,0,0,288,0,0,189.2,4,,2020. 7. 20. 17:26,205,235760,IT·컴퓨터,0
1,https://blog.naver.com/psw415?Redirect=Log&logNo=221856475031,"안녕하세요 Blend입니다.요즘 코로나19 때문에 원래 취미 생활이던사진촬영을 잘 나가지 못하고 있습니다.​그래서 예전부터 도전해보고싶어서핸드메이드페어나 DIY페어를 할때 야금야금 사두었던가죽들과 일본에서 사왔던 툴들,그리고 인터넷으로 과감하게 시킨 툴들을 이용해서가죽공예를 하면서 지내고 있습니다.​제일 처음 만들었던 건강집사가 사용할 다이어리 커버였습니다.꽤 큰 크기인데다처음 만드는거다보니 약간 서툴기도 한데요.그래도 나름 만들고 뿌듯했던 겁니다.강집사가 원하는대로 만들어내느라고생 좀 했었는데요,그래도 생각보다 만족스러웠던 작업이었습니다.그리고 잘써주고 있으니 감사할 따름이죠!그러고 두번째로 만들어본게바로 펜 홀더! 필통이라고 해야할까요..어째뜬이걸 만들어 보았습니다.조금은 난이도가 높았다고 생각하는데요,펜이 들어갈 공간을 생각해서약간 입체적으로 만들어야해서조금 복잡했었네요.돌돌 말아서 함꼐 있는 끈으로묶으면 되는 형식입니다.연습용 가죽으로 제작해서엄청나게 고급스럽지는 않지만,그래도 뭔가 하나씩 만들어가니 재미있더라구요.그리고, 그 다음으로 만든게카드 지갑입니다.카드지갑은 왠지 있으면 쓸거같아서 만들었는데저번에 일본 여행때 유용하게 쓰였습니다.이렇게 뭔가를 만들다보면이렇게 짜투리 가죽들이 남게 되는법이죠.곰곰히 생각해보다보니이 짜투리가죽들로 차키 케이스를만들 수 있겠다 싶었습니다.먼저 차키를 이렇게 올려두고 제단을 합니다.원래 본을 뜨고 종이로 크기같은걸 먼저 확인한다음만드는게 맞긴하나,저는 그냥 바로 칼을 가죽에 대버렸습니다.어짜피 애매한 가죽 크기라 해보지 뭐!라는 생각이었죠.앞뒤로 사이즈 좋게 만든다음구멍을 곱게 잘 뚫은다음옆면에 들어갈 가죽과 함께바느질을 열심히 합니다.​사실 이 다음걸 찍는다는걸 잊고 그냥 후다닥만드는데만 열중해서 사진이 없습니다.그렇게 해서 완성된 제 차 키 케이스입니다.그냥 눈대중+야매 재단으로 만든거 치고꽤 괜찮게 나온 것 같습니다.카드지갑과 함께 두니 뭔가 조금 더 고급스러운 느낌?저만 그런가요 ㅎㅎ이래저래 가죽을 이용한걸 만들어보고 있는데다음엔 뭘 만들지 고민이 되네요.​이상 야매로 만드는 가죽 키케이스 DIY였습니다.잘
",11,0,0,190,4,0,189.2,3,,2020. 3. 16. 15:06,205,235760,IT·컴퓨터,['야매로 나도 하나 맹글어줘... ㅋㅋ']
2,https://blog.naver.com/psw415?Redirect=Log&logNo=221733217743,"안녕하세요 Blend입니다.연말에 자기 자신한테 선물을 하나씩 하죠!그래서 저도 고민을 하고 있던LED 조명을 하나 구매를 해보았습니다.​여러군데의 오픈마켓을 찾아보다가가격이 엄청나게 비싸더라구요.그래서 고민을 하다가 알리 익스프레스에서조명을 구매해보았는데,생각보다 너무나도 좋아서 주변에 추천하고저도 하나를 더 살까 고민중이라서한번 리뷰를 해보려고 합니다.알리익스프레스에서 구매했던 물건중에이렇게 패키지가 깔끔하고 잘되어있는물건은 처음 보았습니다.단단한 박스로 만들어져있었습니다.옆에는 브랜드명이 인쇄되어있었습니다.Manbily라는 브랜드의 물품인데요.꽤나 깔끔하게 잘 되어있었습니다.박스를 열어보았습니다.박스 위에는 Photography Fill Light라고한 가운데에 큼지막하게 적혀있습니다.사진이나 영상에 사용하기 정말 좋은그런 LED 조명입니다.열자마자 설명서와함께USB 케이블, 그리고 파우치가 보입니다.USB는 5핀이 아닌 USB-C 타입을 사용합니다.아직 중국산중에서는 마이크로5핀을 사용하는그런 제품들이 많은데그만큼 최신 제품이라는 의미겠죠?!파우치는 극세사같은 느낌의파우치로 만들어져있었는데요,재질이 너무 고급스러워보이더라구요.그 밑으로는 본품위에 비닐이 쌓여있었습니다.기스가 나지 않도록 패키징이정말 꼼꼼하게 되어있어 정말 좋았습니다.반투명한 판 밑으로 LED가 여러개가 박혀있었는데요,반씩 노란색과 하얀 빛의 LED가 구성되어있는데요,이 두가지의 컬러로 캘빈값을 조절 할 수 있습니다.스위치 부분은 3개로 되어있는데이 3개의 버튼으로 모든 기능을 제어 할 수 있습니다.만듬새가 정말 단단하게 되어있었습니다.예전의 그 중국산이 아니라는그런 느낌이 들더라구요.제 아이폰 XR인데요,크기는 거의 비슷하였습니다.엄청 크지는 않은 느낌이었습니다.조명으로 사용하기에 적당한 크기라고 생각이 듭니다.두께 또한 아이폰 XR과 비슷한 크기로두께도 주머니에 넣어두고 다니기에부담스럽지 않은 크기입니다.동봉되어있는 파우치에쏙 들어가도록 되어있어서휴대하여 다닐때기스나 파손의 걱정에서조금은 덜 수 있었습니다.후면에 자그마한 LCD 창이 있어서잔여 베터리와 잔여 작동 시간,그리고 밝기, K값이 표기가 되는데요,밝기와 함께 K값은 자유롭게 조절이 가능합니다.각 K값 별 조명의 색 입니다.주황색과 하얀색의 빛의 세기로K값을 조절하는 방식으로필요한 K값을 설정하여 사용 할 수 있습니다.작동하는 영상입니다.충전은 USB-C로 충전이되며,충전시 LCD 창에 충전중이라는표시가 나오게되어서 얼마나 충전중인지까지표기가 되어서 너무 좋습니다.반대로 보조베터리처럼 사용도 가능해서USB로 연결하여 기기를 충전 할 수 있었습니다.정말 급할때 빼고는 잘 사용하지 않을 것 같지만없어서 사용을 못하는것과있는데 사용을 안하는건 차이가 큰법이죠.아래부분에는 3/4인치의 삼각대 표준 홀이 있어서미니 삼각대등에 부착하여사용 할 수 있도록 되어있습니다.미니 삼각대 맨프로토 픽시에 연결하여보았는데요,튼튼하게 되어있어서 사진찍을때 조명으로 쓰기정말 적합한 그런 모습입니다.엄청 크지않고 무겁지도 않아서미니 삼각대에서도 충분히 버틸 수있었습니다.제가 구매한 곳에서는사은품으로 핫슈플레이트를 주었는데요,이걸로 카메라 핫슈에 연결하여사용도 가능했습니다.이런식으로 나사 산을 잘 연결하여 주고핫슈에 연결만 해주면 끝인데요.저희가 주로 사용하는Canon EOS RP에 연결하여보았습니다.내장플래시가 없는 카메라라항상 조명이 아쉬웠는데이걸로 조명이 아쉬울 일은 없을 것 같습니다.조명을 켜면 이렇게 되는데요,바로 영상을 찍어도 될 만한그런 모습이었습니다.밝기도 자유자재로 조절 할 수 있고조명부분이 불투명한 재질로 되어있어서빛이 부드럽게 확산되는 모습이어서사용하기 정말 좋았습니다.지금까지 사용해본바로는 정말 만족스러운 모습이고,5~10%정도만 해도 충분한 밝기라서10~15시간은 족히 사용이 가능하더라구요.​간단한 영상용 조명이나,사진 촬영용 조명을 고민하고 계신분이 있다면알리익스프레스에서 이 조명 구매해보시는것도정말 괜찮을 것 같습니다.​​",30,0,0,337,2,1,189.2,4,,2019. 12. 10. 21:30,205,235760,IT·컴퓨터,['좋네여']
3,https://blog.naver.com/psw415?Redirect=Log&logNo=222370368779,"안녕하세요 Blend입니다.​요즘 노트북들은 USB-C타입으로만이루어져있는 경우가 꽤 있습니다.​처음에는 관련 주변기기들이거의 없어서 불편했지만,최근에는 다양한 종류의 주변기기들이출시하여 불편함을 줄이고 있습니다.​그중에 가장 다양한 종류의 주변기기를NEXI라는 회사에서 출시를 해주고 있죠.​맥북에서도 마이크와 스피커를 따로따로NEXI  U31STC 외장형 사운드 카드​​맥북프로의 스피커는 정말 개선이 많이 되었습니다.하지만, 그걸로 충분하다고 할 수 없는 경우도 있는데요,​그런 유저를 위해서 3.5ø의 이어폰 단자를제공하여주고 있습니다.​​​​하지만, 마이크와 스피커나 이어폰을따로 사용하여야 할 경우에는​별도의 아이템이 필요할텐데요,​그럴 때 사용하기 유용한것이USB 사운드 카드입니다.​​​박스는 심플하고 하단부분에이 제품의 장단점이 잘 표시가 되어 있었습니다.​​​​마이크 단자와 스피커 단자가 따로 있는 모습인데요,일반적인 장비들은 대부분 하나의 포트로도사용이 가능하지만, 일부 제품들의 경우따로따로 단자를 요구하는 경우도 있죠.​​​​PC에 연결 하는 방식은 USB-C타입으로최근 기기에 딱 맞는 모습을 볼 수 있습니다.​​​​외장형 사운드카드지만,정말 작은 크기로 되어있어서휴대에도 부담이 없고,책상에 아무렇게나 두고 사용하기에도무리가 없어보입니다.​​​​물론 마이크를 따로 사용하는 경우외에도사운드카드가 고장나는경우컴퓨터를 바꿀수는 없으니이런 외장 사운드 카드를 활용하는것도하나의 방법이라고 볼 수 있겠습니다.​​​​3.5ø의 표준규격을 사용하기때문에어느 장비에도 쉽게 연결 할 수 있는 모습을볼 수 있습니다.​​​​사운드 카드는 맥OS에서도별도 설치가 필요없이작동하는 모습을 볼 수 있는데요,​사운드 설정에가서출력포트를 바꿔주기만 하면 됩니다.​​​​정말 간단하고 사용자 편의적인제품이라고 할 수 있을 것 같습니다.​사운드카드가 고장났을때나,별도로 마이크를 사용하고 싶으실때,​이 USB사운드 카드를 사용하시면간단하게 모든걸 해결 할 수 있을 것 같습니다.​​​​​​",11,0,0,171,0,0,189.2,2,text_ad,2021. 5. 27. 20:19,205,235760,IT·컴퓨터,0
4,https://blog.naver.com/psw415?Redirect=Log&logNo=222036362767,"안녕하세요 Blend입니다.제 블로그를 자주 들어오시는 분들은 아시겠지만,사진이외에 얼마전부터 가죽공예에취미를 붙이고 이것저것 만들고 있는데요,​얼마전, 시를 쓰는 친구를 위하여 펜파우치를한번 만들어보았는데요,​간단하게 만드는 과정을 적어볼까 합니다.​​​제일먼저 재단을 해줘야겠죠?저는 투명한 플라스틱 자를 쓰는걸 선호합니다.왜냐면 투명해서 밑에가 잘 보이거든요!​​​​자와 함께 하얀색의 초크를 사용하는데요,하얀색이 그래도 잘 보이는편이라저는 이걸 사용합니다.​​​​그리고 커터를 가지고 재단한 크기대로 잘라줍니다.​​​​사용할 가죽을 모두 잘라놓았습니다.​​​​이제 펜의 두께와 깊이를 생각하여크기를 다시한번 확인해봅니다.​왜냐면 입체적으로 만드는거라 생각했던게다를 수 있거든요​​​​확정이 되면 사용할 크기에 맞게 잘라줍니다.​​​​자른다음 할일은바느질 할 구멍을 뚫는 일이겠죠?!집이 1층이라 그냥 바닥에서 해도 아무일 없어서정말 좋은 것 같습니다.​그게 아니더라도 소리가 안울리게끔하기는 하는데그래도 아래집에서 올라올 일은 없으니까요!​​​​구멍을 다 뚫고나면본드를 각 가장자리에 잘 발라주는데요,바느질로도 충분히 튼튼 할 수 있지만,그래도 본드로 붙여주는게훨씬 견고하기도 하고,나중에 옆에 부분이 갈라지지 않게 하기 위함입니다.​​​​그래서 ㄷ자 모양으로만본드를 발라주었는데요,다 붙일건 아니기 때문이죠!​​​​크기에 맞춰서 잘 붙여주고나서약간 굳을 시간을 주고나서한쪽에만 뚫은 구멍을반대쪽도 똑같이 뚫어야겠죠?​​​​원래 구멍을 뚫었던 그 자리에 다시구멍을 뚫어줍니다.이번에는 가죽 2장을 뚫는거다보니조금 더 깊게 뚫어줍니다.​​​​신나는 망치질~~​​​​ㄷ자 모양의 구멍을 따라서 뚫다가이제 위로 쭉쭉 올라가줍니다.왜냐하면스티치를 넣어주기 위해서인데요,안넣어주셔도 된다 싶으신분은굳이 안하셔도 상관은 없습니다.​​​구멍을 뚫는일이 끝나면정말 시간이 오래걸리는 노동이 있죠.장인정신으로 한땀한땀 바느질을 해나갑니다.​​​​이제 몇번 했다고 비교적 바느질이조금은 가지런해진 모습입니다.처음에는 엄청 삐뚤삐뚤했었는데,장족의 발전이네요​​​​바느질을 마치고 난 뒤에저는 실부분을 망치질을 해주는데요,원래 실이 조금 울퉁불퉁하기도 하고,왠만하면 조금 깔끔했으면해서살살 망치질을 해주곤 합니다.​​​​망치질을 해주고나면실밥이 조금 튀어나오는 경우가 있는데요,그런 부분까지도 확인하고 잘 잘라주면 됩니다.​​​​이제 끝이 났는데요,모서리부분 라운딩커트해주고똑딱이만 달아주면 이제 모든 작업이 끝이납니다.​​​​부드럽게 라운드를 지게잘라주면됩니다.​​​​잠그고 열 수 있도록똑딱이도 잘 달아주고나면이제 엣지코트만 발라서 말려주면 되는데요,엣지코트는 꼭 안해도 되지만,깔끔한 끝을 위하여!​​​​아까운 엣지코트..뚜껑에 있는것도 알뜰하게 잘 쓰고,​​​​발라줍니다.그냥 열심히 꼼꼼하게 발라줍니다.​​​​그리고 말려주면 끝인데요,엣지코트는 1차로 끝이 아니라2~3차정도는 발라줘야 합니다.​생각보다 마르는 시간은 빠른편이라열심히 하다보면 끝이나죠!​​​​그냥 꼼꼼하게 잘 발라주기만 하면되는데요,말그대로 가죽의 끝단면 부분을정리해주는 역할을 합니다.​이제 가죽공예는 어느정도 할 수 있을 것 같습니다.독학으로 이정도면 정말 잘하는편이 아닐까요?!​다음에는 친구가 이번에 새로 차를 샀다고 해서벨로스터N 가죽키케이스를 만들어줄까하고 생각을 하고 있습니다.​실물 키가 있어야 재단하고 만드는데,그 키를 가지고 있는 사람이 주변에 없네요 ㅠㅠㅠ​조만간 키를 구해서 그것도 만들어보려 합니다 ㅎㅎ​터 ㅣ
",47,0,0,288,0,0,189.2,4,,2020. 7. 20. 17:26,205,235760,IT·컴퓨터,0
