,Post URL,Post,Image num,sticker num,gif num,Paragraph num,Comment num,Video num,weekly viewer mean,Sympathy num,AD,Posting Date,Buddy num,Total visit,Blog category,Comment detail
0,https://blog.naver.com/ranzzang5670?Redirect=Log&logNo=222340792794,"얼마전 우연한 기회에 접하게 되었던 보석십자수어떻게 하는거지? 궁금했었어요​예전에 그냥 십자수는 많이 했었는데반짝반짝 한건가?보석을 실에 껴서 하는 건가?이런 궁금증을 가지고 있었죠​​그런데 학교에서 손바닥만한 보석십자수를 받아왔는데 너무 재밌더라구요아이가 하고 있는 모습을 보는데 저도 너무 하고싶어서신청했지요​​보석십자수에 대해 설명이 써있어요화려한 다이아몬드 형태로 가공된 입체적인 비즈로수놓는 DIY취미생활 입니다남녀노소 구애받지 않으며 초보자도 쉽게 할 수 있고인테리어 또는 선물용으로도 손색이 없으며 집중력과 창의력 향상, 두뇌발달, 치매예방, 우울증 치료도 되는 것​경험상일단 초보자도 할 수 있는 정말 쉽다는 것은 인정입니다그리고 굉장히 집중할 수 있어요​​아이러브페인팅에서 주문했어요저는 작은 것은 좀 성에 안차서크고 멋진것이 하고 싶더라구요​​그래서 이렇게 세가지를 선택했답니다산토리니,고흐(카페테라스),해바라기와작은집​고흐 그림은 평소에 좋아해서...해바라기는 집에 좋은 기운이 들어와서..산토리니는 여름에 시원한 그림을 걸어놓고 싶어서..입니다^^​​​만들고 나서 따로 액자에 넣는 것이 아니라캔버스액자에 되어있는 제품이에요​그래서 완성후 그냥 걸어주거나 테이블에 올려놓아도 예쁘겠죠?​그리고 캔버스에 프린팅이 되어 있어서 훨씬 쉽게어떤 느낌인지 느껴가면서 할 수 있어요​​구성품들 입니다​​도안트레이판펜 고체풀비즈3,6,9 펜 도구라인정리 펜 도구​​펜이 양쪽으로 사용이 가능하게 되어있어요한쪽엔 하나씩 하는 펜반대쪽엔 3개가 들어가는 펜좀 익숙해지면 한번에 하는양을 늘려가면서할 수 있는 펜이에요​6개,9개가 들어가는 펜도 있어요저는 아직 초보라서 하나씩 하나씩 해보겠습니다​이건 라인정리를 하는 펜이에요요거 생각보다 많이 쓰입니다중간중간 해줘야 완성한 후 예뻐요​​​그럼 비즈와 도안을 비교하면서 확인해 봐요넉넉한 양이 들어있네요필요한 양보다 20%정도 많은 양이 들어 있답니다​​​그럼 만드는 법을 알아봐요1. 고체풀에 구멍이 나도록 펜으로 뚫어주세요​​2. 트레이에 붙이려는 비즈를 조금 쏟아주세요​​3. 설명서와 캔버스의 부호를 확인해주세요​4. 설명서와 캔버스의 부호가 일치하는 큐빅을 붙여주세요​​5. 평평한 도구로 단단히 눌러주세요​6.완성!​​고체풀을 준비하고펜으로 구멍이 뚫리게 눌러서 뚫어줘요그럼 펜에 고체풀이 들어가서 준비상태가 됩니다​​​​​보호필름이 붙어 있어요접착면을 보호하기 위해서 인데요이 보호필름을 살살 떼어가면서 비즈를 붙여주는 거에요보호필름은 앞,뒷면이 다르니 원래 덮여져있는 방향으로 덮어주세요​​​하기 편하도록 모서리 쪽부터 해 나가기로 해요​​처음에 선택한 곳은 F가 먼저 있어요F는 15번 비즈입니다​​15번 비즈와 비즈트레이판을 준비해요​​그리고 준비해 놓은 펜으로하나하나 붙여 나가면 된답니다​​아이도 스스로 잘 합니다​시간가는 줄 모르고 잘하네요조금 산만한 아이도집중을 잘 하지 못하는 아이도재미있게 할 수 있어요​​아이와 함께 할때는 무엇을 하고 놀아야하나....보석십자수를 하면 됩니다 ㅎ​집에서 할수있는 취미생활로 이만한 것이 있을까요집중력도 키워주고 많은 공간을 차지하지도 않고무엇보다 재밌어요 ㅎㅎ​그리고 인테리어액자로 활용까지 되니안할 이유가 없는 거죠​​비즈를 어느정도 붙였으면라인정리를 해줘요그러면 비즈가 제 자리를 잘 찾는 답니다완성도가 높은 인테리어 액자가 된답니다^^​​​​도안종류가 많고 색 조화, 비즈 퀄리티가 좋아서고르는 재미도 있고 완성이 되어가는 모습을 보면서 기분이 좋아요​무엇인가를 하고 싶은데 두려워서 못하고 있으시다면쉽게 할 수있는 보석십자수를 취미생활로 추천해요​​",32,0,0,332,7,5,846.6,13,revu,2021. 5. 6. 23:59,1883,1661174,,"['잘 보고 갑니다~', '죄송합니다. 다른건 안보였습니다.저 풍경의 저런 집에 살고 싶다~  생각이.. 이번 생은 틀렸나요~', '저도 ... 이번생은 틀렸나봅니다 ㅎㅎ', '우리에겐 평생적금.. 로..롯ㄸ... 가 있으니.. 힘내요!!  🤣🤣', '넵!! 불금 되세요😃', '아.. 글을 빼먹어서.. 또 남깁니다.. 백골이될때까지못 타먹을수있는 확율이 높은 적금.. ㅋ', 'ㅎㅎㅎ 원금보장이 안되는 군요']"
1,https://blog.naver.com/ranzzang5670?Redirect=Log&logNo=222255478430,집에서 재밌게 할 수 있는 미니어처 만들기를 했어요다이소에서 쇼핑하다 재밌겠다 싶어서 가지고 왔어요​집에서 할수 있는 취미들이 다양하겠지만거창하게 시작하면 중간에 포기하기가 쉬워요간단하게 재미로 시작하는 것도 좋아요​​​​저는 목공 작업실을 갖는게 꿈이예요아직은 먼 이야기 같지만언젠가는 제 차고와 작업실을 갖고 싶어요~​​미니어처를 만들면서 꿈을 키워 가겠어요 ㅎㅎ​​​아이와 함께 만들어 봤어요아이가 있는 집이면 함께 만들어 보셔도 좋아요사실은 저 혼자 하고 싶었던 제 취미활동 인데요...같이 할 수 밖에 없어요​​제법 잘 만드네요그림을 보면서 그림에 적힌 숫자를 비교해 가면서 조립을 하면 된답니다​​이렇게 3장이 들어있는데요34개의 미니어처가 완성이 된답니다​저 나무 판에서 조심스럽게 떼어내서같이 들어있는 사포로 마감부분을 문질러 주고홈에 맞춰서 끼우기만 하면 끝​시간이 되고 심심하면페인트를 칠하고 싶어요그럼 더 예쁘겠죠??​​4인용 식탁이랍니다만들기도 쉽고홈카페에 한 몫하는 소품이 된답니다​​​작은 의자 4개가 똑같은 모양 이예요귀여운데... 나름 견고하답니다아이가 자꾸 가지고 놀아요 ㅎㅎ​​작은 인형들을 앉혀도 될만큼 안락해보여요장식용으로 만들고 싶었으나...아이의 장난감이 되어버리는 현실...​​가끔 나무결이 일어난 부분이 있는데사포로 문질러 주시면 금새 매끄러워 진답니다가시에 찔리지 않게 조심하세요~^^​​​​​씽크대와 식탁을 두니소꿉놀이가 생각나요​작은 주방이 완성 되었답니다​​수전도 있고문도 열리고 가스렌지도 있어요 인덕션인가요? ㅎㅎ​​다른것에 비해 만들기 난이도가 조금 있으니더 재미 있었어요이런 만들기를 하고 있으면 시간이 엄청 잘가죠​​집중해서 하다보면티비나 핸드폰을 잠시 내려놓을 수 있어요나에게 오롯이 집중하는 시간이죠동심으로 돌아간 것 같기도 하고..​그래서 성인도 취미가 있어야 한다고 생각해요​​​밖에 나가서 할 수 있는 취미활동도 좋지만쉽지가 않기 때문에 집에서할수있는취미를 찾아보면 좋아요저는 컬러링북도 좋아하고 미니어처만들기도 좋아한답니다​​​시간이 갈수록 단순한 취미활동이 정서적으로 필요한 것 같아요성인취미미술을 배우는 것도 좋고퀼트라던지 공예를 하시는 분들도 많죠​​​취미활동이라는게 거창할 필요는 없는 것 같아요내가 하루에 1시간정도 시간을 내서하고싶은 일을 집중해서 할 수 있는 것그리고 그 일을 하면서 마음의 안정을 느끼고힐링 할 수 있는 것이 나에게 맞는 취미활동 아닐까요?​​남자취미 활동으로도 추천하는게미니어처 만들기 랍니다프라모델도 미니어처의 일종이죠저도 프라모델 참 좋아하는데요고도의 집중력을 요하기 때문에 작업하는 공간이 따로 있는 분께 추천드립니다​​​집에 있는 시간이 늘어나면서이색취미들도 많이 보게되는데요라탄공예나 인형옷을 만드시는 분들을 보면 감탄을 안 할 수가 없어요엄청난 금손 들이십니다...​​​저도 작은 미싱이 있는데다시 해볼까 생각중이랍니다​​취미라는게 없는 사람들이 의외로 만다는 것을 알고 계실까요?사는데 바빠서 잠시 짬이나면 핸드폰이나 티비를 보느라고그나마 가끔 책을 보시는 분은 봤지만취미활동을 하시는 분은 많지가 않아요​​요즘엔 좀 바뀌는 추세 같으니나에게 맞는 취미는 무엇이 있을까 생각해 보세요작은 변화가 삶을 재미있게 만들어 준답니다​우리는 앞으로 살아갈 날이 많이 남았거든요^^​​​색종이접기도 참 좋은 취미죠재미로 접어본 티슈접기접고나서 너무 귀여워서 사진으로 남겨놓고영상도 찍어봤어요​​​​​바쁜 일상 속에서 시간이 나면 잠을 청하거나 미디어에만 시간을 뺏기지 말고재밌는 놀이 찾는다고 생각해서 취미를 찾아보세요생각보다 재미있는 일이 많답니다^^​​,24,0,0,345,12,2,846.6,27,,2021. 2. 24. 23:46,1883,1661174,,"['자주 소통해요! 오늘도 즐거운 하루 보내세요', '포스팅 잘 봤어요 ㅎㅎ\n자주뵈어요 !!', '미니미한 것이 넘 귀엽네요~ 크기만 줄여놓은 듯 실제랑 비슷해서 더 그런것 같아요. 각티슈도  넘나 귀요미하네요 :)']"
2,https://blog.naver.com/ranzzang5670?Redirect=Log&logNo=222302398515,"​주광색 주백색 형광등 아직도 헷갈리시죠?오늘 확실히 비교해서 보여드릴 수 있어요!!​완전 단단하게 포장이 되어서 도착한 LED 조명입니다​​​윗부분을 열어보니 안에 또 이렇게 완벽하게 포장이 되어있어요​노란색 스티커가 붙은것이 주백색 입니다하얀색 스티커가 붙은것이 주광색 입니다​​​​길이가 꽤 길어서 넓은 공간 커버가 가능해요아주 유용하게 쓰일 것 같아요 ​​LED 등기구가 각각 하나씩 충격방지 지관통 패키지에 쌓여서 주광색 1주백색 1 두개가 도착했습니다​​​LED 등기구 전용 AC 전원 스위치 케이블이 있어요3m 길이라 넉넉하고스위치가 있어서 필요시에 켰다 껐다 가능해서 편해요저는 촬영용 조명으로 쓸 예정이라 아주 유용하답니다​​​먼저 주광색 형광등을 오픈해봐요​주광색은 백색빛이 나는 형광등입니다​​​​형광등과나사, 벨크로양면테이프, 2P 터미널이 들어있어요​​​​주백색 형광등도 개봉해 보겠어요​주백색은 따뜻한 노란빛이 감도는 형광등이예요이름에 백색이 들어간다고 백색이 아니랍니다하나만 외우면 구분하기가 편해져요 ㅎㅎ​​형광등과나사, 벨크로양면테이프, 2P 터미널이 들어있어요​​나사로 고정해서 쓸 수도 있고길이감이 길기 때문에 걸쳐놓고 사용할 수도 있어요120cm의 폭만 있다면 걸침형태로 유지가 가능해요저는 벨크로를 이용하여 탈부착하며 사용할 예정이랍니다​​​선을보면 정말 간단해요형광등에 연결되어 있는 선은 암놈이랍니다​​​전용케이블에 있는 부분은 숫놈그래서 암수를 맞춰서 끼워주면전등이 켜져요~​​​응? 난 전등은 두개고 케이블은 하나인데?병렬로 연결도 가능하답니다​​이렇게 두가지를 연결해보니색감이 확실히 느껴지시죠?주백색은 노란빛이 느껴진다고 했지요?하얀빛이 나는 것이 주광색입니다이젠 더이상 헷갈리지 말도록 해요​주백색이 백색이 아닙니다 ㅎ​​병렬연결로 계속 연결할 수가 있겠어요이렇게 간단하고 안전한 등기구면초보분들도 설치나 사용이 편할 듯 해요​하지만언제나 안전이 최우선!!!형광등 설치 작업시 전원차단기를 내리고 작업해야해요전기설치 전문가와 함께 설치를 권장해요​저도 장갑 끼고 했어요~​​제가 주로 촬영을 하는 공간입니다아무래도 조명이 아쉬웠는데​깜빡임이 없어 사진촬영에 적합한 LED 등기구가 찰떡이네요​​매일 붙여두지 않고필요할 때만 붙여서 사용할 예정이랍니다벨크로로 가능하니 편하네요​​그런데 신기하다 일반 형광등보다 발열감이 덜해요상세페이지를 찾아보니 알루미늄 방열설계를 해서 열이 덜느껴지는 거였나봐요​​​​​제가 가지고 있는 조명을 켰으나 약간의 빛이 모자람을 느껴요(전)​​​조금 더 풍부한 빛이 마련이 되었어요 (후)​​​조명이 없고 있고의 차이가 이렇게나 확연하답니다촬영을 많이 하시는 분들 이라면유용하게 사용하실 것 같아요^^​그리고 주방 간접조명으로 활용도 가능하고형광등을 대체할 조명으로 사용이 가능하겠어요​​​​여러분의 팬하기는 리초마녀에게 큰 힘이 됩니다 팬하기 꾹 눌러주세요~~^^​ 
",28,0,0,261,6,1,846.6,13,revu,2021. 4. 7. 23:47,1883,1661174,,['잘 보고 갑니다...실력이 대단하세요~']
3,https://blog.naver.com/ranzzang5670?Redirect=Log&logNo=222347173491,"​신생아가 있는 가정이라면 필수품이죠온습도계왜냐하면 신생아는 더더욱 온도와 습도에 민감하기 때문이에요​그런데 너무 작아서 잘 보기 힘든 온습도계나사용하기 불편하다면 무용지물이겠죠​드렉텍 온습도계 O-251을 소개합니다일단 멀리서도 한눈에 보이는 크기그리고 예쁜 디자인이 집안 어디에 두어도 잘 어울려요​스탠드형으로 세워 놓을 수도 있어요테이블이나 선반에 올려놓을 수 있어요​받침대를 사용하지 않을때는 접어서벽걸이 용이나 자석형으로 사용할 수도 있어요​홈이 있어서 벽에 걸어두어도 잘~~ 보인답니다​처음 사용할 때는 절연지를 빼고 사용하면 됩니다​전지 교환 방법은 간단해요건전지는 AAA 사이즈 한개가 들어갑니다+,- 를 잘 구분해서 넣으셔야 합니다​​각 부분 명칭이 잘 설명되어 있는데요액정화면이 커서 한 화면에 다 나와있어요​​위에 표시되는 것이 온도아래 표시되는 것이 습도에요아이콘과 일본어로 씌여있는 '열중증'표시가 있는데요아래쪽에서 찬찬히 설명해 볼께요​​온도 버튼을 누르면 MAX,MIN,표시없음으로 바뀌는데요하루중 가장 높은 온도,가장 낮은 온도, 현재 온도 를 표시하는 법이랍니다​​마찬가지로 습도 버튼을 누르면 MAX, MIN, 표시없음 으로 바뀌어요하루중 가장 높은 습도, 가장 낮은 습도, 현재 습도를 표시해주는 것이랍니다​​그렇다면 이모티콘과 열중증은 무엇을 말하는 것일까요?아래쪽에 설명 되어 있어요​​​습도가 낮아져서 건조해지면 감기등 호흡기 질환에 걸리기 쉽고, 건조한 피부는 아토피나 가려움증을 더 유발하죠​반대로 습도와 기온이 높으면 세균이 번식하기 쉬운 환경이 되기때문에 ​온습도 관리를 이모티콘으로 보기 쉽게 표시한거랍니다​​특히나 컨디션 회복이 필요한 산모방이나면역력 관리가 중요한 아기방에서도집중력이 필요한 공부방에서도온습도 관리는 꼭 필요한 부분 이랍니다​​사람의 기분 뿐만이 아니라신체적인 컨디션도 좌우하고질병발생을 예방하는 차원에서도 꼭 필요하죠​특히나 스스로 체온을 조절하는 능력이 발달하지 않은 신생아는 주변환경에 따라 체온이 수시로 변하기때문에 세심한 관리가 필요해요​​멀리서도 한눈에 잘 보이는 대화면 액정이 좋아요74mm X 60mm 사이즈라서굉장히 멀리서도 잘 보입니다​​색상도 다양해서 취향에 맞게 선택하면 된답니다색감이 하나같이 사랑스럽지요?디자인도 모던해서 어떤 인테리어에도 잘 어울려요​​습도 측정폭이 굉장히 넓어요10%~98% 까지 측정이 가능하다니20년간 온습도계를 만들어온 드렉텍의 노하우가 엿보이네요​​거실에 두어보고 사진을 찍어봤어요사실 저 자리가 늘 있게될 자리 입니다가장 많은 시간을 보내는 곳이 거실이거든요​​집안 곳곳을 다녀보며 측정을 했는데놀랐어요모두 수치가 달라져요​금새 바뀌는 온도와 습도얼마나 민감한지 바로바로 바뀌네요​​뒷부분이 자석이라서많이 사용하시는 신생아트레이에 붙여도 좋겠죠?저는 주방에 붙여봤답니다자석력이 대단해요​디자인이 너무 귀여워서 어느곳에 두어도 예뻐요^^수시로 보면서 우리 가족 온습도 잘 조절해서쾌적한 환경 유지할게요^^​​​​​",34,0,0,281,1,1,846.6,10,99das,2021. 5. 11. 23:31,1883,1661174,,['리초마녀님 서로이웃 신청드립니다 ㅎ\n외롭게 블로그 운영하다보니 \n사람이 그리워서\n관심있는 블로거 분들께 서로이웃 신청 드려요\n수락해주시면 자주 방문할께요 !!']
4,https://blog.naver.com/ranzzang5670?Redirect=Log&logNo=222314773395,일반 타이머 말고예쁘고 깜찍한 타이머를 찾아 헤맸더랬죠​흔한 타이머 말고 조금 더 귀여운 것을 찾아보다리초마녀 눈에 쏙 들어온스누피타이머!!​​어릴적에 봤던 찰리브라운과 친구들그중에서 독보적인 캐릭터인 스누피​타이머로도 사용하고시계로도 사용이 되니 더 좋더라구요​​숫자가 다 보여서 사용하기가 더 편해보였어요0~9까지 숫자가 써있어서버튼형으로 간편하게 사용해요그리고 개구장이 스누피 그림이 마음에 들었죠​​​뒷면이예요 윗부분은 자석이 들어있고아래쪽이 건전지 넣는 부분이랍니다​​동전모양의 CR2025 전지를 사용해요​​설명서 인데 찬찬히 보면서 따라해 봅니다은근히 기능이 많네요​​조리 타이밍을 알려주는 카운트 업/다운기능도 있어요작지만 아주 똑똑하답니다​​시계를 맞추는 방법은...자꾸 잊어버려서이렇게 사진으로 박제를 해놓아야 됩니다저도.. 나이가 들어가나 봅니다 ㅎㅎ​​저는 시계모드와 알람모드로 되는 것이 가장 마음에 들었어요생각보다 주방에서 시계를 볼일이 많거든요​​한손에 들어오는 사이즈라목줄을 걸어서 휴대용으로 사용도 가능해요​​가볍고 사용이 편해서 운동하러 나갈때도 목에 걸고 나갈 수가 있어요요즘 아이가 자전거에 재미를 붙여서 자주 나가거든요​약속한 시간 만큼 놀고 알람에 맞춰 집으로 돌아오곤 한답니다​​한손에 쏙 들어오는 사이즈죠?가볍기때문에 먹에 걸어도 부담이 없어요​​화면부분에 비닐을 벗겨주면더 선명해 보여요​​음량 조절가능 해요요리를 할때는 큰알람소리조용한 공간에서는 작은알람소리소리없이 조용히 LED만 깜빡이게​요리를 할 때 뿐만 아니라아이와 게임을 할때도시간맞춰 공부습관을 들일때도 유용하게 사용되요​​​뒷면에 자석이 되어있어서철판에 촥~!!! 하고 잘 붙어요​​​저는 키친타올홀더에 붙여놨답니다~냉장고에도 잘 붙어요~​아이가 자꾸 탐을내서아이 책상에 놓을 것을 하나 더 준비를 해야겠어요​​​​,18,0,0,165,5,1,846.6,13,99das,2021. 4. 18. 22:58,1883,1661174,,"['앜ㅋㅋㅋ 스누피 너무 귀엽네요 ㅋㅋㅋㅋ지금 전 다이소 저렴이 쓰고있는데 이것고 괜찮겟어요!!', '너무 귀엽져 ㅎㅎ', '포스팅 눈팅하고 갑니다 ~! ＞∀＜', '좋은하루 되세요~']"
5,https://blog.naver.com/ranzzang5670?Redirect=Log&logNo=222293304266,"안녕하세요 리초마녀입니다점점 발전하는 조명들 오늘은 설치와 이동이 매우 간편한 전등과 리모컨을사용해 볼꺼예요셀프직접조명으로도 가능하고셀프간접조명으로도 가능하답니다​​일단 패키지를 먼저 볼께요심플합니다어두운 곳 어디든 붙여만 주면 터치와 리모컨으로 작동터치도 되고 리모컨도 된다고??​​신박한 제품이죠?건전지 만으로 작동하는 것은 물론터치로 작동되는 것으로도 충분한데리모컨으로 조절이 된다니..​​간편한 터치방식이고리모컨이 편한건 아시죠?10m의 넓은 사용범위밝기조절이 가능하구요4단계타이머가 가능 하답니다하나하나 다 시험해 볼께요​​​개봉해보니 흔들림 없이 잘 포장되어 있네요​​조명3개와 리모컨이 들어있어요그리고 고정할 수 있는 양면테이프도 들어있답니다​​원하시는 위치에 부착하셔도 좋고이동하며 쓰셔도 좋아요가볍고 간편하고 성능이 좋아서아파트비상등으로 구비해 두셔도 좋을 것 같아요다용도 실이나 신발장 깊숙한 곳 등 은근히 손전등이 필요한 곳이 있죠​그럴땐 핸드폰을 사용하긴 하는데 뭔가 불안했었죠​​​이게 피오라이트의 장점 리모컨 입니다밝기조절도 되고타이머기능이 있어서잠들때 어두운 곳을 두려워하는 아이가 있다면조금은 안심하고 잠들 수 있을 수면등이랍니다​아이방 수면등이라 하면시간 맞춰서 꺼주러 들어가거나아침까지 켜져있기도 하는데​이점에서 칭찬합니다10분,30분,60분 120분 설정이 가능해요​똑똑한 수면등이죠?​잠긴상태입니다​​살짝 돌려서 표시선을 맞춰주면 열리는 상태가 되요​이렇게 힘들이지 않고 열어주세요닫을때는 반대로 닫아주세요​​건전지는 AAA 3개가 들어갑니다알카라인과 망간 전지 중에서 알카라인을 선택하시면 더 오랜시간 사용하실 수 있어요​​개봉해보는 영상입니다​​아이방 수면등 터치로 작동시켜보는 영상입니다​​전등리모컨으로 작동시켜보는 영상입니다밝은 곳에서 찍어서 밝기 조절은 잘 안보이네요​​이렇게 3개의 전등을함께 사용할 수 도 있고각기 사용할 수도 있답니다​​​​리초마녀네 집은 복도가 좀 길고...어두워요그래서 복도등을 켜야 잘 보이는데요중문을 달고나니 현관센서등이 작동을 안하더라구요​거실등을 다 끄고 안방으로 들어가려면저 복도를 지나야해요...​어른인 저도 부딪히거나 잘 안보여서늘 핸드폰 손전등을 켜고 이동하는데요​오늘은 걱정이 없습니다수면등으로도 좋지만저는 이렇게 간접조명으로 사용을 할 듯 하네요​​​전등리모컨으로 작동해보고밝기 조절도 해 보았습니다아주 만족스럽네요 ㅎㅎ​간접조명의 경우 밝기조절이 되면 좋겠다 생각했었는데아주 똑똑합니다...​위치를 옮겨 안방에서 나올때 사용할 수 있게 배치도 해봤어요불을 전체적으로 켜긴 그렇고핸드폰으로 켜는 것도 번거롭고..그럴땐 터치 한번이면 해결 되겠죠?​​조명이 3개가 들어있으니 리초마녀는하나는 아이방 취침등으로 사용하고           (타이머 기능 가장만족)하나는 복도에 두고 현관조명처럼 사용하고하나는 안방에서 나올때 터치로 사용 해야겠어요​사용을 해보니 이런분들 좋을것 같아요​스탠드를 켜고 독서를 하시는 분들도 계시겠지만침대 독서등으로도 좋을 것 같구요​아가들 수유등 으로도 적당할 듯해요​화장실 조명이나 씽크대 조명으로도 간단하게설치와 이동이 가능하니 쓰임새는 많을 것 같아요​​​​​​​​ 
 

미      불을 통해 본 업체로부터
제품 또는 서비스를제공받마 작성된 리뷰입니다
「,】

 
",18,0,1,282,2,5,846.6,6,text_ad,2021. 3. 31. 1:28,1883,1661174,,[]
