,Post URL,Post,Image num,sticker num,gif num,Paragraph num,Comment num,Video num,weekly viewer mean,Sympathy num,AD,Posting Date,Buddy num,Total visit,Blog category,Comment detail
6,https://blog.naver.com/ranzzang5670?Redirect=Log&logNo=222436502953,"여름을 잘 견디고 계실까요?리초마녀는 가까스로 잘 버티고 있답니다사실 손하나도 까딱하기 싫은 요즘이지만한번 눕기 시작하면 아무것도 하기싫은 무기력증이 찾아오기 쉬워요그래서 오늘은 여름 인테리어에 어울릴 만한상큼하고 무독성 디퓨저를 소개하려 해요​​저희집은 우드와 블랙인테리어 랍니다그래서 아로마디퓨저와 고급인테리어 디퓨저 두가지를 선택했어요​깔끔한 포장에 파손방지가 꼼꼼히 되어안전하게 도착했답니다​​왼쪽이 아로마 , 우드리드스틱이고오른쪽이 고급 , 섬유리드스틱이랍니다​케이스도 느낌이 조금 다르지요?​​향은 여러가지로 하는 것보다는통일감을 주고 싶었어요그리고 최대한 자연스러운 향을 남기고 싶어서소프트린넨을 선택했답니다​​먼저 우드에 어울리는 것을 만나볼게요굉장히 심플하고 깔끔한게 일단 마음에 들어요​화려한 유리병은 잠깐은 예쁘지만시간이 지나면 질린 느낌을 받게되거든요​블랑16은 심플한 디자인이 가장 마음에 들었답니다​​공병에 로고가 각인되어있어서시간이 지나도 변함없는 형태를 유지해서 좋아요블랑이라는 뜻은프랑스어로 깨끗한, 결백한을 의미한답니다흠잡을 데 없는 깨끗하고 결백한 제품을 만들겠다는 의지로 보여지네요​자연 그대로의 원료를 사용하고제작부터 발송까지 전 과정을 책임지고 국가공인기관에서 검증 완료된 안전한 제품만을 제공한다고 해요​​공병따로용액따로 배송이 되어 온답니다용액의 입구에 실링처리가 되어있어 샐염려가 없어요한번에 다 담아서 사용해도 되고사용할 만큼만 담아서 사용해도 된답니다​​저는 한번에 다 담아봤어요갓 마른 빨래 냄새처럼기분좋아지는 향이네요​​이번엔 섬유스틱제품이에요두 제품 모두 구성품은 같아요차이가 있다면 리드스틱의 차이와공병의 마감이 다르다는 점이에요​​이 리드스틱을 잘못 구매하면 발향이 되다가 안되는 경우가 있어요그냥 비슷한 모양이라고 다 같은 스틱이 아니랍니다​전문 업체에서 직접 만든 스틱은 확실히 다르더라고요끝까지 발향이 잘 된답니다​만약 사용하다가 리드스틱 끝부분이 마른것 같거나 발향이 잘 안된다면 뒤집어서 꽂아주세요1주일에 한번씩 뒤집어 주면 더 좋답니다그리고 향이 약하다 싶으면 리드의 양을 늘려주세요​​​사실 디퓨저는 인테리어 소품으로서의 역할도 하고실내에 향기를 입히는 것이기 때문에향에만 집중할 수 있는데요​디퓨저를 만드는 성분에도 주의를 기울이셔야 해요왜냐하면우리가 향을 맡는다는 것은 우리 호흡기에 접촉한다는 것이니까요소중한 우리 가족을 생각해야죠​​​순수 발효주정 베이스를 사용했답니다먹을 수 있을만큼 안전한 식음용 발효주정으로 만들어져안심하고 사용할 수 있어요​일반 발효주정이 아니라 식음용 합격인증을 받은 발효주정을 사용하는데요 쌀,보리,고구마 등 여러 곡물에서 추출하여 주류, 식음료 등에 들어갈 만큼 더욱 안전한 국내산 식음용 발효주정이랍니다​​디퓨저의 60% 이상을 차지하는 것이 베이스인데요피부에 바르는 화장품에 첨가될만큼 안전한 원료로 만든 베이스를 사용한답니다​그리고 조향사가 직접 만드는 것이라서더 믿음이 가요시중에 유통되는 기성베이스에 대량생산하는 저가형 제품과는 확실히 다르답니다향 오일 블렌딩은 물론 내츄럴 베이스까지 직접 제조하는 곳이랍니다​성인만 사용한다면 눈감고 사용할 수 있어요하지만 사랑하는 아이와 함께 사용하는 공간그리고 임산부나 신생아가 함께 생활하는 공간이라면더욱 신경을 써야겠지요?​유해성분은 단 한방울도 허락하지 않았답니다가습기살균제 성분, 발암물질, 유해성분은 단 한방울도 들어있지 않아요​​스틱도 자제개발을 해서기존 섬유스틱같은 경우 흡수속도가 너무 빨라 용액이 금방 소모되기도 했던 점을 보완했어요​처음엔 2~3개정도의 스틱을 사용하고 24시간 후 스틱개수를 조절하면 된답니다​​​향은 아래에서 위로 올라가는 성질이 있어요따라서 낮은 곳에 두시면 더 풍부한 향을 느낄 수 있답니다​​​여러가지 시향을 해보고 싶었는데제 마음을 아셨는지 종이시향을 보내주셨네요다음번에 구매시에 어떤 향이 좋을지 가늠해 볼 수 있는 좋은 기회였어요​전체적으로 인공적인 느낌보다는 자연에 가까운 느낌이라서 머리아픔 1도 없이 힐링되는 느낌입니다​공간 인테리어의 마지막은 향이라고 생각하는 데요에어콘을 많이 틀어서 답답한 공기를 환기도 자주 시켜주시고 은은한 향으로 인테리어에 화룡점정을 찍어주세요~^^​​​​​본 포스팅은 업체로부터 제품을 제공받아 체험 후 솔직하게 작성되었습니다​",17,0,0,403,5,1,846.6,9,text_ad,2021. 7. 19. 0:00,1883,1661174,,"['리초마녀님 유익한 시간 되게 해 주셔서 감사합니다^^', '장마철이라 습하고 무더운 가운데 내일은 월요일 한주 시작입니다. 역사상 가장 시원하고 즐거운 월요일이 되시길 응원합니다.!', '잘 보고 갑니다 ｡• ᵕ •｡\n오늘도 활기찬 하루 되세요 ^〇^', '창문 롤 방충망 체험단 이벤트하고 있어요! 놀러오세요~', '글 잘보고 있어요 ^ω^']"
7,https://blog.naver.com/ranzzang5670?Redirect=Log&logNo=222311421961,"​계절이 바뀌거나 삶에 어떤 변화가 생길때또는 이사를 하거나 대청소를 하고난 후가장 적은 비용으로 큰 효과를 누릴 수 있는 것이 바로 디퓨저예요​ 리초마녀네 집에도 봄이 찾아오고비록 밖은 위험할 지언정집안에는 좋은 향기로 가득 채우고 싶은 마음에​실내디퓨저로 인기가 많은 제품들을 찾아보고 있어요​​그러다가 알게된 제품인데요디자인도 깔끔하고 가성비도 좋고 향에대한 평도 좋아서사용하게 된 부케가르니 디퓨져예요​​한병이 아니라 두병!!200ml 디퓨저가 두병이나 들어있어요​한병으로는 너무 아쉬웠는데 여러개를 사자니 부담도 스럽고...​이런 혜자스런 제품이 있다니!!!​​제가 선택한 향은에이프릴프레쉬예요싱그러운 4월의 꽃향기가 연상되는 상쾌하고 포근한 향기 랍니다​에이프릴프레시 외에도 블랙체리, 소프트코튼, 화이트머스크, 클린솝, 베이비파우더, 일랑일랑 등이 있어요​​패키지를 열어보고 군더더기 없는 외형에 한번 더 반했어요그리고 스틱은 발향이 잘되는 섬유스틱이 들어있어요​​집안 어디에 두어도 잘 어울릴 향이네요화학적 냄새가 아닌 은은한 향이 솔솔 나서 기분이 좋아져요​에이프릴프레쉬는 흔한 향이 아니어서 더 매력적인것 같아요 ㅎ​​라벨도 예쁘지요?향에 따라 라벨 색감이 달라요에이프릴프레쉬는 연한 그린 이랍니다​액체도 연한 그린색을 띄는 것 같아요​​​은색마개를 열면 고무마개가 있어요가위를 이용해서 열어도 좋구요손으로 돌려서 빼도 된답니다​​고무마개를 빼고나면 확~ 퍼지는 향기이대로 쓰는것이 아니라​​처음에 열었던 은색마개를 다시 닫아주세요그러면 디퓨저 사용준비 끝!!​​​섬유로 된 스틱은 굉장히 발향이 잘되는 것이 장점이죠투명한 병과도 잘 어울려요라벨에 검은 테두리가 있어서 검은스틱과도 조화로워요​​저는 스틱을 3개씩 꽂아주었답니다공간에 따라서 조절해 주시면 되는데요이렇게 사용하면 대략 2~3개월 사용하게 되는 것 같아요​​두개 다 발향 레디!!어디에 둘까 고민하는데 너무 예쁜거 있죠~~~그리고 꽂자마자 향이 온 집안을 가득 채우는 것 같아서 꽃밭에 온 듯 했어요​평범한 공간을 특별하게 해주는 신비한 힘을 가졌죠​​인테리어소품으로도 예쁜 디자인 이예요저도 써보니 선물용으로도 좋겠다는 생각이 들어요​왜냐하면 그냥 향만 좋은게 다가 아니거든요나와 내 소중한 가족이 머무는 공간에 놓이는 디퓨저성분은 과연 안심할 수 있는 것인가?생각을 하게 되는데요​​​메탄올등 인체에 유해한 주의성분 대신 자연유래 곡물발효 에탄올 성분을 베이스로 사용했어요​자가검사 승인완료자연유래 곡물발효 에탄올가습기 살균성분 불검출유해물질 (포름알데히드, 벤젠, 메탄올) 불검출​이라니 믿고 사용할 수 있겠네요실내디퓨저로 추천합니다~​​디퓨저를 사용해보면 첫 향기는 강하지만 갈수록 향이 느껴지지 않는 경우가 많아요바로 디퓨저베이스의 밸런스 문제 인데요오랜 기술을 담은 디퓨저 베이스로 향이 일정하게 소모되어 마지막까지 기분좋은 향을 느낄 수 있답니다​​지금은 이벤트로 200ml 세트 2개 구매시 80ml 1개 더 증정하는 이벤트를 하고 있답니다단,재고 소진시까지 랍니다​​​​ 

미      불을 통해 본 업체로부터
제품 또는 서비스를제공받마 작성된 리뷰입니다
「,】

 
 
",18,0,0,296,1,1,846.6,9,text_ad,2021. 4. 15. 22:24,1883,1661174,,[]
8,https://blog.naver.com/ranzzang5670?Redirect=Log&logNo=222310296402,"디퓨저 좀 써봤다 하시는 분들인공적인 향에 질리신 분들​리초마녀도 그랬어요...그래서 조금 색다른 디퓨저가 간절했답니다​히노키디퓨저란 말에 궁금증이 생겼어요​일단 패키지 합격입니다친환경 기업이면 소소한 것에도 신경을 써야하지요옥수수로 만들 완충제에 폭 싸여 도착한 순백수 디퓨저​​패키지도 깔끔해서 제 마음을 빼앗아 버렸어요이미 넘어감...​​순백수라는 다소 생소한 브랜드편백숲을 모티브로 자연을 담은 향을 담았다네요숲의 향기로 우리의 하루를 채워 볼까요?​​편백숲에서 아침을 맞아보신 적이 있으실까요?리초마녀는 편백숲에서 맡은 향을 잊을수가 없어요이슬을 머금은 그 향은...폐가 깨끗해지는 느낌이었거든요​​​탑노트가 유칼립투스미들노트가 히노키,파인,허브바텀노트가 샌달우드,타임​전체적으로 자연의 향이 느껴지는 조합이예요​​개봉해보니이 역시 깔끔하네요오픈하는 동안...비닐이나 스티커 하나 발견하지 못했어요​친환경.. 칭찬합니다쓰레기가 안나와서 저도 좋았어요^^​디퓨저 유리용기와화이트 윌로우 우드스틱화이트 섬유 리드스틱 3개​우드스틱은 자연물을 가공한 제품이라형태, 길이, 두께가 일률적이지 않아요그래서 더 매력적이네요​​마개를 조심히 열어서스틱을 넣는데어라?발향이 엄청 잘되는 거예요​​다시한번 유심히 보게되는 이름히노키 리프 디퓨저...​환경부, 식약처, EU 가이드라인 지켜서26가지 알러지 유발 향료를 사용하지 않았네요​​어떤 느낌이냐면이른 새벽 이슬을 머금은 숲속에서 맡는 기분​공기가 깨끗한 날마스크를 벗고 맡았던 그 시원한 공기​딱 그 느낌 이었어요​​병도 깔끔하고 향도 마음에 들어서어느 곳에 둘까 고민해 봅니다​​집에 들어오자마자 맡을 수 있게 현관에 둘까?​생각보다 발향이 잘되고집안에서도 맡고싶어 졌어요​​복도의 한켠에 두기로 합니다중문을 열고 들어오자마자 맡을 수 있고이방 저방 이동할 때도 향이 나요​​인테리어디퓨저로도 이만할 수 없지요스스로 존재감을 뽐내는 것도 좋지만어떤 인테리어에도 어울리는 디자인이라서더욱 만족합니다​​​이거... 쟁이겠어요...리초마녀는 한번 빠지면... 질릴때까지 합니다...​​​이곳 저곳 옮겨가며 놓아보는 동안저는 무뎌졌었나봐요향이 어느정도 좋은것인지잘 못 느꼈는데​퇴근하고 들어온 남편이 문을 열자마자""무슨 향이야? 정말 좋다~""이럽니다​세상 무뚝뚝하신 분이... 저절로 그런 말을 하다니요...​​​그래서 더욱 맘에 들어버렸어요​특히나 바깥공기가 안좋은데다답답한 마스크를 끼고 외출했다 들어올때집안에만 들어와도 좋은데히노키디퓨저의 향이 은은하게 나면​그냥 힐링이 되어버리네요...​​​디자인도 마음에 들고향도 마음에 들어서여름내내 즐겨 사용할 것 같아요​​​가끔 변화를 주고 싶을땐색다른 향의 디퓨저로 느낌을 바꿔보세요​집안을 향기로 채우면 기분이 좋거든요^^​​",22,0,0,237,0,0,846.6,6,revu,2021. 4. 14. 23:23,1883,1661174,,0
9,https://blog.naver.com/ranzzang5670?Redirect=Log&logNo=222277963453,"계절이 바뀌거나,대청소를 하거나,집안의 분위기를 바꾸고자 할 때이곳 저곳 신경을 쓴 후 가장 마지막으로 포인트를 주는 것이 바로 향기​겨우내 두툼했던 이불정리도 하고묵은 향도 벗겨내고 새로운 향으로 바꾸고 싶을 때​리초마녀는 디퓨저를 사용한답니다매번 새로 사는 것 보다는슬기로운 디퓨저사용법을 알려드릴께요​​일단 집안 곳곳에 놓아두었던디퓨저용기를 수거합니다그동안 샀던 디퓨저병을 버리지 않고용액만 바꿔가면서 사용하고 있답니다​​​​아직 남은 것도 있고바닥까지 다 쓴것도 있어요이렇게 향이 날아간 남은 액체는 발향이 안된다고 보면되요​​​스틱도 재활용하지 마시고과감하게 버려주세요다시 사용하게 되면발향이 잘 안되고 향이 섞여서원래의 향을 느낄수가 없어요과감하게 안녕~~​​​이제 병에 남은 액체를 비워내고뜨거운 물로 세척해 주세요같은 향의 액체를 사용할 것이더라도남은용액에 첨가해서 넣는것 보다는새로 세척하고 사용하는게 좋답니다​​​뜨거운 물로 세척한후수건에 뒤집어 놓으세요그럼 금새 마른답니다​​​이렇게 깨끗하게 씻겼어요이렇게 병을 뒤집어서 말리는 동안새로 담을 아로마오일디퓨저 리필을 준비합니다​​​저는 향에 굉장히 민감한 사람인데요그래서 디퓨저를 고를 때도 좀 까다로운 편입니다너무 달콤하거나방향제스러운향은 별로 좋아하지 않아요머리가 아플정도로 화학적인 향이 가득한 것 보다는은은하면서도 고급스러운 향을 좋아한답니다​​​​한번 좋은 향을 발견하면박스로 구입해서 사용하는 편이예요..한놈만 판다...​​​요즘 제가 즐겨쓰는 향이랍니다딱히 계절에 민감하지 않을 향이예요거실,안방,화장실 할 것 없이 무난하게 어울리는 향이랍니다​​실내디퓨저는 너무 진한 향보다는인테리어나 집 분위기에 맞추는게 좋아요​​​뚜껑을 열면 은박으로 밀봉이 되어 있어요이걸 열어주면 금새 향이 퍼져나간답니다​​인테리어디퓨저라고 할 만큼예쁜병에 반해서 구매 했었는데요여러 오프라인 매장에서 만날 수 있답니다향도 좋고 병도 예뻐서 실내디퓨저로 추천합니다​​저도 시향을 해보고 결정 했어요개인차가 있기 때문에처음에는 시향을 해보고 선택하는 것을 추천드려요​​깨끗이 씻어 말린 병에아로마오일 디퓨저용액을 넣어줍니다저는 꽉 채우는 것 보다는 절반정도 채우는 것을 좋아합니다​​가득채우는 것 보다절반 정도 채워서 전체가 다 발향되는게 좋아요가득채우면 아무래도 윗부분에 오일이 남는 경우가 있더라고요​​​용액을 채워주었다면이제 디퓨저스틱을 꽂아주면 됩니다저는 주로 우드스틱을 좋아하는데이유는 내추럴한 느낌이 좋아서예요​​예쁘게 단장한 향기가득 담은인테리어디퓨저들입니다인테리어의 포인트가 되어주는 아이들이죠​​디퓨저를 슬기롭게 사용하는 법조금만 신경쓰면 적은 금액으로잘 활용할 수 있답니다​​​디퓨저스틱을 꽂아두고 10분정도 지나면 스틱에 절반정도 흡수가 되는게 보이는데요이때 뒤집어서 꽂아주면 발향이 훨씬 빠르게 잘된답니다​​디퓨저를 놓으면 좋은 곳은현관, 거실, 화장실, 침실 이랍니다주방은 자칫하면 음식과 향이 섞여 안좋을 수 있어요만약 주방에 놓고 싶으시다면 정말~ 약하고 은은향 향을 추천합니다^^​​​ 
",19,0,0,279,5,1,846.6,12,,2021. 3. 17. 0:36,1883,1661174,,"['랜선그림을 감상하며 즐거운 하루 시작해보시길 바랍니다-아트컨티뉴', '감사합니다~^^', '리초마녀님 들렸다가요~하루하루를 행복한 시간으로 가득 채우시길 바랍니다!! 화이팅!', '감사합니다~^^', '안녕하세요?잘 보고 갑니다.이왕이면어디서 사셨는지 링크 걸어주시면 더 감사하겠습니다!~~^^행복한 하루 되셔요!~~^^']"
10,https://blog.naver.com/ranzzang5670?Redirect=Log&logNo=222254241065,"집안을 시각적으로 꾸미는 것이 중요한 만큼집안에서 나는 향도 굉장히 중요하죠​리초마녀는 향에 굉장히 민감하답니다음식을 할때 간을 보는것도 향으로 가능할 만큼이요킁킁 ^^​실내방향제로 여러가지를 사용하는데요룸스프레이, 향초, 석고방향제, 디퓨저, 등등종류가 많죠그 중에서도 인테리어디퓨저를 많이 사용하시는데요​원래의 디퓨저 뜻 과 디퓨저사용법 을 정확하게 알아보고 가는 것도 좋을 것 같아요그리고 아로마오일을 이용한 방향제품들도 함께 알아봐요​​​디퓨저 뜻전동식 에어펌프에 의한 공기의 압력으로 에센셜 오일을 공기중에 확산시키는 기구.아로마 포트, 아로마 라이트 와 비교해 볼 때 향을 확산시키는 힘이 단연 강한데, 5분만 작동시켜도 향이 1시간 동안 지속된다​열을 가하는 방법이 아니기 때문에 가장 안전할 뿐 아니라, 원액을 희석하지 않고 사용하므로 오일 그 자체의 향을 장시간 즐길 수 있는 것이 특징이다​디퓨저는 넓은 공간이나 많은 사람이 모이는 장소에서 사용하면 좋은데, 오일의 효능을 최대한 활용해 방안의 공기를 살균하면서 좋은 향기로 분위기를 만드는 역할을 한다​디퓨저 대신 가습기를 이용해도 같은 효과를 볼 수 있다.가습기에 3방울 정도의 에센셜 오일을 넣고 작동시키면 된다​​아로마 포트에센셜 오일은 그냥 두었을 때보다 열을 가했을 때 더욱 강한 향을 발산한다.그러한 특징을 이용해 간단하게 방향욕을 즐길 수 있는 전용 기구가 많이 나와 있는데 대표적인 것이 아로마 포트이다​증발접시에 물을 넣고 에센셜 오일을 몇방울 떨어뜨린 뒤 증발접시 밑에 있는 초에 불을 붙인다.촛불에 의해 가열된 물이 증발하면서 에센셜 오일의 향이 점점 멀리 퍼지게 되는 것이다은은한 촛불과 향기가 어우러져 아늑하고 로맨틱한 분위기를 연출 하기에 좋다​​​아로마 라이트안전성 면에서 각광받는 아로마 라이트는 촛불 대신 전구의 열을 이용하여 향을 확산시키게 되어 있다증발 접시에 오일을 떨어뜨린 뒤 전원을 켜면 전구의 열이 오일을 따듯하게 데워 향을 퍼뜨리게 되어있다​촛불을 사용하는 아로마 포트보다 안전하기 때문에 침실이나, 어린이 방에서도 안심하고 사용할 수 있다​​​​​우리가 흔히 쓰는 아로마오일디퓨저와는 좀 다른 모습이죠?예쁜 유리병에 아로마오일과 발향제를 섞은 용액을 담고디퓨저스틱을 꽂아서 사용하는 형태를 통상적으로 디퓨저라고 부르는데요틀린 말은 아니랍니다^^​조금 더 사용하기 쉽고 인테리어효과도 얻을 수 있는 제품으로 정착한 것으로 보면 될 것 같습니다​​​​향에 따라서 실내, 화장실, 드레스룸, 침실, 주방디퓨저 등으로 분류하기도 하는데요​아무래도 탈취효과가 있는 향과심신을 안정하게 하는 향이 다르기 때문이예요​그럼 아로마 향도 잠시 보고 갈까요?이왕 집에 향을 더하고 싶다면그냥 향기로운 것도 좋지만기능이 있는 향이라면 더 도움이 될 듯 해서자료를 준비해 봤어요​​향이라는 것이 우리 신체에 미치는 영향이 생각보다 크답니다절대적인 효과를 바라는 것 보다는심리적인 효과라고 생각하시고 어차피 향을 준비한다면이왕이면 알고 쓰는 방향제라면 더 좋을 것 같아요​​​건강에도 도움을 주는 향도 있다고 하니역시.. 공부는 끝이 없군요...저는 ... 간단한게 좋은데... 점점 어려워 지는 것 같아서​​​아름다움과 연관이 있네요그래서 관리실에서도 오일을 적절하게 사용하는 것 같아요^^​​​​​우리가 방향제로 사용할 때 가장 필요한 부분 같아요센스있는 방향제 선택으로 집안이나 차안에 향을 더해보세요~^^놓는 장소에 따라 향도 다르게 하고디퓨저의 종류도 다르게 하는 것이 더 효과적이랍니다​그리고 디퓨저용액은 발향후에 오일만 남게되니 향이 더이상 나지 않아요용액을 리필 하실때는병을 깨끗하게 씻어내고 새로운 스틱을 꽂아서 해야 향을 제대로 느낄 수 있답니다​​​​​​​​",7,0,0,400,1,0,846.6,14,,2021. 2. 24. 0:08,1883,1661174,,['유용한 정보 포스팅 잘읽고 가요(^.^)']
