,Post URL,Post,Image num,sticker num,gif num,Paragraph num,Comment num,Video num,weekly viewer mean,Sympathy num,AD,Posting Date,Buddy num,Total visit,Blog category,Comment detail
11,https://blog.naver.com/ranzzang5670?Redirect=Log&logNo=222134368853,"냄새가 나는데 향수를 뿌리면..최악이라는 말을 하잖아요!​그리고 워낙에 가족중에 언니가 .. 향에 유독 예민하고 민감!저는 잘 모르는데 향수를 옷에 뿌리고나서 보면 한 4~5시간이 지나도향수 독한거 뿌렸다고 저리가라고 해요 ㅠㅠ​​​그래서 언니는 화장품도거의 무향을 선택을 하고 완전향에 극도로 예민!​저는 그렇지 않아서 향이 너무 진하면그건 싫지만 어느정도는 좋아하거든요.​언니랑 둘이 사는 집에 강아지를 키우다 보니 슬슬 저도개냄새가 ...이상하게 개냄새는 언니는 괜찮데요..​전 싫은데.ㅎㅎㅎ​​제가 좋아하는건 아니고집주인이 언니니가! 언니가 키우는 애완견!그리고 다들 밖에 나가면개 키워요? 라고 물어봐서 종종 신기하다라고 생각을 했지만 특유의 냄새가 배는것 같아서이번에 달콤한 향의 디퓨저로 한번집안 전체의 냄새를 잡아볼까 합니다.​그동안은 칙칙 나오는 분사기도사용을 했었고 페브리즈도 뿌렸는데막상 그때 뿐이고 오래 남아있지 않더라고요​​​​그리고 추울때는 문을 열어서환기를 잘 못시키기 때문에 음... 향이 강한건 언니가 저를 죽일 것 같아서좀 은은하게 풍기는 제품을 찾고있는데 막상 쉽지는 않아요.​​인터넷은 직접 향을 맡아보고살 수가 없어서 그런지 좀 불안불안하고매장을 찾아서 다녀봤지만제가 맡고도 음 하는건 언니는...저를 죽이려고 할 것 같아서 헤매고 있는데요.​​친구랑 카페에 갔다가달콤하고 은은하게 풍기는 향이 있어서신기해서 물어보니과즙의 향을 내는 디퓨저를선물 받고 나서 꾸준히 자기도 사서 사용을 하고 있다고 하셨어요~​​​그리고나서 어디서 샀는지 물어보고 저도 디퓨저를 주문했습니다!​베리엔버가못이라는향을 샀고 여러가지 향들이 있는데이 모든 향들이 조향사가 직접 만든다고 하더라고요 ㅎㅎㅎ​주문을 하고 나서!아침에 한거라 거의 바로 출발을 했나봐요!​​그래서 다음날 바로 받을 수가 있었고한개만 시켜보고 괜찮으면몇개 더 시켜서 엄마도 주고 해야겠다싶은 생각으로 시켰습니다.​포장은 뽁뽁이로 아주 잘 싸여오고기본적으로 케이스가 딱딱한 케이스에 있어서파손의 걱정은 없더라고요!!​​​포장도 잘오고 배송도 빠르고향도 괜찮아서 뜯기전에 언니한테 먼저향을 맡게 해주고ㅋㅋ 지금은 저희집 거실이에이로마의 디퓨저가 자리잡고 있습니다!​와 진짜 완전 다행이었죠!!​​언니도 이 향이 마음에 들기는 하는데그래도 살짝은 진한 것 같다고스틱을 한개만 꼽아두자고 하더라고요.​근데 한개만 꼽으면 뭔가없어 보이기도 하고 해서 꽃으로 만든 스틱을 선물 받은게 있어서그걸 꼽아뒀습니다.​​아마.. 모를거예요 그게 향이 더멀리 퍼지고~ 스틱 많이 꼽은거랑 별차이 없다는걸 ㅎㅎㅎㅎ​요즘은 집에 들어가면달달한 향이 집안에 풍기니까기분이 좋더라고요~​​​​뭔가 맛있는 디퓨저를 먹은것 같기도 하고핑크핑크한 공간에 들어온것 같기도 하고~기분이 상당히 좋은 상태로 귀가를 합니다.​천연향료라고 하는데 이 천영향료는곡물발효를 통해서 만들어진거라합성 알콜향이 나지 않아서 머리가 덜 아파요.​​​예전에는 알콜향이 너무 쎄서솔직히 좀 그랬는데 요즘은 거의 대부분곡물발효를 통해서 사용을 하는것 같고여기는 프랑스산 아로마 재료를 통해서조향사가 직접 향을 만들고 있어서다른 곳에 없는 향이 나오는 것 같아요~​​그래서 더 만족을 하고사용을 하고 있습니다! 집에 놀러오는 친구들이나언니 친구들이 향이 좋다는 말을많이 해서 ㅋ 몇분에게 소개를 해줬고요 ㅋㅋ​그만큼 괜찮더라고요~골드 에디션 라벨이라서 그런지어디에나 놔도 괜찮더라고요 ㅎㅎ​​​향이 계속 나고 보통 뚜껑을 열어놓고사용을 하기 때문에금방 다 날라간다는 말도 많잖아요.​​​그래서 저렴한거 사서 자주 바꾼다고 하는데솔직히 그 저려미가.. 머리가 아픔알콜냄새가 많이 독해서 그런지 머리가 아픈것들도 몇가지 있었어요.​​​발향도 오래가고용량도 가성비가 좋아서 그런지~금방 없어지지는 않는것 같아요!​이제 집에서 애완견의 특유의 냄새가몸에 배지 않고 달달한 향이가득 배어서 좋더라고요 ㅎㅎ​​그래서 조용히 옷방에도용량을 덜어서 하나 뒀는데 ㅋㅋㅋ진짜 완전 대만족을 하고 있어요!​옷방에는 진짜 작은 공병에다가덜어서 스틱 반토막 내서 뒀는데괜찮더라고요​근데 방이 작아서 그런지창문 앞에 뒀어요!​​​그거 아니면 언니가 독하다고뭐라 할것 같아서 ㅎㅎㅎ​조용하게 창문 앞에 뒀는데요괜찮더라고요~옷에 다 달콤한 향이 배어서 그런지날씨도 춥고 해서왠지 저를 포근하게 감싸주는것 같더라고요.​​​여름에는 시원한 향이 좋은데겨울에는 따뜻하고 살짝 묵직하고달콤한 향들이 땡기잖아요.​날이 그래서 그런지 지금베리앤 버가못향이 완전 딱이더라고요 ㅎㅎ​​​​이 향에는 딸기랑 체리,그리고 라즈베리랑 버가못의 향들을 조합하여서 말고 설명을 하기좀 애매해한데 달콤해요!체리향인데 진하지 않고 은은하면서도버가못 향이 살짝 잡아주기에부담스럽지 않은 향이라고 해야 할까?딱 ㅋ 오~ 이거 무슨향?좋다~~ 라는 생각이 들게 되는 그런 향이랍니다.​​​좋은 원료를 사용을 하고직접 향전문인 조향사라 만들고 있어서기대해도 좋은 것 같아요!​사용기한도 용량대비!발향이 오래 지속이 되어서 몬스터급!그래서 가성비를 찾는 분들에게도잘 맞는것 같네요!​총향의 종류는 6가지가 있고모든 향마다 다 조향사가 직접 만듬!​그래서 자신이 원하는 향을선택을 할 수 있어서 좋고후기를 보니까 한가지만 인기가 있는게아니라 모든 향들이 좋다고 나와 있더라고요 ㅎㅎ​​​이걸 다 쓰면 그 다음에는 피오니 프리지아를주문을 해볼까 합니다~​원래 프리지아 꽃을 좋아하기도 했고이건 완전히 꽃향기를머금고 있는것 같아서 기대가 되거든요 ㅎㅎ​스틱으로 향을 조절을 할 수 있으니까걱정이 없고~ 집안 전체에향긋함이 가득하게 풍기는 것 같아요.​​​아직도 유목민이라면정착을 하지 못했다면 에/이/로/마/의6가지 향들을 봐도 좋을 것 같아요~​아래를 참고한다면물어보지 않고 바로 알 수 있다는 점을한번 더 언급하면서오늘 같이 추운날은감기 조심하시고! 건강 챙기시기 바랍니다.​​​​",22,0,0,574,15,2,846.6,51,,2020. 11. 3. 16:18,1883,1661174,,"['이런 건 널리 알려햐한다고 봄ㅋㅋ스크랩해요ㅋㅋ', '글 잘보고 갑니다.', '완벽하네요!!', '왕~ 감사. 좋은 내용이에요. 굳~', '정말 좋네요 ^*^', '자주 들릴께요공감 누르고 가요', '어서오세요~~^^', '포스팅 잘 보고 갑니다~^^\n날씨가 무지 추워 졌네용~\n감기 조심 하세요:)', '네 갑자기 넘 추워요 겨울이 된것 같아요~~~', '날씨가 많이 쌀쌀합니다. 감기 조심하세요.~~~^^', '감사합니다 감기조심하세요~~^^']"
12,https://blog.naver.com/ranzzang5670?Redirect=Log&logNo=222117608807,"​퇴근을 하고 집에오면..이상하게  침실에서 남자냄새라고 하는특유의 냄새가 너더라고요.​결혼을 하고나서 어느정도 시간이 지나고이상하게.. 자꾸 왜 방에서 그런냄새가 날까 하는 생각으로이불도 일주일에 한번씩 세탁을 하고페브리즈에 여러가지를 사용을 해봤는데요.​원래 디퓨저도 생각을 했지만요즘 워낙 향이 독한게 많아서 머리아파서이번에는 아예 생각을 하지 않았어요.​​​​근데 점점.. 강해지고지금은 집에 가자마자 창문을 열고환기를 해도, 도저히 안되겠다 싶어서환기는 환기대로 집안의 향은 좀 바꿔보자 라는 생각으로강하지 않은 제품들로 알아봤거든요?​그리고.. 왜 그런지이유를 찾기 시작을 했습니다.​여러 원인이 있지만땀을 많이 흘리는 일을 하는 직업의남편의 특성상 어쩔수가 없는거 알고 ㅠ세탁도 자주하고 하는것과방향제 같은것을 놓는  방법 뿐이더라고요​하아..좀 많이 스트레스를 받았는데한겨울에도 창문을 열고 살 수는 없으니까요!!!​그래서 고민을 하다가은은 하면서도 천영향료를 통해서만들어진 디퓨저를 찾았어요.​​​천영향료라서 걱정없고향이 은은하니 좋더라고요~~​거실에 하나두고병을 나워 용량을 적게하여 방에도 놨더니그 후로는 남자냄새가 사라졌습니다!!​와... 진짜 살것 같더라고요 ㅠ그리고 섬유향수도 같이 있어서구입을 할까 하다가 써보고 사자 라는마음으로 뺐는데 장바구니에 넣어둔거그대로 다시 겟 해야할것 같아요​​​워낙에 많은 제품들이 있고가격도 천차만별인데 이번에 선택한제품은 기본적으로 조향사를 통해서직접 향을 조제하여 만들어진 제품이라고 합니다!​용량도 마음에 들고 택배도 완전 뽁뽁이 포장이 잘되어서 깨지지 않게도착을 했습니다.​여러모로 만족을 하고나서 보니다른 제품들은 어떨까 해서 찾아봤는데향초도 있고 선물용으로 세트도 준비가 되어 있어서 주변 지인들에게선물을 주기도 좋을 것 같더라고요.​​​무엇보다 며칠전에 결혼식을 다녀왔는데와인을 답계품으로 줬는데이렇게 선물용 포장이 잘 되어 있다면거의 일상생활속의 필수품이라고 할 수 있어서이거로 답례품을 하는 것도 괜찮아 보였어요.​들고 다니기 편하게 세팅이 되어 있고!본품,스틱으로 구성이 되어서누굴 주기도 참 편하더라고요 ㅎㅎ​​그 전에는 사용을 하다보면향이 너무 진해서 머리가 아프거나사용을 하는데.. 기름? 그런게위로 올라오기도 하고 너무 빠른시간에 다 향이 사라져서둘 필요가 없는것들도 많이 있었는데이건 오래도록 지속되는 향으로 좋더라고요!​사용주기가 길어진 만큼향도 오래 가다보니 가성비 적인 면에서도최고인것 같아요!​​​마트에도 많이 있고로드샵에도 많이 있는데 향을 맡아볼 수 없어서솔직히 불안한건 있었는데받아보고 나서 후회는 없습니다!​골드 에디션이라서 어디에 둬도!인테리어 효과가 너무 좋더라고요~​​​책장에 둬도 괜찮고!~tv앞에 둬도 괜찮고!~파스텔톤의 라벨지도 잘 어울어져서 좋더라고요 ㅎㅎ​원래 주기가 짧은줄 알았는데만들어지는 과정에 따라서 다르다고 하더라고요 ㅎㅎ​그래서 오래도록 지속이 될 수 있도록 곡물로 발효과정을 거치고만들어지다 보니더 은은하고 좋은것 같아요.​​​이번에 구입한 에이로마의 디퓨저는제가 사용을 하는데 지금 한달정도 되었는데불편함 없고! 너무 좋습니다.​포함되어있는 성분도 마음에 들고전문 조향사를 통해서 향이 만들어 진다고 하니부담스럽지 않고 은은한 향기가 오래도록 지속이 되는것 같아요!​​​고민을 했던 시간이 무색할 정도로만족을 하고 있습니다~​집에서 나던 퀘퀘한 냄새까지싹 잡아준 덕분에 ㅎㅎㅎ요즘은 집에 들어가도 기분이 좋아요~​저녁마다 인상을 찌뿌리며 들어갔는데요즘은 향이 좋아서기분이 좋고 퇴근후에 피로가 풀리는 기분도 들고는 합니다 ㅎㅎ​​은은하면서도 오래 지속되는디퓨저를 찾는다면 알아보시면 좋을것 같아욤~~​​=
",20,0,0,346,10,1,846.6,23,,2020. 10. 16. 19:07,1883,1661174,,"['앗 저한테 꼭 필요한 제품이네요^^', '점점 디퓨저가 좋아지더라고요']"
13,https://blog.naver.com/ranzzang5670?Redirect=Log&logNo=222315899547,"운동화세탁 어떻게 하세요?리초마녀는 운동화세탁소에 맡겼다가신발 변형이 일어난 적도 있고..세탁이 잘 안되어 온적도 있고..​그래서 좀 힘들더라도직접 손으로 빨았어요​그런데 힘은 들지만 드라마틱한 효과를 보기는 힘들었어요​​​그러던 중 운빨세제 라는 제품을 알게되었어요​운동화세탁은 리초마녀 뿐만 아니라많은 분들의 고민이구나...그걸 해결하기 위한 운동화세제가 있었답니다 ​​패키지가 상당히 예뻐요 저는 운동화세제와 발포클리너 세트를 사용했어요​​먼저 운빨 운동화세제예요유해물질이 없어 안심이예요​방부제, 표백제, 형광증백제, 색소, 인산염, 벤젠, 비소, 전인산염, 테트라클로로에틸렌 이 없어요!!​​자연유래성분인콩 : 단백질 분해효소 얼룩제거녹차 : 토코페놀성분 살균, 냄새제거자몽종자추출물 : 항바이러스 작용 천연 방부제코코넛 : 코코넛 지방 계면활성제, 악취제거 및 항균작용​이런 성분들로 주로 이루어져 있어요좀 안심이 되죠??​​투명한 병에 담겨 있고뒷면에 사용법이 나와있어요따뜻한 물에 담가놓고 15~20분 후 세척하면 된답니다​​분말인데조미료처럼 원터치 캡으로 사용이 가능해요사용하기 편하더라구요 ​​뿌릿 발포클리너예요운동화가 더러운 경우나냄새가 많이 나는 경우사용하면 도움이 된답니다​​운동화세탁 뿐만아니라탄냄비 세척, 스테인레스연마제, 김치통냄새제거,에어프라이어 세척, 행주나 흰빨래 삶은 효과이렇게 다양한 쓰임새가 있답니다​​마찬가지로 투명한 병에 들어있어요입자가 조금 더 크답니다​​탐색은 끝났으니 사용을 한번 해볼까요?​​한주내내 고생한 신발아이 실내화는 어쩜이렇게 일주일만에 더러워지는지끙...​​운빨 운동화세제와 발포크리너 둘다 사용할꺼예요​​먼저 따뜻한 물에운빨세제와 발포클리너를 넣고잘 녹여줬어요​​사용이 편하게 뿌리는 타입이라 적당량 넣으시면 되는데요계량을 하려면 뚜껑에 가득 담은양이 25g 이랍니다​20분 정도를 담가놓았다가비누를 사용하지 않고 운동화 세척 솔로 문질렀어요물로 헹구기만 여러번 했어요운동화는 빠는것 보다 헹구는 것이 중요합니다 ㅎ​​세상에... 이렇게 하얗게 변했어요힘들이지 않고담궈놓기만 했는데 신기했어요​​제 운동화도 깨끗해 졌네요~괜히 살림 잘하는 주부가 된것 같은 느낌육아뿐만 아니라 살림도 템빨이네요 ㅎㅎ​겉만 깨끗해 진 것이 아니라 안좋은 냄새도 사라졌어요 살균작용도 같이 해주니 기특하네요​​무엇보다 편한 사용법힘들이지 않고 운동화세탁이 가능해요역시 뭐든지 알아보고 공부하고 찾아봐야해요이렇게 기특한 걸 알기전에는 얼마나 고생했던지...​이제 힘들이지 마세요~​​​​",25,0,0,222,3,1,846.6,10,revu,2021. 4. 19. 21:16,1883,1661174,,['잘 보고 갑니다.감사합니다~']
14,https://blog.naver.com/ranzzang5670?Redirect=Log&logNo=222356509239,"자동차용 공기청정기의 필요성을 많이 느끼는 요즘이에요집에서는 공기청정기를 켜고 있고요즈음은 어디를 가나 공기청정기를 어렵지 않게 만날 수 있는데요운전을 하는 시간이 많은 사람들이나아이와 함께 차량으로 이동을 하는 경우가 많은 리초마녀 같은 경우에는 차량용공기청정기를 찾고있었어요​​​차량용 공기청정기는 생각보다 많지 않고만약 있다고 해도 크기가 너무 크거나가격이 부담스러워서 고민이 되었어요그렇다고 효과를 알수 없는 아무 제품이나 사용할 수는 없지요​그런 시점에 알게된 수피공기청정기에요피톤치드공기청정기로도 알려져 있는 제품인데요강력한 BLDC팬모터 및 H13등급의 필터로 초미세먼지를 제거해 공기를 맑게 해준답니다​​잘 포장되어 온 수피공기청정기는포장상태도 좋고구성품 마감이 좋았어요​반영구적으로 사용이 가능한 느낌이에요​​​본체와 필터, 수피큐브, 5핀케이블이 들어있어요사용설명서도 잘 들어 있으니 꼼꼼하게 읽어보시고사용하세요~​​먼저 본체를 분리해 봤어요결합할때는 하단부를 반시계방향으로 회전시키고분리할때는 하단부를 시계방향으로 회전시켜주세요​​전체를 다 분리를 하면 이 순서가 됩니다이제 사용하기 전 결합을 해보려고 해요잘 따라오세요~​​이 제품의 특징 1수피큐브랍니다수피큐브가 뭐냐면요?에탄올이나 메탄올 등 화학적인 향료가 들어가지 않는오로지 고농축 편백나무 에센셜오일과 편백큐브만으로 구성되었답니다​​밀봉된 봉투를 개봉하면 편백향이 확~ 나요그렇다고 머리가 아프거나 하지 않고은은한 편백가구의 느낌정도에요​피톤치드는 긴장과 불안함을 해소하는 것으로 알고있는데요미세먼지 정화는 물론 피톤치드를 활용한 탈취까지 상쾌한 공기를 느낄 수 있겠지요?​​한 봉을 다 넣으니 딱 맞게 들어가요수피큐브의 교체주기는 약 1개월 정도랍니다기호에 맞게 소분해서 사용해도 좋고향이 좀 약해졌다 싶으면 교체하면 될 듯해요​​​저 구멍을 통해 향이 은은하게 나요차량은 밀폐된 좁은 공간이기 때문에 저정도 향으로 충분하답니다​수피큐브를 담는 케이스는 트라이탄 소재에요트라이탄은 젖병에도 사용하는 안전한 소재죠100% 천연 에센셜 오일은 일반 플라스틱이나 합성수지에 반응해 용기를 녹일 수 있기 때문에 내화학성인 재료를 사용했답니다​​그리고 본체의 하단부에 넣어준 다음​​이 제품의 핵심인 필터를 넣어 줍니다헤파 13등급 필터로 남다른 필터링을 자랑해요​WTO는 미세먼지를 1급 발암물질로 지정하고 있어요게다가 미세먼지는 입자가 작을수록 건강에 미치는 영향이 크다고 합니다​여러 필터중 헤파13등급 필터는 일반필터보다미세먼지 제거율이 우수하며 PM2.5의 초미세먼지를 99.95%까지 필터링해주는 고성능 필터입니다꽃가루, 곰팡이, 실내먼지, 자동차 가스, 대기오염을 필터링하여 깨끗한 공기를 만들어줘요​​가정에서 사용하는 공기청정기의 필터 모양은원통형이 많은데요그 이유는 공간의 효율성을 높이기 위해서 랍니다상대적으로 매우 저렴하지만 정체모를 중국산 필터가 아닌 유명브랜드의 대형 공기청정기 필터와 동등한 수준의 국산 헤파필터를 사용했답니다​그래서 믿을 수 있어요^^​그리고 수피의 모터에 집중해야해요이제 많이 익숙해 지신 단어일텐데요바로 BLDC 팬모터를 사용했어요​그리고 선풍기나 쿨링팬에 사용하는 팬모터가 아닌공기를 빨아들이는 힘에 최적화된 팬모터 타입을 썼어요​ 그래서 직진성과 효율성은 올리고 소음과 전력은 낮췄지요​​​MADE IN 대한민국미국 안전규격 개발기관인 UL에 발급한UL 인증마크가 있는 안전한 재료를 사용했어요​부가기능은 덜고 공기본질에 충실해서가격을 합리적으로 만들었답니다가성비공기청정기라고 감히 말할 수 있겠어요​​​원터치 버튼으로1초이상 길게 누르면 ON/OFF 가 되고짧게 누를때마다 3단계로 조절이 된답니다​​​더운 여름 차량내부온도는 최대 90도까지 올라가요이런 차안에서 공기청정기를 사용한다면당연히 그 공기청정기 재료는 고온에 버틸 수 있는 내열성 재료여야 해요​수피는 108도 까지 버틸 수 있는 ABS를 사용하여 내구성과 안정성을 높였답니다​​화이트병에 걸린 리초마녀지만차량내에 사용하는 제품은 블랙이 진리그러나 화이트도 너무 예뻐서 엄청 고민했어요 ㅎ​​5핀 충전기를 연결했어요​차량에 아주 찰떡으로 잘어울리죠?꼭 차의 일부분 같네요 ㅎㅎ​남편님 깨알 하트 ㅎ에어컨 필터냄새도 잡히고 차량 고유의 냄새도 사라져서 좋은가봐요​​패밀리카에도 장착해 보았어요역시 블랙하길 잘했네요​아이와 함께 여행을 갈때도등하교 시킬때도안좋은 바깥공기에 실내 만이라도 맑은공기를 주고싶다면 더이상 주저하지 마세요~^^​​토출부분이 하나이기 때문에원하는 방향으로 위치하면 됩니다혼자 사용할때는 내쪽으로뒷자리에 아이가 있다면 아이쪽으로수피방향을 돌려주세요~​그리고 팁을 하나 드리자면대형 공기청정기 하나를 켜는 것보다작은 공기청정기 여러개를 배치하는 것이더 효율적이라고 하네요^^​​​​",25,0,0,436,6,3,846.6,9,revu,2021. 5. 18. 22:44,1883,1661174,,"['아~~좋은데요!!저두 구입하고 싶어서 여기저기 둘러봤는데좋은 정보 감사해요^^', '저도 엄청 찾아봤었어요 ㅎㅎ 드디어 찾았어요 ㅎ']"
