,Post URL,Post,Image num,sticker num,gif num,Paragraph num,Comment num,Video num,weekly viewer mean,Sympathy num,AD,Posting Date,Buddy num,Total visit,Blog category,Comment detail
0,https://blog.naver.com/rednbk?Redirect=Log&logNo=221328499784,"오늘 소개할 제품은 샤오미 LED 조명입니다.언제 샀는지 기억은 안나지만 제품 촬영할 때 서브 조명 정도로 사용하려 구매했어요.조명이 세진 않지만 서브 정도로 활용하면 그림자는 없애주더라구요.보조배터리를 활용해서 사용중입니다.그리고 사무실 노트북 중에 자판에 라이트가 없는 모델이 있었어요.밤에 불 꺼놓고 사용 중 자판이 안보일 때 이 제품을 활용해서 잘 썼네요.제품은 폴리백에 간단하게 담겨져 있었어요.전체적인 모습입니다.샤오미 USB 선풍기와 동일한 컬러로 구매를 했어요.​이쪽면은 조명이 발광하는 부분이에요.불투명한 덮개가 덮여 있어요.​아래쪽을 보면 MI 샤오미 로고가 있습니다.이쪽 면이 조명의 위쪽이에요.​USB의 모습입니다.이 부분을 보조배터리나 USB 단자에 삽입하면 됩니다.​조명 머리 부분을 볼게요.위쪽면입니다.실버 컬러 느낌이 납니다.​반대편의 모습이에요.조명이 발광하는 부분입니다.발광 중에는 약간 뜨거운 느낌이 납니다.​재질은 실리콘 재질이에요.그래서 잘 휘어집니다.​이렇게까지 구부릴 순 있어요.하지만 강제로 구부리면 잘 안접힙니다.망가질지도 몰라요.보조 배터리에 연결을 해 볼게요.사용한 보조배터리는 샤오미 20,000 2세대입니다.듀얼 USB에요.​아래 사진처럼 연결 해 주면됩니다.연결하면 처음에 바로 조명이 발광됩니다.보토배터리 옆면을 누르면 꺼지고 다시 누르면 켜집니다.​조명을 켜봤어요.밝기는 생각보다 멀리 퍼져나갑니다.​불을 끄고 LED 조명만 켜봤습니다.약간 노란빛이 도네요.어느 정도 밝기는 되지만 어두운 곳에서 후레쉬처럼 사용하긴 어렵습니다.단순히 가까운 거리만 사용하는 걸 추천해요.조명을 켜고 끄는걸 동영상으로 촬영해 봤습니다.포커스는 잔디에 맞춰놨어요.제가 가지고 있는 다른 샤오미 제품과 같이 찍어봤어요.USB 선풍기입니다.곧 리뷰 할 거에요.​끝 부분에 MI 라고 새겨져 있어요.샤오미가 만들었다는 걸 알려줍니다.​두 제품다 동일하게 구부러집니다.다 똑같이 생겼어요.기능만 다릅니다.​마지막 사진이네요.LED 조명을 메인으로 촬영했어요.추가로 동일한 다른 제품을 비교해 볼게요.사은품으로 어디선가 받은 제품이에요.아래쪽 블루가 샤오미 제품, 위쪽 핑크가 어딘가의 제품입니다.​조명 머리 부분을 비교해 봅니다.왼쪽 샤오미 제품은 그냥 실버 컬러이고, 오른쪽 어딘가 제품은 반짝이는 실버입니다.조명 발광 부분은 샤오미가 약간 비추는 아크릴 느낌이라면 어딘가 제품은 플라스틱 느낌이 강하네요.​아래쪽 USB의 모습입니다.샤오미 제품은 MI가 새겨져 있고 어딘가 제품은 아무것도 없습니다.​샤오미 보조배터리를 사용해 조명을 켜 봤습니다.듀얼이다 보니 이럴 땐 좋네요.위 핑크색 제품이 어딘가 제품이고 아래쪽 블루가 샤오미 제품입니다.자세히 보면 샤오미 제품이 약간 누런빛을 띕니다.어딘가 제품은 상대적으로 흰빛 느낌이 납니다.발광은 샤오미가 조금 더 낫습니다.​마지막 이네요.어딘가 제품의 발광 모습을 동영상으로 담아봤습니다.샤오미 휴대용 USB LED 조명은 크게 사용할 곳이 많지는 않았어요.저 같은 경우는 촬영할 때 보조등 역할이나, 노트북 자판을 보이게 해주는 역할 정도를 했어요.그리고 방에서 잠시 불을 켜고 책을 보거나 물건 찾을 때 유용하기도 합니다.​발광력이 엄청 샌게 아니기 때문에 범위는 좁습니다.간단하게 사용할 정도로 생각하면 되겠습니다.제품명 : 샤오미 USB LED 조명판매가 : 3,500원매장명 : 온라인몰​이 리뷰는 제가 직접 구매하여 쓰는 지극히 주관적인 포스팅입니다.",23,0,0,335,0,2,197.0,0,,2020. 1. 28. 13:00,541,632635,상품리뷰,0
1,https://blog.naver.com/rednbk?Redirect=Log&logNo=222093472640,"휴대용 선풍기가 어쩌다보니 여러개 사용하고 있어요.처음엔 저가형 선풍기들을 샀다가 1년도 안되어서 망가지기 일쑤였어요.그래서 그뒤로는 브랜드 제품을 좀 사게 됩니다.​이번에 구입한 제품은 삼각대처럼 세울 수도 있고, 길이도 조절이 됩니다.게다가 브라켓이 있어서 핸드폰으로 동영상을 보면서 바람을 쐴 수도 있죠.배터리 용량도 제법커서 만족스러워요.패키지에요.흰색 박스에 담겨져 있습니다.이름처럼 삼각대 다기능 휴대용 선풍기에요.​뒷면의 모습이에요.여러가지 타입의 방식이 그림으로 안내되어 있어요.가장 기본부터, 길이 조절, 삼각대 및 브라켓 기능까지요.​양쪽 옆면의 모습이에요.제품명과 기능들이 안내되어 있습니다.컬러는 3가지가 있는데 핑크로 구매를 했어요.​개봉을 했습니다.핑크이지만 연한오렌지, 코랄 느낌의 컬러네요.구성품의 모습이에요.선풍기, 설명서 그리고 케이블로 구성이 되어 있습니다.​보증서 겸 설명서에요.​케이블이 제공됩니다.마이크로 5핀이에요.​선풍기를 볼게요.기본 스타일이에요.​양쪽 옆에서 본 모습이에요.한쪽에는 충전 단자가 위치해 있습니다.​뒤쪽의 모습이구요.​바닥 부분의 모습이에요.삼각대가 위치해 있습니다.​헤드에는 브라켓이 위치해 있어요.​충전 단자의 모습이에요.​버튼부의 모습이에요.1번 누르면 1단이고 누를수록 단계가 올라갑니다.총 3단계고 마지막 한번 더 누르면 오프 됩니다.작동 중에는 흰색 램프가 들어오고 충전중에는 빨간 램프가 들어옵니다.​날개는 5엽이에요.라미 로고가 깔끔하게 인쇄되어 있습니다.​헤드 부분은 위, 아래로 어느정도 움직입니다.요게 스탠드타입으로 사용시에는 은근 쏠솔하게 사용됩니다.​옆에서 본 각도에요.왼쪽이 위로, 오른쪽이 아래로 내린 모습입니다.​이번엔 브라켓의 모습이에요.윗 부분을 그냥 펼쳐주면 됩니다.꼭 사슴같아요.​브라켓의 모습이에요.쉽게 접히진 않습니다.​이번엔 길이 조절을 해 봤어요.쭈~욱 최대한 당긴 상태에요.손잡이 만큼 더 길이가 늘어납니다.​마디마디 고정이 되는건 아니에요.쭈욱 끝까지 당겨주면 고정이 됩니다.​하단 삼각대 부분이에요.손잡이 부분이 3개로 펼쳐 집니다.미끄럼 방지 패드 처리가 되어 있어요.그리고 끝 부부넹 자석이 들어 있어서 서로 찰 달라 붙어 줍니다.그래서 평상시에 사용시 벌어지거나 하지 않아요.​삼각대 스타일로 펼쳐 본 모습이에요.안정성에서는 좋은 상태죠.세워두고 사용하기엔 최적화되어있습니다.​다리 부분의 모습이에요.안쪽 봉을 위 아래로 조절해서 높이 조절도 어느정도는 가능합니다.높이에 따라 다리의 벌려지는 각도가 달라져요.​브라켓도 세워 봅니다.​스마트폰을 거치해 봤어요.제가 사용중인건 아이폰11 프로 맥스에요.젤리 케이스가 씌워진 상태에요.이 상태로는 거치라기 보다는 올려 둔 느낌이 듭니다.젤리 케이스를 빼고 올려놔야 안전하게 거치가 됩니다.이건 뭐 제 핸드폰이 크니 어쩔 수가 없어요.그래고 선풍기로 바람 쐬면서 동시에 동영상도 시청할 수 있다는 장점이 큽니다. 제품명 : 휴대용 선풍기판매가 : 17,800원판매처 : 라미 스마트스토어이 리뷰는 제가 직접 구매하여 쓰는 지극히 주관적인 포스팅입니다.",32,0,0,283,0,0,197.0,0,text_ad,2020. 9. 28. 6:00,541,632635,상품리뷰,0
2,https://blog.naver.com/rednbk?Redirect=Log&logNo=221975080364,"루메나 선풍기를 여러개 사용하고 있어요.지금까진 스탠드 제품만 사용해 왔어요.그러다가 올 해 미리 선풍기를 준비했습니다.​슈피겐 제품도 구매를 했고 루메나 제품도 구매를 했습니다.개인적으로는 루메나 제품이 조금 더 커서 더 바람이 센거 같아요.패키지의 모습이에요.비닐에 한번 더 포장되어 있습니다.​비닐을 제거 했어요.선풍기 이미지가 나와 있고 크래들도 같이 보이네요.N9-FAN PRO 2배터리 용량은 2500mAh입니다.​뒤쪽의 모습이에요.안전망이 분리되는 모습과 크래들의 모습이 있어요.제품에 대한 설명도 나와 있습니다.​양쪽 옆면의 모습이구요.​봉인 스티커가 부착되어 있습니다.​개봉을 했어요.사진과 실물의 컬러감이 좀 다르네요.제가 구매한 컬러는 네이비입니다.구성품의 모습이에요.선풍기와 크래들, 케이블, 매뉴얼 그리고 스트랩입니다.​왼쪽부터 매뉴얼, 스트랩, 케이블이에요.케이블은 마이크로 5핀입니다.​정면에서 본 루메나 휴대용 선풍기의 모습이에요.전원 버튼이 위치해 있어요.​양쪽 옆면의 모습이에요.충전 단자와 LED 램프가 위치해 있습니다.​뒤쪽의 모습이에요.스트랩 고리가 위치해 있습니다.​거치 기능이에요.뒤쪽 일부가 직각으로 되어있어 옆으로 뉘일 수 있습니다.​안전망의 모습이에요.옆으로 살짝 돌려주면 분해가 됩니다.손잡이 부분에는 전원 버튼이 위치해 있어요.풍속은 4단계까지 조절이 가능합니다.​손잡이 옆 부분이에요.마이크로 5핀 충전 단자가 있습니다.​반대편 옆이에요.LED 램프가 있어요.배터리 잔량 확인과 충전 확인이 가능합니다.​아래 사진처럼 램프가 들어옵니다.작동 중 램프가 들어오는데 흰색이면 20% 이상 배터리 잔량이 남았다는 뜻입니다.20% 이하가 되면 붉은색이 됩니다.​손잡이 하단 부분이에요.스트랩 연결 고리가 있고, 하단은 금속으로 되어 있습니다.크래들에 장착시 그냥 꽃으면 충전이 됩니다.​크래들이에요.크래들 한쪽에 마이크로 5핀 단자가 위치해 있습니다.안쪽에는 숫핀이 있어서 선풍기를 꽃으면 됩니다.​케이블을 연결 한 모습이에요.책상에 두고 선풍기만 가지고 다니다가 꽃아주면 충전도 되니 편리합니다.​크래들에 올린 모습이에요.​크래들에 올려주면 충전이 됩니다.충전시에 빨간램프가 깜박이고 완충시 흰색이 됩니다.​안전망은 사진처럼 분리가 되어요.그래서 세척도 가능합니다.날개나 뒤쪽망은 물티슈로 닦아주면 깨끗이 사용이 가능해요.예전에는 분리가 안되는 선풍기가 많아서 먼지가 많이 겼는데 이젠 세척도 가능하니 위생적이에요.소음도 적고 바람고 세서 마음에 듭니다.제품명 : 루메나 N9-FAN PRO 2세대판매가 : 29,000원판매처 : 루메나 쇼핑몰이 리뷰는 제가 직접 구매하여 쓰는 지극히 주관적인 포스팅입니다.",28,0,0,243,0,0,197.0,3,,2020. 7. 20. 6:00,541,632635,상품리뷰,0
3,https://blog.naver.com/rednbk?Redirect=Log&logNo=221975010280,"여름에 휴대용 선풍기 없이는 돌아다니기 힘들 정도로 더위가 매섭습니다.매 년 선풍기를 하나씩 들이고 있는거 같네요.이번에도 슈피겐에서 나온 접이식 선풍기를 2개 구입을 했습니다.​일단 믿고 쓰는 브랜드라는 이미지가 컸어요.그리고 접이도 가능하다는 장점, 4단계 풍속이 조절 가능하다는 점이에요.패키지의 모습이에요.화이트 컬러 제품이 이미지가 나와 있어요.A901 USB Foldable Mini Fan​뒷면의 모습이에요.접은 이미지와 힌지 그리고 안전망 분리된 이미지도 있네요.제품의 스펙도 적혀 있습니다.​옆면이에요.AIRNIC​반대편 옆면이에요.제품의 특징이 나와 있어요.THE AIR SOLUTION​아래쪽 부분이구요.한글 표시 스티커가 부착되어 있어요.​위 아래에는 봉인 스티커가 부착되어 있습니다.​봉인 스티커를 제거하고 개봉을 했습니다.구성품의 모습이에요.매뉴얼, 선풍기, 추가 힌지, 케이블이 들어 있습니다.내용물을 다 꺼내었습니다.​매뉴얼이에요.​사용 방법과 제품 정보 등이 나와 있습니다.​구성품은 케이블, 추가 힌지, 스트랩입니다.​선풍기의 모습이에요.화이트 컬러의 제품입니다.전면 안전망과 힌지, 버튼부의 컬러만 다릅니다.​뒤쪽의 모습이에요.스트랩 연결 고리가 위치해 있습니다.​버튼부의 모습이에요.위쪽 버튼을 누르면 한번에 4단이 됩니다.아래쪽 버튼은 1단계씩 올라 갑니다.​손잡이 아래쪽에는 AIRNIC 로고가 새겨져 있어요.​손잡이 뒤쪽에 스트랩을 연결 할 수 있습니다.​손잡이 옆 부분이에요.4개의 램프가 들어옵니다.2가지 기능이 있어요.​풍속 버튼을 누르면 1~4단계까지 LED가 들어옵니다.그리고 잠시 뒤 배터리 잔량이 표시가 됩니다.칸에 따라 25%씩 잡으면 되겠네요.​반대편 옆면이에요.충전 단자가 위치해 있습니다.마이크로 5핀이 사용됩니다.그리고 아래에 힌지가 있는데 힌지는 교체가 가능합니다.​2가지 컬러로 선택이 가능해요.크게 별다른 기능은 없습니다.접어줄 때 고정성 정도로 생각하면 됩니다.​사진처럼 거치형태 또는 접을 수 있어요.손잡이 접는 정도에 따라 각도 조절이 가능합니다.그리고 반으로 완전히 접을 수 있어요.​접은 모습이에요.왼쪽은 정면, 오른쪽은 측면의 모습이에요.​작동 영상을 동영상에 담아 봤습니다.제품명 : 에어닉 휴대용 미니 선풍기 2세대판매가 : 24,900원판매처 : 슈피겐 스마트스토어이 리뷰는 제가 직접 구매하여 쓰는 지극히 주관적인 포스팅입니다.",30,0,0,217,0,1,197.0,0,,2020. 7. 4. 6:00,541,632635,상품리뷰,0
4,https://blog.naver.com/rednbk?Redirect=Log&logNo=221994281792,"루메나 선풍기를 1세대 부터 사용하고 있습니다.2세대도 아주 잘 사용하고 있어요.이번에 3세대가 나오면서 회전 기능이 추가가 되었습니다.좀 늦은거 같긴 하네요.​암튼 그래서 3세대를 출시와 동시에 구매를 하게 되었어요.역시 루메나는 믿고 씁니다.패키지부터 볼게요.비닐에 한번 감싸져 있습니다.​비닐을 제거해 줍니다.전면의 모습이에요.LUMENA FAN STAND2루메나 무선 서큘레이터라 써 있군요.제품의 이미와 특징이 나타나 있습니다.​옆면의 모습이에요.조그 버튼이 생겼어요.조그 버튼의 기능도 안내되어 있네요.​패키지 뒤쪽면이에요.제품의 스펙이 적혀 있습니다.​반대 옆면이에요.드디어 좌우 회전이 됩니다.​위쪽이에요.굿디자인​봉인 스티커가 부착되어 있어요.제거해 주고 오픈 해 줍니다.​기존 스탠드2나 스탠드1처럼 동일한 패키지 스타일이에요.안에 종이 박스로 잘 보호되고 있습니다.비닐에 담긴 선풍기와 부속품의 모습이에요.구성품을 볼게요.스탠드3 본체와 케이블 그리고 설명서에요.​설명서와 케이블의 모습입니다.특히 이번 스탠드3에서는 C타입으로 케이블이 바뀌었어요.이점 또한 마음에 드네요.​잘 알아두어야할 부분만 찍어 놨어요.​제가 선택한 컬러는 네오민트에요.지금까지 나온 컬러는 다 있어서 없는 컬러를 선택 했습니다.상당히 밝은 민트라고 보면 됩니다.조그 버튼이 생긴게 눈에 확 들어오네요.날개는 기존 3엽에서 5엽으로 바뀌었어요.​양쪽 옆에서 본 모습이에요.기존 제품과 디자인은 동일합니다.헤드 사이즈도 동일하구요.개인적으로 컬러감은 마음에 드네요.​뒤쪽에서 본 모습이에요.역시 디자인은 기존 스태드1이나 스탠드2와 동일합니다.충전 단자만 바뀌었어요.​바닥 부분의 모습이에요.4개의 미끄럼 방지 패드가 부착되어 있습니다.​헤드 부분이에요.위 아래로 움직입니다.위로는 45도 정도가 되지만 아래로는 각도가 상대적으로 낮습니다.​후면부 충전 단자에요.기존 마이크로 5핀에서 C타입으로 변경이 되었습니다.대세는 C타입이니 이제라도 반영이 되어 만족스러워요.제가 사용하는 것들이 대부분 C타입이라서 말이죠.​조그 버튼의 모습이에요.우측으로 돌리면 작동이 됩니다.퐁속은 4단계인데 초미풍부터 시작합니다.그리고 조그를 2초 정도 누르면 회전이 됩니다.회전의 각도는 120도이고 작동을 중지하면 저절로 가운데로 복귀 합니다.또한 작동 중 조그를 다시 2초 정도 누르면 해당 위치에서 회전이 멈춥니다.​타이머 기능도 있어요.LED에 표시가 되는데 조그 버튼을 한번 누르면 1시간, 2시간, 4시간 순으로 됩니다.​작동 중에는 아래 사진처럼 램프에 불이 들어와요.충전시에는 깜박이다가 완충이 되면 계속 들어와 있습니다.배터리가 20% 이하일 때는 빨간색 램프가 들어옵니다.​안전망은 분리가 됩니다.그래서 세척 역시 가능하구요.본체는 물티슈로 닦아 줍니다.​5엽 날개에요.기존에는 3엽이었는데 5엽으로 바뀌면서 20% 정도 풍속이 강해졌다고 합니다.실제로 사용해 보면 좀 더 세진게 느껴집니다.​한 번 비교를 해 봤어요.왼쪽은 N9-FAN STAND2, 오른쪽은 N9-FAN STAND3입니다.일단 정면에서 보면 3엽에서 5엽으로 바뀌었구요.조그 버튼이 생겼습니다.안전망의 디자인은 같아요.​바닥면도 동일하구요.뒤쪽 충전 단자는 마이크로 5핀에서 C타입으로 변경이 되었습니다.새로 출시된 N9-FAN STAND3는 회전 기능이 추가되고 풍속이 더 강해졌어요.매 년 개선되는 제품이 나오니 매년 사게 되네요.​저는 놀러 나갈 때 가지고 나가곤 합니다.전용 가방이 별도로 있어서 편리하기도 하구요.핸드 선풍기보다는 커니 더 시원합니다.​배터리도 더 오래가서 좋고, 회전 기능이 있어서 여러 사람이랑 같이 쓰기에도 좋아요.텐트치고 놀기 좋은 요즘엔 딱 입니다.​여름에 핸드 선풍기 대신 루메나 스탠드3로 나보렵니다.제품명 : 루메나 FAN STAND 3세대 휴대용선풍기판매가 : 41,000원판매처 : 루메나 스마트스토어이 리뷰는 제가 직접 구매하여 쓰는 지극히 주관적인 포스팅입니다.",32,0,0,364,0,0,197.0,0,,2020. 6. 22. 6:00,541,632635,상품리뷰,0
5,https://blog.naver.com/rednbk?Redirect=Log&logNo=221328477972,"한동안 오늘 소개할 제품이 인기였죠.사은품으로도 엄청 풀렸었구요.최근에도 간간히 보이긴 합니다.특히 카카오톡 이모티콘을 활용한 제품들이 엄청 인기였어요.그래서 짭도 참 많이 있었던 기억이 납니다.제가 소개할 제품은 샤오미 제품으로 USB를 이용하는 선풍기입니다.제품의 전체 모습이에요.포장은 그냥 폴리백 안에 간단하게 담겨 있어요.​몸통과 날개는 분리가 됩니다.분리가 되는 이유는 아무래도 휴대 시 망가질 수 있기 때문인것 같아요.그리고 보관시에도 용이합니다.​몸통 부분을 가까이 찍어봤어요.동그란 원형 안에 모터가 들어 있습니다.모형 자동차에 들어가듯 모터가 들어가 있어서 날개를 돌려줍니다.​날개를 위에서 찍었어요.말랑 말랑한 연질의 실리콘 재질입니다.몸통의 재질도 같아요.​날개 뒷면이에요.중앙부에 모터수핀을 끼을 수 있는 홈이 있고 홈 주변은 비어 있어요.그리고 자세히 보면 홈 주변 원형부에 약간 돌출된 부분이 2개 있어요.날개 결합시 몸통과 완전 밀착되지 않게 만들어 두었습니다.​몸통에 날개를 끼워볼게요.홈에 맞춰 모터 수핀을 끼워줍니다.그리고 쭈욱 끝까지 밀어줍니다.​날개가 끝까지 들어간 모습이에요.완전이 밀착이 되지 않게 날개 뒷부분에 약간의 돌출된 부분이 있어요.밀착이 되면 날개가 돌아갈 때 소리가 나고 마모가 될거에요.세심하게 신경 써 놨네요.다만 쓰다보면 재질이 재질인지라 닳긴 하겠어요.​몸통 아래부분입니다.MI라고 샤오미 로고가 새겨져 있습니다.​뒷부분에는 아무것도 없어요.이걸로 만져보면 앞, 뒤 구분이 가능하긴 하겠네요.​USB의 모습입니다.요즘 나온 C허브에는 사용을 못하죠.보조배터리에 결합하여 사용할 수도 있습니다.USB를 꽃을 수 있는 곳이면 다 되는거 같아요.*해보진 않았어요.​아 그리고 중요한 점 한가지가 있네요.이 제품은 구부러집니다.어느 정도 범위 내에서는 잘 구부러져서 방향을 맞춰서 사용할 수 있어요.어거지로 너무 구부리면 안구부러집니다.​이제 제가 사용중인 샤오미 보조배터리 20,000 2세대에 사용해 보겠습니다.듀얼 USB라 아무데나 꽃아도 사용이 됩니다.참고로 꽃으면 바로 가동이 됩니다.보조 배터리 옆에 버튼을 누르면 멈추고 다시 누르면 가동이 됩니다.가품은 그냥 무조건 가동이더라구요.​이렇게 쌔앵 잘 돌아갑니다.제로나인보다 시원할거 같아요.날개 재질도 실리콘 소재라 다칠 염려가 없습니다.아프지도 않습니다.보조배터리에 장착해서 가동 되는 영상을 담아봤어요.​이번엔 가동 중 소음을 담아봤어요.솔직히 소음이라고 하기도 좀 그렇습니다.요즘 선풍기에 비하면 소음이 거의 없다고 보는게 맞을거 같아요.제가 가지고 있는 다른 샤오미 제품과 같이 찍어봤어요.LED 조명입니다.곧 리뷰 할 거에요.​끝 부분에 MI 라고 새겨져 있어요.샤오미가 만들었다는 걸 알려줍니다.​두 제품다 동일하게 구부러집니다.다 똑같이 생겼어요.기능만 다릅니다.​마지막 사진이네요.선풍기를 메인으로 촬영했어요.USB를 사용한 제품들이 상당히 많이 나오죠.이 제품도 컴퓨터 옆에 두고 사용해도 되는 제품이에요.소음도 적고 바람도 사무실에서는 쓸만 합니다.그리고 무엇보다 재질이 실리콘이라 다칠 염려도 없습니다.​가벼워서 휴대하기도 좋고 보조배터리를 갖고 다니니 거기에 사용해도 됩니다.사용 시간은 보조배터리 용량에 따라 다르겠죠.간편하게 다닐 때 사용하기엔 추천할만합니다.하지만 바람 세기 조절이 안되고, 제가 사용중인 20,000 용량 배터리를 들고 다니기엔 무거워요.그냥 사무실 컴퓨터에 두는게 저는 제일 잘 쓰고 있습니다.제품명 : 샤오미 USB 선풍기판매가 : 2,500원매장명 : 온라인몰​이 리뷰는 제가 직접 구매하여 쓰는 지극히 주관적인 포스팅입니다.",18,0,0,356,0,2,197.0,2,,2019. 12. 29. 20:00,541,632635,상품리뷰,0
