,Post URL,Post,Image num,sticker num,gif num,Paragraph num,Comment num,Video num,weekly viewer mean,Sympathy num,AD,Posting Date,Buddy num,Total visit,Blog category,Comment detail
12,https://blog.naver.com/rednbk?Redirect=Log&logNo=222337913850,"블루투스 스피커가 하나 더 늘었어요.집에서는 줄 마샬과 보스를 사용중이에요.​사무실에서는 앤커 제품을 사용하죠.이번에는 작은 스피커가 필요 했어요.촬영 소품으로도 좋고 간편하게 들고 다니면서 사용하기 좋은걸로요.패키지에요.작고 아담한 사이즈라 패키지도 작네요.MY MELODYBluetooth Speaker​뒷면에는 제품에 대한 정보가 인쇄되어 있어요.배터리 용량은 950mAh고 재생시간은 최대 9시간, 충전시간은 2~3시간입니다.​옆면엔 별다른건 없어요.위쪽에는 프롬비 로고가 있네요.​개봉을 했습니다.스피커와 설명서 그리고 케이블 박스가 있습니다.내용물을 볼게요.설명서, 마이 멜로디 블루투스 스피커, 케이블, 핸드스트랩으로 구성이 되어 있습니다.​설명서에요.작동법이 나와 있습니다.​케이블의 모습이에요.케이블은 마이크로 5핀입니다.​스트랩은 흰색으로 손목에 걸 수 있는 타입이에요.​마이 멜로디 블루투스 스피커를 볼게요.정면의 모습이에요.뉴트로 스타일이 잔뜩 묻어 나네요.​옆에서 본 모습이에요.​반대쪽 옆 모습이에요.스트랩을 달 수 있는 연결 부위가 위치해 있습니다.​뒤쪽의 모습이에요.케이블 단자와 안테나가 위치해 있네요.​위쪽의 모습이구요.​아래쪽의 모습이에요.제품 정보 스티커가 부착되어 있고, 낮은 다리가 있습니다.미끄럼 방지 패드는 아니고 몸체와 동일한 소재에요.​부분샷들을 볼게요.먼저 뒤쪽이에요.안테나가 달려 있는데 180도 회전이 가능합니다.기능은 없고 디자인적인 요소에요.이게 있어서 더 뉴트로 느낌을 주네요.​스트랩 연결 부위도 위치해 있습니다.고리에 스트랩을 끼워주면 됩니다.​그리고 충전 단자도 뒤쪽에 있어요.마이크로 5핀을 연결 해 주면 충전이 됩니다.정면에 램프가 들어와요.충전중에는 빨간색 완충이 되면 꺼져요.충전은 2~3시간이 걸려요.​정면의 모습이에요.왼쪽편은 스피커가 위치해 있어요.​오른쪽 돌리는 스위치가 있어요.전원 및 볼륨 버튼이에요.​스위치를 켜면 전원이 켜지고 바로 페어링 모드로 전환이 됩니다.페어링시에는 파란색 램프가 0.5초 간격으로 깜박여요.페어링이 완료가 되면 파란색 램프에 불이 들어와 있습니다.​블루투스는 4.2를 지원합니다.연결 범위는 5M에요.​스위치를 우측으로 돌리면 볼륨이 켜집니다.다시 왼쪽으로 돌리면 작아지고 최대한 돌리면 딱 소리가 나면서 꺼지죠.물리적 스위치의 소리에요.음악 재생 중에는 파란색 램프가 1초씩 깜박여요.​이번에 구매하면서 화이트, 핑크를 다 구매 했어요.네이비도 살 걸 그랬나 봐요.​크기는 작지만 쓸만한 스피커에요.베이스를 잡아준다거나 고음을 잘 내준다거나 하진 않습니다.정직하게 소리를 잘 내줍니다.​무엇보다 디자인적 요소가 강한 제품이에요.저도 그래서 구매를 한 이유가 되겠죠.게다가 촬영 소품으로 활용하기에도 좋은 아이템입니다.​소리도 꽤나 크게 잘 내줍니다.​둘이 같이 두니 아주 이쁘네요.​며칠 전에 밖으로 가지고 나가 봤어요.사람이 없는 잔디 밭에 앉아서 바람을 좀 쐬었죠.​그리고 음악을 들어 봤습니다.조용한 분위기에 시끄럽지 않으니 볼륨을 중간 정도로만 해도 잘 들렸습니다.​하나는 사무실에서 쓰고 있어요.나머지 하나는 아이랑 놀러갈 때 가지고 다니는 중이네요.귀엽고 이쁜 마이 멜로디 블루투스 스피커에요.블루투스 연결을 해 볼게요.사용중인 스마트폰으로 해 볼거에요.제 스마트폰은 아이폰12 프로 맥스에요.​아이폰에서 블루투스를 켜 줍니다.그리고 마이멜로디 블루투스 스피커 스위치를 돌려서 켜 줍니다.핸드폰 상에 기타기기 Hearme라고 떠요.보통은 제품명이 뜨는데 재미있네요.​터치 해 줍니다.그러면 연결이 됩니다.사운드를 통해 연결 된걸 알 수 있어요.연결이 해제되었을 때도 사운드로 알려 줍니다.​음악을 재생해 줍니다.오늘은 브레이브걸스의 하이힐이에요.동영상으로 브레이브걸스의 하이힐을 담아봤어요.사운드는 중간 정도 크기 입니다.제품명 : 프롬비 마이벨로디 블루투스 스피커판매가 : 29,800원판매처 : 프롬비스마트스토어이 리뷰는 지원 받아서 쓰고 싶지만제가 직접 구매하여 쓰는 지극히 주관적인 포스팅입니다.",37,0,0,364,0,1,197.0,0,text_ad,2021. 5. 24. 6:00,541,632635,상품리뷰,0
13,https://blog.naver.com/rednbk?Redirect=Log&logNo=222333284271,"앤커 스피커가 하나 더 늘었습니다.이번엔 사운드코어3 제품이에요.당연시 방수기능은 있고, 출력도 빵빵하고, 재생시간도 길기에 마음에 들었습니다.고사양 제품을 찾는게 아니기에 가격대비 성능이 좋다고 생각이 되네요.​아웃도어에서 활용하기에도 좋은 제품인데 전 사무실에서 쓰고 있어요.그나마 여기저기 돌아다니면서 일할 때 사용하는데 신나게 잘 듣고 있어요.앤커 스피커가 3개째인가 그러네요.늘 비닐에 담겨져 있습니다.​패키지를 볼게요.지금까지의 앤커 스타일과는 조금은 다른 느낌의 패키지에요.정면의 모습이에요.제품의 이미지와 방수가 된다고 표현을 해 줬네요.SOUNDCORE3EXCEPTIOMAL CLARITYIPX7 24H Playtime​바닥면의 모습이에요.제품 스티커가 부착되어 있습니다.​뒤쪽의 모습이에요.제품의 기능이 그림과 글로 안내되어 있습니다.파워풀한 스피커, 방수, 100개 스피커 링크 등이에요.​다른쪽면이에요.웨이브 느낌의 이미지네요.​옆쪽에는 스피커 내부 이미지가 있어요.Boosted Bass via Titanium Driversand Dual Passive Radiators​ 반대쪽이에요.음악을 듣을면서 커피를 마시는 여성의 이미지네요.벽난로도 보이고요.힐링의 느낌이...INCREDIBLE SOUND LOVED BY20 MILLION+ PEOPLE​봉인 스티커가 부착되어 있습니다.​개봉을 했어요.스피커 본체와 여러가지 브로셔 그리고 스트랩과 케이블이 들어 있습니다.​왼쪽은 C타입 케이블이에요.오른쪽은 스트랩입니다.​브로셔의 모습이에요.사용설명서 주의사항 등이 적혀 있습니다.사운드코어3 제품을 볼게요.정면에서 본 모습이에요.SOUNDCORE라 써 있어요.티타늄 드라이브가 사용 되었습니다.두 개의 1.5 드라이버와 두 개의 패시브라디에이터로 16W의 스테레오를 지원합니다.​위쪽에서 본 모습이에요.버튼이 5개가 위치해 있습니다.왼쪽부터 전원, 볼륨줄이기, 다기능, 볼륨높이기, 블루투스 순입니다.그리고 버튼 양쪽 끝에는 각각 LED가 위치해 있어요.​뒤쪽의 모습이에요.우퍼 같이 생겼네요.사운드코어의 독자적인 Bass Up 테크놀로지는 실시간으로 저음을 강화해 줍니다.내장 마이크가 탑재되어 있어 통화도 가능해요.​바닥부분의 모습이에요.4군데 귀퉁이에 미끄럼 방지 패드가있습니다.제품에 대한 정보가 가운데 인쇄되어 있어요.시리얼 스티커도 부착되어 있네요.​옆쪽을 볼게요.스트랩 연결 고리 부분이에요.​반대쪽은 충전단자가 위치해 있습니다.C타입 충전 포트에요.이번엔 C타입이라 편리하네요.​버튼부를 조금 더 자세히 볼게요.버튼은 살짝 다 튀어 나와 있는 구조에요.터치는 아니고 누르는 방식입니다.버튼감은 잘 눌리고, 세게 안눌러도 잘 작동됩니다.​전원 버튼의 모습이에요.큼지막 해요.전원 버튼 왼쪽에 작은 LED가 위치해 있어요.전원을 켜면 불이 들어옵니다.​오른쪽엔 블루투스 버튼이 있어요.역시 옆에 LED가 있어요.블루투스 작동시 불이 들어와요.블루투스는 5.0을 지원해서 최대 20m 까지 사용 가능해요.사운드코어 APP을 활용하면 EQ 세팅을 사용할 수 있어요.​스트랩 연결 부위구요.흔히 보던 작은 구멍 스타일이 아닌 옆면에 고정성이 좋게 만들어져 있습니다.스트랩 두께도 있어서 야외 활동에 들고다니긴 좋아요.IPX7 완전 방수라 물에서 어느 정도는 사용 가능합니다.그래서 부담감이 덜 하죠.​스트랩을 끼우는건 간단하니...​사운드코어3 스피커는 최대 100개의 스피커를 동시에 연결 가능하다고 하네요.파티를 즐길 수 있다고 해서 파티캐스트 테크놀로지가 탑재되어 있습니다.100개를 쓸 사람은 없을거 같긴한데 여러대는 연결 할 수 있다는건 장점이 되겠죠.​앤커 스피커를 여러대 사용해 오고 있지만 참 정직한 사운드를 들려 주는거 같아요.그리고 확실히 사운드코어3는 베이스를 잘 드러내 줍니다.출력도 16W로 괜찮고, 최대 24시간 재생도 가능하기 때문에 아웃도어에서 활용하기에 좋아 보입니다.저는 사무실에서 쓰고 있는데 촬영하거나 작업할 때 이리저리 들고 가서 음악을 듣는데 아주 잘 사용 중이에요.사용을 한번 해볼게요.사운드코어3와 제 스마트폰인 아이폰12 프로 맥스를 준비 해 줍니다.전 지니를 사용 중이에요.​왼쪽의 전원 버튼을 눌러 줍니다.흰색 램프가 들어오네요.전원을 키고 끌 때 사운드가 있어요.​이번엔 우측 끝에 있는 블루투스 버튼을 눌러 줍니다.그러면 파란색 LED가 들어와요.소리가 나면서 기기를 찾기 시작합니다.​아이폰12 프로 맥스에서 블루투스를 켜 줍니다.그리고 기타 기기를 보면 Soundcore3가 뜨는걸 볼 수 있어요.선택 해 줍니다.​이제 아이폰12 프로 맥스와 사운드코어3가 쌍방으로 연결이 되었습니다.이제 사운드코어3를 통해서 사운드를 들을 수 있어요.음악도 들을 수 있고 유튜브도 볼 수 있죠.​지니를 실행 해 줍니다.그리고 음악을 선택하고 재생해 주면 사운드코어3에서 음악이 흘러 나와요.베이스도 은근하게 잘 드러나구요.좋습니다.롤린을 재생 해 봤어요.동영상이 사운드를 제대로 전달을 해 주지 못해서 아쉽네요.동영상보다 음질이 훨씬 좋습니다.제품명 : 사운드코어3 블루투스 스피커판매가 : 69,900원판매처 : 앤커코리아이 리뷰는 지원 받아서 쓰고 싶지만제가 직접 구매하여 쓰는 지극히 주관적인 포스팅입니다.…
",33,0,1,473,1,1,197.0,1,text_ad,2021. 5. 10. 6:00,541,632635,상품리뷰,['우왕~ 캠핑갈때 가져가면 좋겠네요']
14,https://blog.naver.com/rednbk?Redirect=Log&logNo=222326340434,"블루투스 스피커를 참 좋아하는 저입니다.이래저래 참 많이도 사고 다시 팔고 하고 있습니다.그중에서도 앤커 제품도 여러개 사용하고 있죠.​일단 가격대비 깔끔한 성능을 주기 때문이에요.그래서 사무실에 주로 두고 사용을 하고 있습니다.이번에 구매한 제품은 그냥 여기저기 막 들고 다니려고 구매를 한 제품이에요.방수, 방진에 AUX가 되기에 망설임 없이 잘 사용하고 있답니다.패키지의 모습이에요.앤커 스피커를 여러개 사 왔지만 플라스틱 패키지에 담긴건 처음이네요.제품이 확 보입니다.제가 구매한건 오렌지 컬러 제품이에요.​뒤쪽의 모습이에요.사운드코어 아이콘 미니 제품의 특징이 적혀 있습니다.8시간 플레이 가능하고 방수 등이 된다고 하네요.​옆면의 모습이에요.제품에 대한 정보 스티커가 부착되어 있습니다.​반대쪽에는 가방에 달린 제품의 이미지가 있네요.아웃도어용으로 사용이 가능하기에 이런 이미지를 사용한거 같아요.방수, 방진이 되기에 말이죠.IP67 입니다.​위쪽과 아래쪽의 모습이에요.​봉인 스티커는 위 아래에 각각 부착되어 있습니다.위쪽의 네모난 스티커에 보면 화살표가 있는데 그걸 따라 제거 해 주면 쉽게 개봉이 됩니다.​개봉을 했어요.안에 한번 더 포장이 되어 있네요.마져 개봉을 해주면 구성품이 다 나옵니다.사운드코어 아이콘 미니 스피커와 케이블 그리고 브로셔입니다.스트랩은 처음부터 장착되어 있습니다.​브로셔는 사용 설명서와 주의사항이 담긴 내용이에요.케이블도 같이 제공이 되는데 C타입이 아닌 마이크로 5핀입니다.같은 앤커 스피커인데도 어떤건 C타입이고 어떤건 5핀이고 그러네요.​제품을 볼게요.사운드코어 아이콘 미니 블루투스 스피커의 모습이에요.사운드코어가 전면에 인쇄되어 있습니다.​옆면의 모습이에요.단자부와 스트랩이 위치해 있어요.​뒤쪽의 모습이에요.제품의 기본 정보가 인쇄되어 있습니다.​반대쪽 옆면이에요.여기에는 홀 1개가 위치해 있어요.마이크부분으로 핸즈프리 통화가 가능합니다.​위쪽의 모습이에요.각종 버튼부가 위치해 있어요.​아래쪽의 모습이에요.전체를다 보면 둥글둥글 해서 스탠드형 스피커가 아닌점을 알 수 있습니다.즉 위로 향하게 두거나 걸어서 사용하는 형태이기 때문이죠.​스트랩 연결 부위에요.컬러에 맞게 스트랩도 달려 있습니다.​길이는 꽤나 길어요.중앙 부분에 조임이 가능한 부분이 있어서 손목에 끼고 사용 가능해요.​단자 부분을 볼게요.사진처럼 뚜껑을 열어 주면 됩니다.2개의 단자가 위치해 있는데 왼쪽은 AUX, 오른쪽은 충전 단자에요.​옆의 단자를 통해 충전 케이블을 연결 한 모습이에요.충전시에는 전면부에서 LED 램프가 들어옵니다.스피커 부분이에요.깔끔한 이미지에요.그리고 스피커 2개를 연결 해서 스테레오로 사용할 수도 있습니다.​버튼부를 볼게요.왼쪽부터 전원, 볼륨줄이기, 재생/정지등의 다기능 버튼, 볼륨키우기, 블루투스 연결 버튼 순이에요.별다른 버튼이 필요 없으니 간단하네요.​전원을 누르면 켜지고 누르고 2~3초 정도 있으면 꺼집니다.연결된 기기와 연결이 끊어지면 자동으로 30분 뒤에 전원이 꺼집니다.이런건 있으면 좋아요.까먹어도 저절로 꺼지니깐요.​방수 방진이 되는 제품이라 아웃도어용으로 적합합니다.그냥 여기저기 다닐 때 막 들고 다니면 되는거에요.무게도 가볍도 크지 않아서 부담감이 없네요.블루투스는 5.0으로 말할 필요가 없죠.기본적인 성능이 워낙 깔끔한 앤커 제품이라 잘 사용 중에 있습니다.노래를 재생 해 봤어요.깔끔해요.제품명 : 사운드코어 아이콘 미니 블루투스 스피커판매가 : 29,900원판매처 : 앤커스마트스토어이 리뷰는 지원 받아서 쓰고 싶지만제가 직접 구매하여 쓰는 지극히 주관적인 포스팅입니다.-
 
",26,0,0,342,1,1,197.0,0,text_ad,2021. 5. 4. 7:00,541,632635,상품리뷰,['이쁘기는 하지만 크기에 비해 무게감이 있네요']
15,https://blog.naver.com/rednbk?Redirect=Log&logNo=222197410611,"사무실에 스피커를 사용중이죠.그런데 이쁜것만 생각하다가 AUX가 없는걸 구매했어요.영상을 보려다 보니 소리를 들을 수가 없어서 간단하 스피커를 찾게 되었습니다.​소니는 예전부터 사용해 봤고 음질도 좋았던 기억이 있었어요.그래서 작지만 소니 블루투스 스피커를 구매했습니다.그냥 딱 FM이라고 생각되는 스피커네요.패키지의 모습이에요.아주 간단해요.스피커가 사이즈도 작아서 미니미니 합니다.SONY EXTRA BASS 레드 컬러에요.​뒤쪽의 모습이에요.한글 표시사항 스티커가 부착되어 있습니다.간단한 특징도 안내되어 있네요.​옆에서 본 모습이에요.​개봉은 편리하게 되어 있어요.자를 필요 없이 위쪽에 홈을 이용해서 열어 주면 됩니다.손 안아파서 좋네요.​개봉을 했습니다.구성품의 모습이에요.​설명서와 보증서가 있구요.​케이블이 기본으로 제공됩니다.마이크로 5핀입니다.​휴대용이고 작아서 스트랩이 같이 제공되네요.​스피커의 모습이에요.전면에서 본 모습입니다.타원형 모양의 소니 블루투스 스피커에요.​옆쪽의 모습입니다.단자부가 위치해 있어요.​반대쪽 옆면에는 소니 로고가 인쇄되어 있습니다.​뒤쪽의 모습이에요.​위쪽에서 본 모습이에요.버튼부가 위치해 있습니다.​바닥 부분의 모습이에요.제품 정보가 부착되어 있습니다.​부분샷을 좀 볼게요.스트랩은 우측 상단에 끼워서 사용할 수 있어요.​위쪽에는 4개의 버튼이 있습니다.왼쪽위가 재생/정지/곡넘김 버튼이고, 오른쪽이 전원 및 페어링 버튼이에요.그아래에는 볼륨 버튼이 위치해 있습니다. ​후면에는 37.5mm 풀레인지 스피커가 위치해 있어요.저음을 내주는 역할이에요.​바닥 부분에는 미끄럼 방지 패드가 있습니다.​전면 스피커 망의 모습이에요.​각종 단자부입니다.왼쪽부터 AUX, 리셋, 마이크로 5핀 충전 단자순이에요.​전면에는 LED 램프가 있어서 작동 상태를 알려줍니다.참고로 왼쪽과 오른쪽 각각 상태에 따라 켜집니다.배터리는 6시간 정도 사용이 가능해요.그리고 핸즈프리도 가능합니다.​블루투스는 연결이 잘 됩니다.저는 사무실에서 간단하게 동영상 강의 들을 때 사용하려고 구매를 했어요.그래서 AUX가 되는 이 제품을 구매 했습니다.소니는 예전부터 사용해 와서 음질은 믿음직 스럽죠.이 제품은 저가이고 작아서 확실히 상위 소니 제품과 차이는 납니다.재생하는 모습을 동영상에 담아 봤습니다.제품명 : EXTRA BASS SRS-XB01판매가 : 29,800원판매처 : 쿠팡이 리뷰는 지원 받아서 쓰고 싶지만제가 직접 구매하여 쓰는 지극히 주관적인 포스팅입니다.",25,0,0,222,0,1,197.0,0,text_ad,2021. 3. 2. 6:00,541,632635,상품리뷰,0
16,https://blog.naver.com/rednbk?Redirect=Log&logNo=222234462630,"마샬 블루투스 스피커를 좋아하는 1인입니다.여러대 보유 중이죠.리뷰 못한 제품들이 여럿있습니다.​이번엔 엠버튼이라는 제품이에요.마샬의 단점 중의 하나가 휴대성이였죠.그런데 엠버튼이 이런 단점을 없애줬습니다.성능면이나 가격면 그리고 디자인적인면까지 저는 너무 만족스럽습니다.요새는 이거 하나 가지고 다니면서 쓰고 있어요.보스 사운드 링크 미니와 비교가 많이 될거 같네요.둘 다 선택해도 후회가 없어서 전 둘 다 사용 중이에요.패키지에요.마샬 특유의 스타일은 계속 됩니다.깔끔하지만 그래피티적인 느낌도 납니다.​20+ HOURS OF PORTABLE PLAYTIMEEMBERTON​뒤쪽의 모습이에요.제품의 특징이 적혀 있습니다.전후면 사운드, 20시간 플레이 타임, 방수등급, 노브, 가벼운 무게, 블루투스​옆면의 모습이에요.방수가 된다고 대놓고 사진을 해 놨네요.IPX7등급이에요.그러나 굳이 물에 넣어볼게 아니니...​반대쪽이에요.제품의 스펙이 적혀 있습니다.제가 선택한건 한정판 블랙 & 브래스 컬러에요.​위쪽의 모습이구요.​투명한 2개의 봉인 스티커가 부착되어 있습니다.​스티커를 떼어 냅니다.은박 자국이 딱 남아요.​개봉을 했습니다.구성품을 볼게요.가이드와 보증서 그리고 엠버튼, 케이블입니다.​보증서와 가이드에요.​케이블이에요.USB to C 타입이 제공 됩니다.​엠버튼 블랙 & 브래스의 모습이에요.블랙 제품과 다른점은 스피커망 컬러와 로고 컬러에요.블랙 제품은 실버에 화이트 로고이고, 블랙 앤 브래스는 블랙에 골드 로고에요.개인적으로 금장 로고가 더 마음에 들어서 구매를 했습니다.​뒷면의 모습이에요.엠버튼 제품은 스톡웰2처럼 전,후로 사운드가 나옵니다.​바닥면의 모습이에요.제품 표시 사항들이 적혀 있습니다.​위쪽의 모습이에요.가운데 노브부터 버튼부가 위치 해 있습니다.​양쪽 옆면의 모습이에요.한쪽에 충전 단자가 위치해 있어요.​전면 스피커부의 모습이에요.퀄리티야 늘 좋으니 흠잡을곳은 없어요.금장 로고가 화려함을 더해 주는거 같아요.​버튼부를 볼게요.블루투스 페어링 버튼입니다.누르고 있으면 LED가 깜박이고 스마트폰과 페어링 시킬 수 있습니다.블루투스 거리는 최대 10m에요.​가운데에는 골드 컬러의 노브가 위치해 있어요.다양한 기능을 합니다.누르고 있으면 전원 온/오프의 기능을 합니다.전원이 켜졌을 때는 일시정지의 기능도 합니다.그리고 좌우는 곡 넘기기 기능이고, 위 아래는 볼륨의 기능이에요.버튼이 딱 떨어지는 맛은 없습니다.​오른쪽은 배터리 잔량 램프에요.마샬 스톡웰2와 동일합니다.충전시 붉음 램프가 아래부터 위까지 깜박입니다.​옆면에는 충전단자가 있는데 이게 좀...뭔가 딱 들어맞는 맛이 없어요.덜 끼워진 느낌이 납니다.이런 문제가 여기저기서 보이긴 하더라구요.저 같은 경우 C 단자가 긴 케이블을 끼워주니 해결이 되더라구요.그냥 다른 케이블 사용중이에요.​제가 사용 중인 스마트폰과 비교 해 봤어요.아이폰11 프로 맥스에요.거의 크기가 비슷합니다.스톡웰2보다 크기는 작아졌고, 폭은 더 커졌습니다.​스톡웰2 사용하면서 불만이였다면 사운드 였어요.기존 스톡웰보다 보다 못한 느낌이였죠.결론적으로 스피커의 차이가 결국 음량의 차이로까지 이어졌더라구요.이번 엠버튼은 걱정을 했는데 오히려 스톡웰2 안쓰게 되네요.사운드 강력하고 고음, 저음 잘 잡힙니다.보스 사운드링크 미니와 비교해도 손색이 없어요.오히려 음악적으로는 엠버튼이 더 나은거 같아요.제품명 : 엠버튼 블랙 & 브래스판매가 : 200,000원판매처 : Qoo10이 리뷰는 지원 받아서 쓰고 싶지만제가 직접 구매하여 쓰는 지극히 주관적인 포스팅입니다.",25,0,0,326,0,0,197.0,0,text_ad,2021. 2. 14. 6:00,541,632635,상품리뷰,0
