,Post,score,Image num,Video num,comment num,sympathy num,weekly view,AD,keyword score,tfidf score,josa,noun,noun/josa,paragraph num,gif num,sticker num
0,사진속에서 보시는것과 같이 기본프로브는 니은자로 생긴 모양의 볼 프로브 형식이구요 수직타입 볼 프로브도 함께 구성되어 있습니다 제품의 형태 모양 재질에 따라서 프로브를 다양하게 구성하실수 있으며 보통 필름지 측정이나 얇은 평면 제품을 측정할 경우에는 평면 프로브를 많이 사용하십니다 장비 자체적으로 석재 스탠드가 포함이 되어 있기 때문에 별도의 석정반이나 테이블이 필요 없으며 올려 놓고 사용한 공간만 있으시면 어디든지 설치가 가능합니다 디스플레이 모니터는 언어 선택이 가능하며 한글도 지원하고 있습니다다양한 형태의 프로브가 제공되고 있으며 장비 상담시 정확한 측정물에 대한 도면이나 사진 재질을 함께 말씀해주시면 보다 빠른 장비 상담이 가능합니다 현 국내에서는  연구소 외에도 다양한 곳에서 배터리 사업 및 디스플레이 사업 수력발전소 외의 다양한 종류에 사용되고 있는 장비로 이미 정밀도 및 사용의 편리성을 인정받고 있는 장비입니다 감사합니다 상담은 아래의 연락처로 연락을 주시면 친절하게 상담해드리겠습니다  ,3.7050346265146996,36,0,0,0,19.6,0,-7.317073170731707,2.002,0.19831223628691982,0.39662447257383965,2.0,121,0,0
1,안녕하세요 씨아이피통상 입니다오늘은 경기도 화성시 소재의 한 업체에 납품했던진원단차높이측정기를소개해드리려 합니다 진원단차높이측정기이하 는 측정하시려는 샘플에 맞춰 지그를 주문제작하여납품을 진행하게됩니다 제작은 국내에서 이루어지며사진상에 함께 장착되어있는인디게이터옵션와 다이알게이지옵션는 한국교정기술연구원에 검교정을 진행하여인증 성적서와 함께 출고되고 있습니다 아래링크에서 인디게이터다이알게이지 등 확인가능합니다  진원도 거칠기 단차높이측정 등편리한 측정이 가능하며 사용법도아주 간단합니다 아래 시험영상을 확인해보세요 저희 씨아이피통상주로 문의주시면신속하고 정확한 상담을통해필요하신 제품을 알맞게 구매하실 수 있도록친절히 서포트 해드리겠습니다 감사합니다     정밀광학 측정기기 및 각종 측정공구 전문씨아이피몰        ,6.471567506466469,5,1,0,6,66.8,0,-4.464285714285714,0.40780000000000016,0.13157894736842105,0.46842105263157896,3.56,58,0,3
2, 커튼 블라인드 설치를 위해서는정확하게 가로와 세로 길이 사이즈실측이 필요해서 줄자가 꼭 있어야 하지만요즘에는 간편하고 정확한 레이저거리측정기레이저줄자자가 있지만 블라인드 사이즈를 실측할 때는레이저줄자 보다는일반 줄자가 필요해서 굳이레이저거리측정기를 구입하지 않았지만며칠 전 다녀온 곳은천정이 너무 많이 삐뚤어서 시간이 걸려도기울기를 꼼꼼하게 다 잡아 주고 설명을 드렸더니우리 집은 삐뚤어지지 않았다고 계속 말씀하셔서 다시 블라인드를 떼어내고 수평을맞추지 않고 설치하고 보여드리면서천장 좌우 높이가 맞지 않아서이렇게 된다고 말씀드렸더니 블라인드가잘못된 거 아니냐고 하셔서좌측과 우측 높이를 재서 서로 다른 높이숫자를 보여드렸더니 그래도 못 믿으시는지 계속 같은 말씀만 반복해서 하셔서 힘들었다고 하더라고요그래서 직접 눈으로 숫자를 확인할 수 있는레이저거리측정기를 하나씩 준비하기로 했답니다층고 높이 또는 전체적인 가로 사이즈를잴 때만 필요하기 때문에양방향 또는 여러 기능이 있는 건 말로간단한 사용방법을 찾다 보니가격도 저렴하고 후기가 좋은 스위스밀리리터를구입하게 되었어요    빠르게 쿠팡 배송으로 받은 박스에거리 면적 부피 등 작업 시 꼭 필요한 알찬 기능이 포함되어 있는고적혀있네요이제 좌측과 우측 층고 높이가 다른 곳직접 확인할 수 있도록 간편하게 레이저거리측정기로 해결할 수 있게 되었어요아파트 오피스텔 건물 등 어느 곳이나빗물이 고이지 않도록살짝 기울어지게 공사를 하기 때문에천장 높이는 좌우 맞는 곳이 없다고 하네요그래서 저도 받아보고저희 집 거실 좌 우 높이를 비교해보았더니 차이가 나더군요거실 블라인드나 커튼을 몇 번씩 교체를 해보았지만높이가 다를 줄 몰랐거든요    저희 사장님 또는 직원들이 설치를 할 때는 어떤 곳은 높이가  차이가나는 곳도 있다고 하더군요최대한 높이를 맞춰서 시공해야 사용하기 편리하기 때문에꼼꼼하게 마무리를 해드리고 있답니다길이 측정뿐만 아니라면적이나 부피도 계산해 주는완전 스마트줄자인 것 같아요뒤면에 배터리 개를 넣어주면 되는데요배터리는 별도 구입하셔서넣어주셔야 해요받아보고 궁금해서 바로 사용하고 싶었지만배터리가 없어서 집에  리모컨 건전지를 빼서사용해보았답니다     레이저거리측정기 기계가파손되지 않도록 파우치와 손목 스트랩까지있고요 설명서도 있어서읽어보고 다양하게 활용하면 좋을 것 같아요일단 자세히 읽어보고 기능성을알아야 하지만 급한 길이 측정하는것만 간편해서 사용해봤답니다사이즈가 정말 잘 맞을까 혹시 몰라서줄자로 다시 재어봤더니똑같았어요천장의 높이가 다른 좌측과 우측 사이즈를비교하여 직접 보여드리기위해서 직접 구입한 레이저거리측정기후기였어요    수  수 났담노 아기    수  수 났담노 아기    수  수 났담노 아기    ,3.412817480364151,5,0,1,27,175.4,1,6.229508196721312,-9.296899999999983,0.14634146341463414,0.31859756097560976,2.18,263,0,1
3,하그로프  수고측정기    구 하그로프  수고측정기는 숲과 필드에서  수고거리경사각 및 수평거리 측정시 가장 많이 사용되는 기기입니다 빽빽한 덤불을 포함한 울창한 곳에서도 정확한 측정치를 제공합니다      버텍스 초음파 기기 시스템은 대부분의 산림 지형과 조건에서 정확하고 신뢰할 수있는 측정 결과를 제공하는 진정한 작업 말입니다 이것은 또한 최고의  판매 악기와 정확한 높이에 대 한 전문 산림의 선호 거리 및 수평 거리 측정 제품 시트를 다운로드합니다   초음파 거리 측정  숲에서 큰 정확성과 입증 된 신뢰성  조밀한 식물에서 작동합니다  결과를 측정하기위한 가청 비프음 신호  배터리 소모가 적습니다  전 세계 사용자를 참조합니다   기능  블루투스 및  송신기 버텍스 는 끈과 알루미늄 안전 및 운송 케이스로 제공됩니다정점    패키지  세트 포함 정점  악기 트랜스 폰더  플롯 직원 및 어댑터 정점    패키지  세트 포함 정점  측정 기기 트랜스 폰더  버텍스  측정 기기도 사용할 수 있습니다  거    리입증된 초음파 측정 방법과 가시성이 높은 크로스 헤어 볼로 는 두꺼운 저성장에서도 정확한 거리 판독값을 제공합니다초음파 방법은 샘플 플롯 설문 조사에서 잘 작동하며 약   까지의 거리 울창한 숲에서 및 표적화에 어려움이있는 경우 초음파와 샘플 플롯  수    고정점 시스템을 통해 빠르고 정확한 점 측정 트랜스폰더를 높이에 고정하고 원하는 거리를 걷고 마지막으로 측정된 개의 높이가 디스플레이에 표시되어 있는 각 오브젝트의 높이를 원하는 만큼 측정합니다트랜스폰더를 조준하고 버튼을 누르고 물체까지의 거리를 읽습니다측정할 높이를 목표로 버튼을 누르고 정점 악기 디스플레이의 높이를 읽습니다  각    도지형의 경사를 측정하고 학위 졸업점 및 백분율로 제시하도록 합니다플롯 반지름샘플 플롯 인벤토리 작업에서 올바른 반지름 측정을 사용하는 것이 중요합니다 초음파 방법은이 응용 프로그램에 매우 적합합니다    기저 지역 요인일부 나무가 숲에서 다른 나무를 덮을 때 요인 게이지 또는 프리즘으로 작업하는 것은 어려울 수 있습니다 시력이 좋지 면 정확한 직경 측정을 방지할 수 있습니다 함수에 내장된 버텍스  사용하면 플롯에 포함될 나무의 최소 트리 직경을 추천할 수 있습니다  통    신 또는 블루투스와 통신합니다 값을  데이터 형식으로   또는   캘리퍼 또는 기타 핸드헬드 단위로 전송합니다 측정방법초음파발신기를 수목에 꽂아놓고 수신기의 버튼을 눌러 초음파를 수신하면 거리가 입력되고 수목의 꼭대기를 조준하여 측정하면 수고가 자동으로 계산되어 수치로 디스플레이에 표시됨  트랜스폰터     조선계측기        메 일      ,2.311672941272301,9,0,0,2,173.8,0,-4.026845637583892,-13.353499999999993,0.18386491557223264,0.50093808630394,2.72,368,0,0
4,골프 라운드를 할 때마다 생각하는 것이 있습니니다 어떻게 하면 더 좋은 스코어를 낼 수 있을까어떻게 하면 실수를 줄이고 좋은 임팩트를 가져올 수 있을까스코어 대한 많은 생각을 하게 됩니다  골프는 팀워크로 플레이를 하는 것이 아니라 혼자 플레이를 합니다 그리고 심리적으로 많은 작용을 일으키기도 하여 골프를 흔히들 멘탈 스포츠라고 합니다 그렇기 때문에 골프에 대한 명언이 많은 것도 사실입니다  골프 스코어에 멘탈도 많은 영향을 끼치게 됩니다   사실 골프 라운드를 하면서 심심한 내기를 하곤 합니다 가볍게 캐디피 내기 또는 라운드 끝나고 식사 내기 그런 이유에서인지 상대방의 플레이를 의식하게 되고동반자이지만 상대편으로 인식하고 방해를 하기도 합니다  이렇게 티를 꼽고 있는 상황에서 또 어드레스를 하면속삭임이 들리곤 하죠왼쪽으로 왼쪽으로멘탈이 무너지는 순간입니다   저는 스코어를 위해서 두 가지 제품을 꼭 챙기는 스타일입니다 바로 골프거리측정기와 멘탈플레스입니다 골프거리 측정기는 정확한 거리를 측정하고 정확한 샷을 위한 준비물이고멘탈플러스는 멘탈이 흔들리지 않기 하기 위함입니다   거리측정기는 골프라운드할때 필수인것 같아요골프스코어를 위해서 정확한 거리 측정은 필수입니다 물론 캐디가 불러주긴 하지만 매번 샷할때마다 캐디에게 의존하기 어렵고또 멀리 있을때 캐디가 정확한 거리를 확인해주는 것도 어렵기 때문에스스로 거리를 측정하는 것이 좋습니다 그리고 그만큼의 정확한 거리를 공략할 수 있는 실력도 중요하고요  멘탈플러스는 골프를 위해 출시한 골프플러스 제품의 두 번째 버전즉 업그레이드된 버전으로 골프 또는 일상생활에서 멘탈을 집중력을 높이고 멘탈을 강화하기 위해 만들어졌습니다 또한 편안한 숙면에도 좋은 제품입니다   골프 라운드를 하게 되면 중요한 퍼팅을 하게 될 때도 있기도중요한 티샷을 할 때도 있습니다 한타 한타가 소중합니다 그럴 때 집중력을 발휘할 수 있다면 실수로 이어지지 않고중요한 퍼팅을 성공할 수 있으며중요한 티샷을 잘 보낼 수 있습니다  멘탈플러스는 어떤 제품인가궁금하게 만듭니다스크린골프의 최강자 골프존의 고민과수면 디바이스 전문 기업 아모랩의 기술력으로 만들어진 제품입니다  멘탈플러스를 한마디로 정의한다면심리적으로 안정감에 도움을 주는 생체 전자공학 디바이스입니다   구성품을 보면 멘탈플러스 본품과 스트랩 충전 케이블 그리고 설명서와 보증서로 이루어져 있습니다실제 내용물을 보면 간단한 것처럼 실제 사용하는 것도 간단합니다 디바이스를 충전하고 스트랩에 체결하고 버튼만 누르면 됩니다   본품은 예전 세대 제품보다 훨씬 업그레이드되었습니다 세대 골프플러스란 제품으로 여러 골퍼들의 멘탈을 책임지었는데세대는 주얼리 느낌이 나도록 디자인이 개선되었습니다 그리고 무게도 으로 가볍습니다   스트랩만 체결하고 바로 뒤에 있는 전원 버튼을 누르면 바로 사용이 가능합니다 약 초간 누르면 전원이 들어오고 멘탈강화 모드로 작동하며한 번 더 누르게 되면 멘탈휴식 모드로 작동합니다 시간 착용을 권장하고 있어 시간 후면 자동으로 꺼지게 됩니다 물론 하루 종일 착용해도 됩니다   뒷면에 하단을 보면 충전 케이블을 연결할 수 있는 곳이 있습니다 이곳을 이용해 간단하게 디바이스를 미리 충전해 놓으세요처음 구매하고 바로 사용도 가능하지만 사용 전에 충전을 하는 것이 좋습니다   그리고 간단 사용 설명서와 같이 뒷면에 있는 버튼을 약 초간 누르면바로 작동이 됩니다 사용 방법 정말 간단합니다   이렇게 녹색 가 표시되고 멘탈강화 모드로 작동되고 있다는 것을 확인할 수 있습니다 뒤에 있는 버튼을 한번 더 누르면 파란색 가 작동하고 멘탈 휴식 모드로 변경됩니다  가벼운 무게에 스타일리시 한 제품으로평상시 착용해도 전혀 어색함이 없을 것 같습니다 하지만 저는 티셔츠 안쪽에 넣어서 착용하여 겉으로 보이지 않게 착용을 합니다   목걸이처럼 자연스럽게 착용만 하고 있으면심리적 안정과 숙면에 도움을 줄 수 있는 생체전자공학 디바이스멘탈 플러스입니다  멘탈강화 모드로 업무시간에 집중력을 발휘할 수 있고멘탈휴식 모드로 숙면을 취하고 싶을 때 사용하면 좋은 효과로 이어질 수 있습니다    스트랩 재질도 가벼운 스타일로 되어 있고디바이스와 연결 또한 쉽습니다 스트랩 연결 쉽게 하고 바로 착용하면 간단합니다  골프는 멘탈 스포츠란 말이 많이 있다고 위에서 언급하였는데저 또한 골프는 멘탈에 많은 영향을 받는다고 생각합니다 한번 샷이 무너지면 계속 무너지기도 하고집중력이 흐트러지게 되면 골프 라운드 전체가 엉망이 되기도 합니다   골프 라운드를 할 때 멘탈플러스를 착용하면샷에 대한 자신감이 생겨 좋은 것 같습니다 멘탈플러스는 골프 라운드 때 골프거리측정기와 함께 챙기는 준비물이 되었습니다   이라는 무게가 오랜 시간 착용하여도 전혀 불편함이 없게 합니다 골프 라운드 내내 착용하고 있었는데 착용하고 있다는 것 자체를 잊을 정도였습니다 라운드가 끝나고 알 정도였으니까요 가벼운 무게로 이질감이 전혀 느껴지지 않습니다   골프라운드를 할 때 가끔은 동반자가 실수하기 바라는 사람들이 있습니다 티샷을 할 때 갑자기 말을 시키거나 방향을 잡아주는 것도 멘탈을 흔들리게 하는 요소입니다 그리고 버디가 보기가 되는 것도 많이들 경험할 수 있습니다 퍼팅은 어느 골프샷보다도 집중력이 필요하기 때문에 조금이라도 흔들리면퍼팅수가 급격하게 늘어나기도 합니다    한 번의 실수로 전 라운드 골프를 망칠 수 있기 때문에골프라운드를 할때 심리적 안정 또한 중요합니다 실력만큼 중요한 멘탈을 이제는 멘탈플러스로 챙겨볼까 합니다  라운드 전에 항상 명상을 하는 골프선수도 있다고 합니다그런 것처럼 라운드 시작 전 멘탈플러스를 착용하면그런 비슷한 효과를 얻을 수 있을 것이라고 생각합니다   골프스코어를 높이는 골프준비물 두가지골프거리측정기와 멘탈플러스를 챙겨 즐거운 골프라운드가 되길 바랍니다    현재 와디즈 펀딩에서 펀딩으로 만나볼수 있습니다       ,3.9021513445428373,22,0,20,57,7105.2,1,-4.037267080745342,-75.6499,0.17696414950419528,0.35697940503432496,2.02,660,0,1
5, 디지털측정기 로 높이 두께까지 고정도로 측정하는 라이트매틱정밀 측정 아시아툴텍 에서 소개하는 디지털측정기  라이트 매틱     정확한 측정을 위해서는 여러 조건들이 필요하죠 측정압의 영향을 받기 쉬운 측정물의 두께 높이 측정에 최적화되어 있습니다 최소 표시량이 으로 고분해능과 의 넓은 측정 범위를 가지고 있으며 스핀들에 저팽창재 측정 테이블에 세라믹 사용으로 온도에 의한 변형이 적습니다  또한 녹이 슬 염려가 없어 환경적인 부분에 있어 유지 관리가 매우 수월하다고 할 수 있어요  석정반 타입의 분리형도 있는데 최근에는 해당 타입을 정말 많이들 찾으세요 고무 플라스틱 렌즈 필름 얇은 금속판 반도체 칩 반도체 웨이퍼 반도체 리드 프레임 주로 측정하며 다양한 파트에서 활용되는 만큼 기기를 고르실 때는 확실한 것을 고르시는 게 정답이라 생각합니다정밀 측정업체 아시아툴텍이 여러분들에게 약속드립니다  형식적인 견적만 내드리지 않습니다   측정이라는 작업 특성상 실제로 구동되는 환경도 매우 중요하기에저희는 문의가 온 지역의 영업담당자를 파견하여 모든 조건들을 면밀하게 파악한 뒤 장비를 직접 제안해드리고 있으며 당장의 회사 이익을 위해 수준 이상의 고가 장비를 우선으로 권해드리지 않습니다 문의하신 현 조건에 최적의 상품을 소개해드려요 장비 사용상 문제가 발생하지 않도록 끝까지 고객과 함께 합니다  장비 문제가 발생하지 않도록 꼼꼼하게 관리함과 동시에 문제 발생 시 신속하게 처리해드리고 있어요저희 회사를 이용하여 구매한 장비들은 특히 부품비 빼고 출장비를 받지 않고 있으니 빠르게 연락 주세요 저희가 확인해드리고 문제점을 찾아 해결해드리겠습니다 단순한 유통 판매는 그만  시험 기기 제품에 대해 유통 판매 이전 직접 설계 제작까지 하고 있습니다그에 맞게 장비에 대한 기본적인 스펙을 넘어 실사용에서 발생할 수 있는 여러 문제들도 잘 파악하고 있는데요지식과 노하우를 갖춘 전문가 그룹에 맞게 철저한 서비스 약속드립니다 시대 테크와 결합한 종합적 해결책 제공  담당자가 직접 방문하여 검교정 서비스를 안내제공하며 국내 메이커 이외 해외 메이커에 대한 수리 서비스 진행 및 정도 검사 강습 등 말이 아닌 행동으로 보여주는 서비스 약속드립니다 측정기 사용하는 브랜드는 이미 정해져 있으니아무 곳이나 문의해도 상관없을까 모델 고른다고 고민하는 시간이 얼마나 걸렸든 실제로 사용하고 운영하는 시간은 그 수십배가 될 겁니다 장비 고장 소프트웨어 연동 문제  등 자잘한 것부터 시작해서 큰 문제들까지트러블이 발생하였을 때 신속하게 해결하고 지속적인 관리가 가능한 업체를 고르는 것이 현명한 선택이 아닐런지요 회사의 도약을 위한 투자는 업체의 선택에서부터 이미 시작된 걸지도 모릅니다  디지털측정기  측정기  차원측정기  정밀측정  두께측정기  고정도측정   ,5.0689157554475,12,1,0,0,10.0,0,-3.64741641337386,1.5133000000000012,0.15746753246753248,0.4107142857142857,2.61,323,2,0
6,안녕하세요골드공인중개사 소장 류미란입니다 골드부동산은 공장 중개 전문 부동산으로 공장 평수를 자주 계산하게 되는데 공장 건물주께서 알고 계신 평수와 다른 경우들이 많습니다 건축물대장상 면적이 다른 경우 불법 증축하셨거나 가설 건축물로 신고받은 경우 등이 있는데 저는 줄자 대신 휴대용 레이저 측정 공구로 직접 거리와 면적을 측정해 봅니다얼마 전 고객께서 공장을 매입하셨어요 기계설비 설치로 길이를 재고 싶다고 하셔서 휴대용 세인 레이저로 공장의 층고 길이 면적을 재어 드렸습니다 공장 전문가 답다며 감탄을 하셨어요어찌나 탐을 내시기에 선물로 드렸답니다 가격은 만 원대이지만 기쁨은 만 원의 가치를 하는 듯 너무 좋아하셨어요   세인 레이저 측정기 구성품 중국  작은 건전지  작고 가벼워 휴대하기도 편해요 수평계 위 측면에 개나 있습니다 빨간 레이저 불빛 보이시죠  액정으로 야간에도 잘 보여요   레이져 거리 측정기 사용 전에는 줄자를 사용해서 공장 면적을 계산했었어요지금은 휴대하기도 편하고 가벼워 항상 들고 다닙니다두 포스팅 비교되셨죠측정기 길이  차이   이 제품의 장점은 간편 조작 버튼입니다너무 복잡한 건 딱 질색 면적 평수 계산예 가로   세로       평 평 전환시 직접 계산기로  곱해야함  원하는 위치에서 반사판 활용     세인 레이저 측정기은 까지 측정이 가능하지만 이렇게  공장의 길이까지 측정할 수 있습니다 빔  빔 사이 거리만 측정 후 개수를 곱해서 평수를 계산합니다  골드 부동산에서는 건물 내부 길이를 직접 측정합니다저장 기능도 있어 아무리 큰 공장도 모두 잴 수 있답니다레이저 거리 측정 기능  거리 측정거리 연속 측정 면적 측정 체적부피 측정 피타고라스 간접 측정 측정 구간 가감 기능 측정 단위 변경  자기 교정 기능 측정 기록 저장 백라이트 기능  액정 낙하 시 제품 보호 기능 전자제품은 비싸고 기능 많다고 좋은 것만은 아닙니다 만 원대로 휴대하기 편하고 오차 범위 내 지원해주는 것이면 일반인들에게 부담 없는 휴대용 측정공구입니다 전문가는 고가의 전문가용으로 구입하시기 바랍니다새매티    ,6.132383726634203,14,0,2,4,26.2,0,-1.6129032258064515,-2.683599999999992,0.15402298850574714,0.4735632183908046,3.07,268,0,2
