,Post,score,Image num,Video num,comment num,sympathy num,weekly view,AD,keyword score,tfidf score,josa,noun,noun/josa,paragraph num,gif num,sticker num
239,부모님을 모시게 된 상황이 되며 당분간은 고 사양의 측정 기기들은 필요치 않겠다 생각하여 정리하기도 하였지만파손이나 분실된 상황의 경우에도 굳이 바로바로 재구입할 필요성을 느끼지 못했던 다양한 측정 기기들이최근 들어서는 하나둘 다시 필요하다는 느낌이 들 때가 있더군요상위 기종으로 사용했던 클램프미터나 테스트기도 요즘 일반적인 버전의 히오키 가 많이 저렴해지니 눈에 들어오고무엇보다도 레이저 거리 측정기의 부재가 상당한 불편으로 다가오므로마음으로는 이번엔 를 염두에 두었으나 로도 만족스럽게 사용했었기에현실적인 면을 고려하여 이 기종으로 구입합니다 박스에 물건만 달랑 넣어 보내는 것보다는 안심 포장이네요반짝반짝한 신삥이리 개봉할 때의 느낌은 학교 다닐 때 새 교과서를 받아들고 기대감에 활짝 펼쳐볼 때의 느낌 정도 이중 실링 처리되어 신뢰감이 듭니다기본 구성품에 건전지도 있으니 바로 테스트 가능하고요전체 구성품은 파우치도 들어있는 모델이기에 이렇습니다뒤 배터리 커버를 열어 전지 두 개를 장착하면 사용 준비 끝이네요선명한 화면이 보기 좋네요최소 측정 거리 부터 까지 측정 가능하나실내용 모델임을 염두에 둬야 하네요한 화면에 필요한 정보가 일목요연하게 보입니다예전 벽돌폰 이후로 많이 콤팩트해진  폰 정도의 크기지요기본 파우치에 스판 기능은 있지만 많이 타이트해서 넣고 빼기가 불편합니다벨트 걸이도 일반적인 신사용 벨트에 맞는 사이즈라 넓은 벨트에는 좀 다행히 스트랩을 걸 수 있는 홈은 있으므로 스트랩을 별도로 준비하셔서 걸어두면 편리합니다파우치도 넉넉한 크기의 제품으로 따로 준비하면 좋겠지요직관적인 메뉴와 기능키로 구성되어 누구라도 사용에 어려움이 없을 것입니다디지털 수준기방울 레벨링 기능으로 수평 상태도 확인할 수 있고방울 레벨링 기능 상태에서 옆으로 기울이면 자동으로 경사계로 전환되어 경사 각도도 측정할 수 있기에사용이 대단히 편리합니다삼각대에 장착할 수 있는 홀도 있어 좋지만 홀 내부는 신주 등 금속으로 처리되었으면금상첨화였을 텐데 아쉽네요보쉬 레이저 거리 측정기 중  모델은 당연히 기본 기능인 거리 측정 및이 데이터를 기반으로 한 면적과 부피 산출 및 여러 편리한 기능도 뛰어나지만수평계와 경사계 및 블루투스 기능도 돋보이는 편리한 측정 기기이지요다시 이 모델을 선택한 이유도 제가 필요로 하는 주요 기능이 모두 내장되어 있기 때문이지만실외 거리 측정에는 한계가 여실하기에 상위 기종인 에 눈이 가는 것이지요하지만 이 도 비교적 짧은 거리의 실외 측정에 가끔 사용하니 그리 큰 불편함은 없고요적외선 포인트가 잘 표시되도록 타깃을 만들어 쓰면 조금은 보완되기에제가 쓰는 용도로는 큰 불편은 없습니다 알리 표 레이저 거리 측정기들보다는 가격은 다소 높지만가격 대비 만족도는 결코 뒤처지지 않는   입니다  ,3.476172659825099,18,0,6,10,609.6,1,-3.4375000000000004,-8.642399999999997,0.18865030674846625,0.37423312883435583,1.98,318,0,0
240,부쉬넬  구성품 부쉬넬 사용 설명서 부쉬넬  간지 대박 입니다 부쉬넬 모델중 최근에 나온    디쟌호불호가 갈리지만 난  부쉬넬      부쉬넬   크기가  보다 조금 크지만자력이있는  하우징에 외부온도 습도를 계산해오차율을 줄였고화각이 넓고 붉은색  를 사용해 목표물 촬영이좀더 유용해 졌으며부쉬넬의  기능 또한 타 브랜드의 레이저거리 측정기보다 배 빠른 레이저 반응 속도를보여 준다고 하네요   골프 국가대표 공식 거리측정기 전문브랜드로부쉬넬  레인지 파인더의기술력은 탑 인듯 해요 사용리뷰에는 여성분이 사용하기에는부쉬넬 레이저 측정기크기로 인해 무게감과 불편함이 있다고 하지만  지극히 갠적인 부분 아닐까 합니다  레인저파인더  그립감이 아주 안정적입니다 졸트기능진동기술거리 측정시 물체가 조준원 했을때  짧은 진동으로목표물에 정확히 감지해 주는 졸트기능이 탑재되어있어요 부쉬넬 파우치 좌측이 요즘 버젼 오른쪽 버전이 구 버전 이랍니다갠적으론 구버젼 파우치가 고급지네요 부쉬넬 아쉬운점이라면 파우치가 좀 허접함에살짜기 맘 상합니당      ,6.463645154743678,14,0,0,3,411.8,1,0.0,-5.551200000000003,0.14537444933920704,0.4845814977973568,3.33,117,0,1
241, 가정용미세먼지측정기 휴마아이  각 방마다 공기청정기가 열일하고 있는 우리집  이 공기청정기들이 열심히 일을 하고 있는지 의심도 되고무엇보다 새집이니 화학물질이 나오나그것도 걱정인데눈으로 정확하게 수치를 알 수 없으니 답답해요 저처럼 답답하신 분들 많으시죠 전 이번에 휴마아이 블랙 가정용 미세먼지 측정기 만나고 나서답답함이 싸악 사라졌습니다  예전 아리버  초창기 모델처럼 생겼어요  가로세로높이가 로 컴팩트한 사이즈라실내는 물론 실외에서도 부담없이 사용할 수 있는 크기입니다  고무 케이스와 충전기 스트랩 줄이 함께 들어 있어요  휴마아이 블랙은 충전식 리튬폴리머 배터리를 사용하고 있습니다 회 충전시 연속 사용 기준 분 사용 가능하고휴대용 보조배터리를 연결해 사용하면 더욱 오래 사용 할 수 있습니다 버튼 하나로 는 물론 옆으로 가기 기능이 있어사용 방법이 굉장히 편해요  전원버튼을 한 번씩 누를 때마다 통합표시모드 아이콘 모드  모드  모드모드 이산화탄소 모드 온습도 모드 통합표시모드 순서대로 나옵니다사용하지 않으면 분 뒤 자동  입니다 미세먼지의 경우  창에 수치와 함께 표정도 함께 나와서숫자를 잘 모르는 아이들도 바로 알 수 있어요미세먼지가 좋은지 나쁜지요 휴마아이 가정용 미세먼지 측정기만 있으면미세먼지는 물론 온습도까지 측정가능하니 출산선물  신생아선물 위해 준비하면 완전 센스 넘치겠죠   다른 모드의 수치는 알아야 할 것 같은데 이산화탄소 수치까지 알아야해  하고 궁금하시죠  사람이 산소를 마시고 이산화탄소를 뱉어낸다는 건 초등학교 과학시간에 배웠어요 이산화탄소 자체는 독성이 없지만 다량으로 존재하게 되면 사람의 호흡속도 증가 혼합 된 유해가스의 흡입을 증가 시키게 된다 해요이가 지속되면 인체에 좋지 않은 영향을 미치게 되겠죠  이산화탄소 수치 역시 숫자로 확인 할 수 있고좋음  보통  나쁨  아주나쁨으로 나눠져 있습니다 이산화탄소 수치를 낮추기 위해서 중요한 것은 환기이고수치가 나쁨  아주나쁨으로 뜨면 그 때가 바로 환기가 필요한 타이밍 이산화탄소 농도가 나쁨  아주나쁨이 되면 제품 표시창이 깜빡이면서사용자에게 위험 신호를 보내준다 하니사무실 차 안에서 장거리 운전 할 때 환기타임을 잡을 수 있어요 휴마아이 측정기의 핵심 부품인 레이저산란측정 센서로부터 흡입 및 측정 알고리즘을  국내 기술로 국내 공기질 사용 환경에 맞도록 자체 개발하였다 해요 기존 측정기들의 대부분이 중국산 측정센서를 탑재하거나 중국 제품을 수입생산하는 방식과는 완전히 다른 중국발 미세먼지와 황사에 대응하는 대한민국 제품 입니다  전원을 켜고 측면 구멍 뚫린 곳으로 손을 살짝 대보면 공기가 흡입되는 것이 느껴지고귀를 대보면 우웅하며 모터 돌아가는 소리도 나요 실시간 측정해 수치를 보여주기 때문에손에 쥔 상태에서는 물론 걸어다니면서사무실 집 안 차 안 등 다양한 곳에서 사용 가능합니다  아무리 미세먼지가 나빠도 하루에 한 번은 환기를 시켜야 한다고 하잖아요 특히 새집의 경우 벤젠 포름알데히드 등 새집증후군의 원인이 되는화학물질이 매우 걱정이 되거든요 환기를 시키지 않았을 경우 집안에서 발생하는화학물질이 사람에게 더 좋지 않다구요 그걸 휴마아이 블랙이 증명해주네요  약 시간 분 정도 환기를 시켜주었는데 수치가 확 떨어진 것을 알 수 있죠  이제 이사한지 년 지난 새집이라 늘  수치 걱정하는데이번에도 환기가 중요하다는 걸 다시 한 번 느꼈습니다  미세먼지 측정도 국내 기준과  기준 모두 확인 가능합니다 국내 미세먼지 권고 기준도가 강화되었긴 하지만 권고 기준에는 아직 미치지 못한다 해요 그래서 노약자 영유아가 있는 집에서는 국내 기준보다 모드 사용을 더 권장한다 합니다  요즘 외출할 때도 휴대하고 다니면서내가 다니는 카페 음식점 등등이 미세먼지가 어떤가와 이산화탄소 농도가 어떤가 측정하고 다닙니다  제가 살고 있는 곳이 신도시라 새건물이 정말 많거든요  도 단계로 상태를 확인 할 수 있습니다독일보건부의 기준으로 단계로 나눴으며좋음  보통  나쁨  아주나쁨 입니다 단위는  입니다 기상청이나 스마트폰 제공 수치는 기본적으로 지상에서 가 넘는 곳에서 측정하고국내 설치된 특정 측정소에서 제공하는 데이터를 제공한다 합니다 휴마아이는 내 코 앞의 미세먼지를 실시간으로 측정하는 것이니 기상청이나 스마트콘 제공 수치와 다르다 해서 걱정하지 않아도 됩니다오히려 내 근처의 미세먼지 수치를 측정해서 보여주니 더 정확하다 할 수 있겠어요     사무실미세먼지측정기 차안미세먼지측정기 휴마아이블랙 휘발성유기화학물               ,3.886967151107833,15,1,0,6,10667.4,0,-6.111111111111111,-81.35590000000006,0.16497975708502025,0.42206477732793524,2.56,499,0,0
242,  사실 이전에 알리익스프레스를 통해서 레이저 거리측정기를 구매한적이 있습니다현직에서 사용하던 레이저 측정기 입니다기존에 쓰던것과  비교한 사진도 보여드릴게요  자자개봉기 갑니다  샤오미 레이저거리 측정기 쿠팡 구매링크  레이저거리측정기  줄자  샤오미  중국제품  직구  건설현장필수품 사실 이전에 사용하던 제품이 있는데인간의 욕심은 끝이없고 같은 실수를 반복한다 작고 귀여운 레이저 거리측정기가 가지고 싶었습니다건설현장에서 항상 소지하고 다니는 펜 홀더 도면 줄자 등등 소지품들이 많은데 조금이나마 무게를 줄여보고자 구매하게 되었습니다   생각보다 너무 작아서 놀랬습니다 포장부터 이렇게 작다니   깃털그림은 가볍다는 뜻이겠지요    구성품은 단촐 본품 스트랩 충전케이블 설명서 충전 케이블은 마이크로핀을 사용하며 예전에 쓰던 구형 안드로이드폰 충전케이블과 동일합니다     설명서는 죄다 중국어라서 어떤말인지 잘 모르겠지만그냥 그림보고 느낌만 알아보겠습니다느낌 아니까   좌측에는 충전단자가 있습니다마이크로핀 예전 안드로이드폰 충전기랑 같은 케이블을 사용합니다   우측에는 버튼이 하나 있구여메뉴 버튼인거 같습니다    뒷면에는 뭐 딱히그냥 제품에 대한 정보가 나와있습니다배터리용량은    손가락과 사이즈 비교손이 그냥 평범한 남자손 사이즈 입니다거의 검지손가락이랑 비슷해보이죠   위 제품은  까지 측정이 가능합니다실제로는 해보질 않아서기회가 되면 해볼게요   기존에 있던 측정기랑 비교사진 입니다좌측꺼는  측정가능우측꺼는  측정가능 둘다 최대치를 찍어보질 않아서 확실한지 모르겠네요    같은 위치에서 거리측정을 해보았습니다오차범위는 소수점 번째에서 차이가 나네요이정도면 크기에 비해 성능이 좋다는거죠 샤오미 레이저거리 측정기 쿠팡 구매링크        ,4.390407300612804,17,0,0,5,386.2,1,-0.9389671361502347,-3.4476000000000084,0.16489361702127658,0.40691489361702127,2.47,156,0,5
243,안녕하세요 측정마스터입니다 헥사곤     차원 측정기를 판매 설치하게 되어 소개 드리려고 합니다  측정마스터를 통해서      차원 측정기를 구입하신 회사는 정밀 다이캐스팅 전문 회사로 헥사곤 차원 측정기를 대 보유하고 있으며 차원 측정기만 총 대를 운영 중이 회사입니다 측정 시간을 획기적으로 줄이면서 고정밀 측정이 가능한 장비가 필요하시게 되어  측정마스터의 전문적인 컨설팅으로 헥사곤     차원 측정기를 도입하게 되었습니다이번에 설치된 헥사곤     차원 측정기는 헥사곤 미국공장에서 생산된 차원 측정기로 자동 높이 조절이 가능한 컴퓨터 테이블이 포함되어 있습니다헥사곤의 모든 차원 측정기는 헥사곤의 전문적은 설치 교정 과정을 이수한 전문 엔지니어에 의해 고객님이 원하시는 장소에 안전하게 설치됩니다 설치가 완료되면 장비 무빙 및 프로브 테스트 후 측정실에 적응 할 수 있도록 에이징을 진행합니다이번에 입고된 헥사곤     차원 측정기는 고정밀 접촉식 스캐닝 프로브를 포함하고 있어서   및  에 근거한 정밀도 보정과 검사를 진행 했습니다헥사곤     차원 측정기에 적용된 프로브 시스템은 스위스 의 자동 도 인덱싱 프로브헤드인 와 독일 의 고정밀 스캐닝 프로브인 가 적용 되었습니다헥사곤     차원 측정기에는 이탈리아 에서 개발된 최신의  콘트롤러가 장착되어 있으며  콘트롤러는  이라는 고속 스캐닝 기술을 탑재하고 있으며     기술과 함께 고속 스캐닝시에 급격한 곡률 변화에 능동적으로 가감속을 할 수 있어서 정밀도를 유지하면서 측정 시간을 현저히 줄일 수 있는 첨단의 콘트롤러입니다헥사곤     차원 측정기를 운용하는 소프트웨어로는 차원 측정기를  활용할 수 있는  가 적용 되었으며 기존에 를 잘 사용하셨지만 고정밀 스캐닝 차원 측정기에 맞게 더욱 높은 수준으로 교육을 진행 했습니다 측정마스터가 공급하는 모든 차원 측정기는 장비 선정부터 프로브 센서 및 소프트웨어 구성 제품측정 프로세스 등 모든 측정 과정을  측정마스터에 의해 설계되어 납품 설치 및 교육이 이루어집니다의 모든 임직원은 고객님과의 소중한 인연을 이어갈 수 있도록 최선을 다하여 모실 것을 약속드리며 고객님의 한결같은 성원 부탁드립니다 고객님의 건승과 행운이 늘 함께 하시길 기원합니다 헥사곤 차원 측정기에 대한 문의사항 및 자세한 스펙은 측정마스터에게 언제든지 문의하시기 바랍니다 때  깜 열   는  너 ,5.383738351130713,36,1,0,0,5.0,1,-2.3166023166023164,1.019500000000001,0.1807465618860511,0.4302554027504912,2.38,313,0,8
244,약 년 정도 문제없이 사용하고 있던 에너톡이었는데 최근 들려온 소식에 의하면 사용자 귀속이 되어버렸다고 합니다기존에 사용하던 사람들은 계속 이용할 수 있지만 신규 등록이 불가능하고 다시 설정할 때 가 달라지면 등록이 불가능하다는 이야기인데 를 완전히 접는다면서 기존에 판매된 제품들의 상품 가치를 현저하게 훼손시킨 것에 대한 괘씸함이 가장 먼저 느낀 감정이었습니다이미 될 대로 되라고 사업을 접어버린 장치를 계속 붙들고 있다가 언젠가 서버를 확 닫아버려도 이상하지 않을 것이라 판단하고 깔끔하게 손절 후 다원 분전반 측정기로 변경하기로 했습니다현실적으로 사용자가 구매할 수 있는 몇 안 되는 전력 측정 장치라고 보면 될 것 같습니다  시하스 측정기는 아무리 두꺼비집 있는 곳에 설치하는 장치라고 해도 공업소 내음이 물씬디스플레이가 달려 있다는 장점이 있으나 굳이 두꺼비집 열어서 전력량 확인할  인이 있을까 싶습니다라는 강점을 가진 이젝스 에너지 미터도 있지만 따위는 하지 않고 구입하려면 전화해서 비싼 가격으로 구입해야 하는 부담 그리고 우리 집 분전반에는 남은 공간이 없어서 이런 형태는 설치가 불가능하기도 합니다에너톡과 비슷한 크기지만 높이가 조금 더 낮아 슬림 합니다 전면에는  주소가 적혀 있어서 모자이크를뒷면은  양면테이프가 있고 다른 구성품은 전원 케이블과  센서입니다에너톡의 후면 포트는 이렇게 되어 있는데  센서 포트가 동일합니다  센서는 에너톡 것을 그대로 사용할 수 있겠더군요 전원 포트는 모양이 달라서 호환되지 않습니다 어차피 작업할 거 완전히 교체하기로혹시나 싶어 꽂아보니 잘 되긴 하네요 센서는 방향성이 있습니다 전류가 흘러가는 방향으로 설치해야 합니다 반대로 설치하면 전력량이 로 나오겠죠낡은 분전반인데 나사 풀고 원래 전선 꽂혀있는 구멍에 추가로 제품의 전선을 넣고 다신 나사를 조여주면 되는 구조입니다요렇게 설치해 주면 됩니다이제 보니  센서 연결된 사진을 안찍었에너톡 사진으로 대체합니다 케이블을 본체에 연결해 주면 끝어차피 잘 열어보는 곳은 아니지만 바닥에 두는 것보다는 붙이는 게 좋을 것 같아서 양면테이프로 대충 붙여줍니다이제 장치 등록을 해야지요 맨 처음 전원에 연결되었다면 녹색 불이 깜빡이고 있을 겁니다  앱을 열고  버튼을 눌러 분전반 전력 측정기 이름 좀 멋지게 안되려나요 를 선택하고 시작 버튼을 눌러 등록 과정을 진행합니다 와이파이 연결 방식이므로 장치가 뿌리는  를 잡아서 세팅하고 우리 집 네트워크 정보로 변경하는 평이한 방식에너톡과 마찬가지로 한 달 정도 연결이 되어 있어야 요금을 체크해 볼 수 있는데 설정에서 정산일을 미리 넣어줍니다 나름 자체 앱으로도 알림을 받을 수 있는 옵션이 있네요이제 로 데려와야지요 디바이스 추가 옵션에서  를 선택하고 조금 이상하기는 하지만 스위치조광기로 들어가서  를 선택해서 앱 연동을 해줍니다연동 후에 타일에는 누적 전력 사용량이 기본으로 잡힙니다타일을 눌러 들어가면 누적 사용량과 전력 소비량이 나옵니다 예상 요금은 나오지 않습니다 아직 에너톡을 사용할  수 없는 상태가 아님에도 불구하고 미리 다원 분전반 전력 측정기로 갈아탄 이유는 어느 날 갑자기 에너톡 사용을 못 하게 될 수도 있다는 불안감도 있지만 최근  에너지에 대한 리서치가 진행되고 있다는 소식을 들어서 왠지  에너지에서 다원 분전반 전력 측정기를 활용할 수 있게 되지 않을까 하는 막연한 촉 때문이기도 합니다 어쩌면 헛손질일 수도 있겠지만 일단 갈아탔습니다  ,3.609798032844253,19,0,4,0,344.8,1,0.5405405405405406,5.478699999999998,0.16709183673469388,0.3227040816326531,1.93,427,0,0
