,Post,score,Image num,Video num,comment num,sympathy num,weekly view,AD,keyword score,tfidf score,josa,noun,noun/josa,paragraph num,gif num,sticker num
226,라즈베리파이가 몇달전에 나왔다 기능은 좋아지고 가격은 낮아졌다 미니 컴퓨터라고 하지만 사실 메이커로 이것저것 만들면 모를까 일반적으로 쓰기에는 한계가 있는 것같다 내가 하려는 프로젝트는 라즈베리파이를 가지고 일정시간마다 사진을 찍고 그 사진을 구글포토에 자동으로 저장하고 모아진 사진들을 가지고 뭔가 머신러닝이나 딥러닝 이런쪽으로 활용할 수 있게 자료를 수집하고자 한다  보통 세트를 사면 이것저것 들어있다   케이블을 개나 열결할 수 있어서 듀얼모니터를 사용 할 수 있다  내가 구입한 세트에는 팬과 방열판이 있었는데 팬이 생각보다 시끄럽고 온도가 빨리 뜨거워지는 것 같다 소음이 없는 팬을 쓰거나 냉각팬을 따로 달아야 할 것 같다     타입을 통해서 전원넣어줄 수 있어서 보조배터리로 작동가능하다  일반사용하는 컴퓨터처럼 빠르진 않지만 적당한 속도로 작업이 가능한 것 같다 주말프로젝트이기 때문에 주말에  를프로그래밍도구 한번 살펴봐야겠다   기본 제품외국 유튜브보면 이런 타워형식의 쿨링키트도 많이 쓰는 것 같다   파트너스 활동을 통해 일정액의 수수료를 제공받을 수 있음  ,4.29995276596726,12,1,0,7,1331.8,0,2.6548672566371683,-0.1580999999999999,0.18631178707224336,0.3688212927756654,1.98,125,0,0
227,우선 사과의 말씀을 드립니다 바로 직전 콘텐츠인 추억의 게임기 만들기  에서 게임 을 다운로드하는 법과 콘텐츠 배포 시 저작권에 이슈가 될 수 있는 내용이 담겨 일부 지적이 있었습니다 저작권자가 배포를 허용한  파일을 사용한다고 노력했는데 일부 문제가 있었던 모양입니다 급히 콘텐츠를 내렸습니다 저작권 문제 등을 다시 파악한 뒤 수정 업로드 하도록 하겠습니다 안녕하세요 권문송의 라즈베리 파이 먹기 시간이 돌아왔습니다 원래는 지난 주 추억의 게임기 만들기  편에 대한 질의 응답 내용여러분의 현답을 다루려고 했지만 여러분들의 댓글이 많지 않아 넘어가기로 했습니다 앞으로도 내용 주시면 추가 업데이트하도록 하겠습니다 많은 관심 부탁드립니다 오늘부터는 본격적으로 라즈베리 파이를 다뤄보려고 합니다 라즈베리 파이는 초소형 싱글보드 컴퓨터라고 합니다 즉 지금 사용하고 있는 나 노트북처럼 운용체계보통 마이크로소프트 윈도나 애플 맥를 설치해 컴퓨터처럼 사용할 수 있습니다 원래 컴퓨터 기능 대부분이 포함된 싱글 보드인데 컴퓨터 처럼 사용한다니 조금 어색하군요 앞서 게임을 즐기기 위한 레트로 파이는 정말 게임 만을 위한 이자 에뮬레이터였습니다 라즈베리 파이를 컴퓨터로 활용하거나 다양한 사물인터넷 기기로 구현하기에는 적합하지 않습니다 사실 라즈베리 파이는 독자적인 를 가지고 있습니다 바로 라즈비안입니다 라즈비안은 라즈베리와 데비안을 합친 말입니다 라즈베리는 알겠는데 데비안은 무엇일까요 데비안은 수많은 리눅스 배포판 중 하나입니다 즉 라즈비안은 리눅스 배포판 가운데 데비안에 기반을 둔 라즈베리 파이 전용 라고 보면 됩니다 오늘은 라즈비안을 라즈베리 파이에 설치하고 향후 프로젝트를 진행할 수 있도록 기본적인 설정까지 해보겠습니다  라즈비안을 설치하려면 우선 마이크로카드가 필요합니다 라즈베리 파이에서는 마이크로 카드가 가 있는 하드 드라이브 역할을 하죠 전에 레트로 파이를 설치했던 그 마이크로  카드입니다 이제 레트로 파이는 떠나보내야하니 과감하게 포맷해봅시다  전과 동일하게 로 포맷했습니다 깨끗하게 포맷한 마이크로 카드에 이제 부팅 가능한 를 깔아야하는데요 라즈베리 파이 홈페이지에 가면 정식 라즈비안을 내려 받을 수 있습니다   라즈베리 파이 홈페이지는 입니다 들어가보면 상단 세번째 메뉴에 다운로드가 있습니다 아래 최근 출시한 라즈베리파이  제품이 있군요 기회가 되면 다뤄보도록 하겠습니다 테크플러스에는 아직 없어요  라즈비안은  형태와 원 이미지 파일 형태로 다운로드할 수 있습니다 는 마이크로  카드에서 바로 부팅까지 가능하도록 만든 패키지입니다 앞서 레트로 파이를 설치할 때 부팅 디스크를 만들기 위해   라는 프로그램을 썼습니다 는 그럴 필요 없이 압축 파일을 풀어서 복사만 해주면 돼 훨씬 간단합니다  토렌트를 설치하지 않아 바로  파일로 내려받았습니다 옆에  라는 것이 있는데 이건 인터넷에 연결하지 않으면 라즈비안을 제대로 설치하기 어렵습니다 파일을 받아서 압축을 풀어 마이크로  카드에 복사해줍니다  가장 최상위 폴더를 열었을 때 처음 나오는 화면가 이라고 되어  있습니다 이건 잘못된 것입니다 최상위 폴더는 압축을 푼  원 파일들이 있어야 합니다  이렇게 돼야 정상입니다 이제 마이크로  카드 준비는 끝났습니다 잠깐 첨언하자면 라즈비안을 설치하고 라즈베리파이를 구동하기 위해서는 마이크로  카드  이상을 권장한다고 합니다  기본적인 준비물입니다 이건 필수적이라고 할 수 있겠네요 우선 화면을 봐야하기 떄문에 모니터가 있어야 합니다 모니터와 라즈베리 파이를 연결할  케이블과 키보드 마우스가 필요합니다 사진에는 전원 어댑터가 없는데 전에 사용했던 전원 어댑터를 그대로 사용했습니다  완성된 형태입니다 왼쪽 검은 케이블이 전원 흰색 케이블이  입니다 오른쪽에 키보드와 마우스를  포트에 연결했습니다 라즈베리 파이는 전원 케이블을 연결하며 바로 가동합니다  케이스처럼 전원 버튼이 없어서 좀 불편하군요 아무리 찾아봐도 전원 버튼 비스무리 한 것도 없습니다 이렇게 연결하면 끝입니다 사진은 이미 라즈비안을 설치한 뒤에 찍어서 모니터에 라즈비안 화면이 나오는 군요 상당히 헐 벗은 싱글보드 컴퓨터입니다 쿨링팬과 방열판이 내장된 케이스가 아직 도착하지 않았기 때문입니다 열심히 날아오고 있을텐데 혹시 배타고 오느라 늦은 걸까요 일단 기다려봐야겠습니다  전원을 켜면 나오는 첫 설치 화면입니다 모니터를 직접 촬영해 사진 품질이 떨어집니다 양해 부탁드립니다 설치와 와이파이 네트워크 항목이 있습니다 아래에 있는 언어한국어 키보드 레이아웃을 먼저 선택하고  네트워크 설정을 했습니다   네트워크를 선택하면 하단에 현재 라즈베리 파이가 잡고 있는 와이파이 목록이 자동으로 뜹니다 자신의 와이파이 네트워크를 클릭해 암호를 입력하면 쉽게 연결됩니다  와이파이에 연결하니 설치할 수 있는 목록이 더 늘어났습니다 가장 상단에 있는 라즈비안 전체 버전 을 설치했습니다  용량이 필요하군요 라즈비안을 설치하는데  이상 용량이 필요하니 참고해야 합니다  새 술은 새 부대에 담아야겠죠 이미 마이크로  카드를 포맷했기 때문에 걱정없습니다 싹 밀어버렸으니 깔끔하게 설치해보도록 하겠습니다  설치를 시작합니다 데비안 리눅스 기반이란 걸 설명해주고 있네요  운영체제 설치 완료 마우스 스크롤하는 초의 시간 밖에 걸리지 않았으면 좋겠지만 설치 완료까지 약 분 정도 걸렸던 거 같습니다 커피도 마시고 스마트폰으로 뉴스도 검색하고 화장실도 잠시 다녀오고 하면 좋습니다  웰컴 투더 라즈베리 파이 데스크톱 재부팅하면 이런 로고와 함께 라즈비안이 시작됩니다 오른쪽 상단에 번개 마크는 여전히 있네요댓글로 알려주셨는데 고질적인 전원 문제라고 합니다 빠른 시일 내로 해결해보도록 하겠습니다  라즈비안에 진입했습니다 처음에는 국가와 언어 설정을 합니다 이후 라즈비안 비밀 번호 설정과 네트워크 설정을 다시 합니다 영어로 되어 있지만 가 단순해 설정하는데 큰 어려움은 없습니다  이후 자동으로 소프트웨어 업데이트를 실시합니다 업데이트가 완료되는 시간은 한 시간을 넘기지 않았던 것 같습니다 그래도 상당히 오래 걸리더군요 간단하게 식사를 하고 오면 적당할 시간입니다  다시 한번 재부팅하면 드디어 설치가 완료됩니다 상단 왼쪽에 라즈베리 아이콘이 시작입니다 교육 오피스 인터넷 음악과 비디오 그래픽 설정 등 메뉴를 할 수 있습니다 라즈비안도 리눅스이기 때문에  윈도를 쓰는 사람에게는 익숙하지 않을 수 있습니다저도 그렇습니다 계속 모니터를 직접 찍은 사진입니다 라즈비안에서 캡쳐나 녹화하기 위해 프로그램을 찾아봤습니다 이란 프로그램이 있어 사용해봤는데 사용 방법을 잘 모르겠습니다 녹화를 제대로 한 것인지 녹화했다면 파일은 어디로 간 것인지좀 더 편한 프로그램을 찾아봐야겠습니다  라즈비안에서 터미널을 실행시킨 모습입니다 상단에 검은색 창 모양 아이콘입니다단축키는 입니다 이게 문제입니다 라즈비안이 리눅스다보니 기본적인 리눅스 지식이 없으면 쉽게 할 수 없을 것 같습니다 저도 라즈베리 파이와 병행해 리눅스를 공부해보려고 하는데 문송이다 보니 어렵네요  상단에 있는 화면은 리눅스 터미널입니다 리눅스에 명령을 하는 창인데  시절에 라는 명령어로 디렉토리를 옮겨다녔던 옛 기억이 잠시 떠오르는군요 리눅스에 대해서는 차차 알아가기로 하고 라즈비안을 운용할 수 있는 한글 입력 등 기본적인 설정까지만 해보겠습니다 우선 터미널에서   라고 쳐줍니다 여러가지 소프트웨어를 업데이트하는 명령어 입니다 이 후   라고 입력합니다중간에 설치할 것이냐를 묻는 에서는 를 눌러줍니다 이건 리눅스 설치하고 기본적으로 해줘야하는 명령인 듯합니다 라즈베리 파이 책이나 여러 블로그를 돌아다녀봐도 이건 필수더라고요   그 뒤 시작메뉴라즈베리 아이콘기본 설정  에 들어갑니다 시스템과 인터페이스 성능 지역언어 설정은 보통 여기서 제어 및 관리할 수 있습니다 기본적인 윈도 세팅과 같다고 보면 됩니다   에서 언어와 국가 등을 설정합니다  이후 한글입력기를 설치해야합니다 리눅스에서 한글을 입력할 수 있는 입력기는    등 여러가지가 있습니다 저는 와  등을 설치했다가 실패하고 에서 겨우 성공했습니다터미널에서     명령어로 를 설치하고 재부팅을 했습니다 추가 설정 없이 한영키로 바로 전환 가능했습니다  터미널에서 한글을 입력한 모습입니다 좀 더 손 볼 게 있겠지만 오늘은 여기까지 하겠습니다 라즈비안 설치로 처럼 쓸 수 있는 단계까지 입니다 앞으로 여기서 스크래치나 파이썬 등을 이용해  불 켜기 카메라 구현 등을 할 수 있다고 합니다 그럼 다음 이 시간에 뵙겠습니다 감사합니다  라즈베리 파이에서 을 제외하고 화면 캡처와 화면 영상 녹화를 할 수 있는 프로그램은 어떤 것이 있을까요 쉽고 편하고 빠르게 사용할 수 있는 프로그램을 추천해주세요  테크플러스 에디터 권동준  네이버 테크 구독하기 테크플러스 텔레그램 구독하기  ,4.985893886966552,28,0,7,45,46228.0,1,-10.699588477366255,-108.7964000000007,0.16621104428649536,0.37780207763805357,2.27,1002,0,0
228,드디어 라즈베리 파이   모델 를 구입했습니다 이제 물량이 슬슬 풀리기 시작하나 봅니다 직구를 하려고 했으나 국내 가격이랑 큰 차이가 없어서 국내서 주문했습니다 바로 사진 갑니다  역시나 저렴한 포장입니다 열받으니까 뭔가 감싸지 말고 전원이 인가된 상태에서 만지지 말라는 뜻이겠죠 전원 공급장치는 최소  를 사용해야 한다네요   보이십니까  마이크로  포트가 무려 개입니다 뭐랄까 기특하다고나 할까요  여하튼 그렇습니다 왼쪽 하단 방열판에 라즈베리 모양이 안 보이네요 조금 아쉽습니다  라즈베리 파이    단체샷입니다는 동생 집에 미디어 재생기로 입양 보냈습니다 가운데 모델 왼쪽 하단 방열판에는 라즈베리 모양이 있는데 에는 없습니다 지금 방 온도가 도인데 기기 온도는 도를 가리키고 있습니다 여전히 발열 문제가 있어 보이긴 합니다 물론 보통 도 언저리는 정상작동 온도로 괜찮다고 알려져 있는데 기분상 불편한 온도이긴 하죠 유튜브를 재생하면 도 가까이 올라갑니다 그래서 추가로 방열판을 주문했네요  지금 라즈베리 파이로 글을 작성하고 있는데 느린 느낌은 들지 않습니다 부팅은 윈도우 보다 훨씬 빠릅니다주변기기가 없으니 어쩌면 당연한 결과일지도 모르겠네요 웹 브라우저도 바로 뜨고 사용하기 별로 불편하지 않아 보이고요 부하가 걸리는 작업은 해보지 않았지만  인터넷 용으로는 확실히 쓸만하다고 말할 수 있을 것 같네요,3.0407950617128643,12,0,2,2,108.0,1,-9.554140127388536,-12.106399999999999,0.15862068965517243,0.31724137931034485,2.0,151,0,0
229,  모듈 알아보기 안녕하세요 아토플래닛과 함께하는 즐거운 시간이 돌아왔습니다오늘은   모듈을 사용해서 빨간빛 초록빛 파란빛을 내는 실습을 진행해 볼 텐데요오늘도 활기차게 알아보러 떠나볼까요오늘 사용하는   모듈은 가지 빛빨간색 초록색 파란색을 낼 수 있고가지 색깔을 조합해서 가지 빛뿐만 아니라 여러 가지 빛을 낼 수 있어요는 빛의 원색을 말하며 이 원색의 조합으로 여러 가지 색깔을 만들 수 있어서컴퓨터 모니터나 에 여러 색깔의 표현이 가능하게 만든답니다 참고로 컴퓨터는 숫자를 표현할 때  은 숫자는 의  승으로 표현하게 되는데의 단위는 화소이며 화소는 로 이루어져 있고 는 에요따라서 는 의 승인 의 값을 가지게 됩니다그래서 로 여러 색을 표현할 때   의 조합으로 표현할 수 있답니다 그렇다면 한 가지 예를 들어 볼까요위의 사진은 네이버에 색상 코드표를 검색하면 나오게 되는데요제가 선택한 색깔의  조합을 보면 는  는  는 으로 제가 선택한 색깔을 표현할 수 있습니다  모듈의 는  번에 연결 는 번에 연결 는 번에 연결 는 라즈베리파이의 와 연결해 주세요   는   에 연결된 핀번호를    변수에 저장하는 부분이에요          은   모듈에 연결된 핀에  신호를  로 출력하는 부분이에요      은  신호가 출력되는 핀에 초기 듀티비를 설정하는 부분이에요듀티비는 위의 그림처럼 전압을 조절해서 모터의 속도나 의 밝기를 조절할 수 있어요위의 그림처럼  반복문은 숫자를 증가시켜서  함수 안에 넣으면 넣은 숫자로 듀티비를 바꿔줄 수 있어요 는  반복문과는 반대로 지정한 숫자에서 거꾸로 숫자가 감소하는 반복문이에요             는 부터 까지 숫자를 하나씩 증가해 증가한 숫자로 듀티비를 변경해서 빨간 불이 천천히 켜지고           은  함수를 사용해 부터 까지 숫자가 내려가 빨긴 불이 천천히 꺼집니다 빨간 불 뿐만 아니라 밑에 있는 코드로 초록 불 파란 불도 똑같은 동작을 하게 만들었어요  오늘도 알찬 시간이 되었을까요다음 시간에는 더욱 알찬 시간으로 돌아오겠습니다 우리 다음에 만나요     ,4.987995410194071,7,1,0,1,715.2,1,7.352941176470589,2.6883999999999926,0.26406926406926406,0.35714285714285715,1.35,304,0,3
230,안녕하세요 외계인의  플래닛입니다 라즈베리파이 는 영국 잉글랜드의 라즈베리파이 재단이 학교 및 개발도상국에서 기초 컴퓨터 사이언스에 대한 교육을 증진시키고자 개발한 싱글 보드 컴퓨터입니다 라즈베리파이는 작은 크기에서도 준수한 성능에 저렴한 가격으로도 구매할 수 있는 초소형 컴퓨터라는 것이 특징입니다라즈베리파이는 년 월  클럭의 비트   쿼드코어 프로세서가 탑재된 라즈베리파이 모델를 공식 출시했습니다 라즈베리파이는 이전 라즈베리파이 모델 대비 배의 성능 개선을 이루었으며 메모리 용량은 더 커진    옵션을 제공하고 있기도 합니다 라즈베리파이 재단은 라즈베리파이에 대한    그래픽  적용에 대해 공식적으로 발표했습니다 많은 개발자 및 사용자들이 오랜 시간 요청했던 라즈베리파이에 대한  의 차세대 버전으로 알려진  에 대한 지원이 드디어 반영된 것입니다  는 오버헤드가 적은 크로스 플랫폼을 위한  그래픽 및 컴퓨팅 입니다 이는 게임 개발자 컨퍼런스 에서 크로노스 그룹에 의해 처음으로 소개되었죠  는 과 같이 게임이나 상호작용이 필요한 미디어 또는 고성능 작업이 요구되는 실시간  그래픽 애플리케이션을 모든 플랫폼에서  사용률을 낮출 수 있다는 장점이 있습니다 첫 번째 삼각형 이미지는  그래픽 전통 중 하나이죠 브로드컴에 도착했을 때는   버전을 보기에는 너무 늦었지만 제임스와 개리가 처음으로 완벽한 단일 삼각형  그래픽을 확인할 수 있었습니다 시뮬레이션에 사용된 드라이버는   버전입니다   도입으로 최신 그래픽 처리 유닛에 대한 지원을 더 잘 받아들이며 기존 의 일반적인 성능 병목 현상을 해결하도록 설계되어 그래픽 개발자들로부터 하드웨어에서 최상의 성능을 낼 수 있도록 새로운 방법을 제시할 것입니다 라즈베리파이 재단은 아직까지 라즈베리파이를 위한   개발은 아직 시작 단계일 뿐이며 년까지 기존  를 위한 커뮤니티의 노력이 있었지만 이갈리아의 로드맵으로 개발 중인 라즈베리파이를 위한  는 일반 사용자들이 예상하는 시기보다 조금 더 오래 걸릴 것으로 예상됩니다 라즈베리파이  라즈베리파이  벌칸    브로드컴  싱글보드컴퓨터 잠깐 다른 포스팅을 둘러보고 가시는 건 어떠세요,5.15800461361015,7,0,2,2,2092.8,0,-6.0728744939271255,-14.893200000000007,0.20518867924528303,0.4528301886792453,2.21,262,0,0
231,이제 라즈베리파이 재고가 어느정도 풀린듯 싶습니다 한달전만 해도    상태인 판매 사이트들이 많았는데 지금은 대부분 물량을 가지고 있습니다   모델부터는 램 용량이 기존  시리즈의  고정 용량이 아니라    로 선택할 수 있습니다 까지는 과한 것 같아서 로 선택해서 주문했습니다 아래는 개봉샷 입니다구성품은 심플합니다 라즈베리파이  본체와 간단한 설명서가 동봉되어 있습니다라즈베리파이 모델부터 구성에 상당부분 변화가 생겼습니다일단 는 비트  로 성능이 개선되었습니다 기존   는  램은  에서  더구나 램용량을 선택하는것이 가능합니다그리고 전원은 기존   핀에서  타입으로 변경되었으며 드디어   지원 포트가 추가되었습니다눈여겨 볼만한 부분이 비디오 출력이   듀얼로 구성되어 있습니다 일반적인 경우 라파에서 듀얼 모니터를 사용할 일이 없겠지만 가령  나 키오스크 단말기를 구성한다고 하면 매우 요긴한 기능이 될 것 같습니다 라즈베리파이   라즈베리파이   라즈베리파이   의 외관비교 입니다사실 파이 와 파이 는 포트위치가 동일하고 케이스도 호환됩니다파이 의 경우 파이와 사이즈는 동일한데   포트와 이더넷 포트 위치가 서로 바뀌어 있습니다 케이스 호환 안됩니다측면을 보면 명확하게 구분이 됩니다 파이 는 푸른색의   포트가 보이네요입출력 포트 비교샷 입니다위에 사진이 라즈베리파이 아래가 라즈베리파이  모델입니다일단 기존   모델과 외관 위주로 비교해 봤습니다라즈베리파이  케이스도 배송되고 있는데 주말에 케이스와 라즈비안 세팅해서 찬찬히 실제 성능도 한번 비교해 봐야겠습니다,3.0601663513619033,7,0,1,0,1434.6,0,-2.7027027027027026,-24.406299999999984,0.20189274447949526,0.4353312302839117,2.16,203,0,0
232,안녕하세요 어드밴텍입니다어드밴텍의 을 소개합니다  어드밴텍에서는 국내 최초 라즈베리파이 산업용 케이스를 출시했습니다 바로 인데요 이 제품은 강도 높은 외부환경에서도 안정적인 플랫폼을 운영할 수 있는 내외구성을 자랑합니다 또한  이미지가 탑재된 카드 와 를 지원하는 산업용 등급의  보드가 탑재되어 있습니다 무엇보다도 커스터마이징 서비스를 제공하여 다양한 애플리케이션에 적용 가능하다는 장점을 가지고 있습니다    의 특장점에 대해서 꼼꼼히 읽어보셨나요 아직 제품에 대해 더 궁금하실 분들을 위해 아래 제품의 실제 이미지와 소개 동영상을 가져왔습니다  산업용 라즈베리파이 에 많은 관심 부탁드립니다 제품에 대한 문의가 있으시다면 하단의 연락처로 문의해주세요    수           배아 노우 ,3.916731189320342,5,0,0,0,53.2,0,-3.5294117647058822,-6.792400000000002,0.19186046511627908,0.37790697674418605,1.97,82,0,3
