,Post,score,Image num,Video num,comment num,sympathy num,weekly view,AD,keyword score,tfidf score,josa,noun,noun/josa,paragraph num,gif num,sticker num
127, 안녕하세요 아빠별입니다  를 벗어나 천체사진촬영을 하기 위해  라즈베리 파이     를 중고로 싸게 샀습니다별하늘지기 츄하이님 땡큐요 라즈베리 파이 구입 기념으로 라즈베리 파이로 어떻게 천체사진 촬영이 가능한 건지 간단하게 소개해보겠습니다  라즈베리 파이는 초소형초저가 컴퓨터라고 보시면 됩니다   카드가 하드디스크라고 보면 되고    각각 개 인터넷을 위한  이더넷 포트 개  전원부    개 은 선택 브로드컴  쿼드코어      등 기본적으로 컴퓨터가 가지고 있어야 할 구성을 전부 가지고 있습니다 전원은  를 지원하는 를 지원하기 때문에 스마트폰 충전기라면 대부분 쓸 수 있습니다  라즈베리 파이는 컴퓨터이기 때문에 다양한 를 설치할 수 있습니다 리눅스뿐만 아니라 심지어 윈도우잘하믄도 설치할 수 있죠 여기에 키보드 모니터 연결하면 진짜 컴퓨터입니다 하지만 윈도우는 하지 마세요 고생직빵입니다 그리고 리눅스도 라즈베리 파이 전용라즈비안 으로 설치하는 것을 권장합니다 다음 글을 보면 조금 더 이해가 될 것 같습니다정말저는 여기에  리눅스 기반를 설치해서  처럼 사용할 생각입니다  를 쓸 때 진짜 좋은 점은  기반에서 무선으로 천체사진을 촬영할 수 있다는 점입니다 스마트폰에 앱을 설치하고 무선으로 연결해서 할 수 있고 와 기능이 매우 간략하고 편하게 만들어져 있습니다   면 적도의 제어 오토 가이드 카메라 촬영 필터 휠 동작 자동포커서등을 할 수 있습니다 이 모든 것을 하는데 전력 소비량도 적습니다 때문에 파워 뱅크도 훨씬 가벼운 걸로 가지고 다닐 수 있지요 노트북이 필요 없습니다 스마트폰이나 태블릿이면 만사 입니다 너무 좋죠 그런데  의 이 엄청난 편의성에는 함정이 하나가 있습니다 바로 자사에서 판매되는 제품들과 대표적인  카메라 정도만 호환이 된다는 점입니다  그래서 이런 말이 있죠  지옥 빠지면 헤어나오기 힘듭니다 너무 편해서   제품들이 많이 좋긴 합니다 하지만 같은 스펙에 다른 회사 제품도 좋은 게 많거든요 그런 것들을 사용 못 할 바엔 차라리 를 버리겠음 그럴 순 없고   그리고  의 또 하나의 문제는 장비 대만 운영이 가능합니다 이게 초보자에게는 너무 좋지만 저처럼 대 이상 운영하고 싶다던가 적도의 한 대에 여러 대의 망원경을 올려서 디더링 문제없이 촬영하고 싶다면  로는 불가능합니다물론 이점은 라즈베리 파이로 해도 힘들죠 되나 그건 좀 연구해보겠습니다 누가 알려주시면 더 좋아요 적도의 대 망원경 대가 기준이기에 장비가 늘어나면 도 더 필요한 것이지요  제품들이 타사에 비해서 좀 비싼 편이라 고민되는 부분입니다여러분 다 부자시니 그래봤자인가요 전 가난해서 아껴야 잘 살죠  의 하드웨어는 사실은 라즈베리 파이입니다 거기의 전원분배 장치가 붙어있습니다 그래서 엄청 편하게 쓸 수 있죠 위 사진을 보시면 도 라즈베리 파이입니다 제가 산 것과 완전히 동일한 모델이죠 다만 메모리 용량만 차이가 있어요 제가 산 건 인데 천체사진용으로 쓰기에는 좀 오버 스펙이긴 합니다   가 공식 홈페이지에서  월 기준입니다 사실 라즈베리 파이로 구성하면 거의  가격으로 훨씬 싸게 만들 수 있지만  가 워낙 간편하고 쉽게 잘 만들어져 있기 때문에 처음 입문하시는 분들이라면 저는 적극   로 시작하시라고 추천합니다  초보자가 노트북 기반이나 라즈베리 파이 기반으로 가시면 너무 고생스럽습니다 물론 좋은 선배가 주변에 있다면 말리지 않습니다  제가 산 라즈베리 파이에는 이렇게 플라스틱 케이스로 무장되어 있습니다 발열판과 발열 팬도 기본 장착되어 있고요  게다가 망원경에 딱 달 수 있도록 이미 작업이 되어 있었습니다 귀찮은 작업 하나 덜었네요  역시 중고가 최고죠   그리고 선배님들이 조언해 주시길 알루미늄 케이스는 쓰지 말래요  통신에 장애가 있나 봅니다 그렇지 않아도  단점이 갑자기 생각나는데  송수신 거리가 너무 짧아서 결국 리피터를 구입해서 쓰고 있습니다 알루미늄 케이스 써서 그런거 아닐까요 그래도 리피터는 필요할지도  라즈베리 파이에는 따로  전원분배 장치가 없으므로 전원분배 장치를 구입했습니다 이미 천체사진 촬영하시는 분들에게 좋은 평가를 받은 제품입니다 무려 개 채널을 지원하고요 가격은 정말 착하죠  총 부하전류는 최대  이고 단일 전류는   잭 규격  외경   내경 입니다  전원분배기는 구입은 여기서 했어요그리고 더불어 도 필요합니다 음그래도 라즈베리 파이에 어떻게  를 인가할지 잘 모르겠네요  조금 더 연구해보겠습니다 일단 저는 라즈베리 파이에 를 설치할 생각입니다 이걸 설치하면 하나의 서버로 동작해서  처럼 무선으로 쓸 수 있습니다 그런데  와 조금 다른 것은 특별히 앱은 필요 없고 웹페이지로도 접근해 작업할 수 있는 것이지요 아니면 노트북에서  등을 설치해서 원격으로 제어해도 됩니다  만으로도 정말 많은 일을 할 수 있습니다 일일이 설치하는 수고가 없는 셈이지요  간단한 설치 소개는 아랫글을 참고하면 될 것 같습니다   국내에는 남수각 님이 만드신 라즈베리 파이용  이미지도 있습니다 영어 울렁증이 계신 분들은 남수각 님 것을 쓰는 것도 괜찮을 것 같습니다 저는 둘 다 써볼 생각입니다  이렇게 설치하고 나서 카메라 제어 필터 휠 제어 자동 포커스 오토 가이드 극축 정렬 등등  를 다루면서 경험했던 것을 똑같이 해보면 실습할 할 생각입니다 이걸로 첫 천체사진을 촬영하는 날이 속히 오길 바랍니다   열심히 공부해야죠 이런 문서 보면서요썅 다 영어야 응원해 주세요    ,1.5867918651172856,11,0,1,5,36.6,0,-6.36042402826855,-43.90600000000006,0.15968586387434555,0.33595113438045376,2.1,720,0,0
128,보안프로젝트   에서 제공하는  강의입니다 이번에 신규로 제작되고 있는  강의 시리즈 중 첫 번째   라즈베리 파이  파이썬 프로그램을 이용한 센서 제어 첫번째   를 배우자 입니다 보안프로젝트 권승민 전임강사가 진행을 하게 됩니다  기본 강의 후에 실습과 함께 진행되는 심화 과정은 후에 유료 강의로 만날 수 있습니다 온라인 강의                       ,6.29,9,0,2,2,564.8,0,-7.6923076923076925,-1.0430000000000006,0.16,0.5066666666666667,3.17,52,0,0
129,필자는 주 컴퓨터를 완전히 맥북으로 이전했다  에서는 를 썼었는데 맥에서는 직접  명령으로 접속하거나 를 쓰면 된다 도 터미널이지만 프로필 저장 기능이 있다  맥북을 쓰면 마우스 스크롤 등에서 문제가 발생한다 주 컴퓨터로 쓸 경우 포트에 덕지덕지 뭔가 연결되어있기 때문에 마우스가 필요하다 이때 시스템 환경 설정을 들어가면 설정할 수 있는 기능이 많이 없다 그런데 써드 파티 프로그램들은 다양한 기능들을 제공한다 이게 어떻게 가능한 걸까 일단 매커니즘을 보면 터미널에서 관련 기능들을 설정할 수 있게 되어있다 윈도우즈의 레지스트리하고 비슷한 느낌인데 터미널에서 라는 커맨드가 있어서 특정 서비스나 프로그램의 옵션에 대해  또는 를 할 수 있다예를 들어 위와 같이 하면 맥북 에서 숨겨진 파일을 표시한다다음과 같이 하면 마우스 스크롤 관성에 대한 설정을 끌 수 있다 그런데 이렇게 했는데도 여전히 마우스에는 이상이 있다 또한 맥 에는 윈도우즈 탐색기처럼 다른 폴더가 뜨지 않는데 이것도 표시하는 터미널 명령이 있어 보인다  맥북에서 반디집은 유료이다 대체적으로 쓸만한 프로그램들은 유료이다 구매하는 것도 나쁘지 않다 맥북의 경우 가 업데이트 되면 기존에 쓰고 있는 프로그램에 문제가 생기기 때문에 지원을 바로 받을 수 있게 아예 유료 구매를 하는 것도 나쁘지 않다 다만 왠만한 압축 파일은 그냥 클릭하거나 터미널에서 풀 수 있어서 필요성은 아직 느끼지 못했다 분 앞으로 가기 초 뒤로 가기앞으로 가기 등이 담긴 무료 플레이어는 아직 찾지 못했다  미디어 플레이어를 쓰고 있는데 팟플레이어처럼 편한 플레이어는 찾지 못해서 동영상을 그리 많이 보고 있는 상황은 아니다 동영상 녹화의 경우 윈도우즈도 마찬가지지만 기본적으로 지원한다 원래 에선  관리 툴로 을 쓰고 있었지만 맥 에서는  를 쓰고 있다라즈베리파이에서 하루에 만 천건 이상의 데이터를  서버를 이용하여  로 보내고 있는데  시간 이상 돌아가면 멈추는 문제가 있었다  이 문제의 원인은 발열 때문이 아니라 시리얼 포트를 어느 순간 읽지 못해서 생기는 문제였다 즉      케이블 때문이었는데 케이블을 교체하니 문제가 사라졌다  또한 소켓 클라이언트에서 네트워크 재연결 관련 로직도 추가하니 현재 일간 문제 없이 동작하고 있다,3.1683712744594597,0,0,0,1,236.4,0,4.273504273504273,-2.220400000000004,0.20362903225806453,0.3245967741935484,1.59,291,0,0
130,라즈베리파이   모델을 구매했다 라즈베리파이를 선주문했던 유저들이 발열이 심하다고 하여 아래 그림과 같은 쿨러를 포함해 구매를 했으며 카드와 전원 어탭터 등을 포함해 원 정도 들었다 만원짜리 라고 생각하면 저렴하다고 감탄하는 사람들이 있는데 성능 대비하면 절대 저렴하지 않다는 점을 명심했으면 좋겠다  아래 그림의 쿨러는 알리에서 많이 판매하고 있으며 국내에서는 메카솔루션이라는 업체에서 나름 합리적인 가격에 판매하고 있다   구매는 개월 전에 했는데 라즈베리파이 용    버전을 올려 보려고 삽질하는데 보름이나 소모했지만 실패했다 화면 출력이 되어야 뭐라고 해 볼텐데 화면에 아무것도 나오지 않으니 라즈베리파이는 처음 출시된 모델부터 까지 다 소유하고 있어    버전을 라즈베리파이 에도 설치를 해 봤다 일단 에러도 많이 발생하고 무엇보다 사용하기 어려울 정도로 느리기 때문에 그냥 해 본 것으로 만족하기로 했다  라즈베리파이 용   이미지가 나오면 성능은 아톰 가 들어간 스틱  정도는 될 것으로 보인다  사에서 출시한  프로그래밍을 위한   인   보다는 확실히  성능이 앞서는 것으로 보인다  아래 사진의 가  이다 제품 종이 박스를 거치대로 사용하도록 되어 있는데 고무줄은 굴러다니지 말라고 둘러 놯다  아무튼 제일 처음 그림에 있는 쿨러는 케이스 역할도 겸하고 있고 타워쿨러에 비해 라즈베리파이 본연의 폼팩터를 유지할 수 있어 장점이 있다 문제는 냉각 성능일텐데 워낙 방열 면적이 넓어 그런지 성능도 괜찮다 펜을 돌리나 돌리지 않으나 온도 차이는 거의 없는 것으로 봐서 방열판에 의한 쿨링 효과가 더 높은 것을 짐작된다 상기 쿨러를 장착하고 아이들시 온도가 도 정도를 보이기에         로 오버클럭을 했으며 오버클럭 후 아이들 상태의 온도는 도 정도로 양호하다 라즈베리파이  정상 클럭 대비 를 오버한 것인데 에서는 상당한 성능 향상이 느껴진다 방열판을 만져본 결과 와 밀착되는 방열판 상판보다 하판의 온도가 더 높은 것으로 느껴졌는데 아무래도 하판은 공기 흐름이 원활하지 않기 때문에 방열 성능이 떨어지는 것으로 짐작되어 공중부양시켰다 공중 부양에 사용한 부품은 컴퓨터 케이스에 들어가는 하드디스크 가이드인데 빵끈으로 묶어서 가이드가 벌어지지 않도록 하고 중간에 라즈베리파이를 넣어서 공중부양했다 그리고 포맥스에 부착했다  라즈베리파이는 워낙 작고 가벼워 뻣뻣한  케이블   케이블 키보드 케이블 등에 휘둘리며 자기 자리를 고수하지 못하며 의외로 책상을 지저분하게 만들기도 한다 그래서 종이박스 안에 넣었다  케이스 쿨링은  전원을 공급받는 사용치 않는 노트북 쿨러에서 적출해서 달았다 펜 속도 조절도 가능하다 스피커는 헌혈하고 받은 것인데 마땅히 사용할 곳이 없어 굴러다니고 있던 것을 활용했다 케이스 쿨러의 영향인지 오버한  상태에서 아이들시 도 정도를 유지하고 있다  는   이고 은  으로 설치했다 라즈베리파이 공식 인 은 왠지 허접해 보여서  아무튼  파일을 수정해 가 아닌 오디오잭으로 소리가 출력되도록 했고 변태 해상도  를 수정해    정상 해상도로 출력되도록 했다 지금까지 사용해 본 로는 아래와 같은 것들이 있다 라즈베리파이 전 모델        하드웨어 자체는 국내 이란 업체에서 만든 가 가장 앞서는 것으로 생각된다 물론 위 제품들이 모두 비슷한 시기에 출시된 것이 아니라 당시의 시장 상황에서는 최신이었던 것이 지금 시점에서는 그저 그런 성능으로 격하된 감이 없지 않지만 가성비를 따져도 결코 라즈베리파이에 비해 떨어지지 않는다 에서 가장 최근에 출시한 제품이 이고 메모리 에 코어 가 들어가 하드웨어는 라즈베리파이 보다 우수한데 에  메모리와 케이스가 포함되어 있다 우수한 하드웨어 성능에도 불구하고 의 가장 큰 단점은 부족한 커뮤니티이다 라즈베리파이처럼 전세계 많은 유저를 확보하지 못 했기 때문에 소프트웨어의 지원이 아쉽다   는 목적이 를 활용해 나 컴퓨터비전 용도로 출시한 것이라 라즈베리파이에 비해서는 범용성이 떨어지는 보드이고 가격도 배 가량 비싸 비교 대상은 아닌 듯 싶다 이번 라즈베리파이 를 이용해  를 구축했다 으로 개발된  프로그램을 과 해서 구동시킬 계획이다 주일정도 계속 켜두고 있는데 잘 버티고 있다  메모리가 로 늘어난 것이 성능 향상에 큰 영향을 미친 것으로 판단되며 여러 목적으로 편하게 활용하기에는 라즈베리파이 만큼 좋은 가 없다고 생각된다 ,1.9292740388813385,6,0,1,13,15.0,0,0.0,-8.126499999999998,0.20166320166320167,0.369022869022869,1.83,564,0,0
131,라즈베리파이 카메라 연결 전원 끄기카메라 단자 열기파란색 부분이  포트등이 있는 방향으로 연결하고 카메라 단자 닫기     설정 메뉴  기본설정           선택메뉴  기본설정         선택라즈비안 업데이트 및 재시작   라즈베리파이 카메라 테스트 사진 촬영     영상 촬영            영상 확인       모듈 사용하기 카메라 모듈 설치 명령 이미 설치되어있을 수 있음     영상 촬영사진 찍기 ,2.5847737837234273,1,0,0,2,8.0,1,14.285714285714285,1.6661999999999952,0.04054054054054054,0.6756756756756757,16.67,92,0,0
132,본문은 위 글을 이용해 설치를 진행하겠습니다 총 진행시간은 라즈베리 파이  기준으로 시간시간정도입니다    소개  을    비트 운영체제에 설치하는 과정입니다 라즈베리 파이  또는 에서도 작동합니다 물론 라즈베이 파이 제로에서도 가능합니다  운영체제라즈베리파이 의 카드로는 의  읽기 쓰기속도를 가진 제품이 좋습니다 라즈베리 파이의 운영체제 설치는 아래 글을 참조해주세요   라즈베이 파이의  버전은 발열량과 관계가 있습니다 업데이트이전에는 코어 온도가 도까지 올라가지만 업데이트 이후엔 도까지 떨어집니다 의 온도는 라즈베리파이의 수명에 악영향을 끼칠 수 있습니다이 방법은 라즈베리 파이 에서만 사용가능합니다추가로라즈베리파이에 를 사용해 를 설치하는 방법은 좋지 않습니다 로 코딩이 불가능하며 누락된 종속성 패키지로 인해 사용이 어렵습니다     또한 문제가 있습니다 에서 인식되지 않으며 이렇게 설치한 는 으로 너무 옛 버전이 설치됩니다   버전확인 명령을 통해 버전을 확인할 수 있습니다  이 나오면 비트 운영체제입니다 만약 라면 비트 운영체제입니다 비트 운영체제의 설치방법은 다음 링크를 확인해주세요   종속성 라이브러리 는 다른 라이브러리를 사용합니다 설치하기 전에 일부 라이브러리를 설치해야합니다한줄씩 터미널에 입력합니다 모든 패키지를 설치해야합니다    다운로드 현재 까지 출시되었습니다 사용목적에 맞게 버전을 다운로드하면 됩니다 앞에 버전을 바꿔 원하는 버전을 받을 수 있습니다다운로드 후 디렉토리 이름을 변경합니다   가상환경에  라이브러리 버전을 유지하기 위해서 가상환경을 설치할 필요가 있습니다 전체 파이썬에서 한 버전의 만을 사용한다면 번을 참고해주시면 됩니다이어서 가상환경 소프트웨어를 설치합니다마지막으로 파일을 다시 활성화합니다 명령으로 를 설치할 가상환경을 설정합니다가상환경이 정상적으로 만들어지면 앞에 만든 가상환경의 이름이 이름으로 나옵니다 에 필요한  종속성 라이브러리는 가 있습니다 가상환경에 를 설치합니다  에  설치  라이브러리는 의존성 패키지에  가 있습니다 에 를 설치해야 가 에 를 정상적으로 컴파일 할 수 있습니다   설치 시 시간이 너무 오래걸려 제대로 안되는 것 처럼 보일 수 있습니다 이럴 때는 로 취소를 한 뒤 다음 명령을 사용하면 진행상황을 볼 수 있습니다     빌드 만들기 라이브러리 빌드 전 빌드파일을 위한 디렉토리를 만들어야 합니다이제 아래 내용을 그대로 복붙하면 빌드가 진행됩니다 만약  라이브러리 때문에 오류가 생긴다면 만들었던 빌드 폴더를 전부 삭제한 뒤 처음부터 다시 진행해야합니다 라즈베리 파이  용과  용이 다릅니다 라즈베리 파이  용정상적으로 진행이 된다면 보고서가 만들어집니다 여기에는 가 설치된 해당 환경  그래픽 가속 설치 여부 등을 확인할 수 있습니다 꼼꼼히 읽어보아야합니다   라즈베리파이 용   빨간색으로 표시된 부분을 확인해보고  의 가상환경을 제대로 지정하지 않았거나 를 설치하지 않았다면 으로 보일 수 있습니다 이런 경우에는 에서 불러오기가 어렵습니다 이어서 실제 빌드를 진행하기 전에 메모리  공간을 늘려야 합니다 빌드가 끝난 뒤에는 다시 줄이겠습니다을 로 수정한 뒤   를 순서대로 눌러 저장 후 닫기를 합니다 새 공간을 활성화하기 위해 공간을 중지 후 재시작해야합니다    만들기 라즈베리 파이 에서 전체 라이브러리를 빌드하는데 걸리는 시간은 대략 시간 반정도입니다 라즈베리 파이 는 시간 이상 는 시간 이상이 걸립니다 제로는 시간 이상이 필요합니다 가끔씩  에서 문제가 생길 수 있는데 이럴 때는 처음부터 다시 한 뒤  으로 다시 빌드하면 됩니다 뒤의 숫자는 사용 코어의 개수입니다 사용하는 라즈베리 파이의 코어 개수만큼 숫자를 조절하면 됩니다위와 같이 빌드가 시작됩니다 한시간정도 걸리고 그동안 가끔 경고문이 뜨긴 하지만 보통은 문제가 없이 될겁니다 이제 만든 패키지를 시스템 데이터베이스에 설치해야합니다  빌드가 끝났으면 이제 스왑 파일을 다시 줄이겠습니다 다운로드받았던 파일들도 정리하겠습니다 위에서 가상환경에 를 설치했으므로 라이브러리를 인식하기 위해 심볼릭 링크를 만들어야 합니다 이 링크가 없으면  을 호출하고 를 불러오면 패키지가 없다는 경고가 뜹니다   확인하기에서 설치를 확인해야합니다 저 위쪽에서 저는   를 사용하겠다 했는데   에서는 가상환경을 자동으로 인식합니다이라는 가상환경  에 설치를 했으니 이를 이용해 를 불러들이겠습니다 가상환경 상에서  라이브러리가 정상적으로 불러들여집니다만약 비주얼 스튜디오 코드의 터미널에 가상환경 실행이 안되어있다면 터미널을 닫은 뒤 위쪽의 터미널메뉴에서 새 터미널을 실행하면 됩니다     빌드 정보 빌드에 어떤 모듈이 포함되었는지 확인하고 싶다면 다음 명령을 사용하면 됩니다                                                                                                                                                                                                                                                                                                   난내소투텔시크르레르내                               그   가타리 애 수수 료 레미제호니고수티이           태  트리   따  대 벨이디애토대            게    나타버  열 도내 장새에이쓰세오오오드소        써                      멀리 가시 에께그시오            매          써                  트  대                                                                                                                                                                                                                                          ,1.3774725185317607,8,0,1,2,224.4,0,-11.785714285714285,-81.80100000000002,0.2112950340798442,0.4021421616358325,1.9,551,0,0
133,라즈베리파이를를 알게 된건 망할놈의  때문입니다 유선인터넷 포트는 있는데 무선이 없는 반쪽짜리 이기 때문입니다 랜선을 깔기엔 지저분해서 도저히 못 깔겠더군요 생각의 흐름을 정리하자면    발열충전문제 탈락   어플  미러링 지원안함 탈락 구글 크롬캐스터  오직  원래 목적이 맞으나 라베를 알아버려서 탈락 라즈베리파이 구매목적   무선로 활용하여 의 유선과 연결와  무선동굴 동영상 시청 인터넷을 통해 라이브 방송 청취  전원 원격제어 필요물품 라즈베리파이향후  를 위해 가격이 싼 보단 를 구매하였습니다  이상의 전원 케이스    케이블  아닙니다 케이스 아마도 전기쪽 분들이면 쉽게 닥트나 모렉스핀과 커넥터를 구할테지만 상황이 여의치 않다면작은 팬이라도 달려 있는 제품을 구매하세요생각보다 열이 많이 난다고 합니다,5.656089965397924,3,0,2,2,118.0,0,2.1052631578947367,-1.1782000000000004,0.15204678362573099,0.40350877192982454,2.65,101,0,0
134,지난번에 라즈베리파이 에 안드로이드 을 포팅 하는 프로젝트가 있어서 그대로 빌드 하여 라즈베리파이 에 올려봤다 우분투  에서 빌드 하였고 특별히 큰 문제 없이 빌드를 할 수 있었다 사소한 패키지들 설치 에러는 뭐 일반적이니 패스 아 라즈베리파이에 이미지를 넣을 때 특이한 점이 하나 있었다빌드를 완료하면 생성되는 파일들 중 를 라즈베리파이에 사용할 카드에 복사한 후 라즈베리 파이에 삽입한 다음  모니터까지 연결 후 라즈베리파이 전원 쪽 를 에 연결해야 했다 모니터가 연결되어 있지 않으면 로 업로드 중 더 이상 진행이 안되는 문제가 발생하였다 아무튼 업로드 스크립트도 잘 짜놔서 명령어 하나로 어렵지 않게 안드로이드 이미지를 넣을 수 있었다전원을 넣고 좀 기다리니 안드로이드 로고가 빡 크크크크 이때 가진 나쁘지 않았다한참을 기다리니 부팅이 완료되었다 뭐 첫 부팅이니 이것저것 생성할 것이 많으니 이해하고좀 사용해보려고 하니 라즈베안으로만 돌려야겠다 라는 생각이 들었다 앱 실행 반응 느림  버벅임 간헐적 깜박임 앱 강제 종료 등 도저히 쓸 수가 없는 수준이었다좀 괜찮으면 플레이스토어도 좀 올려볼까 했는데 그냥 더는 손대고 싶지 않은 수준이라 그냥 기념사진 한방 찍고 마무리하려 한다     ,5.781361014994233,4,0,5,26,3191.4,0,2.564102564102564,-0.03139999999999854,0.12280701754385964,0.34385964912280703,2.8,156,0,0
