,Post,score,Image num,Video num,comment num,sympathy num,weekly view,AD,keyword score,tfidf score,josa,noun,noun/josa,paragraph num,gif num,sticker num
0,주문한 구글 세대 클롬캐스트가 언제 올지 몰라서 그 사이에 로 유튜브라도 봐야 겠다는 생각으로 라즈베리파이에 안드로이드 를 설치해 보기로 했다 그동안 몇번 시도하다가 알 수 없는 문제가 발생해서 포기 했었는데 알고 봤더니 모니터 문제였다 해상도가 맞지 않는 모니터에  연결하니 화면이 까많게 나오지 않았던것 같다 할 수 없이 에  로 연결하니 화면이 정상적으로 뜬다 자세한 과정을 다 적을려고 하니 캡쳐 할 이미지가 한둘이 아니다 그래서 포기 자세한 과정은 아래 유튜브 영상을 참고 하자  준비물라즈베리파이   메모리 설치용 메모리 하나 더  설치에 필요 케이블  지원 모니터 혹은   카드를 사용하지 않고  메모리 카드를 사용하기로 했다 속도가 좀 더 빠르다고 해서  그런데  부팅을 사용하는 경우 문제가 발생 할 수 있다고 한다 문제가 있다면 카드를 사용하면 된다  필요한 파일 다운로드                이미지 파일은 압축 해제할 필요 없다       압축파일 그대로 이 파일을 두번째  카드에 복사해 둔다 나중에 사용된다  플래싱 툴          이것을 사용하라고 많이 나오는데 웬일인지 끝에 가서 에러가 발생한다그래서 그냥 라즈베리파이 공식 플래싱 툴을 사용하였다     둘 중에 사용하면 될것 같다  플래싱하고 부팅  메모리에 앞서 다운로드 받은 이미지를 플래싱 하고 부팅하자 자세한 것은 영상을 참고 하자 부팅하면 아무런 앱도 없는 텅 빈 다 원하는 앱을 설치 해야 하는데 문제가 구글 플레이가 없다는 것이다 왜 공식 안드로이드가 아니기 때문이다 그래서 따로 설치를 해줘야 한다 앞서 를 다운로드 받아서 두번째 에 복사 해 놓았다 라즈베리파이에 채결해 놓는다 영상에 보듯이 개발자 모드를 활성화 시키고 수퍼유저가 되서 터미널이라는 앱을 실행시켜야 한다    하고 재부팅 하면 리커버리 모드로 진입한다 여기서 영상에 따라 를 마운트 시키고  파일을 선택해주면 된다 재부팅 하면 구글 설정과정이 시작된다 자신의 구글 계정으로 로그인 하는 과정을 거치고 마무리 하면 된다 기본 앱들이 설치되고 구글 플레이도 사용이 가능해 진다  안드로이드 버전이다  구글 플레이가 있으니 원하는 앱을 설치 하면 된다  필요한것은 유튜브와 코디 정도 이다 아쉽게도 넷플릭스는 지원하지 않는다 넷플릭스가 실행되기 위해서는 장치에 인가 뭔가 하는게 지원이 되어야 한다고 한다 그래서 앱이 보이지도 않는다 다른 방법이 있는지 좀 더 알아 보기로 하자 유튜브 재생은 되지만 까지만 된다 이런 지금 시대가 어느 시대인데  그나마 그마저도 부드럽지 못하다 어떤 영상은 재생이 제대로 되지 않는 경우도 있다 구글 플레이에서 코디를 설치햐면 최신 버전이 설치 된다 티빙 애드온을 설치하면 실시간 방송 같은 무료 영상을 재생할 수 있다 이건 원래 까지 지원 하는 것이니 나름 활용할만 하다 앱 설정에 들어가서 라즈베리파이 시스템을 설정하는 메뉴가 있다 여기서 성능 향샹을 위해 오버클럭을 해주면 된다 그런데 별 차이 모르겠다  리모콘는 리모콘이 있어야지 블루투스 리모콘이 있으면 되는 모양인데 리모콘이 없다 붙여 보진 못했다  적외선 리모콘이 있기는 한데 찾기 귀찮은데  그래서 스마트폰에 안드로이드 리모콘을 설치해 주었다 그런데 문제는 또 있다 이 리모콘으로는 코디 앱을 제어 하지 못한다 이런 구글 크롬캐스트 올때까지 당분간 유튜브나 티빙 보는 정도로 사용하기로 하자  총평 만족스럽지 못하다 유튜브 로 재생을 못하는 경우가 많다 넷플릭스는 아예 볼 수가 없다 기타 게임 같은것은 해 보지 않아서 모르겠다 메뉴에서 썸네일 오고 가는 것은 쓸만하다 에 사용시 리모콘이 아쉽다모니터에 연결해서 아쉬워서 하는 경우가 아니면 추천 하지 못하겠다 전용 셋톱박스를 구입하는 것이 좋겠다도대체 버전 까지 나오면서 성능을 이렇게 찔끔찔끔 올리는 거야 이런 용도로 사용하라고 나온게 아닌것은 알겠지만 ,2.7757352697813396,11,0,5,6,1871.0,0,-8.571428571428571,-17.005499999999998,0.15856481481481483,0.3472222222222222,2.19,522,0,0
1,이미 더 이상 다른 게 필요 없을 정도로 손에 착 붙고 성능 좋은 아케이드 스틱을 여럿 구비하고 있지만 신제품이 나왔다는 소식이 들리면 써보고 싶어지더라구요 최근 에서 브룩 제로파이 를 내장한 메이크스틱 프로 레트로 버전을 출시한 걸 보고 궁금하기도 했고 그 이상으로 클래식한 분위기가 물씬 풍기는 아스트로시티 스킨이 너무 끌려 직접 써보게 되었습니다  여태껏 몇 번이고 보여드렸던 박스지만 내용물은 전부 다르다는 것 아시죠  이번 메이크스틱 프로 레트로 제로파이는     같은 최신 기종이 타겟이 아니라     닌텐도 스위치에 라즈베리파이까지 옛날 아케이드 게임과 구형 콘솔과 에뮬을 타겟으로 한 모델입니다 닌텐도 스위치는 살짝 덤 같은 느낌이라고 할까요 라즈베리파이를 제외한 모든 콘솔을 보유하고 있고 또 오래된 아케이드 게임을 종종 꺼내서 한두판씩 하는 올드유저인 저에겐 상당히 매력적인 제품이었습니다  아케이드 유저라면 신호를 변환시켜 주는 컨버터 조차 인풋렉이 없기로 유명한 브룩 를 직접 써보진 않았더라도 명성은 들어봤을 거라 생각합니다    역시 구형 콘솔에서 인풋렉 없이 쾌적한 플레이를 할 수 있게 해주는 아이템입니다 사실  초반까지만 해도 사람들이 인풋렉에 대해 크게 신경 쓰지 않았고 출시되는 기성품들 역시 그런 경향이 있어서 요새 나오는 걸 쓰다가 구형 모델을 써보면 딜레이가 느껴질 가능성이 높아요  의 가장 큰 장점은 추가 비용을 들여 자가 교체를 할 필요 없이 주문 단계에서 부터 원하는 부품으로 커스터마이징을 할 수 있어서 이중으로 돈을 쓰고 번거로운 교체 작업을 할 필요가 없다는 것입니다 환타레버 삼덕사 버튼처럼 국내산 부품이나 중국산 부품이라면 모를까 산와 세이미츠 같은 부품으로 바꾸려면 비용이 상당하거든요  지금은 환율이 착하고 업체에서 대량 주문 후 소량 판매를 하고 있어서 예전보다는 많이 나아졌지만 그래도 여전히 비쌉니다 제가 스트리트 파이터에 빠졌을 때만 해도 레버 하나 바꾸려면 약  만원이 들었죠  아무튼 한동안 잠입레버를 써봤는데 쓰면 쓸수록 역시 내 손에 잘 맞는 걸 사용하는 게 스트레스 받지 않고 즐겜을 할 수 있겠다는 생각이 들어 이번에는 세이미츠 를 선택했습니다 대신 봉 길이가 너무 짧은 감이 있어서 확장 샤프트를 추가해봤습니다 사실 두 개를 추가했었는데 너무 길어서 어색하길래 한 개를 뺐더니 손에 착 감기더군요  혹시 세이미츠 를 써볼 마음이 있는 분이라면 닌텐도 스위치 조이콘의 갈림 현상처럼 각 가이드 갈림 현상이 있어서 여분으로 몇 개 구비해두는 것도 나쁘지 않을 겁니다 저는 최상의 컨디션을 유지하기 위해 하루 평균 플레이타임 시간을 기준으로 반년에 한 번씩 새걸로 바꿨습니다  버튼은 기본 옵션이 산와   인데 세이미츠로 바꿨습니다 익숙한 클리어를 쓸까했지만 스킨이랑 조합이 이쪽이 더 예쁠 것 같아 선택했는데 아주 만족스럽습니다 클리어를 했으면 살짝 붕뜬 느낌이 들었을 것 같아요  기계식 키보드에 비유해보면 색상은 똑같으니 적축처럼 부드러운 클릭감을 원한다면 산와가 쫀득한 클릭감과 피드백을 원한다면 세이미츠가 손에 잘 맞을 겁니다 배열은 플스 배열이나 원한다면 타기종 배열로 얼마든지 바꿀 수 있고 스킨 자체를 아예 다른 걸로 선택할 수도 있습니다 또한 오리지널 뷰릭스처럼 레버와 버튼 사이의 간격을 좁게 설정하는 것도 가능해요  무게를 늘리기 위해 철판을 한 개 더 넣었습니다 최대 장까지 가능하고 장에  입니다 솔직히 안넣어도 충분히 묵직하고 고무 발판의 접지력도 우수해서 밀리거나 들썩거리는 현상은 없는데 오프라인 대회장 같은데서 무릎 위에 올려두고 쓸 일이 생길까봐 추가했습니다 그리고 무릎 위에 올리고 쓰는 게 기본이라면 스폰지 쿠션을 부탁하면 조금 더 편하게 쓸 수 있어요  측면 상단에는 버튼 개가 있는데 여기서 왼쪽 두 개만 사용하고 오른쪽 하나는 더미입니다  하판을 분리해서 보면 저렇게 케이블이 연결되어 있지 않은 걸 볼 수 있어요 내부 배선처리가 무척 깔끔하게 정리정돈이 잘 되어 있어서 부품이 마모돼서 감이 떨어졌을 때 손쉽게 자가교체를 할 수 있습니다 수축 튜브는 손으로도 잘 빠지지만 예전에 손으로 뽑다가 끊어 먹은 이력이 있어 개인적으로는 롱로즈를 활용하는 걸 추천드리고 싶네요  를 지원하는 만큼  외에 구형 플스용 인터페이스도 준비되어 있습니다 그래서 양쪽 모두 귀찮은 컨버터 사용 없이 다이렉트로 연결할 수 있습니다  얼마전 스트리트파이터 챔피언 에디션으로 약 년만에 스파에 복귀했고 며칠 간 연습하고 온라인이지만 팀 대회도 한 번 참여했습니다 이후 틈틈이 시간이 날 때마다 재미있게 즐기고 있는 중입니다 엄청 많이 바뀌어서 다른 게임 같더라구요 그동안 손에 잘 맞지 않은 부품 조합으로 플레이를 하다가 가장 익숙하고 선호하는 구성으로 커스터마이징한 메이크스틱 프로 레트로 제로파이로 바꾸니 진짜 속이 뻥 뚫리는 기분이 들었습니다 콤보 삑사리도 거의 안나고 중요한 순간에 엉뚱한 게 나가서 지는 일이 확연히 줄었거든요  오랜만에 추억의 대전격투 버추어파이터도 구동해봤습니다 년이 다 되어 가는데다 제대로 파고 들었던 타이틀도 아니기에 콤보고 뭐고 제대로 기억나는 게 없더라구요 그래도 대표 연속기인 붕격운신쌍호장이나 수패고는 기억하고 있어서 써봤는데 실패 없이 깔끔하게 성공했고 프랙티스 모드에서 입력한 방향 그대로 정확하게 키 로그가 남는 것도 확인했습니다  각 부품은 소모품이라 일까지만 무상 를 지원해주지만 는 년 동안 사후 서비스를 제공하는 만큼 긴 시간 안심하고 쓸 수 있는 것도 장점입니다  닌텐도 스위치와 는 기본이고 지금해도 재미있는 수많은 명작들로 가득한   콘솔이나 라즈베리파이 환경에서 에뮬을 하면서 최대한 오락실 느낌을 살리고 싶다면 현재 쉽게 새걸로 구할 수 있는 것 중 가장 고퀄리티 제품이 아닐까 싶습니다 그리고 메이크스틱 프로 레트로 제로파이 말고도 여타 다른 기종들에서 호환되는 여러가지 모델들이 잔뜩 있으니 내 게임 환경에 잘 어울리는 것을 찾아보시길 바랍니다  아이에스티몰   ,4.396686251719957,21,1,18,71,13507.2,0,-2.488335925349922,-31.68719999999996,0.15997023809523808,0.33482142857142855,2.09,731,3,0
2, 안녕하세요디바이스마트의 시시포스 솔다입니다 블로그 작성일 기준 아두이노 우노 호환보드보다 저렴한라즈베리파이 피코 성능은 물론 가격까지 앞서버린 피지컬 컴퓨팅 개발보드의 혁명 그 자체인데요 오늘은 이러한 피코를 에 연결해보고간단한 테스트 코드를 작성하여 업로드 해보겠습니다 윈도우와 리눅스는 거의 비슷한데두가지 다 다뤄봤습니다 가즈아   단계 하드웨어 연결  준비물 라즈베리파이 피코  링크   케이블  링크 연결하기 전에 장치관리자를 먼저 보겠습니다  키보드의 시작키를 눌러 장치 관리자를 검색하여 실행합니다  로 연결하면 보통은  로 잡히니 저 부분의 화살표를 눌러리스트를 펼쳐줍시다  펼쳐보면 은 기본으로 있는 시리얼 포트고저는  장치를 연결해놔서 기본적으로 과 를 사용중이네요  피코를 연결해줍니다따로 가 켜진다거나 하지는 않습니다  다시 장치 관리자를 살펴보시면의외로 포트가 아니라 기타 장치로 잡혔습니다마치 드라이버가 없는 것 처럼요 지금부터 진행 할 방법은 드라이버 설치는 아닙니다 피코에서 을 사용하기 위해서는드래그 앤 드롭으로 설정 할 수 있게끔 되어있기때문에그 방법으로 진행해보겠습니다  라즈베리파이 피코를 보시면 스위치가 하나 있는데이건 특이하게도  스위치가 아니라  스위치입니다이걸 누른상태로 연결하면 조금 다르게 작동하는데요 이번엔 장치 관리자말고 내 컴퓨터를 실행해봅시다  띠용라는 드라이버가 잡혔네요 그런데 이렇게 드라이버로 안 잡히시는 분들이 있으실 수 있습니다그럴때 저  버튼이 사용됩니다 일단 피코에서 케이블을 분리 한 뒤   버튼을 누르고 있는 상태로케이블을 꽂아주시면 되시겠습니다 그럼 아까 위와 같이 드라이버로써 잡히고내 컴퓨터에서 확인하실 수 있습니다   단계  파일 업로드 이제 펌웨어 업데이트를 할 차례입니다 링크 우선 위 링크로 접속합니다   소개페이지가 나옵니다 여기서 스크롤을 조금 내리시면  이런 화면이 나옵니다 옆에 몇가지 절차가 써있고 녹색 버튼이 있습니다  파일을 받는다 부트셀을 누른상태로 보드를 와 연결한다 파일을  드라이버에 드래그 앤 드롭 한다라고 되어있습니다 그렇습니다 지금 우리가 하려는 그것입니다 그럼 녹색 버튼을 눌러서  파일을 받아줍니다  다운받은 파일입니다좌측을 보시면 탐색기같이 드라이버들이 보이는데이쪽으로 드래그 앤 드롭 해주겠습니다  드래그 앤 드롭이라 함은 저렇게 마우스로 파일을 누른 상태로 당겨서 드라이버 위에서 마우스를 놓아주시면 됩니다  파일이 복사되고 잠깐 기다리면위와같이  드라이버가 없어집니다 이게 어떻게 된 일인지장치 관리자를 확인해보겠습니다  포트에 로 기존에 없던  직렬 장치가 감지되었습니다맞습니다 이게 라즈베리파이 피코입니다 이제 프로그램을 업로들 할 수 있는 환경이 조성 되었습니다 이제 를 준비해줍시다   단계  설치 라즈베리파이 피코를 지원하는 중에서도저희는 를 설치하여 활용해 보겠습니다라즈비안에는 기본설치 되어있습니다 여기서부터는 윈도우와 리눅스우분투가 방법이 조금 다릅니다   윈도우에  설치하기  위 링크를 눌러서 공식 사이트로 접속합니다  이런 심플한 페이지가 나옵니다우측 상단의 를 누르면 윈도우용  설치 파일이 다운로드됩니다  아묻따 실행해줍시다  설치는 아시다시피 사실상 답정너니까시키는대로 하시면 됩니다  응 동의 어그리  설치경로입니다특별히 바꿔줄 이유가 없어 다음으로 넘어갔습니다  바탕화면에 아이콘 만들거냐는 말인데저는 생성해서 폴더를 좀 옮겨줬습니다  설치  설치하는게 그리 오래걸리진 않았습니다  파이썬 확장자파일에 우클릭으로 로 바로 실행이 가능하다고 합니다 미래를 예측하는 가장 좋은 방법은 미래를 발명하는 것이다라는 앨런 케이의 띵언을 끝으로 설치가 완료됩니다   우분투에  설치하기 우분투에서 를 설치하는 방법은 매우 간단합니다   로 접속해줍니다  켜졌다면 돋보기를 누릅니다 를 최초로 실행하시는경우 바로 안켜질 수 있습니다조금 기다리시면 실행 됩니다  를 검색합니다검색 결과를 눌러줍시다  설치 버튼을 눌러줍니다  설치에는 관리자 권한이 필요하므로암호를 입력해줍니다  설치 준비 중입니다  기다리시면 이렇게 설치가 됩니다  이런 화면이 나오면 설치가 완료된 것입니다   윈도우키를 눌러 를 검색하시어 실행하실 수 있습니다  가상머신으로 사용중이시면 장치  로 들어가셔서 를 선택해주셔야 피코와 가상머신이 연결됩니다   단계  코딩과 업로드 설치가 끝났다면 를 실행합니다  이런 화면이 나옵니다이제 용 인터프리터를 선택해줘야합니다  위와같은 경로를 실행해줍니다실행  인터프리터 선택  위쪽의 리스트에서    를 선택합니다  하단의 리스트의 포트는 아까 장치 관리자에서 잡혔던피코의 포트를 선택해주시면 됩니다저는 인데 이 부분은 마다 다를 수 있습니다 이제 설정한대로 다 확인을 눌러주시면 됩니다  내장 의 블링크 테스트를 위해 위와같이 코딩을 합니다  복사하실 수 있게 따로 준비했습니다  작성 완료 후 저장을 눌러주시면  어디에 저장할거냐고 나오네요피코에 저장한다고 합시다  파일명은 로 했습니다  위의 재생모양 버튼이나 키보드의 를 눌러 코드를 실행할 수 있습니다  실행하고나면 이렇게 됩니다가 다섯번 깜빡이는지 보드를 확인해주세요  물론 잘 실행됩니다고정하고 촬영했는데도 많이 흔들리네요  후 짧게 쓰고싶어도 분량이 꽤 되네요도움이 되셨길 바랍니다             으    아바 바떠 ,3.009378247710073,54,0,0,9,1205.8,0,-10.98169717138103,-92.08400000000029,0.18059299191374664,0.35399820305480684,1.96,494,0,0
3,안녕하십니까 입니다 라즈베리파이 먹는건가이건 뭘까 궁금해하시는 분도 있고 라즈베리파이가 먹는게 아니라는걸 아시는 분도 있으실 겁니다  저도 라즈베리파이를 전혀 모르는데요이번에 라즈베리파이 프로그래밍을 해보고 싶어서친한 형님께빌드업 대표 키트를 부탁했더니 흔쾌히 보내주셨습니다  완전 초보이다 보니 설치부터 프로그래밍하는 단계를 써가면서 해볼려고 합니다많이 부족하고 둘러가겠지만요그래도 흔적을 남겨 놓으면 나중에 쉽게 따라 할 수 있지 않을까 생각 합니다  빌드업 형님이 보내온 라즈베리파이를 꺼내봤는데요다양한 구성품을 보내주셨습니다  일단 라즈베리파이를 가동을 해야하는데요인터넷을 해보면 초기상태는 깡통이라고 합니다 아무것도 할 수 없는 상태 입니다 라즈베리파이를 기동하기 위해서 필요한 가징 기본이 있습니다 바로 카드 입니다 일반 카드는 라즈베리파이가 많이 힘들어합니다 이유는 라즈베리파이 키트 하단부에 카드가 들어가기 때문입니다카드는 잠시 홀짝해질 수 있다면 제가 무슨 말을 하는걸까요 네이버쇼핑에서   를 구매했습니다  라즈베리파이 본체  카드 키보드 마우스 를 지원하는 모니터가 필요합니다 터미널을 이용해서 접속하는 방법도 있다고 하지만요저는 아직 라즈베리파이를 잘 모릅니다 그래서 하나 하나 해볼려고 하고 그 작업 후기를 남겨 볼려고 합니다  단계 라즈베리파이가 제대로 작동하기 위해서는 가 필요합니다 아래 링크를 타고 가시면 다운로드를 받을 수 있습니다         기본적으로 애매할때는  를 선택합니다 제가 받은 파일은  인데요용량이 거의 정도 하는 것 같습니다  라즈베리파이 설치 가이드 입니다             카드 입니다   잊어버리시면 안됩니다   단계 이미지 파일을 카드에  해줘야 하는데요프로그램을 이용해서 처리를 해줘야 합니다구글 검색을 해보면 이걸 설치해주는 이 가지 종류인것 같습니다    과    인것 같습니다 저는 을 이용해서 설치를 해볼려고 합니다  프로그램 다운로드 받은 후 에서 실행을 합니다 프로그램 실행 전 노트북에 카드를 삽입합니다 를 실행하면 아래와 같은 화면이 나타납니다  단계에 받은 이미지 파일을 읽어 옵니다 열기를 클릭하면 이 로 바뀝니다 하늘색을 클릭 을 시작합니다  의 파일 압축이 풀리니 의 용량이 됩니다  하는데 걸린 시간은 대략 분 정도 소요되었습니다   두둥이제 라즈비안을 실행해봅니다카드를 라즈베리파이 하단에 장착합니다 해당 라즈베리파이는 가 비활성화 되었는지 없는지 모르겠지만일단 유선랜을 장착했습니다 키보드와 마우스 를 연결합니다  마이크로핀으로 전력을 넣으니 화면이 나타납니다         화면이 나타납니다이러면 거의  왔다고 할 수 있을 것 같습니다  라즈비안의 경우도 윈도우와 비슷한 를 가지고 있습니다배경화면이 좀 괜찮은 것 같습니다  기본 설정을 하게 됩니다  버튼을 누릅니다  여기서 주의기 필요합니다 에서 는  로 하지마시고  로 하시기 바랍니다저도 이렇게 셋팅했더니 메뉴가 다 깨집니다그렇다고 메뉴가 깨진다고 다시 설치할 필요는 없고 설정을 바꿔 주면 됩니다  이미지를 따라가시면 설정파일로가실 수 있습니다  에서 를 다시 변경해주시면 정상적으로 표시가 됩니다 라즈베리파이에  를 처음으로 설치해봤는데요그렇게 어려움이 없었습니다  다만 초기 설치시 랜선이 연결되어 있어 소프트웨어 업데이트를 선택했더니시간이 생각보다 많이 소모 되었습니다 그거 이외에는 설치하는데는 크게 어려움이 없었습니다 앞으로 라즈베리파이를 이용하여 다양한 것을 시도하면서겪는 이야기를 적어볼려고 합니다     라즈베리파이  라즈비안  설치하기    카드  기초  초보라즈베리파이  빌드업,2.7805023381121465,21,0,0,4,1635.8,0,-11.578947368421053,-50.60799999999995,0.17397078353253653,0.33731739707835323,1.94,406,0,0
