,Post,score,Image num,Video num,comment num,sympathy num,weekly view,AD,keyword score,tfidf score,josa,noun,noun/josa,paragraph num,gif num,sticker num
315, 라즈베리파이에서 를 통한 모터 구동의 필요성   라즈베리파이로 모터를 구동하기 위해서는 아래 그림 에서 보듯이 라즈베리파이의 입력핀에 모터 구동 보드를 꽂아서 사용하는 방식으로 모터를 구동합니다      하지만 아래와 같이 라즈베리파이에 케이스를 씌운다거나  모니터를 끼운다거나      또는 전에 쓴 글 라즈베리파이와 를 이용한 전자잉크 프로젝트       에서처럼     전자 잉크 을 올려서 사용하면서 동시에 모터를 구동하고 싶다면 앞에 글 라즈베리파이에서 시리얼 통신으로 모터 구동하기   에서 썼듯이 라즈베리파이의 시리얼 핀에 납땜을 하거나 하여 선을 뽑아 쓰는 방식으로 모터를 사용해야만 합니다  이렇게 하면 되긴 되겠지만 선이 너저분하게 나와 보기도 싫거니와 납땜 등의 작업이 번거롭기도 하여 사용하기가 그다지 용이하지는 않습니다  그래서 라즈베리파이에 케이스를 끼운 상태에서도 모터 드라이브를 사용할 수 있는 방법이 있을까 생각해 봤는데 있더라구요 라즈베리파이에는 라는 최강의 기기 인터페이스가 이미 있었으니까요  이 를 이용하여 모터 드라이브를 연결하면 따로 을 사용하지 않고도 모터를 돌릴 수 있겠다 생각이 들어 아래와 같이  단자에 모터를 연결하여 모터를 돌리는데 성공하였습니다         를 이용한 모터 드라이버 세팅   를 이용한 모터 구동은 기본적으로는 앞에 글 라즈베리파이에서 시리얼 통신으로 모터 구동하기   의 모터 드라이버  를 라즈베리파이의 시리얼 핀을 이용하지 않고 라즈베리파이에  단자에 연결해 신호를 시리얼 신호를 만들어주는  변환보드를 사용하는 것입니다  즉 아래 그림과 같이    라즈베리파이의  단자에    보드  보드를 연결하고 거기에  보드를 연결하면 라즈베리파이 핀에 모터 드라이브를 연결하지 않고  포트를 통해 모터 드라이브를 연결하게 되는 겁니다        구동 프로그램      통신을 통한 시리얼 통신은 앞 서 글 라즈베리파이에서 시리얼 통신으로 모터 구동하기   의  장에서 설명한 시리얼 통신 세팅을 신경 쓸 필요가 없습니다   를 통해서 시리얼 통신 신호로 변하기 때문에 라즈베리파이 보드의 시리얼 통신을 세팅하는 과정이 필요 없기 때문입니다  하지만 시리얼 통신 프로그래밍은 를 사용하던 라즈베리파이 보드의 핀을 사용하던  프로그램의 라이브러리 중  와 를 통해 간단히 할 수 있는 부분은 똑같습니다  먼저 와 를 해 주고   구조체에  변수를 설정하고 아래와 같이 기본 세팅을 해주고  함수에   같은 문자를 송신하면 시리얼 통신을 통해 문자를 전송할 수 있게 됩니다  세팅에 있어서는 먼저    명령을 실행하여 아래와 같이 의   을 확인합니다 여기서는  입니다     아래 프로그램은    통신을 사용하여 시리얼로 연결된 터미널에   를 출력하는 프로그램입니다 여기서 다른 부분은 거의 그대로 써도 되고 아래의 빨간 색에서 표시한 것처럼   를 통해 확인한 시리얼 통신 이름 와 통신 속도인 만 체크하면 됩니다                                                                                                                                                                                                                                                                                                                  모터 드라이브 도 시리얼 통신을 통해 특정 문자를 날려 주면 모터를 제어할 수 있는데요 따라서 위 프로그램에서   대신 특정 문자를 날려 주면 을 동작시켜 모터를 구동시킬 수 있게 되는 겁니다  을 더 자세히 사용하시려면  여기를 참조하시면 됩니다  여기서는 간단한 시리얼 명령어 몇 개만으로 동작을 시켜 보도록 하겠습니다 간단한 명령 몇 가지는 아래와 같습니다   모터  번을    속도로 세팅  모터 구동  모터 멈춤 이 정도만 알아도 모터는 구동이 됩니다 즉 위의 명령어를 차례대로 날리면  번 모터를  의 속도로 정방향으로 움직였다가 멈추는 동작을 하게 됩니다 이를 위해 터미널에서 를 통해 명령 문자를 받고 송신을 하도록 위의 프로그램을 약간 수정한 코드가 아래의 코드 입니다                                                                                                                                                                                                                                                                                                                                                                                                                                                                    위의 코드를 로 저장을 하고 아래와 같이 을 합니다       그리고 아래와 같이 실행을 시키면 됩니다   아래는 위의 프로그램을 실행하여 실제 모터를 돌리는 데모 영상입니다 모터를 속도    이렇게 설정하여 중간 속도 빠른 속도 느린 속도 이렇게 구동하는 데모 영상입니다       모터 드라이브 전원 연결 시 유의점   위의 방법은 라즈베리파이의  를 모터에 연결하는 방법이라 소형 모터만 구동하는 것이 좋구요 만약 여기 사용한 모터보다 큰 모터 즉   이상의 전류가 소모되는 모터를 사용할 경우에는 아래 그림처럼 독립된 전원으로 연결하는 것이 좋습니다       글을 마치며  오늘은 라즈베리파이의  통신을 통해 모터를 돌리는 방법에 대해 예기해 보았는데요   앞 서도 설명했듯이 이 방법을 사용하면 라즈베리파이의 핀에 모터 드라이브를 연결하지 않고도 모터를 사용할 수 있게 되어 라즈베리파이 케이스를 사용하거나  모니터 또는 다른 센서 보드 을 사용한 상태에서도 모터를 구동 할 수 있어 여러 응용이 가능할 것으로 보입니다  또한  프로그램이 어려워 보이지만 위의 예시처럼 몇 줄만 가지고 시리얼 통신으로 구동하는 하드웨어모터 드라이버 센서 보드 등를 간단히 동작 시킬 수 있는 부분은 앞으로 다른 프로젝트를 할 때 새로운 자유도를 추가해 줄 것으로 보여 보람 있는 작업이었습니다  그럼 이만  에  ,2.800648818723233,7,1,0,0,34.8,1,6.8181818181818175,98.34549999999989,0.23574144486692014,0.3925855513307985,1.67,1467,0,0
316, 최근에는 스마트 홈 오디오 시스템과 음감용 를 직접 만드는데 라즈베리 파이를 이용하는 경우가 많아졌다 덩달아 관련 제품도 상당 수 출시되고 있는 상황이다 그리고 이전에 킥스타터에서 인기를 끌었던  가 업그레이드되어 새롭게 공개되었다     기반의 이 는   를 지원하며 음질 개선을 위해 향상된  성능을 제공하는 두 개의 액티브 마스터 클락이 탑재되었다 아울러 사운드 신호의 경로를 수정하고 부품의 등급도 높였다고 편의성도 강화되어 디지털 노브가 탑재되어 사운드를 조절하며 추가로 앰프를 연결할 수도 있다   인치 또는 인치  디스플레이를 선택할 수 있고 인치 모델은 앨범아트를 띄울 수도 있다 라즈베리 파이 파워 스위치와  버튼으로 쉽게 조작이 가능하며 오픈소스로 제작되어 다양한 커스터마이징도 가능하다 현재 킥스타터에서 펀딩에 성공해 월 배송 예정으로 디스플레이가 없는 베이직 모델을 받기 위한 최소 펀딩 금액은  아쉽게도 라즈베리 파이 미포함 가격이다 ,3.1792263963688674,3,0,0,6,725.2,0,-1.9801980198019802,1.1544999999999999,0.2,0.41818181818181815,2.09,127,0,0
317,라즈베리파이와 라즈베리파이 카메라 등 노트북으로 작업한 내용을 데스크톱으로 옮길 때  등 장치를 사용하게 된다 이때 구글 드라이브와 같은 클라우드 서비스를 사용하면 별도 과정없이 파일을 업로드하고 다운로드할 수 있다 윈도우나 맥 운영체제에서는 자체 프로그램이 제공되어 편하게 이용할 수 있으며 다음 방법으로 우분투 리눅스에서 드라이브를 연동할 수 있다  이번 글에서는 을 사용해 라즈베리파이에서 구글 드라이브를 동기화하는 방법을 살핀다작업하기 전 라즈베리파이에 새로 배포된 패키지가 설치가 안된 것이 있다면 업데이트하자라즈베리파이는  기반이라 일부 지원하지 않는 것들이 있을 수 있다 하지만 을 사용하면 문제없이 구글 드라이브 동기화를 마칠 수 있다 본 글은 의  프로그램의  파일을 참고했다 원하는 폴더로 이동 후 다음 문을 입력해 설치 스크립트를 내려받는다 다운로드 후에 설치 예시가 나온다다음 명령 입력 후 을 입력해 새 연결을 생성하자이름은 원하는 이름으로 설정하면 된다 이름 입력시 연동할 수 있는 꽤 많은 드라이브 목록이 출력된다 년 월 일 기준 번이 구글 드라이브다 번은 구글 클라우드 공간으로 연동할 구글 드라이브는 아니다번을 입력하고 클라이언트 와  문자열을 입력하라고 한다 이는 별도로 구글 드라이브용 클라이언트 를 생성해 전송 속도를 높이는 것이며 엔터키를 누르면 기본 값인 빈 문자열로 설정된다다음으로 의 권한을 설정한다 일반적인 동기화라면 번이고 접근 권한에 제한을 두고 싶다면 상황에 따라 적절히 설정하면 되겠다 모든 파일에 액세스 가능 읽기만 가능 에서 만든 파일만 액세스 가능 파일의 만 접근 가능하고 다운로드나 읽기 불가다음은 구글 드라이브에서의  폴더 설정이다 기본 설정이면 전체 공유고 를 선택해 폴더를 지정해서 공유할 수 있다 이때 의 는 구글 드라이브 링크의 뒷자리 숫자들이다  그리고 계정 정보가 담긴  파일 위치를 물으며 둘 다 기본으로 설정한다이후 질문에서 두 가지 질문에 를 입력해 답하면 구글 계정 인증을 위한 링크가 출력된다 링크를 복사해 연동할 계정에 로그인하고 권한에 동의한 뒤 나오는 키를 저장하자마지막으로 팀 드라이브를 사용할지 묻는다 팀 드라이브가 아니면 를 입력하거나 엔터를 선택하면 된다  팀 드라이브로 이용할 경우 팀 드라이브 목록이 출력되고 사용한 팀 드라이브 번호를 입력해 진행 후에 정보 확인 일반 개인 사용의 경우 바로 정보 확인이 진행된다설정이 끝났다 로 나갔다면 다음 명령으로 드라이브 설정을 확인한다 다음 명령 실행 시 페이지 단위로 파일의 목록이 보인다 잘 보이지 않는다면 설정이 정상적으로 되지 않은 것이고 멈추고 싶다면 를 입력해 나가면 된다동기화는 상황에 따라 다음 명령 중 선택적으로 수행하면 된다    원격 폴더와 로컬 폴더를 동일하게 쌍방향    로컬 폴더 내용을 원격 폴더에 복사하며 이미 복사된 것은 넘어감    로컬 폴더 내용을 원격 폴더로 이동 매번 형식대로 명령어를 입력하기는 번거롭기 때문에 설치파일 폴더에 이미 동기화 스크립트가 셸 스크립크 형식으로 만들어져 있다 번째 줄의 문단에 수정하라는 내용의 부분만 적절히 수정해 실행하면 자동으로 동작한다   ,4.233886966551327,7,0,0,4,1239.6,0,-2.8901734104046244,-11.722499999999979,0.18876080691642652,0.4495677233429395,2.38,398,0,0
318,타 블로거 님들 글 이리저리 보다가 정신이 없어서그냥 공식 문서 찾아서 내용 정리했습니다 기본 서버 구축 자체는 코드 줄이면 끝납니다 라즈베리 파이를 가상머신에 설치해서 사용하시려는 분은 이전 포스트 참고 바랍니다  실행    기본 업데이트를 점검 및 다운로드를 합니다      아파치 를 설치합니다      서버용 를 설치합니다      데이터베이스를 서버에서 사용 가능하게 만들어줍니다중간에 커서가 깜박거리면서 빛나는데 해당 프로그램을 설치를 해야 해서공간을 사용해야 하니 해당 공간에 대한 사용 권한을 허락받는 과정입니다 를 입력하고 엔터를 누르면 설치가 진행이 됩니다      사이트에서 를 접근할 수 있게 도와줍니다위에 와 마찬가지로 진행 여부를 묻는데 를 누르고 엔터를 칩니다     마지막으로 아파치를 재부팅 해주면 서버 구축이 끝납니다정말 간단하죠 간혹 여기서 아파치  서비스를 찾지 못한다는 에러가 발생합니다     다시 입력하시면 됩니다 서버 작동 여부 확인 한제 구축된 서버는 동일한 네트워크에서만 사용이 가능합니다 접근 가능내 사설 아이피 접근 시도 영역   접근 불가능내 사설 아이피 접근 시도 영역   저는 가상머신에서 바로 확인하도록 하겠습니다 방법은 라즈베리 파이 혹은동일 네트워크 상에서 인터넷을 접속합니다그 후 아래 을 접속하시면 됩니다  아래 사진처럼 아파치 디폴트 페이지가 나옵니다서버의 상태는  라고 표기가 돼있습니다 성공적으로 서버가 구동되었음을 알 수 있습니다 다음 포스팅은 서버를 구축했으니 그 안에 를 수정하여들어오는 경로 페이지 구성 등의 기본 설정을 조작해보도록 하겠습니다  ,5.253552479815455,8,0,0,0,6.0,1,-1.6042780748663104,-11.203099999999989,0.190625,0.428125,2.25,201,0,0
319,프로젝션 매핑 이라는게 있다 예전에 서울역 앞에서 대우빌딩인가 어디에 비디오 영사해서 화제가 되었던것 같은데기억이 그건 단순히 평면의 빌딩면에 영상 쏜거고 좀 더 아티스틱하게 할려면 굴곡이 있는 다양한 입체면을 가진 것에 영사를 쏴서 자연스럽게 결과가 나오도록 하는 것이 핵심인듯 하다 즉 오브젝트이 경사면의 왜곡까지 계산해서 영상 매핑해 주는 것인듯 하다  이걸 해주는 소프트웨어가 필요하다는 것이다   라즈베리파이로 가능한가 뭐 라즈베리파이에 돌아 가는 소프트웨어가 있으면 되는것 아녀  오픈소스로 된것을 찾아 보니 어려워 보인다 먼저 오픈프레임워크라는 것을 설치해 주고 애드온을 이용해서 라즈베리파이에서 프로젝션 매핑이 가능한듯 보인다  흥미롭기는 한데 문제는 프로젝터가 없다는 것  결국 실습은 못해 본다 나중에 생기면 한번 해 보기로 하자이런게 있다는 것 정도만 알고 넘어 가자   더 편리한 방법이 있다 매드매퍼와 미니매드를 이용하면 아주 편리하게 프로젝션 매핑이 가능하다 그런데 비용이 많이 들어간다 매드매퍼는 소스를 만드는 툴이고 미니매드는 라즈베리파이를 기반으로 한 영상 재생및 조정장치 정도 되는것 같다 그러니까 투사할 영상을 매드매퍼에서 제작을 해서 카드에 저장하고 미니매드에 프로젝터를 연결해서 재생을 하면 되는 흐름인듯 하다 아주 깔금한 솔루션이다 그런데 비용이 매드매퍼가 아주 직관적인 프로그램 인것 같은데 유료이다   그렇다면  좀 더 나은 오픈소스는역시 있다   오픈소스 라즈베리파이 프로젝션 매핑 도구 라즈베리파이만 있으면 되는 모양이다 이것 활용하면 가정에서도 재미난것을 많이 해 볼 수 있을것 같은데 시간이나 계절에 따라 영상 소스가 변하게 하거나 사람들의 움직임에 따라 변하게 하는 등 대륙의 실수 프로젝터라도 하나 구입해야 하나     ,5.442733564013841,0,0,2,12,1875.6,1,0.5405405405405406,0.4014,0.14657210401891252,0.3735224586288416,2.55,207,0,0
320,뀨쌤께 라즈베리파이 과외를 받았다 이 망가져 결과는 볼 수 없었지만많은걸 공부할 수 있었던 시간들이었다 엉망으로 납땜한 핀 헤더를 벗기고 나니 망가진 기판가 제공하는 회로도를 살펴보면 핀이 에도 연결되는 것을 볼 수 있다 쌤께서 점퍼 케이블을 가져와 능숙하게 회로도를 보고 연결하는 방법을 하나씩 하나씩 가르쳐 주셨다세팅해서 일반 컴에서 라즈베리파이를 원격으로 사용하는 방법도 잘 설명해 주시고  키보드도 제대로 세팅해 주심나의 연장탓에 손쉽게 땜질할 수 있는 팁도 전수해 주시고칼팁라즈베리 기판 회로도핀연결 메커니즘다양한 칼팁보드 정전기 방지기올바른 납땜방법  플럭스 바른다 인두로 기판과 핀을 충분히 달군다 납대고 땜질한다  튀어나온 핀은 소형 플라이어로 잘 자르되 다치지않도록 보안경을 쓰고 작업한다  고민끝에 나도 쓰고 나중에 아이들도 쓰기위해 공구로 나온 이 제품을 원에 충성님께 구입했다 넘 잘한 것 같오 기능분 동안 핸들의 이동이 없으면 인두기가도로 낮아지고 사용이 없으면 꺼진다 유연납도 무연납도 작업하는데 보통 우리가 쓰는 위와 같은 소량 실납은 유연납이다   새로 주문한 으로 성공,4.317144231306808,15,0,7,3,576.2,0,5.555555555555555,3.6591000000000005,0.17142857142857143,0.36428571428571427,2.12,132,0,1
321, 라즈베리파이리눅스  데비안 아파치톰캣 설치하기 라즈베리 파이에 아파치 톰캣을 설치하는 방법입니다우선 로 접속합니다     톰캣을 설치하려면 가 있어야 하므로   설치 유무를 확인합니다   를 통해 업데이트 패키지 목록을 읽은후    톰켓  을 설치해 줍니다      설치가 다 끝나면        톰캣 재부팅을 시켜주세요  창에서  를 입력하여 해당 주소에  을 입력하여 페이지가 열리는지 확인을 해줍니다   파일을 연후  위 사진처럼 입력해 주시고       입력후에    링크 부분을 클릭본인  방금 입력한    를 입력해줍니다  이 화면이 뜬다면 아파치톰캣 설정이 잘 된것입니다  감사합니다,5.408985005767012,8,0,2,1,1.2,1,1.4285714285714286,1.761000000000011,0.19047619047619047,0.4444444444444444,2.33,92,0,0
322,오디오는 여자들이 싫어하는 남자들의 취미중 하나이다 아마도 이유는 비싸다 그 가격이 상식적으로 이해가 안될 뿐만 아니라 상상을 초월할 만큼 비싸다 노래 하나 듣는데 여러대의 기계와 스피커 그리고 시디와 엘피 등이 줄줄이 연결되어 공간을 많이 차지할 뿐만 아니라 지저분하고 인테리어적으로 이쁘지도 않다 청소를 하려고 해도 복잡하게 얽힌 전선 때문에 쉽지도 않을뿐더러 건드리지도 못하게 하고 근처에 오지도 못하게 한다  소리의 차이가 없음에도 불구하고 허구헌날 전선을 연결하고 해체를 반복한다 소리를 너무 크게 틀어서 시끄럽고 층간 소음 때문에 이웃에게 피해를 주지 않을까 불안하다 맨날 방에 짱박혀서 나가질 않으니 삼시세끼 밥을 차려줘야 한다 짧은 시간 생각 해봐도 이런 여러가지 이유가 있으니 여자들이 싫어할만 하다 최근에는 인터넷의 발달로 인해 공간적으로 또는 인테리어적으로 매우 불리했던 과거의 오디오를 극복할 수 있는 방법이 있어서 소개해 보고자 한다 과거에는 아래 사진구글 검색 딱 봐도 몇몇 사진은 천만원 이상으로 보인다처럼 기계들을 여러 층으로 쌓아서 오디오를 완성하였다그래서 오디오 매니아들을 이것을 탑쌓기라고도 한다대체로 비싼 장비일수록 구성 요소가 많아지고 복잡하다현대에도 비싼 장비들은 기능을 구분하여 분리형으로 구성한다이 장비들의 구성을 뜯어보면 소스와 앰프로 구분된다 오늘은 소스기에 대해서 말하고자 한다소스는 음원  라디오 등을 플래이 해줘서 신호를 앰프로 보내는 역할을 하는 장비를 말한다대표적인 소스기로는  플레이어 튜너 턴테이블   등이 있다각각의 장비의 가격은 쓸만하다고 하는것 기준으로 대략 만원 전후로 한다일반적으로 오디오를 좋아하는 사람들매니아 제외 매니아들은 가늠이 안됨도 소스기 플레이어 튜너 로 만원만원정도 투자를 한다고 볼 수 있다  가격도 가격이지만 위의 사진에서 보는것과 같은 기계 본체가 개가 구성 되어야 한다고 보면 된다 그런데 인터넷과 컴퓨터의 발달로 인해 위의 여러가지 소스기를 하나의 기계가 충분히 담당하고 음질 또한 나무랄데 없다면 어떨까 뿐만 아니라 그 사이즈는 한대의  정도 작아서 담배 한갑 만하고핸드폰으로 모든 기능을 컨트롤 할 수 있고그런 기계가 있다면 가격은 최소 배는 비싸져야 형평성이 맞는것 아닐까그런데 가격도 쓸만한  한대의  정도 싸다면만원만원 대박 아닌가 사실 나도 약 년 정도 음악을 즐겨 들어왔고 오디오 장비들을 익숙하게 사용해 왔지만최근에 라즈베리파이를 사용하기 전까지는 위의 사실을 믿지 않았다  그리고 해보면서 놀라고 있다 아래 사진이 최근 내 골방의 오디오이다턴테이블을 제외하고 소스기는 없다바로 위의 사진에서 형광색으로 딸기 모양의 불빛이 보이는 기계가 라즈베리파이다  이 시점에서 네이버 지식 백과 사전 내용을 일부 인용해 보자라즈베리파이는 교육용 목적으로 개발된 초소형 컴퓨터다 신용카드 크기의 작은 컴퓨터로 출시 직후 많은 사람들의 관심을 받았다컴퓨터라고 하면 우리는 흔히 노트북이나 데스크톱를 생각하게 된다 초소형 컴퓨터 신용카드 크기 정도인 컴퓨터는 어떻게 생긴 것이고 어떻게 작동될까 일단 라즈베리파이를 초소형 컴퓨터라고 부르는 이유는 컴퓨터의 최소 구성요소와 부품을 가지고 있기 때문이다 라즈베리파이는 사용자가 원하는대로 기능을 확장하거나 용도를 변경할 수 있다 모니터와 마우스를 연결하고 그 안에 운영체제를 설치하면 라즈베리파이는 일반 가 되고 그 안에서 문서를 작성하거나 웹브라우저를 실행할 수 있다 카메라 모듈을 연결하면 디지털 카메라가 된다 각종 센서 모듈을 연결하면 사물인터넷 제품을 만들 수 있고 게임기 버튼과 디스플레이를 결합하면 휴대용 게임기도 만들 수 있다상기와 같은 엄청난 장점도 있지만 단점도 있다즉 하이파이 장비로 구축하기 위해서는 약간의 노가다수많은 인터넷 서칭과 시행착오가 필요하다 그래서 이번 기회에 어떻게 하면 라즈베리파이 기판을 하이파이 소스기로 변신 시키는지에 대한 과정을 몇번에 걸쳐서 포스팅 해보기로 했다 사실 나도 시간이 지나면 잊어버릴것 같아서 기록 차원에서라도 필요한것 같다   라즈베리파이 관련하여 내용이 많아서 나눠서 올린 포스팅을 쉽게 볼 수 있도록 아래에 링크했어요     ,3.130046673624167,14,0,0,2,87.8,1,-1.1111111111111112,7.352899999999985,0.1993801652892562,0.3646694214876033,1.83,477,0,0
